unique_id,date,headline,source,url
2020-12-23_an_0263,2020-12-23,Presiden lantik Menkes dan Wamenkes,Antara,https://www.antaranews.com/berita/1910284/presiden-lantik-menkes-dan-wamenkes
2020-12-23_an_0264,2020-12-23,Didiet Maulana luncurkan platform berbagi kisah dan pengalaman,Antara,https://www.antaranews.com/berita/1910280/didiet-maulana-luncurkan-platform-berbagi-kisah-dan-pengalaman
2020-12-23_an_0265,2020-12-23, Petrus Golose mumpuni jabat Kepala BNN,Antara,https://www.antaranews.com/berita/1910276/sahroni-petrus-golose-mumpuni-jabat-kepala-bnn
2020-12-23_an_0266,2020-12-23,Pengamat berharap UU Ciptaker jadikan Indonesia pemimpin ekonomi ASEAN,Antara,https://www.antaranews.com/berita/1910272/pengamat-berharap-uu-ciptaker-jadikan-indonesia-pemimpin-ekonomi-asean
2020-12-23_an_0267,2020-12-23,Presiden berpesan agar regulasi ekspor benih lobster dievaluasi,Antara,https://www.antaranews.com/berita/1910268/presiden-berpesan-agar-regulasi-ekspor-benih-lobster-dievaluasi
2020-12-23_an_0268,2020-12-23,Syahrian Abimayu resmi berseragam Johor Darul Takzim,Antara,https://www.antaranews.com/berita/1910264/syahrian-abimayu-resmi-berseragam-johor-darul-takzim
2020-12-23_an_0269,2020-12-23,Terminal Kalideres cek kesehatan pengemudi untuk angkutan Natal,Antara,https://www.antaranews.com/berita/1910260/terminal-kalideres-cek-kesehatan-pengemudi-untuk-angkutan-natal
2020-12-23_an_0270,2020-12-23,Tri Rismaharini: Pesan presiden Bansos 2020 harus kelar 100 persen,Antara,https://www.antaranews.com/berita/1910256/tri-rismaharini-pesan-presiden-bansos-2020-harus-kelar-100-persen
2020-12-23_an_0271,2020-12-23,Pasien COVID-19 yang dirawat inap di Wisma Atlet bertambah jadi 3.172,Antara,https://www.antaranews.com/berita/1910248/pasien-covid-19-yang-dirawat-inap-di-wisma-atlet-bertambah-jadi-3172
2020-12-23_an_0272,2020-12-23,Menag Gus Yaqut tegaskan agama sebagai inspirasi bukan aspirasi,Antara,https://www.antaranews.com/berita/1910216/menag-gus-yaqut-tegaskan-agama-sebagai-inspirasi-bukan-aspirasi
2020-12-23_an_0273,2020-12-23,Akademisi : RPP Kawasan Hutan jangan rugikan petani sawit,Antara,https://www.antaranews.com/berita/1910244/akademisi-rpp-kawasan-hutan-jangan-rugikan-petani-sawit
2020-12-23_an_0274,2020-12-23,Gisel penuhi panggilan Polda Metro Jaya,Antara,https://www.antaranews.com/berita/1910240/gisel-penuhi-panggilan-polda-metro-jaya
2020-12-23_an_0275,2020-12-23,Kilas NusAntara Siang,Antara,https://www.antaranews.com/video/1910128/kilas-nusantara-siang
2020-12-23_an_0276,2020-12-23,Menag Yaqut tidak ingin ada diskriminasi di Kemenag,Antara,https://www.antaranews.com/berita/1910236/menag-yaqut-tidak-ingin-ada-diskriminasi-di-kemenag
2020-12-23_an_0277,2020-12-23, Pasien COVID-19 di Tanjungpinang turun 50 persen,Antara,https://www.antaranews.com/berita/1910232/satgas-pasien-covid-19-di-tanjungpinang-turun-50-persen
2020-12-23_an_0278,2020-12-23,Pengamat berharap menteri baru buat terobosan di tengah pandemi,Antara,https://www.antaranews.com/berita/1910228/pengamat-berharap-menteri-baru-buat-terobosan-di-tengah-pandemi
2020-12-23_an_0279,2020-12-23,Tokyo umumkan tim kreatif seremoni pembukaan Olimpiade,Antara,https://www.antaranews.com/berita/1910224/tokyo-umumkan-tim-kreatif-seremoni-pembukaan-olimpiade
2020-12-23_an_0280,2020-12-23,Mau main apa saat Natal? Ada board game bertema virus corona,Antara,https://www.antaranews.com/berita/1910220/mau-main-apa-saat-natal-ada-board-game-bertema-virus-corona
2020-12-23_an_0281,2020-12-23,Jalan lingkar Salido - Carocok sudah bisa dilintasi,Antara,https://www.antaranews.com/foto/1910212/jalan-lingkar-salido-carocok-sudah-bisa-dilintasi
2020-12-23_an_0282,2020-12-23,IPB University-LAPAN gelar pelatihan pemantauan tutupan lahan,Antara,https://www.antaranews.com/berita/1910176/ipb-university-lapan-gelar-pelatihan-pemantauan-tutupan-lahan
2020-12-23_an_0283,2020-12-23,Perusahaan Pantai Gading buat boneka berkulit hitam untuk anak Afrika,Antara,https://www.antaranews.com/berita/1910208/perusahaan-pantai-gading-buat-boneka-berkulit-hitam-untuk-anak-afrika
2020-12-23_an_0284,2020-12-23,Panglima TNI serahkan bantuan COVID-19 kepada warga Kabupaten Poso,Antara,https://www.antaranews.com/berita/1910204/panglima-tni-serahkan-bantuan-covid-19-kepada-warga-kabupaten-poso
2020-12-23_an_0285,2020-12-23, Amerika dominasi rekor kasus mingguan COVID-19 dunia,Antara,https://www.antaranews.com/berita/1910200/who-amerika-dominasi-rekor-kasus-mingguan-covid-19-dunia
2020-12-23_an_0286,2020-12-23,Divpropam Polri segera sidang kode etik terdakwa Napoleon-Prasetijo,Antara,https://www.antaranews.com/berita/1910196/divpropam-polri-segera-sidang-kode-etik-terdakwa-napoleon-prasetijo
2020-12-23_an_0287,2020-12-23,Hasil tes cepat Haikal Hasan reaktif COVID-19 menjelang pemeriksaan,Antara,https://www.antaranews.com/berita/1910192/hasil-tes-cepat-haikal-hasan-reaktif-covid-19-menjelang-pemeriksaan
2020-12-23_an_0288,2020-12-23,Calon penumpang kereta api diimbau lakukan tes cepat antigen H-1,Antara,https://www.antaranews.com/berita/1910188/calon-penumpang-kereta-api-diimbau-lakukan-tes-cepat-antigen-h-1
2020-12-23_an_0289,2020-12-23,"Libur akhir tahun, Jasa Marga siap layani pengguna tol Sumut",Antara,https://www.antaranews.com/berita/1910184/libur-akhir-tahun-jasa-marga-siap-layani-pengguna-tol-sumut
2020-12-23_an_0290,2020-12-23,4.855 warga Batam positif COVID-19,Antara,https://www.antaranews.com/berita/1910180/4855-warga-batam-positif-covid-19
2020-12-23_an_0291,2020-12-23,Karangan bunga Risma jadi Mensos banjiri Rumdin Wali Kota Surabaya,Antara,https://www.antaranews.com/berita/1910172/karangan-bunga-risma-jadi-mensos-banjiri-rumdin-wali-kota-surabaya
2020-12-23_an_0292,2020-12-23,Wamenkumham Eddy Hiraiej bagi-bagi tugas dengan Yasonna Laoly,Antara,https://www.antaranews.com/berita/1910140/wamenkumham-eddy-hiraiej-bagi-bagi-tugas-dengan-yasonna-laoly
2020-12-23_an_0293,2020-12-23,Irving dan Durant antar Nets taklukkan Warriors,Antara,https://www.antaranews.com/berita/1910168/irving-dan-durant-antar-nets-taklukkan-warriors
2020-12-23_an_0294,2020-12-23,"Demi Natal, negara bagian Australia perlonggar pembatasan COVID-19",Antara,https://www.antaranews.com/berita/1910164/demi-natal-negara-bagian-australia-perlonggar-pembatasan-covid-19
2020-12-23_an_0295,2020-12-23,Liburan akhir tahun dengan ikut kelas virtual,Antara,https://www.antaranews.com/berita/1910160/liburan-akhir-tahun-dengan-ikut-kelas-virtual
2020-12-23_an_0296,2020-12-23,Trump ancam untuk tidak tandatangani RUU bantuan COVID-19,Antara,https://www.antaranews.com/berita/1910156/trump-ancam-untuk-tidak-tandatangani-ruu-bantuan-covid-19
2020-12-23_an_0297,2020-12-23,Anggota DPR minta antisipasi puncak arus libur akhir tahun,Antara,https://www.antaranews.com/berita/1910152/anggota-dpr-minta-antisipasi-puncak-arus-libur-akhir-tahun
2020-12-23_an_0298,2020-12-23,Presiden resmi melantik enam menteri dan lima wakil menteri,Antara,https://www.antaranews.com/video/1910076/presiden-resmi-melantik-enam-menteri-dan-lima-wakil-menteri
2020-12-23_an_0299,2020-12-23, Menkes baru harus segera atasi pandemi COVID-19,Antara,https://www.antaranews.com/berita/1910148/fpan-menkes-baru-harus-segera-atasi-pandemi-covid-19
2020-12-23_an_0300,2020-12-23,"Perketat pembatasan COVID, aktivitas bisnis Inggris semakin turun",Antara,https://www.antaranews.com/berita/1910144/perketat-pembatasan-covid-aktivitas-bisnis-inggris-semakin-turun
2020-12-23_an_0301,2020-12-23,Inggris laporkan rekor infeksi baru saat virus corona mengganas,Antara,https://www.antaranews.com/berita/1910136/inggris-laporkan-rekor-infeksi-baru-saat-virus-corona-mengganas
2020-12-23_an_0302,2020-12-23,Polisi sterilisasi gereja jelang perayaan Natal,Antara,https://www.antaranews.com/foto/1910096/polisi-sterilisasi-gereja-jelang-perayaan-natal
2020-12-23_an_0303,2020-12-23,Fachrul Razi yakin Jokowi tepat pilih Yaqut jadi menteri agama,Antara,https://www.antaranews.com/berita/1910132/fachrul-razi-yakin-jokowi-tepat-pilih-yaqut-jadi-menteri-agama
2020-12-23_an_0304,2020-12-23,Wamen Pertanian terima pesan khusus dari Presiden Jokowi,Antara,https://www.antaranews.com/berita/1910124/wamen-pertanian-terima-pesan-khusus-dari-presiden-jokowi
2020-12-23_an_0305,2020-12-23,Wali Kota Surabaya terpilih Eri Cahyadi bangga Risma jadi Mensos,Antara,https://www.antaranews.com/berita/1910120/wali-kota-surabaya-terpilih-eri-cahyadi-bangga-risma-jadi-mensos
2020-12-23_an_0306,2020-12-23,Wamenkes akan fokus ke percepatan penyerapan anggaran Kemenkes,Antara,https://www.antaranews.com/berita/1910116/wamenkes-akan-fokus-ke-percepatan-penyerapan-anggaran-kemenkes
2020-12-23_an_0307,2020-12-23,Polresta Surakarta sterilisasi belasan gereja jelang Natal,Antara,https://www.antaranews.com/berita/1910112/polresta-surakarta-sterilisasi-belasan-gereja-jelang-natal
2020-12-23_an_0308,2020-12-23,KPK panggil ajudan Edhy Prabowo,Antara,https://www.antaranews.com/berita/1910108/kpk-panggil-ajudan-edhy-prabowo
2020-12-23_an_0309,2020-12-23,"Newcastle ditekuk tim Championship, Bruce tampung hujan kritik",Antara,https://www.antaranews.com/berita/1910104/newcastle-ditekuk-tim-championship-bruce-tampung-hujan-kritik
2020-12-23_an_0310,2020-12-23,"Profil - Petrus Golose, penerus tongkat estafet pemberantasan narkoba",Antara,https://www.antaranews.com/berita/1910100/profil-petrus-golose-penerus-tongkat-estafet-pemberantasan-narkoba
2020-12-23_an_0311,2020-12-23,Gus Menteri: SDGs Desa Sejalan dengan Stranas ATS,Antara,https://www.antaranews.com/berita/1910092/gus-menteri-sdgs-desa-sejalan-dengan-stranas-ats
2020-12-23_an_0312,2020-12-23, Penunjukan Mendag-Menparekraf baru tepat untuk pulihkan ekonomi,Antara,https://www.antaranews.com/berita/1910052/indef-penunjukan-mendag-menparekraf-baru-tepat-untuk-pulihkan-ekonomi
2020-12-23_an_0313,2020-12-23,"Profil - Prajurit ""Baret Merah"" yang menjabat Wakil Menteri Pertahanan",Antara,https://www.antaranews.com/berita/1910088/profil-prajurit-baret-merah-yang-menjabat-wakil-menteri-pertahanan
2020-12-23_an_0314,2020-12-23,KPK panggil Anggota Pengadaan Bansos COVID-19 terkait kasus Juliari,Antara,https://www.antaranews.com/berita/1910084/kpk-panggil-anggota-pengadaan-bansos-covid-19-terkait-kasus-juliari
2020-12-23_an_0315,2020-12-23,Pahala Mansury diminta tingkatkan kontribusi BUMN pulihkan ekonomi,Antara,https://www.antaranews.com/berita/1910080/pahala-mansury-diminta-tingkatkan-kontribusi-bumn-pulihkan-ekonomi
2020-12-23_an_0316,2020-12-23,UNIS tambah enam program studi tahun depan,Antara,https://www.antaranews.com/berita/1910072/unis-tambah-enam-program-studi-tahun-depan
2020-12-23_an_0317,2020-12-23,Simpatisan FPI ditangkap polisi lantaran ujaran kebencian di medsos,Antara,https://www.antaranews.com/berita/1910068/simpatisan-fpi-ditangkap-polisi-lantaran-ujaran-kebencian-di-medsos
2020-12-23_an_0318,2020-12-23,PT Fast Food Indonesia perkenalkan Taco Bell kepada masyarakat Indonesia,Antara,https://www.antaranews.com/berita/1910064/pt-fast-food-indonesia-perkenalkan-taco-bell-kepada-masyarakat-indonesia
2020-12-23_an_0319,2020-12-23,Karangan bunga untuk Tri Rismaharini mulai berdatangan,Antara,https://www.antaranews.com/berita/1910060/karangan-bunga-untuk-tri-rismaharini-mulai-berdatangan
2020-12-23_an_0320,2020-12-23,"Jajal Hyundai IONIQ electric ""rute urban"", berapa konsumsi listriknya?",Antara,https://otomotif.antaranews.com/berita/1910056/jajal-hyundai-ioniq-electric-rute-urban-berapa-konsumsi-listriknya
2020-12-23_an_0321,2020-12-23,Dispar DIY: Kewajiban rapid test antigen bukan mempersulit wisatawan,Antara,https://www.antaranews.com/berita/1911540/dispar-diy-kewajiban-rapid-test-antigen-bukan-mempersulit-wisatawan
2020-12-23_an_0322,2020-12-23,Proses restrukturisasi Jiwasraya segera dipercepat,Antara,https://www.antaranews.com/berita/1911500/proses-restrukturisasi-jiwasraya-segera-dipercepat
2020-12-23_an_0323,2020-12-23,Puncak arus mudik Natal di Bandara Soekarno Hatta,Antara,https://www.antaranews.com/foto/1911536/puncak-arus-mudik-natal-di-bandara-soekarno-hatta
2020-12-23_an_0324,2020-12-23,Penyidik periksa mantan Kepala SDN 19 Cakranegara terkait korupsi BOS,Antara,https://www.antaranews.com/berita/1911532/penyidik-periksa-mantan-kepala-sdn-19-cakranegara-terkait-korupsi-bos
2020-12-23_an_0325,2020-12-23,Wisatawan ke Kota Bogor harus miliki hasil tes yang negatif,Antara,https://www.antaranews.com/berita/1911528/wisatawan-ke-kota-bogor-harus-miliki-hasil-tes-yang-negatif
2020-12-23_an_0326,2020-12-23,Tim SAR Jambi cari anak yang tenggelam di Batanghari,Antara,https://www.antaranews.com/berita/1911520/tim-sar-jambi-cari-anak-yang-tenggelam-di-batanghari
2020-12-23_an_0327,2020-12-23,Kadin Jatim dorong pemerintah tunda kenaikan harga cukai pada 2021,Antara,https://www.antaranews.com/berita/1911516/kadin-jatim-dorong-pemerintah-tunda-kenaikan-harga-cukai-pada-2021
2020-12-23_an_0328,2020-12-23,Afghanistan harap Indonesia fasilitasi dialog dengan Taliban,Antara,https://www.antaranews.com/berita/1911512/afghanistan-harap-indonesia-fasilitasi-dialog-dengan-taliban
2020-12-23_an_0329,2020-12-23,Indosat Ooredoo tingkatkan kapasitas data selama libur akhir tahun,Antara,https://www.antaranews.com/berita/1911508/indosat-ooredoo-tingkatkan-kapasitas-data-selama-libur-akhir-tahun
2020-12-23_an_0330,2020-12-23,TNI-Polri-Basarnas bergerak cepat tangani banjir Gorontalo Utara,Antara,https://www.antaranews.com/berita/1911504/tni-polri-basarnas-bergerak-cepat-tangani-banjir-gorontalo-utara
2020-12-23_an_0331,2020-12-23,Hartono resmi dilantik jadi Kepala Badan Restorasi Gambut dan Mangrove,Antara,https://www.antaranews.com/berita/1910048/hartono-resmi-dilantik-jadi-kepala-badan-restorasi-gambut-dan-mangrove
2020-12-23_an_0332,2020-12-23,KAI Divre II Sumbar belum syaratkan rapid test & swab test,Antara,https://www.antaranews.com/video/1909996/kai-divre-ii-sumbar-belum-syaratkan-rapid-test-swab-test
2020-12-23_an_0333,2020-12-23,PCNU Surabaya optimistis Risma bisa emban amanah saat jabat mensos,Antara,https://www.antaranews.com/berita/1910044/pcnu-surabaya-optimistis-risma-bisa-emban-amanah-saat-jabat-mensos
2020-12-23_an_0334,2020-12-23,Kominfo lantik Sekjen dan Kepala Litbang baru,Antara,https://www.antaranews.com/berita/1910040/kominfo-lantik-sekjen-dan-kepala-litbang-baru
2020-12-23_an_0335,2020-12-23,Wamenhan Muhammad Herindra segera menghadap Prabowo,Antara,https://www.antaranews.com/berita/1910036/wamenhan-muhammad-herindra-segera-menghadap-prabowo
2020-12-23_an_0336,2020-12-23,"Peter Jackson garap film dokumenter ""The Beatles: Get Back""",Antara,https://www.antaranews.com/berita/1910032/peter-jackson-garap-film-dokumenter-the-beatles-get-back
2020-12-23_an_0337,2020-12-23,Yili tutup tahun 2020 dengan keberhasilan di sektor susu,Antara,https://www.antaranews.com/berita/1910028/yili-tutup-tahun-2020-dengan-keberhasilan-di-sektor-susu
2020-12-23_an_0338,2020-12-23,Sandiaga Uno siapkan 3 gagasan pariwisata Indonesia,Antara,https://www.antaranews.com/berita/1910024/sandiaga-uno-siapkan-3-gagasan-pariwisata-indonesia
2020-12-23_an_0339,2020-12-23,"Treasure Hiding luncurkan video lirik lagu ""Menjauh""",Antara,https://www.antaranews.com/berita/1910020/treasure-hiding-luncurkan-video-lirik-lagu-menjauh
2020-12-23_an_0340,2020-12-23,Menkeu minta AAIPI pastikan tak ada kompromi belanja uang negara,Antara,https://www.antaranews.com/berita/1910016/menkeu-minta-aaipi-pastikan-tak-ada-kompromi-belanja-uang-negara
2020-12-23_an_0341,2020-12-23,Muhammad Luthfi diberitahu jadi Mendag sejak pekan lalu,Antara,https://www.antaranews.com/berita/1910012/muhammad-luthfi-diberitahu-jadi-mendag-sejak-pekan-lalu
2020-12-23_an_0342,2020-12-23,"Tes negatif COVID, pengemudi dapat kembali masuki Prancis dari Inggris",Antara,https://www.antaranews.com/berita/1909976/tes-negatif-covid-pengemudi-dapat-kembali-masuki-prancis-dari-inggris
2020-12-23_an_0343,2020-12-23,"""Olahraga dan Teknologi"" berdayakan pengembangan industri olahraga berkualitas tinggi",Antara,https://www.antaranews.com/berita/1910008/olahraga-dan-teknologi-berdayakan-pengembangan-industri-olahraga-berkualitas-tinggi
2020-12-23_an_0344,2020-12-23,Arteta akui situasi Arsenal saat ini kian runyam,Antara,https://www.antaranews.com/berita/1910004/arteta-akui-situasi-arsenal-saat-ini-kian-runyam
2020-12-23_an_0345,2020-12-23,"Sandiaga sempat rancu pesan ""cepat sembuh"" dan ""datangi istana""",Antara,https://www.antaranews.com/berita/1910000/sandiaga-sempat-rancu-pesan-cepat-sembuh-dan-datangi-istana
2020-12-23_an_0346,2020-12-23,Budi Sadikin diminta presiden selesaikan masalah COVID-19 secepatnya,Antara,https://www.antaranews.com/berita/1909992/budi-sadikin-diminta-presiden-selesaikan-masalah-covid-19-secepatnya
2020-12-23_an_0347,2020-12-23,BNPB kirim bantuan 10 ribu alat tes cepat antigen COVID-19 ke Gorontalo,Antara,https://www.antaranews.com/foto/1909988/bnpb-kirim-bantuan-10-ribu-alat-tes-cepat-antigen-covid-19-ke-gorontalo
2020-12-23_an_0348,2020-12-23,Facebook perbanyak fitur keamanan tahun depan,Antara,https://www.antaranews.com/berita/1909984/facebook-perbanyak-fitur-keamanan-tahun-depan
2020-12-23_an_0349,2020-12-23,Filipina larang semua penerbangan dari Inggris mulai 24 Desember,Antara,https://www.antaranews.com/berita/1909980/filipina-larang-semua-penerbangan-dari-inggris-mulai-24-desember
2020-12-23_an_0350,2020-12-23,"Peringati hari ibu, Alisa Khadijah gelar aksi donor darah dan tanam pohon",Antara,https://www.antaranews.com/video/1909948/peringati-hari-ibualisa-khadijah-gelar-aksi-donor-darah-dan-tanam-pohon
2020-12-23_an_0351,2020-12-23,Polri hormati vonis hakim soal tiga terdakwa kasus surat jalan palsu,Antara,https://www.antaranews.com/berita/1909972/polri-hormati-vonis-hakim-soal-tiga-terdakwa-kasus-surat-jalan-palsu
2020-12-23_an_0352,2020-12-23,"Sakti Wahyu Trenggono akan ""belanja"" masalah sektor kelautan-perikanan",Antara,https://www.antaranews.com/berita/1909936/sakti-wahyu-trenggono-akan-belanja-masalah-sektor-kelautan-perikanan
2020-12-23_an_0353,2020-12-23,Risma akan kebut realisasi bansos mulai pekan pertama Januari 2021,Antara,https://www.antaranews.com/berita/1909968/risma-akan-kebut-realisasi-bansos-mulai-pekan-pertama-januari-2021
2020-12-23_an_0354,2020-12-23,"Puncak mudik, penumpang pesawat diimbau siapkan dokumen keberangkatan",Antara,https://www.antaranews.com/berita/1909964/puncak-mudik-penumpang-pesawat-diimbau-siapkan-dokumen-keberangkatan
2020-12-23_an_0355,2020-12-23,DPMPTSP Temanggung bidik retribusi IMB,Antara,https://www.antaranews.com/video/1909868/dpmptsp-temanggung-bidik-retribusi-imb
2020-12-23_an_0356,2020-12-23,Misi penjaga perdamaian Uni Afrika di Darfur berakhir pada 31 Desember,Antara,https://www.antaranews.com/berita/1909960/misi-penjaga-perdamaian-uni-afrika-di-darfur-berakhir-pada-31-desember
2020-12-23_an_0357,2020-12-23,"Libur akhir tahun, VICI bidik pendapatan melalui outlet di rest area",Antara,https://www.antaranews.com/berita/1909956/libur-akhir-tahun-vici-bidik-pendapatan-melalui-outlet-di-rest-area
2020-12-23_an_0358,2020-12-23,Risma baru diberitahu akan jadi mensos dua hari sebelum dilantik,Antara,https://www.antaranews.com/berita/1909952/risma-baru-diberitahu-akan-jadi-mensos-dua-hari-sebelum-dilantik
2020-12-23_an_0359,2020-12-23,Vietnam harap ekspansi kerja sama dengan Indonesia ke sektor digital,Antara,https://www.antaranews.com/berita/1909944/vietnam-harap-ekspansi-kerja-sama-dengan-indonesia-ke-sektor-digital
2020-12-23_an_0360,2020-12-23,"Film animasi Pixar ""Soul"" tayang mulai hari Natal",Antara,https://www.antaranews.com/berita/1909940/film-animasi-pixar-soul-tayang-mulai-hari-natal
2020-12-23_an_0361,2020-12-23,Kepatuhan warga bayar PBB di masa pandemi meningkat,Antara,https://www.antaranews.com/video/1909916/kepatuhan-warga-bayar-pbb-di-masa-pandemi-meningkat
2020-12-23_an_0362,2020-12-23,Gubernur Sultra keluarkan edaran larangan perayaan tahun baru,Antara,https://www.antaranews.com/video/1909844/gubernur-sultra-keluarkan-edaran-larangan-perayaan-tahun-baru
2020-12-23_an_0363,2020-12-23,Malaysia izinkan masuk mahasiswa internasional kecuali Inggris,Antara,https://www.antaranews.com/berita/1909932/malaysia-izinkan-masuk-mahasiswa-internasional-kecuali-inggris
2020-12-23_an_0364,2020-12-23,KBRI Doha rutin pastikan seluruh staf bebas COVID-19,Antara,https://www.antaranews.com/berita/1909928/kbri-doha-rutin-pastikan-seluruh-staf-bebas-covid-19
2020-12-23_an_0365,2020-12-23,"Berpesan semoga amanah, Susi ucapkan selamat kepada Menteri KKP baru",Antara,https://www.antaranews.com/berita/1909924/berpesan-semoga-amanah-susi-ucapkan-selamat-kepada-menteri-kkp-baru
2020-12-23_an_0366,2020-12-23,Suasana Kota Poso jelang perayaan Natal dan Tahun Baru,Antara,https://www.antaranews.com/foto/1909920/suasana-kota-poso-jelang-perayaan-natal-dan-tahun-baru
2020-12-23_an_0367,2020-12-23, Existing politik hukum tata kelola pertambangan hadapi anomali,Antara,https://www.antaranews.com/berita/1909912/pakar-existing-politik-hukum-tata-kelola-pertambangan-hadapi-anomali
2020-12-23_an_0368,2020-12-23,KBRI Roma gelar perayaan Natal secara hibrida  dengan tema persatuan,Antara,https://www.antaranews.com/berita/1909908/kbri-roma-gelar-perayaan-natal-secara-hibrida-dengan-tema-persatuan
2020-12-23_an_0369,2020-12-23,Saksi dicecar pembelian mobil-sewa apartemen dari suap benih lobster,Antara,https://www.antaranews.com/berita/1909904/saksi-dicecar-pembelian-mobil-sewa-apartemen-dari-suap-benih-lobster
2020-12-23_an_0370,2020-12-23,Lembaga survei nilai Jokowi siapkan pemimpin dari kalangan teknokrat,Antara,https://www.antaranews.com/berita/1909900/lembaga-survei-nilai-jokowi-siapkan-pemimpin-dari-kalangan-teknokrat
2020-12-23_an_0371,2020-12-23,Lima wakil menteri masuk jajaran kabinet Indonesia Maju,Antara,https://www.antaranews.com/berita/1909896/lima-wakil-menteri-masuk-jajaran-kabinet-indonesia-maju
2020-12-23_an_0372,2020-12-23,Aplikasi PeduliLindungi diperkuat layanan telemedis,Antara,https://www.antaranews.com/berita/1909864/aplikasi-pedulilindungi-diperkuat-layanan-telemedis
2020-12-23_an_0373,2020-12-23,NIH tutup pendaftaran pasien COVID parah pada uji coba pengencer darah,Antara,https://www.antaranews.com/berita/1909892/nih-tutup-pendaftaran-pasien-covid-parah-pada-uji-coba-pengencer-darah
2020-12-23_an_0374,2020-12-23, Segera bentuk basis data tunggal jangkau pengusaha mikro,Antara,https://www.antaranews.com/berita/1909888/peneliti-segera-bentuk-basis-data-tunggal-jangkau-pengusaha-mikro
2020-12-23_an_0375,2020-12-23,"Lima daya tarik drama baru Ji Chang-wook ""Lovestruck in the City""",Antara,https://www.antaranews.com/berita/1909884/lima-daya-tarik-drama-baru-ji-chang-wook-lovestruck-in-the-city
2020-12-23_an_0376,2020-12-23,Menjaga Holtekamp dari serangan sampah,Antara,https://www.antaranews.com/video/1907840/menjaga-holtekamp-dari-serangan-sampah
2020-12-23_an_0377,2020-12-23,Produk kecantikan lokal jadi favorit pengguna TikTok pada 2020,Antara,https://www.antaranews.com/berita/1909880/produk-kecantikan-lokal-jadi-favorit-pengguna-tiktok-pada-2020
2020-12-23_an_0378,2020-12-23,Presiden Jokowi lantik Kepala BRGM Hartono Prawiraatmadja,Antara,https://www.antaranews.com/berita/1909876/presiden-jokowi-lantik-kepala-brgm-hartono-prawiraatmadja
2020-12-23_an_0379,2020-12-23,Presiden lantik Kepala Badan Narkotika Nasional,Antara,https://www.antaranews.com/berita/1909872/presiden-lantik-kepala-badan-narkotika-nasional
2020-12-23_an_0380,2020-12-23,"Dua kali jadi Menteri Perdagangan, ini profil Muhammad Lutfi",Antara,https://www.antaranews.com/video/1909840/dua-kali-jadi-menteri-perdagangan-ini-profil-muhammad-lutfi
2020-12-23_an_0381,2020-12-23, PR Menag Yaqut bangun harmoni keberbedaan,Antara,https://www.antaranews.com/berita/1909860/mui-pr-menag-yaqut-bangun-harmoni-keberbedaan
2020-12-23_an_0382,2020-12-23,Kinerja industri oleokimia diprediksi meningkat pada 2021,Antara,https://www.antaranews.com/berita/1909816/kinerja-industri-oleokimia-diprediksi-meningkat-pada-2021
2020-12-23_an_0383,2020-12-23,Presiden Jokowi lantik enam menteri dan lima Wakil Menteri,Antara,https://www.antaranews.com/berita/1909856/presiden-jokowi-lantik-enam-menteri-dan-lima-wakil-menteri
2020-12-23_an_0384,2020-12-23,"Jelang akhir tahun, Shopee hadirkan promo ""Shopee Gajian Sale""",Antara,https://www.antaranews.com/berita/1909852/jelang-akhir-tahun-shopee-hadirkan-promo-shopee-gajian-sale
2020-12-23_an_0385,2020-12-23, Warga Surabaya bangga Risma jabat mensos,Antara,https://www.antaranews.com/berita/1909848/pdip-warga-surabaya-bangga-risma-jabat-mensos
2020-12-23_an_0386,2020-12-23,Top 10 pesohor dengan bayaran termahal di dunia,Antara,https://www.antaranews.com/infografik/1909836/top-10-pesohor-dengan-bayaran-termahal-di-dunia
2020-12-23_an_0387,2020-12-23,Menteri Kelautan dan Perikanan baru perlu evaluasi regulasi lobster,Antara,https://www.antaranews.com/berita/1909832/menteri-kelautan-dan-perikanan-baru-perlu-evaluasi-regulasi-lobster
2020-12-23_an_0388,2020-12-23,Prediksi ancaman finansial tahun 2021,Antara,https://www.antaranews.com/berita/1909828/prediksi-ancaman-finansial-tahun-2021
2020-12-23_an_0389,2020-12-23,LPEI dapatkan pendanaan 200 juta dolar AS dari KEXIM,Antara,https://www.antaranews.com/berita/1909824/lpei-dapatkan-pendanaan-200-juta-dolar-as-dari-kexim
2020-12-23_an_0390,2020-12-23,"Yuan melemah lagi 171 basis poin menjadi 6,5558 terhadap dolar AS",Antara,https://www.antaranews.com/berita/1909820/yuan-melemah-lagi-171-basis-poin-menjadi-65558-terhadap-dolar-as
2020-12-23_an_0391,2020-12-23,Rupiah berpeluang menguat meski masih dibayangi varian baru Corona,Antara,https://www.antaranews.com/berita/1909812/rupiah-berpeluang-menguat-meski-masih-dibayangi-varian-baru-corona
2020-12-23_an_0392,2020-12-23,Kilas NusAntara Edisi COVID-19,Antara,https://www.antaranews.com/video/1909752/kilas-nusantara-edisi-covid-19
2020-12-23_an_0393,2020-12-23,Dugaan peretasan yang menghebohkan dunia siber sepanjang 2020,Antara,https://www.antaranews.com/berita/1909808/dugaan-peretasan-yang-menghebohkan-dunia-siber-sepanjang-2020
