unique_id,date,source,headline,url
2021-05-07_an_40_1,2021-05-07,Antara,Rupiah menguat seiring masih tertekannya imbal hasil obligasi AS,https://www.antaranews.com/berita/2143658/rupiah-menguat-seiring-masih-tertekannya-imbal-hasil-obligasi-as
2021-05-07_an_40_2,2021-05-07,Antara,Pemerintah Jepang berupaya perpanjang status darurat hingga 31 Mei,https://www.antaranews.com/berita/2143654/pemerintah-jepang-berupaya-perpanjang-status-darurat-hingga-31-mei
2021-05-07_an_40_3,2021-05-07,Antara,Pemda diminta sosialisasikan Panduan Pelaksanaan Shalat Idul Fitri,https://ramadhan.antaranews.com/berita/2143650/pemda-diminta-sosialisasikan-panduan-pelaksanaan-shalat-idul-fitri
2021-05-07_an_40_4,2021-05-07,Antara,KKP bakal percepat kajian penerapan PNBP pascaproduksi,https://www.antaranews.com/berita/2143646/kkp-bakal-percepat-kajian-penerapan-pnbp-pascaproduksi
2021-05-07_an_40_5,2021-05-07,Antara,Dua amaliah di bulan Syawal,https://ramadhan.antaranews.com/berita/2143642/dua-amaliah-di-bulan-syawal
2021-05-07_an_40_6,2021-05-07,Antara,Panglima TNI dan Kapolri kunjungi Timika siang ini,https://www.antaranews.com/berita/2143638/panglima-tni-dan-kapolri-kunjungi-timika-siang-ini
2021-05-07_an_40_7,2021-05-07,Antara,Kampanye daring anti Olimpiade didukung hampir 200.000 orang di Jepang,https://www.antaranews.com/berita/2143634/kampanye-daring-anti-olimpiade-didukung-hampir-200000-orang-di-jepang
2021-05-07_an_40_8,2021-05-07,Antara,Polda Metro Jaya buka pelayanan Samsat Keliling di 14 lokasi,https://www.antaranews.com/berita/2143630/polda-metro-jaya-buka-pelayanan-samsat-keliling-di-14-lokasi
2021-05-07_an_40_9,2021-05-07,Antara,Australia akan mulai repatriasi warganya dari India pada 15 Mei,https://www.antaranews.com/berita/2143626/australia-akan-mulai-repatriasi-warganya-dari-india-pada-15-mei
2021-05-07_an_40_10,2021-05-07,Antara,SIM Keliling di Jakarta pada Jumat ada di lokasi ini,https://www.antaranews.com/berita/2143622/sim-keliling-di-jakarta-pada-jumat-ada-di-lokasi-ini
2021-05-07_an_41_1,2021-05-07,Antara,"Pemda Sabu Raijua alokasikan Rp1,9 miliar dana pengawas PSU",https://www.antaranews.com/berita/2143618/pemda-sabu-raijua-alokasikan-rp19-miliar-dana-pengawas-psu
2021-05-07_an_41_2,2021-05-07,Antara,Peluang perdagangan internasional terbuka di ASEAN,https://www.antaranews.com/berita/2143614/peluang-perdagangan-internasional-terbuka-di-asean
2021-05-07_an_41_3,2021-05-07,Antara,Sebagian Jakarta hujan pada Jumat malam,https://www.antaranews.com/berita/2143610/sebagian-jakarta-hujan-pada-jumat-malam
2021-05-07_an_41_4,2021-05-07,Antara,IHSG akhir pekan diprediksi menguat didorong data ekonomi AS,https://www.antaranews.com/berita/2143606/ihsg-akhir-pekan-diprediksi-menguat-didorong-data-ekonomi-as
2021-05-07_an_41_5,2021-05-07,Antara,KKP siapkan stiker khusus guna jamin kelancaran logistik ikan,https://www.antaranews.com/berita/2143602/kkp-siapkan-stiker-khusus-guna-jamin-kelancaran-logistik-ikan
2021-05-07_an_41_6,2021-05-07,Antara,Peneliti: Waspadai kerumunan warga tidak mudik di Jabodetabek,https://www.antaranews.com/berita/2143598/peneliti-waspadai-kerumunan-warga-tidak-mudik-di-jabodetabek
2021-05-07_an_41_7,2021-05-07,Antara,Sebanyak 80.244 pasien COVID-19 sembuh dari Wisma Atlet,https://www.antaranews.com/berita/2143594/sebanyak-80244-pasien-covid-19-sembuh-dari-wisma-atlet
2021-05-07_an_41_8,2021-05-07,Antara,Pemerintah perlu antisipasi kerumunan di pasar dan mal jelang lebaran,https://ramadhan.antaranews.com/berita/2143590/pemerintah-perlu-antisipasi-kerumunan-di-pasar-dan-mal-jelang-lebaran
2021-05-07_an_41_9,2021-05-07,Antara,"Kemarin, ahli sebut pemidanaan Rizieq tak perlu hingga Sunda Empire",https://www.antaranews.com/berita/2143586/kemarin-ahli-sebut-pemidanaan-rizieq-tak-perlu-hingga-sunda-empire
2021-05-07_an_41_10,2021-05-07,Antara,Otto Hasibuan: Wadah tunggal masih jadi pergumulan perjuangan Peradi,https://www.antaranews.com/berita/2143582/otto-hasibuan-wadah-tunggal-masih-jadi-pergumulan-perjuangan-peradi
2021-05-07_an_42_1,2021-05-07,Antara,"Jakarta kemarin, pemudik sebelum mudik dilarang hingga SIKM terbit",https://www.antaranews.com/berita/2143578/jakarta-kemarin-pemudik-sebelum-mudik-dilarang-hingga-sikm-terbit
2021-05-07_an_42_2,2021-05-07,Antara,Justin Bieber mulai tur dunia Februari 2022,https://www.antaranews.com/berita/2143574/justin-bieber-mulai-tur-dunia-februari-2022
2021-05-07_an_42_3,2021-05-07,Antara,"Setelah 242 tahun, toko Debenhams tutup permanen",https://www.antaranews.com/berita/2143570/setelah-242-tahun-toko-debenhams-tutup-permanen
2021-05-07_an_42_4,2021-05-07,Antara,"Saham China dibuka menguat, bangkit dari kerugian sehari sebelumnya",https://www.antaranews.com/berita/2143566/saham-china-dibuka-menguat-bangkit-dari-kerugian-sehari-sebelumnya
2021-05-07_an_42_5,2021-05-07,Antara,Rupiah Jumat pagi menguat 59 poin,https://www.antaranews.com/berita/2143562/rupiah-jumat-pagi-menguat-59-poin
2021-05-07_an_42_6,2021-05-07,Antara,Suasana pusat perbelanjaan di Padang menjelang lebaran,https://www.antaranews.com/video/2143310/suasana-pusat-perbelanjaan-di-padang-menjelang-lebaran
2021-05-07_an_42_7,2021-05-07,Antara,"IHSG Jumat dibuka menguat 17,09 poin",https://www.antaranews.com/berita/2143558/ihsg-jumat-dibuka-menguat-1709-poin
2021-05-07_an_42_8,2021-05-07,Antara,Final Liga Champions: Ajang pembuktian kekuatan dua tim Inggris,https://www.antaranews.com/infografik/2143554/final-liga-champions-ajang-pembuktian-kekuatan-dua-tim-inggris
2021-05-07_an_42_9,2021-05-07,Antara,Kilas NusAntara Pagi,https://www.antaranews.com/video/2143534/kilas-nusantara-pagi
2021-05-07_an_42_10,2021-05-07,Antara,Asisten pribadi Robert Downey Jr. tutup usia karena kecelakaan,https://www.antaranews.com/berita/2143550/asisten-pribadi-robert-downey-jr-tutup-usia-karena-kecelakaan
2021-05-07_an_43_1,2021-05-07,Antara,SEASUN BIOMATERIALS pasok sistem diagnostik molekuler COVID-19 ke Seoul National University,https://www.antaranews.com/berita/2143546/seasun-biomaterials-pasok-sistem-diagnostik-molekuler-covid-19-ke-seoul-national-university
2021-05-07_an_43_2,2021-05-07,Antara,Oppo K9 5G diperkenalkan dengan chipset Snapdragon 768G SoC,https://www.antaranews.com/berita/2143542/oppo-k9-5g-diperkenalkan-dengan-chipset-snapdragon-768g-soc
2021-05-07_an_43_3,2021-05-07,Antara,"Saham Australia dibuka datar, indeks ASX 200 naik tipis 0,03 persen",https://www.antaranews.com/berita/2143538/saham-australia-dibuka-datar-indeks-asx-200-naik-tipis-003-persen
2021-05-07_an_43_4,2021-05-07,Antara,Pengetatan mobilitas akan persempit penyebaran varian baru COVID-19,https://www.antaranews.com/berita/2143530/pengetatan-mobilitas-akan-persempit-penyebaran-varian-baru-covid-19
2021-05-07_an_43_5,2021-05-07,Antara,"Kemarin, larangan mudik dimulai hingga surat panduan Shalat Idul Fitri",https://www.antaranews.com/berita/2143526/kemarin-larangan-mudik-dimulai-hingga-surat-panduan-shalat-idul-fitri
2021-05-07_an_43_6,2021-05-07,Antara,Andi Rio minta Polri kedepankan persuasif tegakkan larangan mudik,https://www.antaranews.com/berita/2143522/andi-rio-minta-polri-kedepankan-persuasif-tegakkan-larangan-mudik
2021-05-07_an_43_7,2021-05-07,Antara,"AP II : Peniadaan mudik berjalan optimal, penerbangan turun 90 persen",https://ramadhan.antaranews.com/berita/2143518/ap-ii-peniadaan-mudik-berjalan-optimal-penerbangan-turun-90-persen
2021-05-07_an_43_8,2021-05-07,Antara,"Wall Street menguat, Dow melonjak ke rekor tertinggi",https://www.antaranews.com/berita/2143514/wall-street-menguat-dow-melonjak-ke-rekor-tertinggi
2021-05-07_an_43_9,2021-05-07,Antara,RSDC Wisma Atlet mengantisipasi lonjakan pasien COVID-19 usai Lebaran,https://www.antaranews.com/berita/2143510/rsdc-wisma-atlet-mengantisipasi-lonjakan-pasien-covid-19-usai-lebaran
2021-05-07_an_43_10,2021-05-07,Antara,Sony Xperia Pro hadir di pasar Eropa,https://www.antaranews.com/berita/2143506/sony-xperia-pro-hadir-di-pasar-eropa
2021-05-07_an_44_1,2021-05-07,Antara,Hasil Pilkada Banjarmasin kembali digugat ke MK,https://www.antaranews.com/berita/2143502/hasil-pilkada-banjarmasin-kembali-digugat-ke-mk
2021-05-07_an_44_2,2021-05-07,Antara,Snapchat beri kesempatan pada kreator lensa lokal,https://www.antaranews.com/berita/2143498/snapchat-beri-kesempatan-pada-kreator-lensa-lokal
2021-05-07_an_44_3,2021-05-07,Antara,Ribuan angkutan umum di Aceh digudangkan terkait larangan beroperasi,https://www.antaranews.com/berita/2143494/ribuan-angkutan-umum-di-aceh-digudangkan-terkait-larangan-beroperasi
2021-05-07_an_44_4,2021-05-07,Antara,Ombudsman minta Pemkab Kudus menertibkan menara telekomunikasi ilegal,https://www.antaranews.com/berita/2143490/ombudsman-minta-pemkab-kudus-menertibkan-menara-telekomunikasi-ilegal
2021-05-07_an_44_5,2021-05-07,Antara,Waspadai makanan tinggi kalori saat Lebaran demi cegah stroke,https://ramadhan.antaranews.com/berita/2143486/waspadai-makanan-tinggi-kalori-saat-lebaran-demi-cegah-stroke
2021-05-07_an_44_6,2021-05-07,Antara,Dolar AS jatuh saat sentimen risiko meningkat,https://www.antaranews.com/berita/2143482/dolar-as-jatuh-saat-sentimen-risiko-meningkat
2021-05-07_an_44_7,2021-05-07,Antara,SM dan YG Entertaintment tak lagi masuk saham blue-chip di Korea,https://www.antaranews.com/berita/2143478/sm-dan-yg-entertaintment-tak-lagi-masuk-saham-blue-chip-di-korea
2021-05-07_an_44_8,2021-05-07,Antara,Inilah titik pos penyekatan larangan mudik di Provinsi Lampung,https://www.antaranews.com/berita/2143474/inilah-titik-pos-penyekatan-larangan-mudik-di-provinsi-lampung
2021-05-07_an_44_9,2021-05-07,Antara,"Khawatir lonjakan pandemi di India, harga minyak tergelincir",https://www.antaranews.com/berita/2143470/khawatir-lonjakan-pandemi-di-india-harga-minyak-tergelincir
2021-05-07_an_44_10,2021-05-07,Antara,"Tertawa setelah Real Madrid tersingkir, Eden Hazard minta maaf",https://www.antaranews.com/berita/2143466/tertawa-setelah-real-madrid-tersingkir-eden-hazard-minta-maaf
2021-05-07_an_45_1,2021-05-07,Antara,"Bunga rapa bermekaran di Anhui, China timur",https://www.antaranews.com/video/2142370/bunga-rapa-bermekaran-di-anhui-china-timur
2021-05-07_an_45_2,2021-05-07,Antara,"""Hospital Playlist"" musim kedua rilis poster terbaru",https://www.antaranews.com/berita/2143462/hospital-playlist-musim-kedua-rilis-poster-terbaru
2021-05-07_an_45_3,2021-05-07,Antara,La Nyalla buka masa sidang DPD RI usai kegiatan reses,https://www.antaranews.com/berita/2143458/la-nyalla-buka-masa-sidang-dpd-ri-usai-kegiatan-reses
2021-05-07_an_45_4,2021-05-07,Antara,Solskjaer kecam jadwal padat MU usai tembus ke final Liga Europa,https://www.antaranews.com/berita/2143454/solskjaer-kecam-jadwal-padat-mu-usai-tembus-ke-final-liga-europa
2021-05-07_an_45_5,2021-05-07,Antara,Investor LVMH suntikkan Rp818 miliar ke Social Bella,https://www.antaranews.com/berita/2143450/investor-lvmh-suntikkan-rp818-miliar-ke-social-bella
2021-05-07_an_45_6,2021-05-07,Antara,Banjir kembali landa puluhan rumah di Cipinang Melayu,https://www.antaranews.com/berita/2143446/banjir-kembali-landa-puluhan-rumah-di-cipinang-melayu
2021-05-07_an_45_7,2021-05-07,Antara,"""Greenback"" dan imbal hasil obligasi turun, emas melonjak 31,4 dolar",https://www.antaranews.com/berita/2143442/greenback-dan-imbal-hasil-obligasi-turun-emas-melonjak-314-dolar
2021-05-07_an_45_8,2021-05-07,Antara,Hujan lebat diprakirakan terjadi di beberapa daerah di Indonesia,https://www.antaranews.com/berita/2143438/hujan-lebat-diprakirakan-terjadi-di-beberapa-daerah-di-indonesia
2021-05-07_an_45_9,2021-05-07,Antara,"Kemarin, Raditya Oloan wafat hingga Sony akhiri DSLR",https://www.antaranews.com/berita/2143434/kemarin-raditya-oloan-wafat-hingga-sony-akhiri-dslr
2021-05-07_an_45_10,2021-05-07,Antara,"Semikonduktor langka, produsen mobil pangkas fitur",https://otomotif.antaranews.com/berita/2143430/semikonduktor-langka-produsen-mobil-pangkas-fitur
2021-05-07_an_46_1,2021-05-07,Antara,"Jaguar Land Rover raih pertumbuhan 12,4 persen berkat Defender",https://otomotif.antaranews.com/berita/2143426/jaguar-land-rover-raih-pertumbuhan-124-persen-berkat-defender
2021-05-07_an_46_2,2021-05-07,Antara,Presiden Villarreal puas cegah dominasi Inggris di final Eropa,https://www.antaranews.com/berita/2143422/presiden-villarreal-puas-cegah-dominasi-inggris-di-final-eropa
2021-05-07_an_46_3,2021-05-07,Antara,"Kemarin, identifikasi KKB di papua hingga lelang aset sitaan Asabri",https://www.antaranews.com/berita/2143418/kemarin-identifikasi-kkb-di-papua-hingga-lelang-aset-sitaan-asabri
2021-05-07_an_46_4,2021-05-07,Antara,Pakar: Pensiunkan pegawai KPK gagal ASN,https://www.antaranews.com/video/2143186/pakar-pensiunkan-pegawai-kpk-gagal-asn
2021-05-07_an_46_5,2021-05-07,Antara,"Saham Spanyol berakhir di zona hijau, indeks IBEX 35 naik 0,16 persen",https://www.antaranews.com/berita/2143414/saham-spanyol-berakhir-di-zona-hijau-indeks-ibex-35-naik-016-persen
2021-05-07_an_46_6,2021-05-07,Antara,"Kemarin, kunjungan Presiden ke Jatim hingga laporkan ASN nekat mudik",https://www.antaranews.com/berita/2143410/kemarin-kunjungan-presiden-ke-jatim-hingga-laporkan-asn-nekat-mudik
2021-05-07_an_46_7,2021-05-07,Antara,De Gea dan Cavani banjir pujian setelah bantu MU lewati Roma,https://www.antaranews.com/berita/2143406/de-gea-dan-cavani-banjir-pujian-setelah-bantu-mu-lewati-roma
2021-05-07_an_46_8,2021-05-07,Antara,"Saham Inggris berakhir positif, indeks FTSE 100 terkerek 0,52 persen",https://www.antaranews.com/berita/2143402/saham-inggris-berakhir-positif-indeks-ftse-100-terkerek-052-persen
2021-05-07_an_46_9,2021-05-07,Antara,Arteta kecewa berat atas dua leg penampilan Arsenal lawan Villarreal,https://www.antaranews.com/berita/2143398/arteta-kecewa-berat-atas-dua-leg-penampilan-arsenal-lawan-villarreal
2021-05-07_an_46_10,2021-05-07,Antara,Medvedev dan Tsitsipas tersingkir di Madrid Open,https://www.antaranews.com/berita/2143394/medvedev-dan-tsitsipas-tersingkir-di-madrid-open
2021-05-07_an_47_1,2021-05-07,Antara,Babak kedua di Old Trafford penyesalan terbesar Roma musim ini,https://www.antaranews.com/berita/2143390/babak-kedua-di-old-trafford-penyesalan-terbesar-roma-musim-ini
2021-05-07_an_47_2,2021-05-07,Antara,"Gempa Magnitudo 4,7 terjadi di Ransiki Papua Barat",https://www.antaranews.com/berita/2143386/gempa-magnitudo-47-terjadi-di-ransiki-papua-barat
2021-05-07_an_47_3,2021-05-07,Antara,"Kemarin, perjanjian industri baterai sampai Bahlil bantu perizinan",https://www.antaranews.com/berita/2143382/kemarin-perjanjian-industri-baterai-sampai-bahlil-bantu-perizinan
2021-05-07_an_47_4,2021-05-07,Antara,"Saham Jerman naik hari kedua, indeks DAX 30 terangkat 0,17 persen",https://www.antaranews.com/berita/2143378/saham-jerman-naik-hari-kedua-indeks-dax-30-terangkat-017-persen
2021-05-07_an_47_5,2021-05-07,Antara,"Liga Europa : Kalah 2-3 dari Roma, MU melangkah ke final",https://www.antaranews.com/foto/2143374/liga-europa-kalah-2-3-dari-roma-mu-melangkah-ke-final
2021-05-07_an_47_6,2021-05-07,Antara,Kondisi lapangan untungkan Thiem menuju perempat final Madrid Open,https://www.antaranews.com/berita/2143370/kondisi-lapangan-untungkan-thiem-menuju-perempat-final-madrid-open
2021-05-07_an_47_7,2021-05-07,Antara,MU tetap ke final Liga Europa walau kalah di leg kedua lawan Roma,https://www.antaranews.com/berita/2143366/mu-tetap-ke-final-liga-europa-walau-kalah-di-leg-kedua-lawan-roma
2021-05-07_an_47_8,2021-05-07,Antara,Liga Europa : Villareal melangkah ke final usai bermain 0-0 lawan Arsenal,https://www.antaranews.com/foto/2143362/liga-europa-villareal-melangkah-ke-final-usai-bermain-0-0-lawan-arsenal
2021-05-07_an_47_9,2021-05-07,Antara,Nadal dan Osaka atlet terbaik versi Laureus Award,https://www.antaranews.com/berita/2143358/nadal-dan-osaka-atlet-terbaik-versi-laureus-award
2021-05-07_an_47_10,2021-05-07,Antara,"Saham Prancis menguat lagi, indeks CAC 40 bertambah 0,28 persen",https://www.antaranews.com/berita/2143354/saham-prancis-menguat-lagi-indeks-cac-40-bertambah-028-persen
2021-05-07_an_48_1,2021-05-07,Antara,Villarreal lewati Arsenal ke final Liga Europa seusai jaga agregat 2-1,https://www.antaranews.com/berita/2143350/villarreal-lewati-arsenal-ke-final-liga-europa-seusai-jaga-agregat-2-1
2021-05-07_an_48_2,2021-05-07,Antara,Hamilton raih Laureus Award atas perjuangan memerangi rasisme,https://www.antaranews.com/berita/2143346/hamilton-raih-laureus-award-atas-perjuangan-memerangi-rasisme
2021-05-07_an_48_3,2021-05-07,Antara,Pelanggan berharap Telkomsel Papua beri kompensasi akibat gangguan,https://www.antaranews.com/berita/2143342/pelanggan-berharap-telkomsel-papua-beri-kompensasi-akibat-gangguan
2021-05-07_an_48_4,2021-05-07,Antara,Wakapolda Papua ajak milenial tingkatkan nasionalisme,https://www.antaranews.com/berita/2143338/wakapolda-papua-ajak-milenial-tingkatkan-nasionalisme
2021-05-07_an_48_5,2021-05-07,Antara,"Larangan mudik, pengamat sebut pemerintah harus jamin kebutuhan pokok",https://www.antaranews.com/berita/2143334/larangan-mudik-pengamat-sebut-pemerintah-harus-jamin-kebutuhan-pokok
2021-05-07_an_48_6,2021-05-07,Antara,"Larangan mudik, ratusan kendaraan di Kediri diminta putar balik",https://www.antaranews.com/berita/2143330/larangan-mudik-ratusan-kendaraan-di-kediri-diminta-putar-balik
2021-05-07_an_48_7,2021-05-07,Antara,Hertha Berlin mentas dari zona degradasi selepas cukur Freiburg,https://www.antaranews.com/berita/2143326/hertha-berlin-mentas-dari-zona-degradasi-selepas-cukur-freiburg
2021-05-07_an_48_8,2021-05-07,Antara,Wali Kota Kediri ingatkan ancaman mutasi COVID-19,https://www.antaranews.com/berita/2143322/wali-kota-kediri-ingatkan-ancaman-mutasi-covid-19
2021-05-07_an_48_9,2021-05-07,Antara,PUBG Mobile rilis ulang di India menjadi Battlegrounds Mobile India,https://www.antaranews.com/berita/2143318/pubg-mobile-rilis-ulang-di-india-menjadi-battlegrounds-mobile-india
2021-05-07_an_48_10,2021-05-07,Antara,Bisakah suporter lokal City dan Chelsea hadiri final Champions?,https://www.antaranews.com/berita/2143314/bisakah-suporter-lokal-city-dan-chelsea-hadiri-final-champions
2021-05-07_an_49_1,2021-05-07,Antara,Tol Trans Jawa sepi imbas larangan mudik,https://www.antaranews.com/foto/2143306/tol-trans-jawa-sepi-imbas-larangan-mudik
2021-05-07_an_49_2,2021-05-07,Antara,Dharma Lautan Utama layani truk logistik sampai H-2 Lebaran,https://www.antaranews.com/berita/2143302/dharma-lautan-utama-layani-truk-logistik-sampai-h-2-lebaran
