unique_id,date,headline,source,url
2020-12-23_an_0394,2020-12-23,"Saham Hong Kong terus melemah, indeks HSI dibuka turun 0,14 persen",Antara,https://www.antaranews.com/berita/1909804/saham-hong-kong-terus-melemah-indeks-hsi-dibuka-turun-014-persen
2020-12-23_an_0395,2020-12-23,IHSG diprediksi bergerak variatif jelang libur Natal,Antara,https://www.antaranews.com/berita/1909800/ihsg-diprediksi-bergerak-variatif-jelang-libur-natal
2020-12-23_an_0396,2020-12-23,Harga telur ayam murah ada di 15 pasar di DKI Jakarta,Antara,https://www.antaranews.com/berita/1909796/harga-telur-ayam-murah-ada-di-15-pasar-di-dki-jakarta
2020-12-23_an_0397,2020-12-23,Saham China dibuka lebih tinggi setelah anjlok sehari sebelumnya,Antara,https://www.antaranews.com/berita/1909792/saham-china-dibuka-lebih-tinggi-setelah-anjlok-sehari-sebelumnya
2020-12-23_an_0398,2020-12-23,"IHSG Rabu dibuka menguat 38,56 poin",Antara,https://www.antaranews.com/berita/1909788/ihsg-rabu-dibuka-menguat-3856-poin
2020-12-23_an_0399,2020-12-23,Rupiah Rabu pagi menguat 41 poin,Antara,https://www.antaranews.com/berita/1909784/rupiah-rabu-pagi-menguat-41-poin
2020-12-23_an_0400,2020-12-23,"Saham Tokyo dibuka menguat, sektor teknologi ikuti kenaikan Nasdaq",Antara,https://www.antaranews.com/berita/1909780/saham-tokyo-dibuka-menguat-sektor-teknologi-ikuti-kenaikan-nasdaq
2020-12-23_an_0401,2020-12-23,"Saham Australia ""rebound"" untuk dibuka lebih tinggi",Antara,https://www.antaranews.com/berita/1909776/saham-australia-rebound-untuk-dibuka-lebih-tinggi
2020-12-23_an_0402,2020-12-23,"Twitter akan buat akun @POTUS Joe Biden dimulai dengan nol ""follower""",Antara,https://www.antaranews.com/berita/1909736/twitter-akan-buat-akun-potus-joe-biden-dimulai-dengan-nol-follower
2020-12-23_an_0403,2020-12-23,"""Cyberpunk 2077"" terjual lebih dari 13 juta kopi",Antara,https://www.antaranews.com/berita/1909772/cyberpunk-2077-terjual-lebih-dari-13-juta-kopi
2020-12-23_an_0404,2020-12-23,Tantangan hingga persaingan mobil listrik di Indonesia pada 2021,Antara,https://otomotif.antaranews.com/berita/1909768/tantangan-hingga-persaingan-mobil-listrik-di-indonesia-pada-2021
2020-12-23_an_0405,2020-12-23,BNI dukung digitalisasi layanan keuangan di Unjani,Antara,https://www.antaranews.com/berita/1909764/bni-dukung-digitalisasi-layanan-keuangan-di-unjani
2020-12-23_an_0406,2020-12-23,"Mutasi corona baru belum ditemukan, China perketat pengamanan",Antara,https://www.antaranews.com/berita/1909760/mutasi-corona-baru-belum-ditemukan-china-perketat-pengamanan
2020-12-23_an_0407,2020-12-23,Formasi baru kabinet dengan semangat baru,Antara,https://www.antaranews.com/berita/1909756/formasi-baru-kabinet-dengan-semangat-baru
2020-12-23_an_0408,2020-12-23,Toyota hentikan produksi di Inggris dan Prancis,Antara,https://otomotif.antaranews.com/berita/1909748/toyota-hentikan-produksi-di-inggris-dan-prancis
2020-12-23_an_0409,2020-12-23,"Ada karakter ""One-Punch Man"" di game ""Free Fire""",Antara,https://www.antaranews.com/berita/1909744/ada-karakter-one-punch-man-di-game-free-fire
2020-12-23_an_0410,2020-12-23,Tunisia akui tak berminat jalin hubungan diplomatik dengan Israel,Antara,https://www.antaranews.com/berita/1909740/tunisia-akui-tak-berminat-jalin-hubungan-diplomatik-dengan-israel
2020-12-23_an_0411,2020-12-23,3 Indonesia bangun lebih dari 6.000 BTS 4.5G Pro pada 2020,Antara,https://www.antaranews.com/berita/1909732/3-indonesia-bangun-lebih-dari-6000-bts-45g-pro-pada-2020
2020-12-23_an_0412,2020-12-23,Menkeu Slovakia Eduard Heger terkonfirmasi COVID-19,Antara,https://www.antaranews.com/berita/1909704/menkeu-slovakia-eduard-heger-terkonfirmasi-covid-19
2020-12-23_an_0413,2020-12-23,"Didominasi narkoba, Kejari Kendari musnahkan barang bukti perkara 2020",Antara,https://www.antaranews.com/video/1908388/didominasi-narkoba-kejari-kendari-musnahkan-barang-bukti-perkara-2020
2020-12-23_an_0414,2020-12-23,"Ruang digital jadi ""showroom"" baru di tengah pandemi",Antara,https://otomotif.antaranews.com/berita/1909728/ruang-digital-jadi-showroom-baru-di-tengah-pandemi
2020-12-23_an_0415,2020-12-23,Polres Pandeglang siagakan ratusan personil amankan Natal dan tahun baru 2021,Antara,https://www.antaranews.com/video/1908248/polres-pandeglang-siagakan-ratusan-personilamankan-natal-dan-tahun-baru-2021
2020-12-23_an_0416,2020-12-23,Industri perdagangan berjangka komoditi sambut 2021 dengan optimistis,Antara,https://www.antaranews.com/berita/1909724/industri-perdagangan-berjangka-komoditi-sambut-2021-dengan-optimistis
2020-12-23_an_0417,2020-12-23,Gladbach menang besar di markas Elversberg untuk melaju ke 16 besar,Antara,https://www.antaranews.com/berita/1909720/gladbach-menang-besar-di-markas-elversberg-untuk-melaju-ke-16-besar
2020-12-23_an_0418,2020-12-23,"Sederet festival film yang hadir secara ""hybrid"" di tahun 2020",Antara,https://www.antaranews.com/berita/1909716/sederet-festival-film-yang-hadir-secara-hybrid-di-tahun-2020
2020-12-23_an_0419,2020-12-23,"Kemarin, Presiden umumkan enam menteri baru hingga lantik pada Rabu",Antara,https://www.antaranews.com/berita/1909712/kemarin-presiden-umumkan-enam-menteri-baru-hingga-lantik-pada-rabu
2020-12-23_an_0420,2020-12-23,UMM gaet Universitad EAFIT Kolombia perkuat kerja sama internasional,Antara,https://www.antaranews.com/berita/1909708/umm-gaet-universitad-eafit-kolombia-perkuat-kerja-sama-internasional
2020-12-23_an_0421,2020-12-23,"Kemarin, sumber dana PEN hingga strategi bangkitkan pariwisata",Antara,https://www.antaranews.com/berita/1909700/kemarin-sumber-dana-pen-hingga-strategi-bangkitkan-pariwisata
2020-12-23_an_0422,2020-12-23,Dolar naik ketika jenis baru virus corona kurangi optimisme stimulus,Antara,https://www.antaranews.com/berita/1909664/dolar-naik-ketika-jenis-baru-virus-corona-kurangi-optimisme-stimulus
2020-12-23_an_0423,2020-12-23,Lalahuta meriahkan liburan akhir tahun dengan konser virtual,Antara,https://www.antaranews.com/berita/1909696/lalahuta-meriahkan-liburan-akhir-tahun-dengan-konser-virtual
2020-12-23_an_0424,2020-12-23,Wall Street beragam setelah Kongres meloloskan paket bantuan COVID-19,Antara,https://www.antaranews.com/berita/1909692/wall-street-beragam-setelah-kongres-meloloskan-paket-bantuan-covid-19
2020-12-23_an_0425,2020-12-23,"Kemarin, harta enam menteri baru hingga KPK panggil istri Edhy Prabowo",Antara,https://www.antaranews.com/berita/1909688/kemarin-harta-enam-menteri-baru-hingga-kpk-panggil-istri-edhy-prabowo
2020-12-23_an_0426,2020-12-23,Maskapai Citilink bekali penumpang vitamin dan hand sanitizer,Antara,https://www.antaranews.com/berita/1909684/maskapai-citilink-bekali-penumpang-vitamin-dan-hand-sanitizer
2020-12-23_an_0427,2020-12-23,Liga Indonesia : Corona dan dagelan sepak bola kita,Antara,https://www.antaranews.com/berita/1909680/liga-indonesia-corona-dan-dagelan-sepak-bola-kita
2020-12-23_an_0428,2020-12-23,Elon Musk ungkap bos Apple pernah tolak akuisisi Tesla,Antara,https://www.antaranews.com/berita/1909676/elon-musk-ungkap-bos-apple-pernah-tolak-akuisisi-tesla
2020-12-23_an_0429,2020-12-23,Armada SIM Keliling dapat Anda kunjungi di lima lokasi berikut,Antara,https://www.antaranews.com/berita/1909672/armada-sim-keliling-dapat-anda-kunjungi-di-lima-lokasi-berikut
2020-12-23_an_0430,2020-12-23,"Kemarin, Gus Yaqut jadi menteri agama hingga Bogor wajib tes antigen",Antara,https://www.antaranews.com/berita/1909668/kemarin-gus-yaqut-jadi-menteri-agama-hingga-bogor-wajib-tes-antigen
2020-12-23_an_0431,2020-12-23,Bareskrim serahkan tersangka Gus Nur dan barang bukti ke Kejagung,Antara,https://www.antaranews.com/berita/1911496/bareskrim-serahkan-tersangka-gus-nur-dan-barang-bukti-ke-kejagung
2020-12-23_an_0432,2020-12-23,25 pegawai KPU Samarinda positif COVID-19,Antara,https://www.antaranews.com/berita/1911464/25-pegawai-kpu-samarinda-positif-covid-19
2020-12-23_an_0433,2020-12-23,Kasus positif COVID-19 di Kaltim bertambah 418 orang,Antara,https://www.antaranews.com/berita/1911492/kasus-positif-covid-19-di-kaltim-bertambah-418-orang
2020-12-23_an_0434,2020-12-23,Polda Sumbar sebut dokumen lima moge rombongan HOG Siliwangi palsu,Antara,https://www.antaranews.com/video/1911148/polda-sumbar-sebut-dokumen-lima-moge-rombongan-hog-siliwangi-palsu
2020-12-23_an_0435,2020-12-23,Edhy Prabowo dicecar beli barang mewah dari suap ekspor benih lobster,Antara,https://www.antaranews.com/berita/1911488/edhy-prabowo-dicecar-beli-barang-mewah-dari-suap-ekspor-benih-lobster
2020-12-23_an_0436,2020-12-23,Bandara Ngurah Rai tambah fasilitas rapid test antigen,Antara,https://www.antaranews.com/berita/1911484/bandara-ngurah-rai-tambah-fasilitas-rapid-test-antigen
2020-12-23_an_0437,2020-12-23,JK ajak MUI terlibat dalam perdamaian Afghanistan,Antara,https://www.antaranews.com/berita/1911480/jk-ajak-mui-terlibat-dalam-perdamaian-afghanistan
2020-12-23_an_0438,2020-12-23,Warga Kabupaten Madiun positif COVID-19 bertambah jadi 307,Antara,https://www.antaranews.com/berita/1911476/warga-kabupaten-madiun-positif-covid-19-bertambah-jadi-307
2020-12-23_an_0439,2020-12-23,Setara Institute: Menjaga toleransi jadi tantangan Menteri Agama,Antara,https://www.antaranews.com/berita/1911472/setara-institute-menjaga-toleransi-jadi-tantangan-menteri-agama
2020-12-23_an_0440,2020-12-23,Bupati Sangihe minta pengelola minimarket lakukan protokol kesehatan,Antara,https://www.antaranews.com/berita/1911468/bupati-sangihe-minta-pengelola-minimarket-lakukan-protokol-kesehatan
2020-12-23_an_0441,2020-12-23,"Pabrik MMKI mulai produksi mesin Xpander, TKDN sampai 80 persen",Antara,https://otomotif.antaranews.com/berita/1909660/pabrik-mmki-mulai-produksi-mesin-xpander-tkdn-sampai-80-persen
2020-12-23_an_0442,2020-12-23,"Kemarin, klaster COVID-19 Panti Lansia hingga perayaan Natal di DKI",Antara,https://www.antaranews.com/berita/1909624/kemarin-klaster-covid-19-panti-lansia-hingga-perayaan-natal-di-dki
2020-12-23_an_0443,2020-12-23,Juventus tumbang 0-3 saat menjamu Fiorentina,Antara,https://www.antaranews.com/foto/1909656/juventus-tumbang-0-3-saat-menjamu-fiorentina
2020-12-23_an_0444,2020-12-23,"Liburan praktis pakai ""city car"", simak tipsnya",Antara,https://otomotif.antaranews.com/berita/1909652/liburan-praktis-pakai-city-car-simak-tipsnya
2020-12-23_an_0445,2020-12-23,"Minyak turun, varian baru virus corona angkat kekhawatiran permintaan",Antara,https://www.antaranews.com/berita/1909648/minyak-turun-varian-baru-virus-corona-angkat-kekhawatiran-permintaan
2020-12-23_an_0446,2020-12-23,Hipmi bangga kadernya masuk jajaran menteri Kabinet Indonesia Maju,Antara,https://www.antaranews.com/berita/1909644/hipmi-bangga-kadernya-masuk-jajaran-menteri-kabinet-indonesia-maju
2020-12-23_an_0447,2020-12-23,"Polda Metro Jaya selenggarakan ""swab test"" antigen gratis",Antara,https://www.antaranews.com/berita/1909640/polda-metro-jaya-selenggarakan-swab-test-antigen-gratis
2020-12-23_an_0448,2020-12-23,Pentingnya pelumasan mesin pada industri kelistrikan,Antara,https://otomotif.antaranews.com/berita/1909636/pentingnya-pelumasan-mesin-pada-industri-kelistrikan
2020-12-23_an_0449,2020-12-23,Fiorentina menggila menang tiga gol tanpa balas di markas Juventus,Antara,https://www.antaranews.com/berita/1909632/fiorentina-menggila-menang-tiga-gol-tanpa-balas-di-markas-juventus
2020-12-23_an_0450,2020-12-23,"Kemarin, ucapan Hari Ibu artis hingga tips hindari penipuan online",Antara,https://www.antaranews.com/berita/1909628/kemarin-ucapan-hari-ibu-artis-hingga-tips-hindari-penipuan-online
2020-12-23_an_0451,2020-12-23,Waspadai hujan di tiga wilayah di DKI Jakarta siang ini,Antara,https://www.antaranews.com/berita/1909620/waspadai-hujan-di-tiga-wilayah-di-dki-jakarta-siang-ini
2020-12-23_an_0452,2020-12-23,"Saham Prancis balik menguat, indeks CAC 40 melonjak 1,36 persen",Antara,https://www.antaranews.com/berita/1909584/saham-prancis-balik-menguat-indeks-cac-40-melonjak-136-persen
2020-12-23_an_0453,2020-12-23,Emas jatuh lagi karena kekhawatiran varian baru virus angkat dolar AS,Antara,https://www.antaranews.com/berita/1909616/emas-jatuh-lagi-karena-kekhawatiran-varian-baru-virus-angkat-dolar-as
2020-12-23_an_0454,2020-12-23,Villarreal buang peluang tembus tiga besar selepas diimbangi Bilbao,Antara,https://www.antaranews.com/berita/1909612/villarreal-buang-peluang-tembus-tiga-besar-selepas-diimbangi-bilbao
2020-12-23_an_0455,2020-12-23,Messi resmi lewati rekor Pele saat bantu Barcelona gulung Valladolid,Antara,https://www.antaranews.com/berita/1909608/messi-resmi-lewati-rekor-pele-saat-bantu-barcelona-gulung-valladolid
2020-12-23_an_0456,2020-12-23,"Saham Spanyol balik naik tajam, indeks IBEX 35 melambung 1,85 persen",Antara,https://www.antaranews.com/berita/1909604/saham-spanyol-balik-naik-tajam-indeks-ibex-35-melambung-185-persen
2020-12-23_an_0457,2020-12-23,Pertamina tambah pasokan elpiji 5 persen untuk Kalimantan,Antara,https://www.antaranews.com/berita/1909600/pertamina-tambah-pasokan-elpiji-5-persen-untuk-kalimantan
2020-12-23_an_0458,2020-12-23,"Saham Inggris hentikan rugi beruntun, indeks FTSE 100 naik 0,57 persen",Antara,https://www.antaranews.com/berita/1909596/saham-inggris-hentikan-rugi-beruntun-indeks-ftse-100-naik-057-persen
2020-12-23_an_0459,2020-12-23,"Saham Jerman ""rebound"", indeks DAX 30 ditutup bangkit 1,30 persen",Antara,https://www.antaranews.com/berita/1909592/saham-jerman-rebound-indeks-dax-30-ditutup-bangkit-130-persen
2020-12-23_an_0460,2020-12-23,PSV hapus jarak dari Ajax selepas hantam VVV Venlo,Antara,https://www.antaranews.com/berita/1909588/psv-hapus-jarak-dari-ajax-selepas-hantam-vvv-venlo
2020-12-23_an_0461,2020-12-23,Manchester City melenggang ke semifinal Piala Liga lewati Arsenal,Antara,https://www.antaranews.com/berita/1909580/manchester-city-melenggang-ke-semifinal-piala-liga-lewati-arsenal
2020-12-23_an_0462,2020-12-23,Polisi dalami dugaan adanya pelaku lain dari sabu 201 kg,Antara,https://www.antaranews.com/berita/1909544/polisi-dalami-dugaan-adanya-pelaku-lain-dari-sabu-201-kg
2020-12-23_an_0463,2020-12-23,Atletico kokohkan posisi puncak selepas pecundangi Sociedad,Antara,https://www.antaranews.com/berita/1909576/atletico-kokohkan-posisi-puncak-selepas-pecundangi-sociedad
2020-12-23_an_0464,2020-12-23,Leipzig menangi duel dua tim strata tertinggi pada Piala Jerman,Antara,https://www.antaranews.com/berita/1909572/leipzig-menangi-duel-dua-tim-strata-tertinggi-pada-piala-jerman
2020-12-23_an_0465,2020-12-23,Crotone tinggalkan dasar klasemen setelah taklukkan Parma 2-1,Antara,https://www.antaranews.com/berita/1909568/crotone-tinggalkan-dasar-klasemen-setelah-taklukkan-parma-2-1
2020-12-23_an_0466,2020-12-23,Newcastle didepak tim kasta kedua Brentford dari Piala Liga,Antara,https://www.antaranews.com/berita/1909564/newcastle-didepak-tim-kasta-kedua-brentford-dari-piala-liga
2020-12-23_an_0467,2020-12-23,Sevilla bawa pulang tiga poin penuh dari Valencia,Antara,https://www.antaranews.com/berita/1909560/sevilla-bawa-pulang-tiga-poin-penuh-dari-valencia
2020-12-23_an_0468,2020-12-23,"Aliansi Relawan Jokowi apresiasi ""reshuffle"" kabinet oleh Presiden",Antara,https://www.antaranews.com/berita/1909556/aliansi-relawan-jokowi-apresiasi-reshuffle-kabinet-oleh-presiden
2020-12-23_an_0469,2020-12-23,Kenaikan proporsi iuran peserta kelas 3 BPJS diikuti penambahan bansos,Antara,https://www.antaranews.com/berita/1909552/kenaikan-proporsi-iuran-peserta-kelas-3-bpjs-diikuti-penambahan-bansos
2020-12-23_an_0470,2020-12-23,BNPB serahkan ratusan hunian bagi korban tsunami di Pandeglang,Antara,https://www.antaranews.com/video/1909548/bnpb-serahkan-ratusan-hunian-bagi-korban-tsunami-di-pandeglang
2020-12-23_an_0471,2020-12-23,Napoli menangi banding sehingga akan mainkan laga ulang lawan Juventus,Antara,https://www.antaranews.com/berita/1909540/napoli-menangi-banding-sehingga-akan-mainkan-laga-ulang-lawan-juventus
2020-12-23_an_0472,2020-12-23,Ini rencana Risma sebagai Mensos,Antara,https://www.antaranews.com/video/1909536/ini-rencana-risma-sebagai-mensos
2020-12-23_an_0473,2020-12-23,201 kg Sabu di Petamburan merupakan jaringan Timur Tengah,Antara,https://www.antaranews.com/berita/1909532/201-kg-sabu-di-petamburan-merupakan-jaringan-timur-tengah
2020-12-23_an_0474,2020-12-23,"Pulihkan parekraf, Sandiaga Uno akan terapkan big data",Antara,https://www.antaranews.com/video/1909528/pulihkan-parekraf-sandiaga-uno-akan-terapkan-big-data
2020-12-23_an_0475,2020-12-23,"Komentari pertandingan Madrid, pelatih Barcelona buat Zidane jengkel",Antara,https://www.antaranews.com/berita/1909524/komentari-pertandingan-madrid-pelatih-barcelona-buat-zidane-jengkel
2020-12-23_an_0476,2020-12-23,Petenis top dunia diharapkan tampil di Australian Open,Antara,https://www.antaranews.com/berita/1909520/petenis-top-dunia-diharapkan-tampil-di-australian-open
2020-12-23_an_0477,2020-12-23,Kasus positif COVID-19 Pamekasan bertambah menjadi 662 orang,Antara,https://www.antaranews.com/berita/1911460/kasus-positif-covid-19-pamekasan-bertambah-menjadi-662-orang
2020-12-23_an_0478,2020-12-23,"Miliki sabu dan tiga senpi ilegal, pengusaha asal Prancis ditangkap",Antara,https://www.antaranews.com/berita/1911428/miliki-sabu-dan-tiga-senpi-ilegal-pengusaha-asal-prancis-ditangkap
2020-12-23_an_0479,2020-12-23,Hari Rabu puncak arus keberangkatan penumpang kereta api,Antara,https://www.antaranews.com/video/1911380/hari-rabu-puncak-arus-keberangkatan-penumpang-kereta-api
2020-12-23_an_0480,2020-12-23,Gubernur Bali: Petugas jangan loloskan penumpang tanpa surat tes cepat,Antara,https://www.antaranews.com/berita/1911456/gubernur-bali-petugas-jangan-loloskan-penumpang-tanpa-surat-tes-cepat
2020-12-23_an_0481,2020-12-23,Gubernur Sulut terbitkan surat edaran ibadah perayaan cegah COVID-19,Antara,https://www.antaranews.com/berita/1911452/gubernur-sulut-terbitkan-surat-edaran-ibadah-perayaan-cegah-covid-19
2020-12-23_an_0482,2020-12-23,Dembele absen bela Lyon gara-gara patah lengan,Antara,https://www.antaranews.com/berita/1911448/dembele-absen-bela-lyon-gara-gara-patah-lengan
2020-12-23_an_0483,2020-12-23,Jaringan Muda Muslim Jakarta tolak provokasi kelompok sebar kebencian,Antara,https://www.antaranews.com/berita/1911444/jaringan-muda-muslim-jakarta-tolak-provokasi-kelompok-sebar-kebencian
2020-12-23_an_0484,2020-12-23,Kemendikbud sebut pandemi COVID-19 lahirkan ribuan inovasi,Antara,https://www.antaranews.com/berita/1911440/kemendikbud-sebut-pandemi-covid-19-lahirkan-ribuan-inovasi
2020-12-23_an_0485,2020-12-23,Trippier dilarang bermain 10 pekan karena langgar aturan taruhan,Antara,https://www.antaranews.com/berita/1911436/trippier-dilarang-bermain-10-pekan-karena-langgar-aturan-taruhan
2020-12-23_an_0486,2020-12-23,"Kelola limbah, Sampoerna dan Waste4Change daur ulang puntung",Antara,https://www.antaranews.com/berita/1911432/kelola-limbah-sampoerna-dan-waste4change-daur-ulang-puntung
2020-12-23_an_0487,2020-12-23,Arus mudik liburan Natal-Tahun Baru di tol Cikampek,Antara,https://www.antaranews.com/foto/1911424/arus-mudik-liburan-natal-tahun-baru-di-tol-cikampek
2020-12-23_an_0488,2020-12-23,"Panti Sosial Lansia Cengkareng tunggu hasil ""PCR"" 114 penghuni",Antara,https://www.antaranews.com/berita/1911396/panti-sosial-lansia-cengkareng-tunggu-hasil-pcr-114-penghuni
2020-12-23_an_0489,2020-12-23,52 warga Kota Sukabumi meninggal akibat COVID-19,Antara,https://www.antaranews.com/berita/1911420/52-warga-kota-sukabumi-meninggal-akibat-covid-19
2020-12-23_an_0490,2020-12-23,Polda Metro Jaya pecat 45 polisi bandel sepanjang 2020,Antara,https://www.antaranews.com/berita/1911416/polda-metro-jaya-pecat-45-polisi-bandel-sepanjang-2020
2020-12-23_an_0491,2020-12-23,Puluhan warga di DTW Kintamani terjaring operasi protokol kesehatan,Antara,https://www.antaranews.com/berita/1911412/puluhan-warga-di-dtw-kintamani-terjaring-operasi-protokol-kesehatan
2020-12-23_an_0492,2020-12-23,Brimob Sumut perketat pengamanan obyek vital jelang Natal-Tahun Baru,Antara,https://www.antaranews.com/berita/1911408/brimob-sumut-perketat-pengamanan-obyek-vital-jelang-natal-tahun-baru
2020-12-23_an_0493,2020-12-23,20 pelanggar prokes terjaring Operasi Tibmask di Pegadungan,Antara,https://www.antaranews.com/berita/1911404/20-pelanggar-prokes-terjaring-operasi-tibmask-di-pegadungan
2020-12-23_an_0494,2020-12-23,Pemprov Jabar perketat pengawasan lalu lintas di perbatasan selama Nataru,Antara,https://www.antaranews.com/video/1911256/pemprov-jabar-perketat-pengawasan-lalu-lintas-di-perbatasan-selama-nataru
2020-12-23_an_0495,2020-12-23,PMI Jember lakukan penyemprotan disinfektan di 100 gereja,Antara,https://www.antaranews.com/video/1911300/pmi-jember-lakukan-penyemprotan-disinfektan-di-100-gereja
2020-12-23_an_0496,2020-12-23,Mencicip SUV bongsor asal Korea Selatan,Antara,https://otomotif.antaranews.com/berita/1911400/mencicip-suv-bongsor-asal-korea-selatan
2020-12-23_an_0497,2020-12-23,"Kemlu dorong ekspor kopi Indonesia ke pasar Amerika Utara, Jerman",Antara,https://www.antaranews.com/berita/1911392/kemlu-dorong-ekspor-kopi-indonesia-ke-pasar-amerika-utara-jerman
2020-12-23_an_0498,2020-12-23,1000 Days Fund: Banyak ibu hamil di NTT tidak periksa kandungan,Antara,https://www.antaranews.com/berita/1911352/1000-days-fund-banyak-ibu-hamil-di-ntt-tidak-periksa-kandungan
2020-12-23_an_0499,2020-12-23,500 kg telur terjual dalam Gelar Pangan Murah di Jakarta,Antara,https://www.antaranews.com/berita/1911388/500-kg-telur-terjual-dalam-gelar-pangan-murah-di-jakarta
2020-12-23_an_0500,2020-12-23,Dua napi teroris dipindah ke LP Tulungagung,Antara,https://www.antaranews.com/berita/1911384/dua-napi-teroris-dipindah-ke-lp-tulungagung
2020-12-23_an_0501,2020-12-23,Hyundai Palisade dapat sambutan baik dari konsumen Indonesia,Antara,https://otomotif.antaranews.com/berita/1911376/hyundai-palisade-dapat-sambutan-baik-dari-konsumen-indonesia
2020-12-23_an_0502,2020-12-23,"Jakarta Utara kumpulkan Rp1,42 miliar dana PMI",Antara,https://www.antaranews.com/berita/1911372/jakarta-utara-kumpulkan-rp142-miliar-dana-pmi
2020-12-23_an_0503,2020-12-23,KPK perpanjang penahanan Juliari Batubara dan kawan-kawan,Antara,https://www.antaranews.com/berita/1911368/kpk-perpanjang-penahanan-juliari-batubara-dan-kawan-kawan
2020-12-23_an_0504,2020-12-23,Kapolri keluarkan Maklumat Kepatuhan Prokes libur Natal-Tahun Baru,Antara,https://www.antaranews.com/berita/1911364/kapolri-keluarkan-maklumat-kepatuhan-prokes-libur-natal-tahun-baru
2020-12-23_an_0505,2020-12-23,"Kasus COVID-19 Lampung bertambah 111 orang, jadi 5.663",Antara,https://www.antaranews.com/berita/1911360/kasus-covid-19-lampung-bertambah-111-orang-jadi-5663
2020-12-23_an_0506,2020-12-23,Polisi duga sabu Petamburan untuk biayai teroris Timur Tengah,Antara,https://www.antaranews.com/berita/1911356/polisi-duga-sabu-petamburan-untuk-biayai-teroris-timur-tengah
2020-12-23_an_0507,2020-12-23,KPK sita ponsel dari ajudan Edhy Prabowo,Antara,https://www.antaranews.com/berita/1911348/kpk-sita-ponsel-dari-ajudan-edhy-prabowo
2020-12-23_an_0508,2020-12-23,Bambang Sunarwibowo: Patuhi prokes COVID-19 saat libur akhir tahun,Antara,https://www.antaranews.com/berita/1911316/bambang-sunarwibowo-patuhi-prokes-covid-19-saat-libur-akhir-tahun
2020-12-23_an_0509,2020-12-23,Dishub Gianyar buka trayek bus Ubud-Denpasar,Antara,https://www.antaranews.com/berita/1911344/dishub-gianyar-buka-trayek-bus-ubud-denpasar
2020-12-23_an_0510,2020-12-23,Anggota DPR dukung komitmen Presiden perjuangkan kemerdekaan Palestina,Antara,https://www.antaranews.com/berita/1911340/anggota-dpr-dukung-komitmen-presiden-perjuangkan-kemerdekaan-palestina
2020-12-23_an_0511,2020-12-23,Puluhan sopir bus di Terminal Leuwipanjang jalani tes kesehatan,Antara,https://www.antaranews.com/video/1911336/puluhan-sopir-bus-di-terminal-leuwipanjang-jalani-tes-kesehatan
2020-12-23_an_0512,2020-12-23,RSUD Soedarso Pontianak raih predikat WBK dari Kementerian PANRB,Antara,https://www.antaranews.com/video/1911192/rsud-soedarso-pontianak-raih-predikat-wbk-dari-kementerian-panrb
2020-12-23_an_0513,2020-12-23,Stunting Center di NTT diharapkan bisa diadopsi di daerah lain,Antara,https://www.antaranews.com/berita/1911332/stunting-center-di-ntt-diharapkan-bisa-diadopsi-di-daerah-lain
2020-12-23_an_0514,2020-12-23,Holding Perkebunan gandeng KPK tangani pengaduan masyarakat,Antara,https://www.antaranews.com/berita/1911328/holding-perkebunan-gandeng-kpk-tangani-pengaduan-masyarakat
2020-12-23_an_0515,2020-12-23,Positif COVID-19 Sukabumi naik jadi 1.823,Antara,https://www.antaranews.com/berita/1911324/positif-covid-19-sukabumi-naik-jadi-1823
2020-12-23_an_0516,2020-12-23,IPC jamin operasional pelabuhan normal selama libur akhir tahun,Antara,https://www.antaranews.com/berita/1911320/ipc-jamin-operasional-pelabuhan-normal-selama-libur-akhir-tahun
2020-12-23_an_0517,2020-12-23,Warga Jakarta Utara minta bansos DKI tidak dihentikan,Antara,https://www.antaranews.com/berita/1911312/warga-jakarta-utara-minta-bansos-dki-tidak-dihentikan
2020-12-23_an_0518,2020-12-23,Gajah berkostum ala sinterklas bagikan masker di Thailand,Antara,https://www.antaranews.com/foto/1911272/gajah-berkostum-ala-sinterklas-bagikan-masker-di-thailand
2020-12-23_an_0519,2020-12-23,Jatim evaluasi PJJ agar tidak terjadi stunting in learner,Antara,https://www.antaranews.com/berita/1911308/jatim-evaluasi-pjj-agar-tidak-terjadi-stunting-in-learner
2020-12-23_an_0520,2020-12-23,Capres Barcelona janjikan stadion baru senilai Rp15 triliun,Antara,https://www.antaranews.com/berita/1911304/capres-barcelona-janjikan-stadion-baru-senilai-rp15-triliun
2020-12-23_an_0521,2020-12-23,Satgas Pamtas gagalkan penyelundupan 4 kg sabu-sabu asal Malaysia,Antara,https://www.antaranews.com/berita/1911296/satgas-pamtas-gagalkan-penyelundupan-4-kg-sabu-sabu-asal-malaysia
2020-12-23_an_0522,2020-12-23,Jakpro sabet empat penghargaan berkat inovasi digital,Antara,https://www.antaranews.com/berita/1911292/jakpro-sabet-empat-penghargaan-berkat-inovasi-digital
2020-12-23_an_0523,2020-12-23,KPK konfirmasi saksi soal pemilihan vendor salurkan bansos COVID-19,Antara,https://www.antaranews.com/berita/1911288/kpk-konfirmasi-saksi-soal-pemilihan-vendor-salurkan-bansos-covid-19
