unique_id,date,headline,source,url
2020-09-14_an_0394,2020-09-14,DPS Manulife: Reksa dana syariah bisa jadi opsi investasi saat pandemi,Antara,https://www.antaranews.com/berita/1724502/dps-manulife-reksa-dana-syariah-bisa-jadi-opsi-investasi-saat-pandemi
2020-09-14_an_0395,2020-09-14,Polda Metro Jaya gelar Operasi Yustisi Protokol Kesehatan,Antara,https://www.antaranews.com/berita/1724498/polda-metro-jaya-gelar-operasi-yustisi-protokol-kesehatan
2020-09-14_an_0396,2020-09-14,"Ojol boleh beroperasi saat PSBB, Grab apresiasi pemerintah",Antara,https://www.antaranews.com/berita/1724494/ojol-boleh-beroperasi-saat-psbb-grab-apresiasi-pemerintah
2020-09-14_an_0397,2020-09-14,Polda Metro Jaya gelar operasi yustisi protokol COVID-19,Antara,https://www.antaranews.com/foto/1724490/polda-metro-jaya-gelar-operasi-yustisi-protokol-covid-19
2020-09-14_an_0398,2020-09-14,Pupuk Indonesia salurkan pupuk subsidi selama masa transisi kartu tani,Antara,https://www.antaranews.com/berita/1724486/pupuk-indonesia-salurkan-pupuk-subsidi-selama-masa-transisi-kartu-tani
2020-09-14_an_0399,2020-09-14,Pasien positif COVID-19 di RS Darurat Wisma Atlet bertambah 11 orang,Antara,https://www.antaranews.com/berita/1724482/pasien-positif-covid-19-di-rs-darurat-wisma-atlet-bertambah-11-orang
2020-09-14_an_0400,2020-09-14,Tambahan 33 positif dan 3 sembuh COVID-19 di Batam,Antara,https://www.antaranews.com/berita/1724478/tambahan-33-positif-dan-3-sembuh-covid-19-di-batam
2020-09-14_an_0401,2020-09-14,BUMDes dukung kelangsungan usaha kerajinan di Lampung,Antara,https://www.antaranews.com/berita/1724470/bumdes-dukung-kelangsungan-usaha-kerajinan-di-lampung
2020-09-14_an_0402,2020-09-14,Cara unik Polres Depok sosialisasi penggunaan masker,Antara,https://www.antaranews.com/foto/1724438/cara-unik-polres-depok-sosialisasi-penggunaan-masker
2020-09-14_an_0403,2020-09-14,Fraksi PKS DPR ingatkan urgensi RUU Perlindungan Tokoh agama,Antara,https://www.antaranews.com/berita/1724466/fraksi-pks-dpr-ingatkan-urgensi-ruu-perlindungan-tokoh-agama
2020-09-14_an_0404,2020-09-14,"Saat PSBB, Indo Premier permudah investasi reksa dana",Antara,https://www.antaranews.com/berita/1724462/saat-psbb-indo-premier-permudah-investasi-reksa-dana
2020-09-14_an_0405,2020-09-14,Kylian Mbappe ingin tinggalkan PSG musim depan,Antara,https://www.antaranews.com/berita/1724458/kylian-mbappe-ingin-tinggalkan-psg-musim-depan
2020-09-14_an_0406,2020-09-14,Stasiun Bogor telihat lengang di hari pertama PSBB total Jakarta,Antara,https://www.antaranews.com/foto/1724454/stasiun-bogor-telihat-lengang-di-hari-pertama-psbb-total-jakarta
2020-09-14_an_0407,2020-09-14,30 lukisan karya perupa Minang dipamerkan di Taman Budaya Padang,Antara,https://www.antaranews.com/video/1724418/30-lukisan-karya-perupa-minang-dipamerkan-di-taman-budaya-padang
2020-09-14_an_0408,2020-09-14,Daftar juara tunggal putra US Open sejak 1968,Antara,https://www.antaranews.com/berita/1724450/daftar-juara-tunggal-putra-us-open-sejak-1968
2020-09-14_an_0409,2020-09-14,"Pilkada Semarang, Hendi-Ita tes kesehatan di RS Kariadi Semarang",Antara,https://www.antaranews.com/berita/1724446/pilkada-semarang-hendi-ita-tes-kesehatan-di-rs-kariadi-semarang
2020-09-14_an_0410,2020-09-14,Presiden Jokowi lantik 20 duta besar Indonesia untuk negara sahabat,Antara,https://www.antaranews.com/berita/1724442/presiden-jokowi-lantik-20-duta-besar-indonesia-untuk-negara-sahabat
2020-09-14_an_0411,2020-09-14,Pemprov Babel gelar pemeriksaan kesehatan massal bagi pejabat,Antara,https://www.antaranews.com/berita/1724434/pemprov-babel-gelar-pemeriksaan-kesehatan-massal-bagi-pejabat
2020-09-14_an_0412,2020-09-14,Selandia Baru akan cabut pembatasan virus corona pada 21 September,Antara,https://www.antaranews.com/berita/1724394/selandia-baru-akan-cabut-pembatasan-virus-corona-pada-21-september
2020-09-14_an_0413,2020-09-14,"Samsung Galaxy S20 ""ramah kantong"" hadir pekan depan",Antara,https://www.antaranews.com/berita/1724430/samsung-galaxy-s20-ramah-kantong-hadir-pekan-depan
2020-09-14_an_0414,2020-09-14,"Fakta menarik seputar drama ""Record of Youth""",Antara,https://www.antaranews.com/berita/1724426/fakta-menarik-seputar-drama-record-of-youth
2020-09-14_an_0415,2020-09-14,Microsoft gagal akusisi TikTok,Antara,https://www.antaranews.com/berita/1724422/microsoft-gagal-akusisi-tiktok
2020-09-14_an_0416,2020-09-14,Angelina Jolie sumbang bocah penjual limun untuk Yaman,Antara,https://www.antaranews.com/berita/1724414/angelina-jolie-sumbang-bocah-penjual-limun-untuk-yaman
2020-09-14_an_0417,2020-09-14,SMF kucurkan Rp500 miliar pembiayaan kepada Bank DKI,Antara,https://www.antaranews.com/berita/1724410/smf-kucurkan-rp500-miliar-pembiayaan-kepada-bank-dki
2020-09-14_an_0418,2020-09-14,Pengacak sinyal cegah napi kendalikan peredaran narkoba dari dalam LP,Antara,https://www.antaranews.com/berita/1724406/pengacak-sinyal-cegah-napi-kendalikan-peredaran-narkoba-dari-dalam-lp
2020-09-14_an_0419,2020-09-14,JICT perkuat jalur pelayaran China-Asia Tenggara,Antara,https://www.antaranews.com/berita/1724402/jict-perkuat-jalur-pelayaran-china-asia-tenggara
2020-09-14_an_0420,2020-09-14,Jakarta Timur sebar 40 personel Dishub di perbatasan,Antara,https://www.antaranews.com/berita/1724398/jakarta-timur-sebar-40-personel-dishub-di-perbatasan
2020-09-14_an_0421,2020-09-14,PMJ dan Dishub DKI operasi yustisi PSBB total di Pasar Jumat,Antara,https://www.antaranews.com/berita/1724390/pmj-dan-dishub-dki-operasi-yustisi-psbb-total-di-pasar-jumat
2020-09-14_an_0422,2020-09-14,"Saham Hong Kong dibuka  lebih tinggi, indeks HSI terkerek 0,27 persen",Antara,https://www.antaranews.com/berita/1724354/saham-hong-kong-dibuka-lebih-tinggi-indeks-hsi-terkerek-027-persen
2020-09-14_an_0423,2020-09-14,China tidak butuh vaksinasi berskala besar tapi waspadai dampak ADE,Antara,https://www.antaranews.com/berita/1724386/china-tidak-butuh-vaksinasi-berskala-besar-tapi-waspadai-dampak-ade
2020-09-14_an_0424,2020-09-14,Singapura bergulat dengan virus corona di asrama pekerja migran,Antara,https://www.antaranews.com/berita/1724382/singapura-bergulat-dengan-virus-corona-di-asrama-pekerja-migran
2020-09-14_an_0425,2020-09-14,Perusahaan pengolah daging rajungan Morenzo melantai di bursa,Antara,https://www.antaranews.com/berita/1724378/perusahaan-pengolah-daging-rajungan-morenzo-melantai-di-bursa
2020-09-14_an_0426,2020-09-14,"Neymar ""ngamuk"" di Twitter karena mengaku Jadi korban rasisme",Antara,https://www.antaranews.com/berita/1724374/neymar-ngamuk-di-twitter-karena-mengaku-jadi-korban-rasisme
2020-09-14_an_0427,2020-09-14,Tiga juta ekor ikan bakal disebar di lima kabupaten NTT,Antara,https://www.antaranews.com/berita/1724370/tiga-juta-ekor-ikan-bakal-disebar-di-lima-kabupaten-ntt
2020-09-14_an_0428,2020-09-14,Empat perusahaan teknologi medis Taiwan siap rambah pasar Indonesia,Antara,https://www.antaranews.com/berita/1724366/empat-perusahaan-teknologi-medis-taiwan-siap-rambah-pasar-indonesia
2020-09-14_an_0429,2020-09-14,Rupiah berpeluang menguat seiring dimulainya PSBB,Antara,https://www.antaranews.com/berita/1724362/rupiah-berpeluang-menguat-seiring-dimulainya-psbb
2020-09-14_an_0430,2020-09-14,"Yuan ""rebound"" 28 basis poin menjadi 6,8361 terhadap dolar AS",Antara,https://www.antaranews.com/berita/1724358/yuan-rebound-28-basis-poin-menjadi-68361-terhadap-dolar-as
2020-09-14_an_0431,2020-09-14,Penyelenggaraan Piala Thomas & Uber 2020 diragukan,Antara,https://www.antaranews.com/berita/1726202/penyelenggaraan-piala-thomas-uber-2020-diragukan
2020-09-14_an_0432,2020-09-14,Polisi Biak patroli imbau warga waspadai COVID-19,Antara,https://www.antaranews.com/berita/1726170/polisi-biak-patroli-imbau-warga-waspadai-covid-19
2020-09-14_an_0433,2020-09-14,Cek Fakta: Polri berikan kiat blokir penipuan SMS?,Antara,https://www.antaranews.com/berita/1726198/cek-fakta-polri-berikan-kiat-blokir-penipuan-sms
2020-09-14_an_0434,2020-09-14,"Roglic berada dalam posisi bagus, namun Pogacar siap mengancam",Antara,https://www.antaranews.com/berita/1726194/roglic-berada-dalam-posisi-bagus-namun-pogacar-siap-mengancam
2020-09-14_an_0435,2020-09-14,Pemohon BPUM di Madiun melebihi kuota penerima,Antara,https://www.antaranews.com/video/1726154/pemohon-bpum-di-madiun-melebihi-kuota-penerima
2020-09-14_an_0436,2020-09-14,Tiga Pilar Jaksel gencarkan pendisiplinan protokol kesehatan,Antara,https://www.antaranews.com/berita/1726190/tiga-pilar-jaksel-gencarkan-pendisiplinan-protokol-kesehatan
2020-09-14_an_0437,2020-09-14,Inter perpanjang kontrak kiper Daniele Padelli,Antara,https://www.antaranews.com/berita/1726186/inter-perpanjang-kontrak-kiper-daniele-padelli
2020-09-14_an_0438,2020-09-14,KLHK tindak jaringan perdagangan daring cula badak dan gading gajah,Antara,https://www.antaranews.com/berita/1726182/klhk-tindak-jaringan-perdagangan-daring-cula-badak-dan-gading-gajah
2020-09-14_an_0439,2020-09-14,TurunTangan dan PPA salurkan bantuan untuk paramedis dan petugas TPU,Antara,https://www.antaranews.com/berita/1726178/turuntangan-dan-ppa-salurkan-bantuan-untuk-paramedis-dan-petugas-tpu
2020-09-14_an_0440,2020-09-14,Jumlah penumpang KRL turun saat penerapan PSBB total,Antara,https://www.antaranews.com/foto/1726174/jumlah-penumpang-krl-turun-saat-penerapan-psbb-total
2020-09-14_an_0441,2020-09-14,Sudin SDA Jaksel tutup layanan kolam terapi ikan Setu Babakan,Antara,https://www.antaranews.com/berita/1724350/sudin-sda-jaksel-tutup-layanan-kolam-terapi-ikan-setu-babakan
2020-09-14_an_0442,2020-09-14,Pemkot Palembang dorong pengembangan paket wisata Palembang-Lampung,Antara,https://www.antaranews.com/berita/1724314/pemkot-palembang-dorong-pengembangan-paket-wisata-palembang-lampung
2020-09-14_an_0443,2020-09-14,Rehabilitasi DAS cegah bencana hidrologi,Antara,https://www.antaranews.com/infografik/1724346/rehabilitasi-das-cegah-bencana-hidrologi
2020-09-14_an_0444,2020-09-14,Saham China dibuka lebih tinggi lanjutkan kenaikan akhir pekan lalu,Antara,https://www.antaranews.com/berita/1724342/saham-china-dibuka-lebih-tinggi-lanjutkan-kenaikan-akhir-pekan-lalu
2020-09-14_an_0445,2020-09-14,IHSG awal pekan naik seiring mulai diterapkannya PSBB total,Antara,https://www.antaranews.com/berita/1724338/ihsg-awal-pekan-naik-seiring-mulai-diterapkannya-psbb-total
2020-09-14_an_0446,2020-09-14,"Respons PSBB, Bank Mandiri sesuaikan operasional di DKI Jakarta",Antara,https://www.antaranews.com/berita/1724334/respons-psbb-bank-mandiri-sesuaikan-operasional-di-dki-jakarta
2020-09-14_an_0447,2020-09-14,"Jika resesi, pemerintah diminta tetap salurkan bantuan sosial",Antara,https://www.antaranews.com/berita/1724330/jika-resesi-pemerintah-diminta-tetap-salurkan-bantuan-sosial
2020-09-14_an_0448,2020-09-14,Victoria laporkan kenaikan  kasus COVID-19 terendah sejak Juni,Antara,https://www.antaranews.com/berita/1724326/victoria-laporkan-kenaikan-kasus-covid-19-terendah-sejak-juni
2020-09-14_an_0449,2020-09-14,Polda Metro buka empat titik layanan SIM Keliling di hari pertama PSBB,Antara,https://www.antaranews.com/berita/1724322/polda-metro-buka-empat-titik-layanan-sim-keliling-di-hari-pertama-psbb
2020-09-14_an_0450,2020-09-14,"PSBB lanjutan, Jalan MH Thamrin-Sudirman ramai lancar",Antara,https://www.antaranews.com/berita/1724318/psbb-lanjutan-jalan-mh-thamrin-sudirman-ramai-lancar
2020-09-14_an_0451,2020-09-14,Dolar AS di kisaran paruh bawah 106 yen pada awal perdagangan di Tokyo,Antara,https://www.antaranews.com/berita/1724310/dolar-as-di-kisaran-paruh-bawah-106-yen-pada-awal-perdagangan-di-tokyo
2020-09-14_an_0452,2020-09-14,"IHSG Senin dibuka menguat 43,31 poin",Antara,https://www.antaranews.com/berita/1724274/ihsg-senin-dibuka-menguat-4331-poin
2020-09-14_an_0453,2020-09-14,"Kemarin, Jakarta kembali PSBB hingga TNI AU mediasi peluru ""nyasar""",Antara,https://www.antaranews.com/berita/1724306/kemarin-jakarta-kembali-psbb-hingga-tni-au-mediasi-peluru-nyasar
2020-09-14_an_0454,2020-09-14,Rupiah Senin pagi menguat 35 poin,Antara,https://www.antaranews.com/berita/1724302/rupiah-senin-pagi-menguat-35-poin
2020-09-14_an_0455,2020-09-14,Jakarta diperkirakan hujan pada Senin malam,Antara,https://www.antaranews.com/berita/1724298/jakarta-diperkirakan-hujan-pada-senin-malam
2020-09-14_an_0456,2020-09-14,Tantangan syuting selama pandemi dan jelang PSBB total,Antara,https://www.antaranews.com/berita/1724294/tantangan-syuting-selama-pandemi-dan-jelang-psbb-total
2020-09-14_an_0457,2020-09-14,Ketua Satgas: DKI Jakarta belum pernah mencabut PSBB,Antara,https://www.antaranews.com/berita/1724290/ketua-satgas-dki-jakarta-belum-pernah-mencabut-psbb
2020-09-14_an_0458,2020-09-14,Maserati siapkan 13 mobil baru dalam tiga tahun ke depan,Antara,https://otomotif.antaranews.com/berita/1724286/maserati-siapkan-13-mobil-baru-dalam-tiga-tahun-ke-depan
2020-09-14_an_0459,2020-09-14,Susanti rindu ke gereja,Antara,https://www.antaranews.com/berita/1724282/susanti-rindu-ke-gereja
2020-09-14_an_0460,2020-09-14,Saham Tokyo dibuka naik dipicu harapan keberlanjutan kebijakan ekonomi,Antara,https://www.antaranews.com/berita/1724278/saham-tokyo-dibuka-naik-dipicu-harapan-keberlanjutan-kebijakan-ekonomi
2020-09-14_an_0461,2020-09-14,Juara tunggal putra Grand Slam sejak Australia Open 2017,Antara,https://www.antaranews.com/berita/1724270/juara-tunggal-putra-grand-slam-sejak-australia-open-2017
2020-09-14_an_0462,2020-09-14,Depok terapkan PSBB Proporsional hingga akhir September,Antara,https://www.antaranews.com/berita/1724234/depok-terapkan-psbb-proporsional-hingga-akhir-september
2020-09-14_an_0463,2020-09-14,Kilas NusAntara Pagi,Antara,https://www.antaranews.com/video/1724262/kilas-nusantara-pagi
2020-09-14_an_0464,2020-09-14,Thiem dan Zverev saling puji setelah lalui laga final US Open,Antara,https://www.antaranews.com/berita/1724266/thiem-dan-zverev-saling-puji-setelah-lalui-laga-final-us-open
2020-09-14_an_0465,2020-09-14,Anggota DPR harap segera realisasikan regulasi lindungi tokoh agama,Antara,https://www.antaranews.com/berita/1724258/anggota-dpr-harap-segera-realisasikan-regulasi-lindungi-tokoh-agama
2020-09-14_an_0466,2020-09-14,"Uus merasa tertantang perankan tokoh serius di ""Dealova 2""",Antara,https://www.antaranews.com/berita/1724254/uus-merasa-tertantang-perankan-tokoh-serius-di-dealova-2
2020-09-14_an_0467,2020-09-14,Renault akan kembangkan Nissan March generasi berikutnya,Antara,https://otomotif.antaranews.com/berita/1724250/renault-akan-kembangkan-nissan-march-generasi-berikutnya
2020-09-14_an_0468,2020-09-14,Statistik laga final US Open Dominic Thiem vs Alexander Zverev,Antara,https://www.antaranews.com/berita/1724246/statistik-laga-final-us-open-dominic-thiem-vs-alexander-zverev
2020-09-14_an_0469,2020-09-14,"PSBB Jakarta, Atiqah Hasiholan tergerak bantu promosi UMKM",Antara,https://www.antaranews.com/berita/1724242/psbb-jakarta-atiqah-hasiholan-tergerak-bantu-promosi-umkm
2020-09-14_an_0470,2020-09-14,Fakta singkat juara tunggal putra US Open Dominic Thiem,Antara,https://www.antaranews.com/berita/1724238/fakta-singkat-juara-tunggal-putra-us-open-dominic-thiem
2020-09-14_an_0471,2020-09-14,Pemprov NTB mulai berlakukan denda bagi warga yang tidak pakai masker,Antara,https://www.antaranews.com/foto/1724230/pemprov-ntb-mulai-berlakukan-denda-bagi-warga-yang-tidak-pakai-masker
2020-09-14_an_0472,2020-09-14,"Crevanya rilis ""Cinta Di Hatiku"", tentang sahabat jadi kekasih",Antara,https://www.antaranews.com/berita/1724194/crevanya-rilis-cinta-di-hatiku-tentang-sahabat-jadi-kekasih
2020-09-14_an_0473,2020-09-14,Thiem dobrak tiga besar penguasa Grand Slam untuk juarai US Open,Antara,https://www.antaranews.com/berita/1724226/thiem-dobrak-tiga-besar-penguasa-grand-slam-untuk-juarai-us-open
2020-09-14_an_0474,2020-09-14,"Alih kelola Blok Rokan, Pertamina mulai pengadaan barang dan jasa",Antara,https://www.antaranews.com/berita/1724222/alih-kelola-blok-rokan-pertamina-mulai-pengadaan-barang-dan-jasa
2020-09-14_an_0475,2020-09-14,Dominic Thiem juara US Open usai kalahkan Alexander Zverev,Antara,https://www.antaranews.com/foto/1724218/dominic-thiem-juara-us-open-usai-kalahkan-alexander-zverev
2020-09-14_an_0476,2020-09-14,Sekolah Usaha Perikanan Menengah Bone ekspor ikan tuna ke Jepang,Antara,https://www.antaranews.com/berita/1724214/sekolah-usaha-perikanan-menengah-bone-ekspor-ikan-tuna-ke-jepang
2020-09-14_an_0477,2020-09-14,Envision incar Prancis untuk bangun pabrik baterai kendaraan listrik,Antara,https://otomotif.antaranews.com/berita/1724210/envision-incar-prancis-untuk-bangun-pabrik-baterai-kendaraan-listrik
2020-09-14_an_0478,2020-09-14,"Kemarin kasus COVID-19 masih bertambah, pemerintah dukung PSBB Jakarta",Antara,https://www.antaranews.com/berita/1724206/kemarin-kasus-covid-19-masih-bertambah-pemerintah-dukung-psbb-jakarta
2020-09-14_an_0479,2020-09-14,Kratom jadi komoditas pertanian unggulan di Kapuas Hulu,Antara,https://www.antaranews.com/foto/1724202/kratom-jadi-komoditas-pertanian-unggulan-di-kapuas-hulu
2020-09-14_an_0480,2020-09-14,"Kemarin, pemerintah proaktif PSBB Jakarta hingga pertemuan menteri G20",Antara,https://www.antaranews.com/berita/1724198/kemarin-pemerintah-proaktif-psbb-jakarta-hingga-pertemuan-menteri-g20
2020-09-14_an_0481,2020-09-14,"Rayakan ulang tahun, RM BTS sumbang 100 juta won untuk museum seni",Antara,https://www.antaranews.com/berita/1724190/rayakan-ulang-tahun-rm-bts-sumbang-100-juta-won-untuk-museum-seni
2020-09-14_an_0482,2020-09-14,"Kemarin, produksi iPhone 12 lalu sepeda BMX listrik",Antara,https://otomotif.antaranews.com/berita/1724154/kemarin-produksi-iphone-12-lalu-sepeda-bmx-listrik
2020-09-14_an_0483,2020-09-14,"Kemarin, risiko COVID jika Pilkada tak ditunda hingga soal PSBB ketat",Antara,https://www.antaranews.com/berita/1724186/kemarin-risiko-covid-jika-pilkada-tak-ditunda-hingga-soal-psbb-ketat
2020-09-14_an_0484,2020-09-14,Instagram tagih biaya pasang tautan di keterangan foto?,Antara,https://www.antaranews.com/berita/1724182/instagram-tagih-biaya-pasang-tautan-di-keterangan-foto
2020-09-14_an_0485,2020-09-14,"Shin Tae-yong, timnas U-19 dan formasi 4-4-2 Viktor Maslov",Antara,https://www.antaranews.com/berita/1724178/shin-tae-yong-timnas-u-19-dan-formasi-4-4-2-viktor-maslov
2020-09-14_an_0486,2020-09-14,"Heli dan Pesawat CN 235 tiba di kupang, gelar patroli perbatasan udara",Antara,https://www.antaranews.com/berita/1724174/heli-dan-pesawat-cn-235-tiba-di-kupang-gelar-patroli-perbatasan-udara
2020-09-14_an_0487,2020-09-14,"Kemarin, Syekh Ali Jaber ditusuk hingga Mahfud soal keamanan ulama",Antara,https://www.antaranews.com/berita/1724170/kemarin-syekh-ali-jaber-ditusuk-hingga-mahfud-soal-keamanan-ulama
2020-09-14_an_0488,2020-09-14,"""Mulan"" raih angka yang mengecewakan di box office China",Antara,https://www.antaranews.com/berita/1724166/mulan-raih-angka-yang-mengecewakan-di-box-office-china
2020-09-14_an_0489,2020-09-14,Pertamina jamin BBM-LPG aman di masa PSBB,Antara,https://www.antaranews.com/berita/1724162/pertamina-jamin-bbm-lpg-aman-di-masa-psbb
2020-09-14_an_0490,2020-09-14,"Rekor, WHO laporkan 307.930 kasus corona dalam 24 jam",Antara,https://www.antaranews.com/berita/1724158/rekor-who-laporkan-307930-kasus-corona-dalam-24-jam
2020-09-14_an_0491,2020-09-14,Per 15 September Arab Saudi izinkan penerbangan internasional parsial,Antara,https://www.antaranews.com/berita/1724150/per-15-september-arab-saudi-izinkan-penerbangan-internasional-parsial
2020-09-14_an_0492,2020-09-14,Ineos tidak tertarik ambil alih tim Mercedes F1,Antara,https://www.antaranews.com/berita/1724114/ineos-tidak-tertarik-ambil-alih-tim-mercedes-f1
2020-09-14_an_0493,2020-09-14,"Leclerc buktikan talentanya, namun Ferrari terlalu lambat",Antara,https://www.antaranews.com/berita/1724146/leclerc-buktikan-talentanya-namun-ferrari-terlalu-lambat
2020-09-14_an_0494,2020-09-14,Mulai Senin ini MRT lakukan penyesuaian terkait PSBB  Jakarta,Antara,https://www.antaranews.com/berita/1724142/mulai-senin-ini-mrt-lakukan-penyesuaian-terkait-psbb-jakarta
2020-09-14_an_0495,2020-09-14,PSG kalah dari Marseille dalam laga yang diwarnai lima kartu merah,Antara,https://www.antaranews.com/foto/1724138/psg-kalah-dari-marseille-dalam-laga-yang-diwarnai-lima-kartu-merah
2020-09-14_an_0496,2020-09-14,"Jika cuma butuh kecepatan, Ancelotti rekrut Usain Bolt untuk Everton",Antara,https://www.antaranews.com/berita/1724134/jika-cuma-butuh-kecepatan-ancelotti-rekrut-usain-bolt-untuk-everton
2020-09-14_an_0497,2020-09-14,Mourinho anggap Pickford jadi pembeda antara Tottenham dan Everton,Antara,https://www.antaranews.com/berita/1724130/mourinho-anggap-pickford-jadi-pembeda-antara-tottenham-dan-everton
2020-09-14_an_0498,2020-09-14,Tottenham vs Everton : Mourinho dipermalukan Ancelotti di kandang,Antara,https://www.antaranews.com/foto/1724126/tottenham-vs-everton-mourinho-dipermalukan-ancelotti-di-kandang
2020-09-14_an_0499,2020-09-14,Banjir di Kotawaringin Timur  meluas merendam tiga kecamatan,Antara,https://www.antaranews.com/berita/1724122/banjir-di-kotawaringin-timur-meluas-merendam-tiga-kecamatan
2020-09-14_an_0500,2020-09-14,"Klasemen Liga Prancis: Rennes rebut puncak, PSG masih nirpoin",Antara,https://www.antaranews.com/berita/1724118/klasemen-liga-prancis-rennes-rebut-puncak-psg-masih-nirpoin
2020-09-14_an_0501,2020-09-14,Valencia puncaki klasemen Liga Spanyol selepas rangkaian pekan pembuka,Antara,https://www.antaranews.com/berita/1724110/valencia-puncaki-klasemen-liga-spanyol-selepas-rangkaian-pekan-pembuka
2020-09-14_an_0502,2020-09-14,"Menang 2-1, Monaco perpanjang rekor manis kontra Nantes",Antara,https://www.antaranews.com/berita/1724074/menang-2-1-monaco-perpanjang-rekor-manis-kontra-nantes
2020-09-14_an_0503,2020-09-14,Bottas ogah disebut biang kerok tabrakan dramatis di GP Tuscan,Antara,https://www.antaranews.com/berita/1724106/bottas-ogah-disebut-biang-kerok-tabrakan-dramatis-di-gp-tuscan
2020-09-14_an_0504,2020-09-14,"Le Classique diwarnai lima kartu merah, Marseille bekuk PSG 1-0",Antara,https://www.antaranews.com/berita/1724102/le-classique-diwarnai-lima-kartu-merah-marseille-bekuk-psg-1-0
2020-09-14_an_0505,2020-09-14,Valencia awali musim hantam Levante 4-2,Antara,https://www.antaranews.com/berita/1724098/valencia-awali-musim-hantam-levante-4-2
2020-09-14_an_0506,2020-09-14,"Menang lawan Tottenham bukti Everton bisa bersaing, kata Ancelotti",Antara,https://www.antaranews.com/berita/1724094/menang-lawan-tottenham-bukti-everton-bisa-bersaing-kata-ancelotti
2020-09-14_an_0507,2020-09-14,"Nuggets bekuk Clippers 111-98, paksakan gim ketujuh semifinal Barat",Antara,https://www.antaranews.com/berita/1724090/nuggets-bekuk-clippers-111-98-paksakan-gim-ketujuh-semifinal-barat
2020-09-14_an_0508,2020-09-14,Klasemen Liga Inggris setelah dua hari pertama musim 2020/21,Antara,https://www.antaranews.com/berita/1724086/klasemen-liga-inggris-setelah-dua-hari-pertama-musim-2020-21
2020-09-14_an_0509,2020-09-14,"Disalip anak didiknya, Rossi berkelakar menyesal dirikan Akademi VR46",Antara,https://www.antaranews.com/berita/1724082/disalip-anak-didiknya-rossi-berkelakar-menyesal-dirikan-akademi-vr46
2020-09-14_an_0510,2020-09-14,"Gempa magnitudo 5,4 guncang Nagan Raya",Antara,https://www.antaranews.com/berita/1724078/gempa-magnitudo-54-guncang-nagan-raya
2020-09-14_an_0511,2020-09-14,Kapolda pastikan dakwah Syekh Ali Jaber di Lampung tetap berlanjut,Antara,https://www.antaranews.com/berita/1724070/kapolda-pastikan-dakwah-syekh-ali-jaber-di-lampung-tetap-berlanjut
2020-09-14_an_0512,2020-09-14,Robben cuma main setengah jam dan Groningen dipukul PSV 1-3,Antara,https://www.antaranews.com/berita/1724034/robben-cuma-main-setengah-jam-dan-groningen-dipukul-psv-1-3
2020-09-14_an_0513,2020-09-14,Penalti selamatkan satu poin bagi debut Emery bersama Villarreal,Antara,https://www.antaranews.com/berita/1724066/penalti-selamatkan-satu-poin-bagi-debut-emery-bersama-villarreal
2020-09-14_an_0514,2020-09-14, Pasien positif yang tolak isolasi terpusat akan dijemput aparat,Antara,https://www.antaranews.com/berita/1724062/anies-pasien-positif-yang-tolak-isolasi-terpusat-akan-dijemput-aparat
2020-09-14_an_0515,2020-09-14,"Klasemen Liga Belanda: VVV di puncak, debut Robben hanya 28 menit",Antara,https://www.antaranews.com/berita/1724058/klasemen-liga-belanda-vvv-di-puncak-debut-robben-hanya-28-menit
2020-09-14_an_0516,2020-09-14,"Minggu (13/9), kasus baru harian COVID-19 Jakarta sebanyak 1.492",Antara,https://www.antaranews.com/berita/1724054/minggu-13-9-kasus-baru-harian-covid-19-jakarta-sebanyak-1492
2020-09-14_an_0517,2020-09-14,Rodgers katakan Vardy pembunuh berdarah dingin di kotak penalti,Antara,https://www.antaranews.com/berita/1724050/rodgers-katakan-vardy-pembunuh-berdarah-dingin-di-kotak-penalti
2020-09-14_an_0518,2020-09-14,"Juara di Misano, Morbidelli ingin buktikan Rossi tak salah pilih murid",Antara,https://www.antaranews.com/berita/1724046/juara-di-misano-morbidelli-ingin-buktikan-rossi-tak-salah-pilih-murid
2020-09-14_an_0519,2020-09-14,Wolves resmi perpanjang kontrak Nuno Santo,Antara,https://www.antaranews.com/berita/1724042/wolves-resmi-perpanjang-kontrak-nuno-santo
2020-09-14_an_0520,2020-09-14,Everton awali musim dengan curi kemenangan di Tottenham,Antara,https://www.antaranews.com/berita/1724038/everton-awali-musim-dengan-curi-kemenangan-di-tottenham
2020-09-14_an_0521,2020-09-14,"Gempa magnitudo 5,2 dirasakan di kota Mamuju",Antara,https://www.antaranews.com/berita/1724030/gempa-magnitudo-52-dirasakan-di-kota-mamuju
2020-09-14_an_0522,2020-09-14,Leverkusen memulai petualangan di Piala Jerman dengan kemenangan 7-0,Antara,https://www.antaranews.com/berita/1724026/leverkusen-memulai-petualangan-di-piala-jerman-dengan-kemenangan-7-0
2020-09-14_an_0523,2020-09-14,"Kapuas Hulu dikepung banjir, masyarakat diminta waspada",Antara,https://www.antaranews.com/berita/1724022/kapuas-hulu-dikepung-banjir-masyarakat-diminta-waspada
2020-09-14_an_0524,2020-09-14,Dishub DKI: SK 156/2020 untuk putus penularan COVID-19 saat bepergian,Antara,https://www.antaranews.com/berita/1726166/dishub-dki-sk-156-2020-untuk-putus-penularan-covid-19-saat-bepergian
