unique_id,date,source,headline,url
2021-05-07_an_26_8,2021-05-07,Antara,350 relawan COVID-19 Yogyakarta jadi peserta BPJAMSOSTEK,https://www.antaranews.com/berita/2144186/350-relawan-covid-19-yogyakarta-jadi-peserta-bpjamsostek
2021-05-07_an_26_9,2021-05-07,Antara,DPR apresiasi Kemenhub siapkan kapal laut bagi pekerja migran mudik,https://www.antaranews.com/berita/2144182/dpr-apresiasi-kemenhub-siapkan-kapal-laut-bagi-pekerja-migran-mudik
2021-05-07_an_26_10,2021-05-07,Antara,Bijak berbelanja kebutuhan lebaran,https://www.antaranews.com/berita/2144178/bijak-berbelanja-kebutuhan-lebaran
2021-05-07_an_27_1,2021-05-07,Antara,Kapolda Jateng pantau persiapan Pospam Terpadu di Wonogiri,https://www.antaranews.com/berita/2144174/kapolda-jateng-pantau-persiapan-pospam-terpadu-di-wonogiri
2021-05-07_an_27_2,2021-05-07,Antara,"Gunung Sinabung erupsi, semburkan abu vulkanik setinggi 2.800 meter",https://www.antaranews.com/berita/2144170/gunung-sinabung-erupsi-semburkan-abu-vulkanik-setinggi-2800-meter
2021-05-07_an_27_3,2021-05-07,Antara,"Yamaha XSR 155 usung warna baru berkonsep ""Wanderlust Nature""",https://otomotif.antaranews.com/berita/2144166/yamaha-xsr-155-usung-warna-baru-berkonsep-wanderlust-nature
2021-05-07_an_27_4,2021-05-07,Antara,Pospam Banyuanyar Solo tes usap antigen empat pengunjung,https://www.antaranews.com/berita/2144162/pospam-banyuanyar-solo-tes-usap-antigen-empat-pengunjung
2021-05-07_an_27_5,2021-05-07,Antara,"""Captain Tsubasa: Dream Team"" debut pemain baru mengenakan kit resmi J.League musim 2021 hari ini!",https://www.antaranews.com/berita/2144158/captain-tsubasa-dream-team-debut-pemain-baru-mengenakan-kit-resmi-jleague-musim-2021-hari-ini
2021-05-07_an_27_6,2021-05-07,Antara,"Penjualan Honda meningkat, Brio tetap jadi andalan",https://otomotif.antaranews.com/berita/2144154/penjualan-honda-meningkat-brio-tetap-jadi-andalan
2021-05-07_an_27_7,2021-05-07,Antara,BPJT paparkan kesiapan dukung penyekatan di tol selama larangan mudik,https://ramadhan.antaranews.com/berita/2144150/bpjt-paparkan-kesiapan-dukung-penyekatan-di-tol-selama-larangan-mudik
2021-05-07_an_27_8,2021-05-07,Antara,288 Ribu pekerja di Sumbar terdampak COVID-19,https://www.antaranews.com/video/2144130/288-ribu-pekerja-di-sumbar-terdampak-covid-19
2021-05-07_an_27_9,2021-05-07,Antara,Jangan lengah hadapi COVID-19,https://www.antaranews.com/berita/2144146/jangan-lengah-hadapi-covid-19
2021-05-07_an_27_10,2021-05-07,Antara,BSI bidik pembiayaan perumahan segmen milenial hingga Rp500 miliar,https://www.antaranews.com/berita/2144142/bsi-bidik-pembiayaan-perumahan-segmen-milenial-hingga-rp500-miliar
2021-05-07_an_28_1,2021-05-07,Antara,PLN merelokasi kabel bawah tanah Ketapang-Mangga Besar,https://www.antaranews.com/berita/2144138/pln-merelokasi-kabel-bawah-tanah-ketapang-mangga-besar
2021-05-07_an_28_2,2021-05-07,Antara,Kasetpres jelaskan video viral Gubernur Maluku di kunker Presiden,https://www.antaranews.com/berita/2144134/kasetpres-jelaskan-video-viral-gubernur-maluku-di-kunker-presiden
2021-05-07_an_28_3,2021-05-07,Antara,"Shure MV7 dilengkapi teknologi ""isolasi suara"" untuk rekaman",https://www.antaranews.com/berita/2144126/shure-mv7-dilengkapi-teknologi-isolasi-suara-untuk-rekaman
2021-05-07_an_28_4,2021-05-07,Antara,Yogyakarta kampanyekan Gerakan Cinta Zakat dorong kepedulian umat,https://www.antaranews.com/berita/2144122/yogyakarta-kampanyekan-gerakan-cinta-zakat-dorong-kepedulian-umat
2021-05-07_an_28_5,2021-05-07,Antara,Kenali batas normal kerontokan rambut,https://www.antaranews.com/berita/2144118/kenali-batas-normal-kerontokan-rambut
2021-05-07_an_28_6,2021-05-07,Antara,Qarrar 'Al' Firhand kejar prestasi balap ke Italia,https://www.antaranews.com/berita/2144114/qarrar-al-firhand-kejar-prestasi-balap-ke-italia
2021-05-07_an_28_7,2021-05-07,Antara,Menko Airlangga apresiasi dedikasi TNI dalam penanganan COVID-19,https://www.antaranews.com/berita/2144110/menko-airlangga-apresiasi-dedikasi-tni-dalam-penanganan-covid-19
2021-05-07_an_28_8,2021-05-07,Antara,PLN hanya bangun pembangkit EBT setelah program 35.000 MW selesai,https://www.antaranews.com/berita/2144106/pln-hanya-bangun-pembangkit-ebt-setelah-program-35000-mw-selesai
2021-05-07_an_28_9,2021-05-07,Antara,FHCI - Kementerian BUMN salurkan bantuan revitalisasi sekolah di NTT,https://www.antaranews.com/berita/2144102/fhci-kementerian-bumn-salurkan-bantuan-revitalisasi-sekolah-di-ntt
2021-05-07_an_28_10,2021-05-07,Antara,Peningkatan paket kiriman barang jelang Idul Fitri,https://www.antaranews.com/foto/2144098/peningkatan-paket-kiriman-barang-jelang-idul-fitri
2021-05-07_an_29_1,2021-05-07,Antara,Larangan mudik dan sunyinya pariwisata Bali,https://ramadhan.antaranews.com/berita/2144094/larangan-mudik-dan-sunyinya-pariwisata-bali
2021-05-07_an_29_2,2021-05-07,Antara,"Bank Mega beri Rp2,5 miliar untuk masyarakat terdampak pandemi",https://www.antaranews.com/berita/2144090/bank-mega-beri-rp25-miliar-untuk-masyarakat-terdampak-pandemi
2021-05-07_an_29_3,2021-05-07,Antara,81 PTS LLDIKTI Wilayah X peroleh hibah penelitian Kemdikbudristek,https://www.antaranews.com/berita/2144086/81-pts-lldikti-wilayah-x-peroleh-hibah-penelitian-kemdikbudristek
2021-05-07_an_29_4,2021-05-07,Antara,"Hari pertama larangan mudik, 648 mobil diputar balik di Tol Cikampek",https://ramadhan.antaranews.com/berita/2144082/hari-pertama-larangan-mudik-648-mobil-diputar-balik-di-tol-cikampek
2021-05-07_an_29_5,2021-05-07,Antara,Polri putar balikkan 23.573 kendaraan di hari pertama larangan mudik,https://www.antaranews.com/berita/2144078/polri-putar-balikkan-23573-kendaraan-di-hari-pertama-larangan-mudik
2021-05-07_an_29_6,2021-05-07,Antara,Temanggung larang zona oranye dan merah gelar Shalat Idul Fitri,https://www.antaranews.com/berita/2144074/temanggung-larang-zona-oranye-dan-merah-gelar-shalat-idul-fitri
2021-05-07_an_29_7,2021-05-07,Antara,Pacers akhiri kekalahan beruntun dengan menundukkan Hawks,https://www.antaranews.com/berita/2144070/pacers-akhiri-kekalahan-beruntun-dengan-menundukkan-hawks
2021-05-07_an_29_8,2021-05-07,Antara,Wapres: Pengelolaan wakaf digital tingkatkan kepercayaan publik,https://www.antaranews.com/video/2144046/wapres-pengelolaan-wakaf-digital-tingkatkan-kepercayaan-publik
2021-05-07_an_29_9,2021-05-07,Antara,2.665 guru swasta di Kabupaten Kudus terima tunjangan kesejahteraan,https://www.antaranews.com/berita/2144066/2665-guru-swasta-di-kabupaten-kudus-terima-tunjangan-kesejahteraan
2021-05-07_an_29_10,2021-05-07,Antara,Akademisi ingatkan pentingnya belajar Islam secara metodologis,https://www.antaranews.com/berita/2144062/akademisi-ingatkan-pentingnya-belajar-islam-secara-metodologis
2021-05-07_an_30_1,2021-05-07,Antara,Airlangga minta ekspor tanaman hias penuhi ceruk pasar dunia,https://www.antaranews.com/berita/2144058/airlangga-minta-ekspor-tanaman-hias-penuhi-ceruk-pasar-dunia
2021-05-07_an_30_2,2021-05-07,Antara,KPK jadwal ulang pemeriksaan Azis Syamsuddin,https://www.antaranews.com/berita/2144054/kpk-jadwal-ulang-pemeriksaan-azis-syamsuddin
2021-05-07_an_30_3,2021-05-07,Antara,"KKP tetapkan 5 koridor logistik, perluas akses perikanan RI timur",https://www.antaranews.com/berita/2144050/kkp-tetapkan-5-koridor-logistik-perluas-akses-perikanan-ri-timur
2021-05-07_an_30_4,2021-05-07,Antara,Penjualan tiket AKAP Terminal Kalideres diperkirakan anjlok 95 persen,https://www.antaranews.com/berita/2144042/penjualan-tiket-akap-terminal-kalideres-diperkirakan-anjlok-95-persen
2021-05-07_an_30_5,2021-05-07,Antara,Media Jerman: Prancis tunda pasokan vaksin COVID-19 pesanan Uni Eropa,https://www.antaranews.com/berita/2144038/media-jerman-prancis-tunda-pasokan-vaksin-covid-19-pesanan-uni-eropa
2021-05-07_an_30_6,2021-05-07,Antara,Tol Salatiga - Solo terpantau lengang,https://www.antaranews.com/foto/2144034/tol-salatiga-solo-terpantau-lengang
2021-05-07_an_30_7,2021-05-07,Antara,Mudik di tengah ancaman varian corona yang makin menular,https://www.antaranews.com/berita/2144030/mudik-di-tengah-ancaman-varian-corona-yang-makin-menular
2021-05-07_an_30_8,2021-05-07,Antara,Clippers jadi raja Los Angeles usai bekuk Lakers,https://www.antaranews.com/berita/2144026/clippers-jadi-raja-los-angeles-usai-bekuk-lakers
2021-05-07_an_30_9,2021-05-07,Antara,Pos penyekatan Cirebon fleksibel saat saring kendaraan,https://www.antaranews.com/video/2144014/pos-penyekatan-cirebon-fleksibel-saat-saring-kendaraan
2021-05-07_an_30_10,2021-05-07,Antara,"Sikapi larangan mudik, Bali incar wisatawan lokal dengan prokes ketat",https://www.antaranews.com/berita/2144022/sikapi-larangan-mudik-bali-incar-wisatawan-lokal-dengan-prokes-ketat
2021-05-07_an_31_1,2021-05-07,Antara,BBPJN Sumsel gunakan tananam vetiver cegah longsor,https://www.antaranews.com/berita/2144018/bbpjn-sumsel-gunakan-tananam-vetiver-cegah-longsor
2021-05-07_an_31_2,2021-05-07,Antara,Pemkot Tangerang bagikan benih lele ke warga Ciledug,https://www.antaranews.com/video/2143978/pemkot-tangerang-bagikan-benih-lele-ke-warga-ciledug
2021-05-07_an_31_3,2021-05-07,Antara,BCA siapkan uang tunai Rp53 triliun jelang lebaran,https://www.antaranews.com/berita/2144010/bca-siapkan-uang-tunai-rp53-triliun-jelang-lebaran
2021-05-07_an_31_4,2021-05-07,Antara,Twitter kenalkan Tip Jar untuk dukung konten positif,https://www.antaranews.com/berita/2144006/twitter-kenalkan-tip-jar-untuk-dukung-konten-positif
2021-05-07_an_31_5,2021-05-07,Antara,Pelabuhan Tanjung Perak lengang,https://www.antaranews.com/foto/2144002/pelabuhan-tanjung-perak-lengang
2021-05-07_an_31_6,2021-05-07,Antara,TNI AD bantah kerahkan tank lakukan penyekatan larangan mudik,https://www.antaranews.com/berita/2143998/tni-ad-bantah-kerahkan-tank-lakukan-penyekatan-larangan-mudik
2021-05-07_an_31_7,2021-05-07,Antara,Hyundai perluas jaringan dengan resmikan diler Fatmawati,https://otomotif.antaranews.com/berita/2143994/hyundai-perluas-jaringan-dengan-resmikan-diler-fatmawati
2021-05-07_an_31_8,2021-05-07,Antara,Pertamina pastikan stok BBM Idul Fitri aman,https://otomotif.antaranews.com/berita/2143990/pertamina-pastikan-stok-bbm-idul-fitri-aman
2021-05-07_an_31_9,2021-05-07,Antara,Polres Batang buka layanan tes cepat antigen pemudik,https://www.antaranews.com/berita/2143986/polres-batang-buka-layanan-tes-cepat-antigen-pemudik
2021-05-07_an_31_10,2021-05-07,Antara,BNI berikan KUR untuk dukung UKM pengekspor tanaman hias,https://www.antaranews.com/berita/2143982/bni-berikan-kur-untuk-dukung-ukm-pengekspor-tanaman-hias
2021-05-07_an_32_1,2021-05-07,Antara,13 awak kapal berbendera asing yang masuk ke Cilacap positif COVID-19,https://www.antaranews.com/berita/2143974/13-awak-kapal-berbendera-asing-yang-masuk-ke-cilacap-positif-covid-19
2021-05-07_an_32_2,2021-05-07,Antara,Pembubaran kerumunan penonton bola di Papua Barat,https://www.antaranews.com/foto/2143970/pembubaran-kerumunan-penonton-bola-di-papua-barat
2021-05-07_an_32_3,2021-05-07,Antara,MG siagakan diler mereka pada saat Lebaran,https://otomotif.antaranews.com/berita/2143966/mg-siagakan-diler-mereka-pada-saat-lebaran
2021-05-07_an_32_4,2021-05-07,Antara,Kilas NusAntara Siang,https://www.antaranews.com/video/2143958/kilas-nusantara-siang
2021-05-07_an_32_5,2021-05-07,Antara,F-NasDem: Kepala daerah wajib jalankan SE Mendagri larang Gelar Griya,https://www.antaranews.com/berita/2143962/f-nasdem-kepala-daerah-wajib-jalankan-se-mendagri-larang-gelar-griya
2021-05-07_an_32_6,2021-05-07,Antara,Pedagang di Terminal Kalideres dapat diskon retribusi 50 persen,https://www.antaranews.com/berita/2143954/pedagang-di-terminal-kalideres-dapat-diskon-retribusi-50-persen
2021-05-07_an_32_7,2021-05-07,Antara,Toyota Raize dipesan 1.269 unit dalam sepekan,https://otomotif.antaranews.com/berita/2143950/toyota-raize-dipesan-1269-unit-dalam-sepekan
2021-05-07_an_32_8,2021-05-07,Antara,"Rumah.com Ungkap Indeks Harga Properti Turun dalam Tiga Kuartal Terakhir, Sementara Indeks Suplai Meningkat",https://www.antaranews.com/berita/2143946/rumahcom-ungkap-indeks-harga-properti-turun-dalam-tiga-kuartal-terakhir-sementara-indeks-suplai-meningkat
2021-05-07_an_32_9,2021-05-07,Antara,Zynga sepakati perjanjian untuk mengakuisisi Chartboost,https://www.antaranews.com/berita/2143942/zynga-sepakati-perjanjian-untuk-mengakuisisi-chartboost
2021-05-07_an_32_10,2021-05-07,Antara,"Kominfo antisipasi lonjakan ""bandwidth"" untuk tunjang Lebaran virtual",https://ramadhan.antaranews.com/berita/2143938/kominfo-antisipasi-lonjakan-bandwidth-untuk-tunjang-lebaran-virtual
2021-05-07_an_33_1,2021-05-07,Antara,Zynga sepakati perjanjian untuk mengakuisisi Chartboost,https://www.antaranews.com/berita/2143934/zynga-sepakati-perjanjian-untuk-mengakuisisi-chartboost
2021-05-07_an_33_2,2021-05-07,Antara,NBA : Warriors menang atas Thunder 118-97,https://www.antaranews.com/foto/2143930/nba-warriors-menang-atas-thunder-118-97
2021-05-07_an_33_3,2021-05-07,Antara,Pentingnya menanamkan PHBS sejak dini guna cegah COVID-19,https://www.antaranews.com/berita/2143926/pentingnya-menanamkan-phbs-sejak-dini-guna-cegah-covid-19
2021-05-07_an_33_4,2021-05-07,Antara,Jenis olahraga yang baik bagi penderita hipertensi,https://www.antaranews.com/berita/2143922/jenis-olahraga-yang-baik-bagi-penderita-hipertensi
2021-05-07_an_33_5,2021-05-07,Antara,KAI layani 2.852 penumpang non-mudik di hari pertama larangan mudik,https://ramadhan.antaranews.com/berita/2143918/kai-layani-2852-penumpang-non-mudik-di-hari-pertama-larangan-mudik
2021-05-07_an_33_6,2021-05-07,Antara,Penyemprotan disinfektan organik di kawasan wisata Bali,https://www.antaranews.com/foto/2143914/penyemprotan-disinfektan-organik-di-kawasan-wisata-bali
2021-05-07_an_33_7,2021-05-07,Antara,Terminal Kalideres tolak dua penumpang tak penuhi syarat,https://www.antaranews.com/berita/2143910/terminal-kalideres-tolak-dua-penumpang-tak-penuhi-syarat
2021-05-07_an_33_8,2021-05-07,Antara,"Catat, besok Pos Indonesia bakal gelar program gratis ongkir di seluruh Indonesia",https://www.antaranews.com/berita/2143906/catat-besok-pos-indonesia-bakal-gelar-program-gratis-ongkir-di-seluruh-indonesia
2021-05-07_an_33_9,2021-05-07,Antara,"Ditinggal mudik, dua gudang plastik terbakar di Cakung",https://www.antaranews.com/berita/2143902/ditinggal-mudik-dua-gudang-plastik-terbakar-di-cakung
2021-05-07_an_33_10,2021-05-07,Antara,Facebook uji coba fitur komunitas di AS dan Kanada,https://www.antaranews.com/berita/2143898/facebook-uji-coba-fitur-komunitas-di-as-dan-kanada
2021-05-07_an_34_1,2021-05-07,Antara,Luka Doncic bawa Mavericks beri Nets kekalahan keempat beruntun,https://www.antaranews.com/berita/2143894/luka-doncic-bawa-mavericks-beri-nets-kekalahan-keempat-beruntun
2021-05-07_an_34_2,2021-05-07,Antara,Polres Cilegon waspadai modus-modus pemudik,https://www.antaranews.com/video/2143866/polres-cilegon-waspadai-modus-modus-pemudik
2021-05-07_an_34_3,2021-05-07,Antara,"Honda siapkan ""THR"" untuk konsumen baru",https://otomotif.antaranews.com/berita/2143890/honda-siapkan-thr-untuk-konsumen-baru
2021-05-07_an_34_4,2021-05-07,Antara,Ericsson luncurkan Radio 6626 untuk tingkatkan kapasitas FDD 5G,https://www.antaranews.com/berita/2143886/ericsson-luncurkan-radio-6626-untuk-tingkatkan-kapasitas-fdd-5g
2021-05-07_an_34_5,2021-05-07,Antara,"Rayakan Idul Fitri di rumah, simak inspirasi kegiatan bersama keluarga",https://ramadhan.antaranews.com/berita/2143882/rayakan-idul-fitri-di-rumah-simak-inspirasi-kegiatan-bersama-keluarga
2021-05-07_an_34_6,2021-05-07,Antara,KKP gandeng PT Pos perkenalkan layanan Pos Lelaki,https://www.antaranews.com/berita/2143878/kkp-gandeng-pt-pos-perkenalkan-layanan-pos-lelaki
2021-05-07_an_34_7,2021-05-07,Antara,CTI rangkul Furukawa layani solusi data center,https://www.antaranews.com/berita/2143874/cti-rangkul-furukawa-layani-solusi-data-center
2021-05-07_an_34_8,2021-05-07,Antara,Eropa minta Israel hentikan perluasan permukiman di tengah ketegangan,https://www.antaranews.com/berita/2143870/eropa-minta-israel-hentikan-perluasan-permukiman-di-tengah-ketegangan
2021-05-07_an_34_9,2021-05-07,Antara,"""A Quiet Place Part II"" pastikan tayang di bioskop akhir Mei 2021",https://www.antaranews.com/berita/2143862/a-quiet-place-part-ii-pastikan-tayang-di-bioskop-akhir-mei-2021
2021-05-07_an_34_10,2021-05-07,Antara,Sensor ini diklaim dapat deteksi kendaraan berjarak lebih dari 500 m,https://otomotif.antaranews.com/berita/2143858/sensor-ini-diklaim-dapat-deteksi-kendaraan-berjarak-lebih-dari-500-m
2021-05-07_an_35_1,2021-05-07,Antara,Pengembang perumahan sasar konsumen milenial,https://www.antaranews.com/berita/2143854/pengembang-perumahan-sasar-konsumen-milenial
2021-05-07_an_35_2,2021-05-07,Antara,"Na In-woo bakal bintangi drama webtoon ""The Jinx's Lover""",https://www.antaranews.com/berita/2143850/na-in-woo-bakal-bintangi-drama-webtoon-the-jinxs-lover
2021-05-07_an_35_3,2021-05-07,Antara,20 armada di Terminal Kalideres siap layani penumpang non-mudik,https://www.antaranews.com/berita/2143846/20-armada-di-terminal-kalideres-siap-layani-penumpang-non-mudik
2021-05-07_an_35_4,2021-05-07,Antara,"""Stranger Things 4"" tampilkan cuplikan kedua nan misterius",https://www.antaranews.com/berita/2143842/stranger-things-4-tampilkan-cuplikan-kedua-nan-misterius
2021-05-07_an_35_5,2021-05-07,Antara,Pemilik H&M yakin prospek jangka panjangnya usai pandemi,https://www.antaranews.com/berita/2143838/pemilik-hm-yakin-prospek-jangka-panjangnya-usai-pandemi
2021-05-07_an_35_6,2021-05-07,Antara,Terminal AKAP di Aceh sepi,https://www.antaranews.com/foto/2143834/terminal-akap-di-aceh-sepi
2021-05-07_an_35_7,2021-05-07,Antara,Ada tim pemantau bagi ASN Jatim yang nekat mudik,https://www.antaranews.com/video/2143790/ada-tim-pemantau-bagi-asn-jatim-yang-nekat-mudik
2021-05-07_an_35_8,2021-05-07,Antara,Wisata peradaban Islam pertama akan dibangun di Bogor,https://www.antaranews.com/berita/2143830/wisata-peradaban-islam-pertama-akan-dibangun-di-bogor
2021-05-07_an_35_9,2021-05-07,Antara,Clubhouse danai kreator untuk buat konten,https://www.antaranews.com/berita/2143826/clubhouse-danai-kreator-untuk-buat-konten
2021-05-07_an_35_10,2021-05-07,Antara,"aespa keluarkan ""Next Level"" sebagai single baru",https://www.antaranews.com/berita/2143822/aespa-keluarkan-next-level-sebagai-single-baru
2021-05-07_an_36_1,2021-05-07,Antara,Doni Monardo apresiasi terhadap penerapan PPKM Mikro di Jambi,https://www.antaranews.com/berita/2143818/doni-monardo-apresiasi-terhadap-penerapan-ppkm-mikro-di-jambi
2021-05-07_an_36_2,2021-05-07,Antara,Hari pertama peniadaan mudik di Palembang dan Cirebon,https://www.antaranews.com/video/2143794/hari-pertama-peniadaan-mudik-di-palembang-dan-cirebon
2021-05-07_an_36_3,2021-05-07,Antara,"Debut di Resso, Mitty Zasia cover lagu ""Jaga Mata Hati""",https://www.antaranews.com/berita/2143814/debut-di-resso-mitty-zasia-cover-lagu-jaga-mata-hati
2021-05-07_an_36_4,2021-05-07,Antara,"Pemerintah genjot pengembangan pabrik garam industri, kurangi impor",https://www.antaranews.com/berita/2143810/pemerintah-genjot-pengembangan-pabrik-garam-industri-kurangi-impor
2021-05-07_an_36_5,2021-05-07,Antara,Sebagian warga di 98 RW Jakpus mulai terima vaksin AstraZeneca,https://www.antaranews.com/berita/2143806/sebagian-warga-di-98-rw-jakpus-mulai-terima-vaksin-astrazeneca
2021-05-07_an_36_6,2021-05-07,Antara,Gubernur BI paparkan 4 langkah transformasi wakaf produktif,https://www.antaranews.com/berita/2143802/gubernur-bi-paparkan-4-langkah-transformasi-wakaf-produktif
2021-05-07_an_36_7,2021-05-07,Antara,Kampanye anti-Olimpiade mendapat dukungan secara daring di Jepang,https://www.antaranews.com/berita/2143798/kampanye-anti-olimpiade-mendapat-dukungan-secara-daring-di-jepang
2021-05-07_an_36_8,2021-05-07,Antara,Dinkes Depok lakukan mitigasi kluster pertemuan positif COVID-19,https://www.antaranews.com/berita/2143786/dinkes-depok-lakukan-mitigasi-kluster-pertemuan-positif-covid-19
2021-05-07_an_36_9,2021-05-07,Antara,"Hari pertama larangan mudik, Terminal Kalideres berangkatkan 22 orang",https://www.antaranews.com/berita/2143782/hari-pertama-larangan-mudik-terminal-kalideres-berangkatkan-22-orang
2021-05-07_an_36_10,2021-05-07,Antara,"Grab kerja sama dengan BAZNAS hingga LinkAja, dorong ekonomi syariah",https://www.antaranews.com/berita/2143778/grab-kerja-sama-dengan-baznas-hingga-linkaja-dorong-ekonomi-syariah
2021-05-07_an_37_1,2021-05-07,Antara,SM Entertaintment siapkan ajang pencarian grup K-pop di Amerika,https://www.antaranews.com/berita/2143774/sm-entertaintment-siapkan-ajang-pencarian-grup-k-pop-di-amerika
2021-05-07_an_37_2,2021-05-07,Antara,"""Imitation"", drama bertabur idola K-pop tayang Jumat ini",https://www.antaranews.com/berita/2143770/imitation-drama-bertabur-idola-k-pop-tayang-jumat-ini
2021-05-07_an_37_3,2021-05-07,Antara,UU Ciptaker beri perlindungan pekerja sektor sawit,https://www.antaranews.com/berita/2143766/uu-ciptaker-beri-perlindungan-pekerja-sektor-sawit
2021-05-07_an_37_4,2021-05-07,Antara,Penyelenggara Golden Globes sepakati diversifikasi organisasi,https://www.antaranews.com/berita/2143762/penyelenggara-golden-globes-sepakati-diversifikasi-organisasi
2021-05-07_an_37_5,2021-05-07,Antara,Larutan ekstrak herbal mampu hambat bakteri pada sapi perah,https://www.antaranews.com/berita/2143758/larutan-ekstrak-herbal-mampu-hambat-bakteri-pada-sapi-perah
2021-05-07_an_37_6,2021-05-07,Antara,"Larangan mudik, Doni Monardo minta masyarakat bersabar",https://www.antaranews.com/berita/2143754/larangan-mudik-doni-monardo-minta-masyarakat-bersabar
2021-05-07_an_37_7,2021-05-07,Antara,Dentuman suara meriam jadi penanda berbuka puasa,https://www.antaranews.com/berita/2143750/dentuman-suara-meriam-jadi-penanda-berbuka-puasa
2021-05-07_an_37_8,2021-05-07,Antara,Gerindra harap revisi UU Otsus akhiri persoalan di Papua,https://www.antaranews.com/berita/2143746/gerindra-harap-revisi-uu-otsus-akhiri-persoalan-di-papua
2021-05-07_an_37_9,2021-05-07,Antara,"Ratusan notaris ikut rakor ""beneficial ownerhsip"" cegah pencucian uang",https://www.antaranews.com/berita/2143742/ratusan-notaris-ikut-rakor-beneficial-ownerhsip-cegah-pencucian-uang
2021-05-07_an_37_10,2021-05-07,Antara,Bank Mega cetak laba bersih kuartal I 2021 Rp747 miliar,https://www.antaranews.com/berita/2143738/bank-mega-cetak-laba-bersih-kuartal-i-2021-rp747-miliar
2021-05-07_an_38_1,2021-05-07,Antara,"Jaringan hotel daring bersiap lonjakan ""staycation"" jelang Lebaran",https://ramadhan.antaranews.com/berita/2143734/jaringan-hotel-daring-bersiap-lonjakan-staycation-jelang-lebaran
2021-05-07_an_38_2,2021-05-07,Antara,Twitter tutup akun berafiliasi dengan medsos Trump,https://www.antaranews.com/berita/2143730/twitter-tutup-akun-berafiliasi-dengan-medsos-trump
2021-05-07_an_38_3,2021-05-07,Antara,Malaysia larang aktivitas olahraga dan rekreasi di wilayah PKP,https://www.antaranews.com/berita/2143726/malaysia-larang-aktivitas-olahraga-dan-rekreasi-di-wilayah-pkp
2021-05-07_an_38_4,2021-05-07,Antara,PGI Dukung BPIP Jadikan Pancasila Mainstream Dalam Kebijakan Negara,https://www.antaranews.com/berita/2143722/pgi-dukung-bpip-jadikan-pancasila-mainstream-dalam-kebijakan-negara
2021-05-07_an_38_5,2021-05-07,Antara,"Menparekraf siapkan dana hibah Rp3,7 triliun untuk pariwisata NTB",https://www.antaranews.com/berita/2143718/menparekraf-siapkan-dana-hibah-rp37-triliun-untuk-pariwisata-ntb
2021-05-07_an_38_6,2021-05-07,Antara,KKP tangkap dua kapal ikan asing berbendera Vietnam di Natuna Utara,https://www.antaranews.com/berita/2143714/kkp-tangkap-dua-kapal-ikan-asing-berbendera-vietnam-di-natuna-utara
2021-05-07_an_38_7,2021-05-07,Antara,LeBron James akan kembali main pekan depan,https://www.antaranews.com/berita/2143710/lebron-james-akan-kembali-main-pekan-depan
2021-05-07_an_38_8,2021-05-07,Antara,Epidemiolog: Masyarakat harus disiplin prokes meski sudah divaksin,https://www.antaranews.com/berita/2143706/epidemiolog-masyarakat-harus-disiplin-prokes-meski-sudah-divaksin
2021-05-07_an_38_9,2021-05-07,Antara,Kurma - Bijak bersosial media,https://www.antaranews.com/video/2137986/kurma-bijak-bersosial-media
2021-05-07_an_38_10,2021-05-07,Antara,NBA : Clippers pimpin perolehan angka atas Lakers di paruh waktu,https://www.antaranews.com/foto/2143702/nba-clippers-pimpin-perolehan-angka-atas-lakers-di-paruh-waktu
2021-05-07_an_39_1,2021-05-07,Antara,Wamen BUMN sebut nilai transaksi wakaf 2020 lewat BSI rendah,https://www.antaranews.com/berita/2143698/wamen-bumn-sebut-nilai-transaksi-wakaf-2020-lewat-bsi-rendah
2021-05-07_an_39_2,2021-05-07,Antara,"BI: cadangan devisa akhir April 2021 sebesar 138,8 miliar dolar AS",https://www.antaranews.com/berita/2143694/bi-cadangan-devisa-akhir-april-2021-sebesar-1388-miliar-dolar-as
2021-05-07_an_39_3,2021-05-07,Antara,"Coldplay resmi rilis ""Higher Power"" hari ini",https://www.antaranews.com/berita/2143690/coldplay-resmi-rilis-higher-power-hari-ini
2021-05-07_an_39_4,2021-05-07,Antara,Akulaku Finance dorong penguatan literasi pelaku UMKM,https://www.antaranews.com/berita/2143686/akulaku-finance-dorong-penguatan-literasi-pelaku-umkm
2021-05-07_an_39_5,2021-05-07,Antara,"Beijing dilanda angin kencang, 22 meter per detik",https://www.antaranews.com/berita/2143682/beijing-dilanda-angin-kencang-22-meter-per-detik
2021-05-07_an_39_6,2021-05-07,Antara,"Oppo perluas ekosistem dengan earphone TWS, smartband, dan Smart TV",https://www.antaranews.com/berita/2143678/oppo-perluas-ekosistem-dengan-earphone-tws-smartband-dan-smart-tv
2021-05-07_an_39_7,2021-05-07,Antara,Kiat jaga keamanan akun Google,https://www.antaranews.com/berita/2143674/kiat-jaga-keamanan-akun-google
2021-05-07_an_39_8,2021-05-07,Antara,KPK panggil Azis Syamsuddin,https://www.antaranews.com/berita/2143670/kpk-panggil-azis-syamsuddin
2021-05-07_an_39_9,2021-05-07,Antara,Eko Roni Saputra terkesan dengan perjuangan peserta The Apprentice,https://www.antaranews.com/berita/2143666/eko-roni-saputra-terkesan-dengan-perjuangan-peserta-the-apprentice
2021-05-07_an_39_10,2021-05-07,Antara,Puluhan kendaraan diputar balik di jalur perbatasan Tangerang,https://www.antaranews.com/berita/2143662/puluhan-kendaraan-diputar-balik-di-jalur-perbatasan-tangerang
