unique_id,date,source,headline,url
2022-05-17_ko_0107,2022-05-17,Kompas,"Ingatkan Menteri Tak Sibuk Manuver Capres 2024, Pimpinan Komisi II: Kerjalah Bantu Presiden",https://nasional.kompas.com/read/2022/05/17/15383941/ingatkan-menteri-tak-sibuk-manuver-capres-2024-pimpinan-komisi-ii-kerjalah
2022-05-17_ko_0108,2022-05-17,Kompas,Oditur Militer Beberkan Mengapa Alasan Kolonel Priyanto Mengaku Panik Tak Masuk Akal,https://nasional.kompas.com/read/2022/05/17/15361841/oditur-militer-beberkan-mengapa-alasan-kolonel-priyanto-mengaku-panik-tak
2022-05-17_ko_0109,2022-05-17,Kompas,"Menag: BPIH Lebih Besar dari Bipih, Jemaah Haji Bayar Rp 39,9 Juta",https://nasional.kompas.com/read/2022/05/17/15292721/menag-bpih-lebih-besar-dari-bipih-jemaah-haji-bayar-rp-399-juta
2022-05-17_ko_0110,2022-05-17,Kompas,Menag: Pemerintah Menyubsidi Jemaah agar Biaya Haji Lebih Ringan,https://nasional.kompas.com/read/2022/05/17/15172241/menag-pemerintah-menyubsidi-jemaah-agar-biaya-haji-lebih-ringan
2022-05-17_ko_0111,2022-05-17,Kompas,"Wajib Lapor Kasus Pornografi, Dea ""OnlyFans"" Disebut Sedang Hamil",https://megapolitan.kompas.com/read/2022/05/17/15131591/wajib-lapor-kasus-pornografi-dea-onlyfans-disebut-sedang-hamil
2022-05-17_ko_0112,2022-05-17,Kompas,Membaca Bayangan Peta Koalisi Pilpres 2024 dalam Dominasi Kuasa PDI-P,https://nasional.kompas.com/read/2022/05/17/15105781/membaca-bayangan-peta-koalisi-pilpres-2024-dalam-dominasi-kuasa-pdi-p
2022-05-17_ko_0113,2022-05-17,Kompas,"Ikuti Sidang Mafia Tanah, Kakak Nirina Zubir: Ada Pemain Figuran",https://megapolitan.kompas.com/read/2022/05/17/15092371/ikuti-sidang-mafia-tanah-kakak-nirina-zubir-ada-pemain-figuran
2022-05-17_ko_0114,2022-05-17,Kompas,"Polisi Tangkap Nelayan Pencuri Motor, Pelaku Kelabui Korban dengan Modus Pinjam",https://megapolitan.kompas.com/read/2022/05/17/15032161/polisi-tangkap-nelayan-pencuri-motor-pelaku-kelabui-korban-dengan-modus
2022-05-17_ko_0115,2022-05-17,Kompas,"Soal Koalisi Indonesia Bersatu, Gerindra: Bukan Hal yang Perlu Diperdebatkan",https://nasional.kompas.com/read/2022/05/17/14452891/soal-koalisi-indonesia-bersatu-gerindra-bukan-hal-yang-perlu-diperdebatkan
2022-05-17_ko_0116,2022-05-17,Kompas,Waketum Gerindra Minta Koalisi Golkar PAN PPP Jangan Dipertentangkan,https://nasional.kompas.com/read/2022/05/17/14423231/waketum-gerindra-minta-koalisi-golkar-pan-ppp-jangan-dipertentangkan
2022-05-17_ko_0117,2022-05-17,Kompas,"PP Muhammadiyah Sesalkan UAS Tak Diizinkan Masuk, Tuntut Penjelasan ke Singapura",https://nasional.kompas.com/read/2022/05/17/14335761/pp-muhammadiyah-sesalkan-uas-tak-diizinkan-masuk-tuntut-penjelasan-ke
2022-05-17_ko_0118,2022-05-17,Kompas,"Tanggapi Pembelaan Kolonel Priyanto, Oditur Militer Anggap Terdakwa Sengaja Buang Sejoli ke Sungai",https://megapolitan.kompas.com/read/2022/05/17/14332421/tanggapi-pembelaan-kolonel-priyanto-oditur-militer-anggap-terdakwa
2022-05-17_ko_0119,2022-05-17,Kompas,"Uji Materiil UU Otsus, Ahli Presiden Pertanyakan Kedudukan Hukum Majelis Rakyat Papua",https://nasional.kompas.com/read/2022/05/17/14322811/uji-materiil-uu-otsus-ahli-presiden-pertanyakan-kedudukan-hukum-majelis
2022-05-17_ko_0120,2022-05-17,Kompas,"Wali Kota Tangsel Sebut ""Work From Anywhere"" Bisa Bikin Kerja Lebih Efektif",https://megapolitan.kompas.com/read/2022/05/17/14304241/wali-kota-tangsel-sebut-work-from-anywhere-bisa-bikin-kerja-lebih-efektif
2022-05-17_ko_0121,2022-05-17,Kompas,Dharma Jaya Pastikan Sapi yang Dipasok ke Jakarta Bebas dari Penyakit Mulut dan Kuku,https://megapolitan.kompas.com/read/2022/05/17/14283251/dharma-jaya-pastikan-sapi-yang-dipasok-ke-jakarta-bebas-dari-penyakit
2022-05-17_ko_0122,2022-05-17,Kompas,Bapak dan Anak yang Begal Ibu Muda di Teluknaga Sempat Coba Kabur Saat Hendak Ditangkap,https://megapolitan.kompas.com/read/2022/05/17/14192561/bapak-dan-anak-yang-begal-ibu-muda-di-teluknaga-sempat-coba-kabur-saat
2022-05-17_ko_0123,2022-05-17,Kompas,"Mengenal PPS dan KPPS, dari Sejarah hingga Tugas dalam Pemilu",https://nasional.kompas.com/read/2022/05/17/14142701/mengenal-pps-dan-kpps-dari-sejarah-hingga-tugas-dalam-pemilu
2022-05-17_ko_0124,2022-05-17,Kompas,Pemprov DKI Minta Perumda Dharma Jaya Antisipasi Penyebaran Penyakit Mulut dan Kuku,https://megapolitan.kompas.com/read/2022/05/17/14133171/pemprov-dki-minta-perumda-dharma-jaya-antisipasi-penyebaran-penyakit
2022-05-17_ko_0125,2022-05-17,Kompas,"Bentuk Koalisi Indonesia Bersatu, Golkar Kekeh Usung Airlangga Capres 2024",https://nasional.kompas.com/read/2022/05/17/14020651/bentuk-koalisi-indonesia-bersatu-golkar-kekeh-usung-airlangga-capres-2024
2022-05-17_ko_0126,2022-05-17,Kompas,"Lengkapi Pemberkasan Kasus Binomo, Polisi Bawa Ferrari Indra Kenz ke Jakarta",https://nasional.kompas.com/read/2022/05/17/14005441/lengkapi-pemberkasan-kasus-binomo-polisi-bawa-ferrari-indra-kenz-ke-jakarta
2022-05-17_ko_0127,2022-05-17,Kompas,"Syarat Haji 2022, Sudah 2 Kali Vaksin Covid-19, Usia di Bawah 65 Tahun",https://nasional.kompas.com/read/2022/05/17/13391661/syarat-haji-2022-sudah-2-kali-vaksin-covid-19-usia-di-bawah-65-tahun
2022-05-17_ko_0128,2022-05-17,Kompas,Anies Dijadwalkan Tiba di Jakarta Rabu Besok Usai Kunjungan ke 3 Negara Eropa,https://megapolitan.kompas.com/read/2022/05/17/13390931/anies-dijadwalkan-tiba-di-jakarta-rabu-besok-usai-kunjungan-ke-3-negara
2022-05-17_ko_0129,2022-05-17,Kompas,"Setiap Jemaah Haji Membayar Rp 39,9 Juta untuk Berangkat",https://nasional.kompas.com/read/2022/05/17/13374441/setiap-jemaah-haji-membayar-rp-399-juta-untuk-berangkat
2022-05-17_ko_0130,2022-05-17,Kompas,Menag: Tidak Benar Dana Haji Digunakan untuk Bangun IKN,https://nasional.kompas.com/read/2022/05/17/13363891/menag-tidak-benar-dana-haji-digunakan-untuk-bangun-ikn
2022-05-17_ko_0131,2022-05-17,Kompas,"Mengenal DKPP, dari Sejarah hingga Tugas dan Kewajibannya",https://nasional.kompas.com/read/2022/05/17/13251581/mengenal-dkpp-dari-sejarah-hingga-tugas-dan-kewajibannya
2022-05-17_ko_0132,2022-05-17,Kompas,Gerindra Tanggapi soal Kemungkinan Koalisi dengan PDI-P: Nanti Kita Lihat Perkembangan,https://nasional.kompas.com/read/2022/05/17/13190671/gerindra-tanggapi-soal-kemungkinan-koalisi-dengan-pdi-p-nanti-kita-lihat
2022-05-17_ko_0133,2022-05-17,Kompas,"Bapak dan Anak Lakukan Percobaan Pembegalan di Teluknaga, Seorang Ibu Muda Dibacok",https://megapolitan.kompas.com/read/2022/05/17/13100881/bapak-dan-anak-lakukan-percobaan-pembegalan-di-teluknaga-seorang-ibu-muda
2022-05-17_ko_0134,2022-05-17,Kompas,Menag: Pemerintah Sudah Siap Layani Jemaah Haji 2022,https://nasional.kompas.com/read/2022/05/17/12594711/menag-pemerintah-sudah-siap-layani-jemaah-haji-2022
2022-05-17_ko_0135,2022-05-17,Kompas,Wagub Sebut Rusun Kampung Bayam Akan Diisi Warga Sekitar serta Mereka yang Terdampak Normalisasi Sungai,https://megapolitan.kompas.com/read/2022/05/17/12585261/wagub-sebut-rusun-kampung-bayam-akan-diisi-warga-sekitar-serta-mereka
2022-05-17_ko_0136,2022-05-17,Kompas,4 Prajruit TNI AL Sumbang 6 Emas di SEA Games Vietnam,https://nasional.kompas.com/read/2022/05/17/12520021/4-prajruit-tni-al-sumbang-6-emas-di-sea-games-vietnam
2022-05-17_ko_0137,2022-05-17,Kompas,"Jadi Saksi Kasus Mafia Tanah, Nirina Zubir Harap Eks ART Divonis Seberat-beratnya",https://megapolitan.kompas.com/read/2022/05/17/12454741/jadi-saksi-kasus-mafia-tanah-nirina-zubir-harap-eks-art-divonis-seberat
2022-05-17_ko_0138,2022-05-17,Kompas,"Tegaskan Tak Ada Arahan Istana, Golkar Sebut Koalisi Indonesia Bersatu Demi Kemaslahatan Bangsa",https://nasional.kompas.com/read/2022/05/17/12425561/tegaskan-tak-ada-arahan-istana-golkar-sebut-koalisi-indonesia-bersatu-demi
2022-05-17_ko_0139,2022-05-17,Kompas,Volume Angkutan Kargo Bandara Naungan AP II Capai 41.500 Ton Selama Periode Lebaran 2022,https://megapolitan.kompas.com/read/2022/05/17/12363671/volume-angkutan-kargo-bandara-naungan-ap-ii-capai-41500-ton-selama
2022-05-17_ko_0140,2022-05-17,Kompas,"Pilpres 2024 Diprediksi Munculkan 3 Poros Capres, Bergantung Sikap PDI-P",https://nasional.kompas.com/read/2022/05/17/12250181/pilpres-2024-diprediksi-munculkan-3-poros-capres-bergantung-sikap-pdi-p
2022-05-17_ko_0141,2022-05-17,Kompas,Gerindra soal Menentukan Koalisi: Politik Sama kayak Orang Pacaran,https://nasional.kompas.com/read/2022/05/17/12233951/gerindra-soal-menentukan-koalisi-politik-sama-kayak-orang-pacaran
2022-05-17_ko_0142,2022-05-17,Kompas,"Sosialisasi Pencegahan Hepatitis Akut, Pemkot Jakpus Libatkan Kader Dasawisma",https://megapolitan.kompas.com/read/2022/05/17/12184841/sosialisasi-pencegahan-hepatitis-akut-pemkot-jakpus-libatkan-kader
2022-05-17_ko_0143,2022-05-17,Kompas,"Antisipasi Kekeringan, BPBD DKI Imbau Masyarakat untuk Hemat Air dan Tampung Air Hujan",https://megapolitan.kompas.com/read/2022/05/17/12152741/antisipasi-kekeringan-bpbd-dki-imbau-masyarakat-untuk-hemat-air-dan
2022-05-17_ko_0144,2022-05-17,Kompas,"Mulai Malam Ini Pelintasan Rel Kereta Jalan Dewi Sartika Depok Ditutup, Ada Pembangunan ""Underpass""",https://megapolitan.kompas.com/read/2022/05/17/12035811/mulai-malam-ini-pelintasan-rel-kereta-jalan-dewi-sartika-depok-ditutup
2022-05-17_ko_0145,2022-05-17,Kompas,Begini Kronologi Versi Kerabat soal UAS dan Rombongan Tak Diizinkan Masuk ke Singapura,https://nasional.kompas.com/read/2022/05/17/12030151/begini-kronologi-versi-kerabat-soal-uas-dan-rombongan-tak-diizinkan-masuk-ke
2022-05-17_ko_0146,2022-05-17,Kompas,KPK Geledah Kantor Sejumlah SKPD di Pemkot Ambon,https://nasional.kompas.com/read/2022/05/17/11560041/kpk-geledah-kantor-sejumlah-skpd-di-pemkot-ambon
2022-05-17_ko_0147,2022-05-17,Kompas,Gerindra Belum Akan Mendeklarasikan Koalisi dalam Waktu Dekat,https://nasional.kompas.com/read/2022/05/17/11544261/gerindra-belum-akan-mendeklarasikan-koalisi-dalam-waktu-dekat
2022-05-17_ko_0148,2022-05-17,Kompas,"Mengenal Bawaslu, Sejarah hingga Tugas dan Wewenang",https://nasional.kompas.com/read/2022/05/17/11485531/mengenal-bawaslu-sejarah-hingga-tugas-dan-wewenang
2022-05-17_ko_0149,2022-05-17,Kompas,Dugaan Kasus Permainan Mafia Tanah yang Dialami Nirina Zubir...,https://megapolitan.kompas.com/read/2022/05/17/11463321/dugaan-kasus-permainan-mafia-tanah-yang-dialami-nirina-zubir
2022-05-17_ko_0150,2022-05-17,Kompas,"Datangi PN Jakarta Barat Terkait Perkara Mafia Tanah, Nirina Zubir: Akhirnya Masuk Persidangan",https://megapolitan.kompas.com/read/2022/05/17/11451231/datangi-pn-jakarta-barat-terkait-perkara-mafia-tanah-nirina-zubir
2022-05-17_ko_0151,2022-05-17,Kompas,Kapolda Metro Fadil Imran Bisa Berpeluang Jadi Pj Gubernur DKI Setelah Anies Lengser,https://megapolitan.kompas.com/read/2022/05/17/11383051/kapolda-metro-fadil-imran-bisa-berpeluang-jadi-pj-gubernur-dki-setelah
2022-05-17_ko_0152,2022-05-17,Kompas,"Masa Tahanan Fakarich, Brian Edgar Nababan, dan Admin Indra Kenz di Kasus Binomo Diperpanjang",https://nasional.kompas.com/read/2022/05/17/11375091/masa-tahanan-fakarich-brian-edgar-nababan-dan-admin-indra-kenz-di-kasus
2022-05-17_ko_0153,2022-05-17,Kompas,"Peringati Trisuci Waisak, Ganjar Sebut Candi Borobudur Tak Hanya Sekadar Destinasi Wisata",https://regional.kompas.com/read/2022/05/17/11291271/peringati-trisuci-waisak-ganjar-sebut-candi-borobudur-tak-hanya-sekadar
2022-05-17_ko_0154,2022-05-17,Kompas,Penyidik PNS Kementerian LHK Periksa Terbit Rencana Perangin Angin di KPK,https://nasional.kompas.com/read/2022/05/17/11252061/penyidik-pns-kementerian-lhk-periksa-terbit-rencana-perangin-angin-di-kpk
2022-05-17_ko_0155,2022-05-17,Kompas,Dinkes DKI: 3.792.426 Orang Sudah Divaksinasi Covid-19 Dosis Ketiga,https://megapolitan.kompas.com/read/2022/05/17/11204651/dinkes-dki-3792426-orang-sudah-divaksinasi-covid-19-dosis-ketiga
2022-05-17_ko_0156,2022-05-17,Kompas,"DPR Gelar Rapat Paripurna, 76 Anggota Hadir Fisik dan Virtual 252 Orang",https://nasional.kompas.com/read/2022/05/17/11185591/dpr-gelar-rapat-paripurna-76-anggota-hadir-fisik-dan-virtual-252-orang
2022-05-17_ko_0157,2022-05-17,Kompas,Boyamin Saiman Penuhi Panggilan KPK,https://nasional.kompas.com/read/2022/05/17/11090141/boyamin-saiman-penuhi-panggilan-kpk
2022-05-17_ko_0158,2022-05-17,Kompas,Sidang Kasus Kebakaran Lapas Kelas I Tangerang Kembali Digelar Selasa Siang,https://megapolitan.kompas.com/read/2022/05/17/11051341/sidang-kasus-kebakaran-lapas-kelas-i-tangerang-kembali-digelar-selasa
2022-05-17_ko_0159,2022-05-17,Kompas,"Dubes RI di Singapura: UAS Tidak Dideportasi, tapi Tak Diizinkan Masuk karena Tak Penuhi Kriteria",https://nasional.kompas.com/read/2022/05/17/10592871/dubes-ri-di-singapura-uas-tidak-dideportasi-tapi-tak-diizinkan-masuk-karena
2022-05-17_ko_0160,2022-05-17,Kompas,Taufik Gerindra: Kita Aminkan supaya Airin Jadi Gubernur DKI 2024,https://megapolitan.kompas.com/read/2022/05/17/10533991/taufik-gerindra-kita-aminkan-supaya-airin-jadi-gubernur-dki-2024
2022-05-17_ko_0161,2022-05-17,Kompas,"Libur Hari Raya Waisak, 38.000 Pengunjung Padati Ancol",https://megapolitan.kompas.com/read/2022/05/17/10455201/libur-hari-raya-waisak-38000-pengunjung-padati-ancol
2022-05-17_ko_0162,2022-05-17,Kompas,"Tanggapi Survei Tingkat Kepuasan Kinerja Jokowi, Begini Kata KSP",https://nasional.kompas.com/read/2022/05/17/10284361/tanggapi-survei-tingkat-kepuasan-kinerja-jokowi-begini-kata-ksp
2022-05-17_ko_0163,2022-05-17,Kompas,PPP Sebut Isu Koalisi Indonesia Bersatu Arahan Istana sebagai Imajinasi,https://nasional.kompas.com/read/2022/05/17/10082021/ppp-sebut-isu-koalisi-indonesia-bersatu-arahan-istana-sebagai-imajinasi
2022-05-17_ko_0164,2022-05-17,Kompas,M Taufik Anggap Heru Budi Hartono Paling Tepat Jadi Penjabat Gubernur DKI Jakarta,https://megapolitan.kompas.com/read/2022/05/17/10081431/m-taufik-anggap-heru-budi-hartono-paling-tepat-jadi-penjabat-gubernur-dki
2022-05-17_ko_0165,2022-05-17,Kompas,Menteri PPPA: Umat Buddha Punya Peran Besar Ciptakan Lingkungan Aman bagi Perempuan dan Anak,https://nasional.kompas.com/read/2022/05/17/09390471/menteri-pppa-umat-buddha-punya-peran-besar-ciptakan-lingkungan-aman-bagi
2022-05-17_ko_0166,2022-05-17,Kompas,Kejagung Imbau Terdakwa Tidak Pakai Atribut Keagamaan di Ruang Sidang,https://nasional.kompas.com/read/2022/05/17/09181711/kejagung-imbau-terdakwa-tidak-pakai-atribut-keagamaan-di-ruang-sidang
2022-05-17_ko_0167,2022-05-17,Kompas,Kebakaran Gudang Penyimpanan Ikan di Pelabuhan Muara Baru Diduga akibat Korsleting,https://megapolitan.kompas.com/read/2022/05/17/09160811/kebakaran-gudang-penyimpanan-ikan-di-pelabuhan-muara-baru-diduga-akibat
2022-05-17_ko_0168,2022-05-17,Kompas,Mencermati Perpres Natuna Utara,https://nasional.kompas.com/read/2022/05/17/09153931/mencermati-perpres-natuna-utara
2022-05-17_ko_0169,2022-05-17,Kompas,"Rumah 2 Lantai di Cimanggis Depok Terbakar, Diduga akibat Korsleting",https://megapolitan.kompas.com/read/2022/05/17/09100991/rumah-2-lantai-di-cimanggis-depok-terbakar-diduga-akibat-korsleting
2022-05-17_ko_0170,2022-05-17,Kompas,Sidang Kasus Dugaan Mafia Tanah yang Dialami Keluarga Nirina Zubir Digelar Hari Ini,https://megapolitan.kompas.com/read/2022/05/17/09043821/sidang-kasus-dugaan-mafia-tanah-yang-dialami-keluarga-nirina-zubir
2022-05-17_ko_0171,2022-05-17,Kompas,"Berkaca Pandemi Covid-19 dan Hepatitis Misterius, Pemerintah Didesak Ciptakan Kemandirian di Bidang Vaksin",https://nasional.kompas.com/read/2022/05/17/08551521/berkaca-pandemi-covid-19-dan-hepatitis-misterius-pemerintah-didesak-ciptakan
2022-05-17_ko_0172,2022-05-17,Kompas,"Update 16 Mei: Bertambah 9, Total Kasus Covid-19 di Tangsel Kini 84.204",https://megapolitan.kompas.com/read/2022/05/17/07534671/update-16-mei-bertambah-9-total-kasus-covid-19-di-tangsel-kini-84204
2022-05-17_ko_0173,2022-05-17,Kompas,"Hari Ini, KPK Panggil Boyamin Saiman Terkait Kasus Pencucian Uang Budhi Sarwono",https://nasional.kompas.com/read/2022/05/17/07485601/hari-ini-kpk-panggil-boyamin-saiman-terkait-kasus-pencucian-uang-budhi
2022-05-17_ko_0174,2022-05-17,Kompas,"Update 16 Mei: Nihil Kasus Baru di Kota Tangerang, 66 Pasien Covid-19 Masih Dirawat",https://megapolitan.kompas.com/read/2022/05/17/07413131/update-16-mei-nihil-kasus-baru-di-kota-tangerang-66-pasien-covid-19-masih
2022-05-17_ko_0175,2022-05-17,Kompas,Jadwal dan Lokasi SIM Keliling di Kota Bekasi Pekan Ini,https://megapolitan.kompas.com/read/2022/05/17/07324901/jadwal-dan-lokasi-sim-keliling-di-kota-bekasi-pekan-ini
2022-05-17_ko_0176,2022-05-17,Kompas,"PDSI Usul UU Pendidikan Kedokteran Direvisi, IDI: Selama Dilakukan Bukan untuk Kepentingan Pribadi, Kami Dukung",https://nasional.kompas.com/read/2022/05/17/07081181/pdsi-usul-uu-pendidikan-kedokteran-direvisi-idi-selama-dilakukan-bukan-untuk
2022-05-17_ko_0177,2022-05-17,Kompas,"Kasdam Pattimura Meninggal Dunia, KSAD: TNI AD Kehilangan Salah Satu Perwira Terbaik",https://nasional.kompas.com/read/2022/05/17/07033071/kasdam-pattimura-meninggal-dunia-ksad-tni-ad-kehilangan-salah-satu-perwira
2022-05-17_ko_0178,2022-05-17,Kompas,Oditur Militer Akan Sampaikan Bantahan atas Pleidoi Kolonel Priyanto Siang Ini,https://nasional.kompas.com/read/2022/05/17/06470391/oditur-militer-akan-sampaikan-bantahan-atas-pleidoi-kolonel-priyanto-siang
2022-05-17_ko_0179,2022-05-17,Kompas,Pengertian Partai Pengusung dan Pendukung,https://nasional.kompas.com/read/2022/05/17/06380021/pengertian-partai-pengusung-dan-pendukung
2022-05-17_ko_0180,2022-05-17,Kompas,Pemindahan Warga Korban Kebakaran Pasar Gembrong ke Rusun Tunggu Kesiapan Sudin Perumahan,https://megapolitan.kompas.com/read/2022/05/17/06273891/pemindahan-warga-korban-kebakaran-pasar-gembrong-ke-rusun-tunggu-kesiapan
2022-05-17_ko_0181,2022-05-17,Kompas,Arah Koalisi Baru dan Prediksi Airlangga Bakal Berujung Jadi Cawapres,https://nasional.kompas.com/read/2022/05/17/06060001/arah-koalisi-baru-dan-prediksi-airlangga-bakal-berujung-jadi-cawapres
2022-05-17_ko_0182,2022-05-17,Kompas,[POPULER JABODETABEK] Cinta Segitiga Berujung Pembunuhan | Ketua DPRD DKI Bakal Panggil Manajemen Ancol,https://megapolitan.kompas.com/read/2022/05/17/06000011/-populer-jabodetabek-cinta-segitiga-berujung-pembunuhan-ketua-dprd-dki
2022-05-17_ko_0183,2022-05-17,Kompas,"Mengenal Sejarah, Tugas, dan Wewenang KPU",https://nasional.kompas.com/read/2022/05/17/05450091/mengenal-sejarah-tugas-dan-wewenang-kpu
2022-05-17_ko_0184,2022-05-17,Kompas,[POPULER NASIONAL] Wawancara Khusus Wali Kota Solo Gibran Rakabuming | Sikap AHY soal Koalisi Baru,https://nasional.kompas.com/read/2022/05/17/05350301/populer-nasional-wawancara-khusus-wali-kota-solo-gibran-rakabuming-sikap-ahy
2022-05-17_ko_0185,2022-05-17,Kompas,"Mayoritas Publik Puas Kinerja Jokowi, Stafsus Mensesneg: Tantangan Pemerintah Semakin Besar",https://nasional.kompas.com/read/2022/05/17/05283031/mayoritas-publik-puas-kinerja-jokowi-stafsus-mensesneg-tantangan-pemerintah
