unique_id,date,source,headline,url
2021-10-19_ko_0217,2021-10-19,Kompas,"PPKM Jawa-Bali Diperpanjang, DKI Jakarta Berstatus Level 2",https://nasional.kompas.com/read/2021/10/19/06451851/ppkm-jawa-bali-diperpanjang-dki-jakarta-berstatus-level-2
2021-10-19_ko_0218,2021-10-19,Kompas,"Sulit Berjalan, Pasien Berbobot 120 Kg Dievakuasi Petugas Damkar dari Lantai 2 Rumah ke RS",https://megapolitan.kompas.com/read/2021/10/19/06354741/sulit-berjalan-pasien-berbobot-120-kg-dievakuasi-petugas-damkar-dari
2021-10-19_ko_0219,2021-10-19,Kompas,Seputar Perpanjangan PPKM: Penyesuaian Aktivitas Anak hingga Antisipasi Gelombang Ketiga Covid-19,https://nasional.kompas.com/read/2021/10/19/06351951/seputar-perpanjangan-ppkm-penyesuaian-aktivitas-anak-hingga-antisipasi
2021-10-19_ko_0220,2021-10-19,Kompas,"Viral di Medsos, Bolehkah Polisi Masuki Wilayah Privasi di Ponsel Warga?",https://nasional.kompas.com/read/2021/10/19/06300091/viral-di-medsos-bolehkah-polisi-masuki-wilayah-privasi-di-ponsel-warga
2021-10-19_ko_0221,2021-10-19,Kompas,Rapor Merah 4 Tahun Anies dari LBH: Gimik soal Reklamasi hingga Warga Sulit Punya Rumah di Jakarta,https://megapolitan.kompas.com/read/2021/10/19/06253411/rapor-merah-4-tahun-anies-dari-lbh-gimik-soal-reklamasi-hingga-warga
2021-10-19_ko_0222,2021-10-19,Kompas,"PPKM Jawa-Bali Diperpanjang, Ini Daftar Daerah yang Berstatus Level 3",https://nasional.kompas.com/read/2021/10/19/06235341/ppkm-jawa-bali-diperpanjang-ini-daftar-daerah-yang-berstatus-level-3
2021-10-19_ko_0223,2021-10-19,Kompas,PPKM Jakarta Turun Jadi Level 2,https://megapolitan.kompas.com/read/2021/10/19/06130431/ppkm-jakarta-turun-jadi-level-2
2021-10-19_ko_0224,2021-10-19,Kompas,Airlangga: Syarat Beli Tiket World Superbike Sudah Divaksinasi Lengkap,https://nasional.kompas.com/read/2021/10/19/06100051/airlangga--syarat-beli-tiket-world-superbike-sudah-divaksinasi-lengkap
2021-10-19_ko_0225,2021-10-19,Kompas,"PPKM Jawa-Bali Diperpanjang, 54 Kabupaten/Kota ini Berstatus Level 2",https://nasional.kompas.com/read/2021/10/19/06072021/ppkm-jawa-bali-diperpanjang-54-kabupaten-kota-ini-berstatus-level-2
2021-10-19_ko_0226,2021-10-19,Kompas,"Babak Baru Kasus Unlawful Killing Laskar FPI, Briptu Fikri dan Ipda Yusmin Didakwa Menganiaya hingga Korban Tewas",https://megapolitan.kompas.com/read/2021/10/19/06052181/babak-baru-kasus-unlawful-killing-laskar-fpi-briptu-fikri-dan-ipda-yusmin
2021-10-19_ko_0227,2021-10-19,Kompas,Menkes Jajaki 3 Obat Alternatif Covid-19,https://nasional.kompas.com/read/2021/10/19/06050011/menkes-jajaki-3-obat-alternatif-covid-19-
2021-10-19_ko_0228,2021-10-19,Kompas,"PPKM Diperpanjang, 9 Daerah di Jawa-Bali Ini Berstatus Level 1",https://nasional.kompas.com/read/2021/10/19/05551981/ppkm-diperpanjang-9-daerah-di-jawa-bali-ini-berstatus-level-1
2021-10-19_ko_0229,2021-10-19,Kompas,5 Kesaksian Rita Widyasari Terkait Perkara Suap Eks Penyidik KPK,https://nasional.kompas.com/read/2021/10/19/05425901/5-kesaksian-rita-widyasari-terkait-perkara-suap-eks-penyidik-kpk
2021-10-19_ko_0230,2021-10-19,Kompas,Cinta Satu Malam di Lokalisasi Gunung Antang Berujung Tewasnya Pelanggan yang Ogah Bayar,https://megapolitan.kompas.com/read/2021/10/19/05353601/cinta-satu-malam-di-lokalisasi-gunung-antang-berujung-tewasnya-pelanggan
2021-10-19_ko_0231,2021-10-19,Kompas,"UPDATE 18 Oktober: Tambah 1 Kasus Covid-19 di Kota Tangerang, 40 Pasien Dirawat",https://megapolitan.kompas.com/read/2021/10/19/05155781/update-18-oktober-tambah-1-kasus-covid-19-di-kota-tangerang-40-pasien
