unique_id,date,source,headline,url
2021-11-15_de_13_4,2021-11-15,Detik,Fahri Hamzah Bela Fadli Zon yang Ditegur Prabowo karena Sindir Jokowi,https://news.detik.com/berita/d-5812290/fahri-hamzah-bela-fadli-zon-yang-ditegur-prabowo-karena-sindir-jokowi
2021-11-15_de_13_5,2021-11-15,Detik,Wagub Klaim Sudah 18 Ribu Sumur Resapan Dibangun di Jakarta,https://news.detik.com/berita/d-5812289/wagub-klaim-sudah-18-ribu-sumur-resapan-dibangun-di-jakarta
2021-11-15_de_13_6,2021-11-15,Detik,Apa Tujuan ANBK yang Dimulai Hari Ini untuk Siswa SD? Simak Selengkapnya,https://news.detik.com/berita/d-5812293/apa-tujuan-anbk-yang-dimulai-hari-ini-untuk-siswa-sd-simak-selengkapnya
2021-11-15_de_13_7,2021-11-15,Detik,"Puluhan Tahanan Polres Batanghari Kabur, Begini Penjelasan Lapas",https://news.detik.com/berita/d-5812288/puluhan-tahanan-polres-batanghari-kabur-begini-penjelasan-lapas
2021-11-15_de_13_8,2021-11-15,Detik,"10.739 Warga Palangka Raya Terdampak Banjir, Walkot Ingatkan Klaster COVID",https://news.detik.com/berita/d-5812286/10739-warga-palangka-raya-terdampak-banjir-walkot-ingatkan-klaster-covid
2021-11-15_de_13_9,2021-11-15,Detik,"Langgar Kapasitas, Tiga Hotel di Pangandaran Disanksi Tipiring",https://news.detik.com/berita-jawa-barat/d-5812282/langgar-kapasitas-tiga-hotel-di-pangandaran-disanksi-tipiring
2021-11-15_de_13_10,2021-11-15,Detik,Heboh Penari Waria Berbusana Terbuka di Binjai Milenial Market,https://news.detik.com/berita/d-5812281/heboh-penari-waria-berbusana-terbuka-di-binjai-milenial-market
2021-11-15_de_13_11,2021-11-15,Detik,Pagar Tembok Roboh Timpa Ibu dan Dua Anaknya di Kota Malang,https://news.detik.com/berita-jawa-timur/d-5812280/pagar-tembok-roboh-timpa-ibu-dan-dua-anaknya-di-kota-malang
2021-11-15_de_13_12,2021-11-15,Detik,LSM dan Pemandu Lagu di Cilegon Tolak Tempat Hiburan Malam Dibongkar,https://news.detik.com/berita/d-5812276/lsm-dan-pemandu-lagu-di-cilegon-tolak-tempat-hiburan-malam-dibongkar
2021-11-15_de_13_13,2021-11-15,Detik,"Banjir Rob Rendam Permukiman di Kota Pekalongan, Warga Mengungsi",https://news.detik.com/berita-jawa-tengah/d-5812263/banjir-rob-rendam-permukiman-di-kota-pekalongan-warga-mengungsi
2021-11-15_de_13_14,2021-11-15,Detik,"Polisi Tolak Penangguhan Penahanan Anak Nia Daniaty, Ini Alasannya",https://news.detik.com/berita/d-5812262/polisi-tolak-penangguhan-penahanan-anak-nia-daniaty-ini-alasannya
2021-11-15_de_13_15,2021-11-15,Detik,"Wagub DKI: Banyak Daerah Banjir Berhari-hari, di Jakarta Tidak Sampai",https://news.detik.com/berita/d-5812259/wagub-dki-banyak-daerah-banjir-berhari-hari-di-jakarta-tidak-sampai
2021-11-15_de_13_16,2021-11-15,Detik,"Pembunuhan di Subang, Kapolda Jabar Bandingkan dengan Kasus Pulomas",https://news.detik.com/berita-jawa-barat/d-5812257/pembunuhan-di-subang-kapolda-jabar-bandingkan-dengan-kasus-pulomas
2021-11-15_de_13_17,2021-11-15,Detik,Demo Pencari Suaka Afghanistan di Kantor UNHCR Ricuh,https://news.detik.com/berita/d-5812255/demo-pencari-suaka-afghanistan-di-kantor-unhcr-ricuh
2021-11-15_de_13_18,2021-11-15,Detik,Saksi Cerita Detik-detik Mengerikan Anggota FBR Dikeroyok di Jakbar,https://news.detik.com/berita/d-5812254/saksi-cerita-detik-detik-mengerikan-anggota-fbr-dikeroyok-di-jakbar
2021-11-15_de_13_19,2021-11-15,Detik,Saat Permendikbud PPKS Bikin Prof Harkristuti Vs Prof Romli Beda Pendapat,https://news.detik.com/berita/d-5812252/saat-permendikbud-ppks-bikin-prof-harkristuti-vs-prof-romli-beda-pendapat
2021-11-15_de_14_0,2021-11-15,Detik,Dampak Ekspres Relawan Capres,https://news.detik.com/kolom/d-5812212/dampak-ekspres-relawan-capres
2021-11-15_de_14_1,2021-11-15,Detik,"Dihadang Massa Ormas, Pembongkaran Lapak Karaoke Liar di Semarang Batal",https://news.detik.com/berita-jawa-tengah/d-5812251/dihadang-massa-ormas-pembongkaran-lapak-karaoke-liar-di-semarang-batal
2021-11-15_de_14_2,2021-11-15,Detik,Nurdin Abdullah Usai Dituntut 6 Tahun Penjara: Doain Ya,https://news.detik.com/berita/d-5812239/nurdin-abdullah-usai-dituntut-6-tahun-penjara-doain-ya
2021-11-15_de_14_3,2021-11-15,Detik,"Perkosa 2 Anak Tiri Bermodus Obati Penyakit, Pria di Sumsel Ditangkap",https://news.detik.com/berita/d-5812238/perkosa-2-anak-tiri-bermodus-obati-penyakit-pria-di-sumsel-ditangkap
2021-11-15_de_14_4,2021-11-15,Detik,15.000 Tentara Polandia Dikerahkan ke Perbatasan Belarusia,https://news.detik.com/detiktv/d-5812237/15000-tentara-polandia-dikerahkan-ke-perbatasan-belarusia
2021-11-15_de_14_5,2021-11-15,Detik,MAKI Kritik Bupati Banyumas soal 'Dipanggil Sebelum OTT': Kekanak-kanakan!,https://news.detik.com/berita/d-5812234/maki-kritik-bupati-banyumas-soal-dipanggil-sebelum-ott-kekanak-kanakan
2021-11-15_de_14_6,2021-11-15,Detik,Tanah Gerak Hingga Ambles Satu Meter  Ancam Permukiman di Pesisir Trenggalek,https://news.detik.com/berita-jawa-timur/d-5812209/tanah-gerak-hingga-ambles-satu-meter--ancam-permukiman-di-pesisir-trenggalek
2021-11-15_de_14_7,2021-11-15,Detik,Warga Israel Tuntut Pemerintah Selamatkan Orang Yahudi di Ethiopia,https://news.detik.com/internasional/d-5812232/warga-israel-tuntut-pemerintah-selamatkan-orang-yahudi-di-ethiopia
2021-11-15_de_14_8,2021-11-15,Detik,Kata Daops 9 soal Pegawai yang Viral Berangkat Kerja Dijemput KA Depan Rumah,https://news.detik.com/berita-jawa-timur/d-5812227/kata-daops-9-soal-pegawai-yang-viral-berangkat-kerja-dijemput-ka-depan-rumah
2021-11-15_de_14_9,2021-11-15,Detik,Melihat Komplek Pemakaman Leluhur Sumedang di Gunung Puyuh,https://news.detik.com/berita-jawa-barat/d-5812226/melihat-komplek-pemakaman-leluhur-sumedang-di-gunung-puyuh
2021-11-15_de_14_10,2021-11-15,Detik,"Demo Pencari Suaka Afghanistan di UNHCR Ricuh, Anak-anak Menangis Terjepit",https://news.detik.com/berita/d-5812225/demo-pencari-suaka-afghanistan-di-unhcr-ricuh-anak-anak-menangis-terjepit
2021-11-15_de_14_11,2021-11-15,Detik,"Cara Membuat Akta Kelahiran untuk Orang Dewasa, Simak Ulasannya!",https://news.detik.com/berita/d-5812229/cara-membuat-akta-kelahiran-untuk-orang-dewasa-simak-ulasannya
2021-11-15_de_14_12,2021-11-15,Detik,Pemprov DKI Klaim Banjir di Jaktim dan Jaksel Surut Kurang dari 6 Jam,https://news.detik.com/berita/d-5812224/pemprov-dki-klaim-banjir-di-jaktim-dan-jaksel-surut-kurang-dari-6-jam
2021-11-15_de_14_13,2021-11-15,Detik,"Sopir Truk Kabur Usai Tabrak Angkot di Tangerang, 5 Orang Luka-luka",https://news.detik.com/berita/d-5812217/sopir-truk-kabur-usai-tabrak-angkot-di-tangerang-5-orang-luka-luka
2021-11-15_de_14_14,2021-11-15,Detik,"Bikin Konten Seret Celurit Biar Eksis di Medsos, Pemuda Wonogiri Ditangkap!",https://news.detik.com/berita-jawa-tengah/d-5812216/bikin-konten-seret-celurit-biar-eksis-di-medsos-pemuda-wonogiri-ditangkap
2021-11-15_de_14_15,2021-11-15,Detik,"detikcom Do Your Magic: Galian Belum Selesai, Macet di Tendean Makin Parah",https://news.detik.com/berita/d-5812215/detikcom-do-your-magic-galian-belum-selesai-macet-di-tendean-makin-parah
2021-11-15_de_14_16,2021-11-15,Detik,JPU Tuntut Nurdin Abdullah Dimiskinkan: Bayar Negara Rp 3 M-SGD 350 Ribu,https://news.detik.com/berita/d-5812214/jpu-tuntut-nurdin-abdullah-dimiskinkan-bayar-negara-rp-3-m-sgd-350-ribu
2021-11-15_de_14_17,2021-11-15,Detik,"Filipina Gelar Sekolah Tatap Muka, Siswa Belajar di Bilik Plastik",https://news.detik.com/foto-news/d-5812112/filipina-gelar-sekolah-tatap-muka-siswa-belajar-di-bilik-plastik
2021-11-15_de_14_18,2021-11-15,Detik,"Mahasiswanya Diduga Lakukan Kekerasan Seks, UGM Bentuk Tim Investigasi",https://news.detik.com/berita-jawa-tengah/d-5812206/mahasiswanya-diduga-lakukan-kekerasan-seks-ugm-bentuk-tim-investigasi
2021-11-15_de_14_19,2021-11-15,Detik,Pasukan Yaman Kembali Pukul Mundur Kelompok Houti,https://news.detik.com/detiktv/d-5812204/pasukan-yaman-kembali-pukul-mundur-kelompok-houti
2021-11-15_de_15_0,2021-11-15,Detik,Qatar Sepakat Jadi Perwakilan Diplomatik AS di Afghanistan,https://news.detik.com/internasional/d-5812203/qatar-sepakat-jadi-perwakilan-diplomatik-as-di-afghanistan
2021-11-15_de_15_1,2021-11-15,Detik,3 Mobil dengan STNK Palsu Diamankan di Ponorogo,https://news.detik.com/berita-jawa-timur/d-5812205/3-mobil-dengan-stnk-palsu-diamankan-di-ponorogo
2021-11-15_de_15_2,2021-11-15,Detik,"Laporan ke Greenpeace Dicabut, Polda Metro Setop Penyelidikan",https://news.detik.com/berita/d-5812200/laporan-ke-greenpeace-dicabut-polda-metro-setop-penyelidikan
2021-11-15_de_15_3,2021-11-15,Detik,"Sudah 5 Hari, 8 Kecamatan di Kotim Kalteng Masih Banjir!",https://news.detik.com/berita/d-5812194/sudah-5-hari-8-kecamatan-di-kotim-kalteng-masih-banjir
2021-11-15_de_15_4,2021-11-15,Detik,Eks Ketua Laskar Jokowi Dorong Ganjar-Puan Maju Pilpres 2024,https://news.detik.com/berita-jawa-barat/d-5812193/eks-ketua-laskar-jokowi-dorong-ganjar-puan-maju-pilpres-2024
2021-11-15_de_15_5,2021-11-15,Detik,Eks Anggota LAMRI Surabaya Terduga Pelaku Kekerasan Seks Mahasiswa UGM,https://news.detik.com/berita-jawa-tengah/d-5812191/eks-anggota-lamri-surabaya-terduga-pelaku-kekerasan-seks-mahasiswa-ugm
2021-11-15_de_15_6,2021-11-15,Detik,Ganjarist Optimistis Ganjar Dapat Tiket dari PDIP Meski Golkar Buka Pintu,https://news.detik.com/berita/d-5812190/ganjarist-optimistis-ganjar-dapat-tiket-dari-pdip-meski-golkar-buka-pintu
2021-11-15_de_15_7,2021-11-15,Detik,"Tak Ada Jembatan, Warga Aceh Gotong Keranda Terjang Arus Sungai ke Pemakaman",https://news.detik.com/berita/d-5812188/tak-ada-jembatan-warga-aceh-gotong-keranda-terjang-arus-sungai-ke-pemakaman
2021-11-15_de_15_8,2021-11-15,Detik,KSAL soal Marinir Dipimpin Jenderal Bintang 3: Tanya ke Panglima,https://news.detik.com/berita/d-5812177/ksal-soal-marinir-dipimpin-jenderal-bintang-3-tanya-ke-panglima
2021-11-15_de_15_9,2021-11-15,Detik,Laksamana Yudo: Jangan Ragukan Loyalitas TNI AL!,https://news.detik.com/berita/d-5812173/laksamana-yudo-jangan-ragukan-loyalitas-tni-al
2021-11-15_de_15_10,2021-11-15,Detik,Jaksa juga Tuntut Hak Politik Nurdin Abdullah Dicabut 5 Tahun,https://news.detik.com/berita/d-5812172/jaksa-juga-tuntut-hak-politik-nurdin-abdullah-dicabut-5-tahun
2021-11-15_de_15_11,2021-11-15,Detik,Pernyataan Bamsoet Bikin Gerindra Tafsirkan Jokowi Dukung Formula E,https://news.detik.com/berita/d-5812171/pernyataan-bamsoet-bikin-gerindra-tafsirkan-jokowi-dukung-formula-e
2021-11-15_de_15_12,2021-11-15,Detik,Penjelasan Kapolda Jateng Soal Penyebab Kilang Pertamina Cilacap Terbakar,https://news.detik.com/detiktv/d-5812169/penjelasan-kapolda-jateng-soal-penyebab-kilang-pertamina-cilacap-terbakar
2021-11-15_de_15_13,2021-11-15,Detik,Pimpinan DPRD DKI Nilai Usulan Dana Dapil Rp 49 Miliar Wajar,https://news.detik.com/berita/d-5812168/pimpinan-dprd-dki-nilai-usulan-dana-dapil-rp-49-miliar-wajar
2021-11-15_de_15_14,2021-11-15,Detik,Tempat Wisata Diminta Bentuk Satgas Prokes Antisipasi Libur Nataru,https://news.detik.com/berita/d-5812167/tempat-wisata-diminta-bentuk-satgas-prokes-antisipasi-libur-nataru
2021-11-15_de_15_15,2021-11-15,Detik,Respons Luhut Soal Dirinya Mau Dilaporkan Polisi Soal Bisnis PCR,https://news.detik.com/detiktv/d-5812160/respons-luhut-soal-dirinya-mau-dilaporkan-polisi-soal-bisnis-pcr
2021-11-15_de_15_16,2021-11-15,Detik,Anak Muda Banyuwangi Ini Cuan Puluhan Juta dari Bikin Replika Samurai,https://news.detik.com/berita-jawa-timur/d-5812154/anak-muda-banyuwangi-ini-cuan-puluhan-juta-dari-bikin-replika-samurai
2021-11-15_de_15_17,2021-11-15,Detik,"Tangki Pertamina Terbakar, Kapolda Jateng: Kejadian Sama dengan Juni Lalu",https://news.detik.com/berita-jawa-tengah/d-5812153/tangki-pertamina-terbakar-kapolda-jateng-kejadian-sama-dengan-juni-lalu
2021-11-15_de_15_18,2021-11-15,Detik,Mungkinkah Terwujud Duet Airlangga-Ganjar? Ini Analisis Doktor Paramadina,https://news.detik.com/berita/d-5812152/mungkinkah-terwujud-duet-airlangga-ganjar-ini-analisis-doktor-paramadina
2021-11-15_de_15_19,2021-11-15,Detik,Laporan Polisi ke Greenpeace soal Deforestasi Dicabut!,https://news.detik.com/berita/d-5812151/laporan-polisi-ke-greenpeace-soal-deforestasi-dicabut
2021-11-15_de_16_0,2021-11-15,Detik,Gudang Rokok yang Dirampok di Solo Digaris Polisi,https://news.detik.com/foto-news/d-5812104/gudang-rokok-yang-dirampok-di-solo-digaris-polisi
2021-11-15_de_16_1,2021-11-15,Detik,"HUT Ke-41, Brantas Abipraya Gelar Lomba buat Karyawan",https://news.detik.com/berita/d-5812148/hut-ke-41-brantas-abipraya-gelar-lomba-buat-karyawan
2021-11-15_de_16_2,2021-11-15,Detik,"Nani Sianida Dituntut 18 Tahun Bui, Ayah Korban: Terlalu Ringan",https://news.detik.com/berita-jawa-tengah/d-5812137/nani-sianida-dituntut-18-tahun-bui-ayah-korban-terlalu-ringan
2021-11-15_de_16_3,2021-11-15,Detik,"Viral Video Napi Pesta Sabu di Sumsel, Kalapas Buka Suara",https://news.detik.com/berita/d-5812136/viral-video-napi-pesta-sabu-di-sumsel-kalapas-buka-suara
2021-11-15_de_16_4,2021-11-15,Detik,Ganjar Undang Perwakilan Buruh Diskusi Soal Formula Upah Tahun 2022,https://news.detik.com/berita/d-5812135/ganjar-undang-perwakilan-buruh-diskusi-soal-formula-upah-tahun-2022
2021-11-15_de_16_5,2021-11-15,Detik,"Ceceran Tanah Bikin Jalan Saketi-Malingping Licin, Belasan Pemotor Terjatuh",https://news.detik.com/berita-jawa-barat/d-5812123/ceceran-tanah-bikin-jalan-saketi-malingping-licin-belasan-pemotor-terjatuh
2021-11-15_de_16_6,2021-11-15,Detik,Ssst...!! Kapolda Metro Tahu Lokasi Pengendara Nakal Pakai Strobo,https://news.detik.com/berita/d-5812111/ssst-kapolda-metro-tahu-lokasi-pengendara-nakal-pakai-strobo
2021-11-15_de_16_7,2021-11-15,Detik,Emang Bisa Jusuf Kalla Jadi Ketum PBNU?,https://news.detik.com/berita/d-5812091/emang-bisa-jusuf-kalla-jadi-ketum-pbnu
2021-11-15_de_16_8,2021-11-15,Detik,Firli Bahuri Minta Bupati Banyumas Tak Takut Berlebihan soal OTT,https://news.detik.com/berita/d-5812089/firli-bahuri-minta-bupati-banyumas-tak-takut-berlebihan-soal-ott
2021-11-15_de_16_9,2021-11-15,Detik,"Minyak Goreng Tumpah di Jalanan Medan, 20 Pemotor Terjatuh",https://news.detik.com/berita/d-5812088/minyak-goreng-tumpah-di-jalanan-medan-20-pemotor-terjatuh
2021-11-15_de_16_10,2021-11-15,Detik,Polisi-BMKG Ungkap Penyebab Kebakaran Kilang Pertamina Cilacap,https://news.detik.com/foto-news/d-5812061/polisi-bmkg-ungkap-penyebab-kebakaran-kilang-pertamina-cilacap
2021-11-15_de_16_11,2021-11-15,Detik,MA Pulihkan Gelar Doktor Eks Gubernur Sultra Nur Alam,https://news.detik.com/berita/d-5812085/ma-pulihkan-gelar-doktor-eks-gubernur-sultra-nur-alam
2021-11-15_de_16_12,2021-11-15,Detik,"Dalami Kasus Diksar Maut Menwa, Polisi Periksa Staf Biro Akademik UNS",https://news.detik.com/berita-jawa-tengah/d-5812081/dalami-kasus-diksar-maut-menwa-polisi-periksa-staf-biro-akademik-uns
2021-11-15_de_16_13,2021-11-15,Detik,Beban Budaya Politik Demokrasi Kita,https://news.detik.com/kolom/d-5812078/beban-budaya-politik-demokrasi-kita
2021-11-15_de_16_14,2021-11-15,Detik,Apa yang Dimaksud dengan ANBK: Tujuan dan Jadwal untuk Siswa SD,https://news.detik.com/berita/d-5812077/apa-yang-dimaksud-dengan-anbk-tujuan-dan-jadwal-untuk-siswa-sd
2021-11-15_de_16_15,2021-11-15,Detik,Fakta Pegawai KA yang Viral Dijemput Kereta Api di Depan Rumah,https://news.detik.com/berita-jawa-timur/d-5812076/fakta-pegawai-ka-yang-viral-dijemput-kereta-api-di-depan-rumah
2021-11-15_de_16_16,2021-11-15,Detik,SMAN 1 Lembang Waspada Potensi Banjir Bandang yang Masih Mengintai,https://news.detik.com/berita-jawa-barat/d-5812075/sman-1-lembang-waspada-potensi-banjir-bandang-yang-masih-mengintai
2021-11-15_de_16_17,2021-11-15,Detik,Austria Mulai Terapkan Lockdown untuk Warga Tak Divaksin,https://news.detik.com/internasional/d-5812074/austria-mulai-terapkan-lockdown-untuk-warga-tak-divaksin
2021-11-15_de_16_18,2021-11-15,Detik,Berkas Kasus Rachel Vennya Kabur Karantina Dilimpahkan ke Jaksa,https://news.detik.com/berita/d-5812073/berkas-kasus-rachel-vennya-kabur-karantina-dilimpahkan-ke-jaksa
2021-11-15_de_16_19,2021-11-15,Detik,Nurdin Abdullah Dituntut 6 Tahun Penjara-Denda Rp 500 Juta,https://news.detik.com/berita/d-5812059/nurdin-abdullah-dituntut-6-tahun-penjara-denda-rp-500-juta
2021-11-15_de_17_0,2021-11-15,Detik,"Cemburu, Suami di Bandung Bacok Istri Gegara Pesan di Facebook",https://news.detik.com/berita-jawa-barat/d-5812058/cemburu-suami-di-bandung-bacok-istri-gegara-pesan-di-facebook
2021-11-15_de_17_1,2021-11-15,Detik,"Jakarta Masuk Musim Hujan, Pembangunan Sumur Resapan Digencarkan",https://news.detik.com/foto-news/d-5811977/jakarta-masuk-musim-hujan-pembangunan-sumur-resapan-digencarkan
2021-11-15_de_17_2,2021-11-15,Detik,Luhut Segera Layangkan Gugatan Perdata Rp 100 Miliar ke Haris-Fatia,https://news.detik.com/detiktv/d-5812046/luhut-segera-layangkan-gugatan-perdata-rp-100-miliar-ke-haris-fatia
2021-11-15_de_17_3,2021-11-15,Detik,DPR Disarankan Tunda Pembahasan RUU BPK,https://news.detik.com/berita/d-5812045/dpr-disarankan-tunda-pembahasan-ruu-bpk
2021-11-15_de_17_4,2021-11-15,Detik,Tiket Gratis KAI untuk Siapa Saja? Ini Daftarnya,https://news.detik.com/berita/d-5812044/tiket-gratis-kai-untuk-siapa-saja-ini-daftarnya
2021-11-15_de_17_5,2021-11-15,Detik,Penampakan Tumpukan Sampah Menggunung di Sungai Jaranan Kudus,https://news.detik.com/berita-jawa-tengah/d-5812041/penampakan-tumpukan-sampah-menggunung-di-sungai-jaranan-kudus
2021-11-15_de_17_6,2021-11-15,Detik,"Tren COVID-19 Meningkat, Luhut Ungkap Ada Daerah PPKM Level 1 Naik Level",https://news.detik.com/berita/d-5812040/tren-covid-19-meningkat-luhut-ungkap-ada-daerah-ppkm-level-1-naik-level
2021-11-15_de_17_7,2021-11-15,Detik,Sebaran Varian of Concern COVID Masih Harus Diwaspadai Warga RI,https://news.detik.com/berita/d-5812036/sebaran-varian-of-concern-covid-masih-harus-diwaspadai-warga-ri
2021-11-15_de_17_8,2021-11-15,Detik,Kejutan HUT ke-76 Marinir dari Polisi Sidoarjo,https://news.detik.com/berita-jawa-timur/d-5812034/kejutan-hut-ke-76-marinir-dari-polisi-sidoarjo
2021-11-15_de_17_9,2021-11-15,Detik,Nani Takjil Sianida Dituntut 18 Tahun Bui,https://news.detik.com/berita-jawa-tengah/d-5812031/nani-takjil-sianida-dituntut-18-tahun-bui
2021-11-15_de_17_10,2021-11-15,Detik,"KSAL Tantang Isu Perwira TNI AL Minta Rp 4,2 M ke Kapal Asing Dibuktikan",https://news.detik.com/berita/d-5812028/ksal-tantang-isu-perwira-tni-al-minta-rp-42-m-ke-kapal-asing-dibuktikan
2021-11-15_de_17_11,2021-11-15,Detik,Pema USU Minta Nadiem Tambah Larangan Seks Luar Nikah di Permendikbud 30,https://news.detik.com/berita/d-5812026/pema-usu-minta-nadiem-tambah-larangan-seks-luar-nikah-di-permendikbud-30
2021-11-15_de_17_12,2021-11-15,Detik,Catat! Operasi Zebra Lodaya Polres Sumedang Mulai Digelar Hari Ini,https://news.detik.com/berita-jawa-barat/d-5812025/catat-operasi-zebra-lodaya-polres-sumedang-mulai-digelar-hari-ini
2021-11-15_de_17_13,2021-11-15,Detik,Cak Imin Dukung Permendikbud PPKS: Kekerasan Seksual Sangat Meresahkan,https://news.detik.com/berita/d-5812022/cak-imin-dukung-permendikbud-ppks-kekerasan-seksual-sangat-meresahkan
2021-11-15_de_17_14,2021-11-15,Detik,"Demokrat Ucapkan Selamat Datang ke Narji 'Cagur', Ada Apa?",https://news.detik.com/berita/d-5812021/demokrat-ucapkan-selamat-datang-ke-narji-cagur-ada-apa
2021-11-15_de_17_15,2021-11-15,Detik,"Talut 13 Meter Ambrol di Karanganyar, 1 Pekerja Tertimbun",https://news.detik.com/berita-jawa-tengah/d-5812020/talut-13-meter-ambrol-di-karanganyar-1-pekerja-tertimbun
2021-11-15_de_17_16,2021-11-15,Detik,"Bajing Loncat Sasar Truk di Tangerang, Curi 8 Tabung Gas Kosong",https://news.detik.com/berita/d-5812018/bajing-loncat-sasar-truk-di-tangerang-curi-8-tabung-gas-kosong
2021-11-15_de_17_17,2021-11-15,Detik,Kapolda Pastikan Tak Ada Korban Jiwa Kebakaran Tangki Pertamina Cilacap,https://news.detik.com/berita-jawa-tengah/d-5812016/kapolda-pastikan-tak-ada-korban-jiwa-kebakaran-tangki-pertamina-cilacap
2021-11-15_de_17_18,2021-11-15,Detik,KSAL Bicara Loyalitas ke Calon Panglima TNI Andika,https://news.detik.com/detiktv/d-5812014/ksal-bicara-loyalitas-ke-calon-panglima-tni-andika
2021-11-15_de_17_19,2021-11-15,Detik,Potret Bintang Mahaputera Fadli Zon yang Disinggung Ngabalin,https://news.detik.com/foto-news/d-5812008/potret-bintang-mahaputera-fadli-zon-yang-disinggung-ngabalin
2021-11-15_de_18_0,2021-11-15,Detik,Penjelasan KSAL Yudo Margono soal Kapal Asing Bayar Agar Dibebaskan,https://news.detik.com/detiktv/d-5812007/penjelasan-ksal-yudo-margono-soal-kapal-asing-bayar-agar-dibebaskan
2021-11-15_de_18_1,2021-11-15,Detik,Relawan Mileanies Bakal Deklarasi Anies Capres 2024,https://news.detik.com/berita/d-5812004/relawan-mileanies-bakal-deklarasi-anies-capres-2024
2021-11-15_de_18_2,2021-11-15,Detik,Paus Fransiskus Berterima Kasih ke Pers yang Bongkar Skandal Seks Pastor,https://news.detik.com/internasional/d-5812001/paus-fransiskus-berterima-kasih-ke-pers-yang-bongkar-skandal-seks-pastor
2021-11-15_de_18_3,2021-11-15,Detik,Potret Warga Tembagapura Demo Minta Saham Freeport 4 Persen,https://news.detik.com/foto-news/d-5811996/potret-warga-tembagapura-demo-minta-saham-freeport-4-persen
2021-11-15_de_18_4,2021-11-15,Detik,"Sebelum Tewas Dirampok, Satpam Gudang Rokok Solo Sempat Kirim Foto Selfie",https://news.detik.com/berita-jawa-tengah/d-5811995/sebelum-tewas-dirampok-satpam-gudang-rokok-solo-sempat-kirim-foto-selfie
2021-11-15_de_18_5,2021-11-15,Detik,Kemenkumham Jambi soal 23 Tahanan Kabur: Penjagaan Wewenang Polres,https://news.detik.com/berita/d-5811990/kemenkumham-jambi-soal-23-tahanan-kabur-penjagaan-wewenang-polres
2021-11-15_de_18_6,2021-11-15,Detik,Luhut Ungkap Kebakaran Tangki Pertamina karena Thunderstorm Luar Biasa,https://news.detik.com/berita/d-5811989/luhut-ungkap-kebakaran-tangki-pertamina-karena-thunderstorm-luar-biasa
2021-11-15_de_18_7,2021-11-15,Detik,Greenpeace: Laporan Polisi ke Kami Bentuk Intimidasi,https://news.detik.com/berita/d-5811986/greenpeace-laporan-polisi-ke-kami-bentuk-intimidasi
2021-11-15_de_18_8,2021-11-15,Detik,"Omeli Suami Mabuk, Istri di Karawang Dituntut 1 Tahun Penjara",https://news.detik.com/berita-jawa-barat/d-5811976/omeli-suami-mabuk-istri-di-karawang-dituntut-1-tahun-penjara
2021-11-15_de_18_9,2021-11-15,Detik,Belasan Siswa PTM SD dan SMP di Surabaya Sempat Terpapar COVID-19,https://news.detik.com/berita-jawa-timur/d-5811975/belasan-siswa-ptm-sd-dan-smp-di-surabaya-sempat-terpapar-covid-19
2021-11-15_de_18_10,2021-11-15,Detik,Pemprov Banten Paparkan Capaian Pembangunan ke Warga Desa Ketapang,https://news.detik.com/berita/d-5811963/pemprov-banten-paparkan-capaian-pembangunan-ke-warga-desa-ketapang
2021-11-15_de_18_11,2021-11-15,Detik,"Dikira Mainan, Orok Bayi Ditemukan Mengapung di Aliran Sungai Malang",https://news.detik.com/berita-jawa-timur/d-5811950/dikira-mainan-orok-bayi-ditemukan-mengapung-di-aliran-sungai-malang
2021-11-15_de_18_12,2021-11-15,Detik,Luhut Respons Rencana Dirinya Dipolisikan soal isu Bisnis PCR: Kampungan!,https://news.detik.com/berita/d-5811961/luhut-respons-rencana-dirinya-dipolisikan-soal-isu-bisnis-pcr-kampungan
2021-11-15_de_18_13,2021-11-15,Detik,Demokrat Nggak Niat Tampung Ganjar: Kami Perjuangkan AHY!,https://news.detik.com/berita/d-5811960/demokrat-nggak-niat-tampung-ganjar-kami-perjuangkan-ahy
2021-11-15_de_18_14,2021-11-15,Detik,Pesan KSAL Laksamana Yudo Margono di HUT Korps Marinir Ke-76,https://news.detik.com/berita/d-5811958/pesan-ksal-laksamana-yudo-margono-di-hut-korps-marinir-ke-76
2021-11-15_de_18_15,2021-11-15,Detik,"Jan Ethes Juara Taekwondo, Langsung Dapat Selamat dari Eyang Jokowi",https://news.detik.com/berita-jawa-tengah/d-5811955/jan-ethes-juara-taekwondo-langsung-dapat-selamat-dari-eyang-jokowi
2021-11-15_de_18_16,2021-11-15,Detik,"DPRD DKI Usul Dana Dapil Rp 49 M, Wagub: Asal Bukan Untuk Kepentingan Pribadi",https://news.detik.com/berita/d-5811953/dprd-dki-usul-dana-dapil-rp-49-m-wagub-asal-bukan-untuk-kepentingan-pribadi
2021-11-15_de_18_17,2021-11-15,Detik,"Minta Saham Freeport 4 Persen, Warga 3 Kampung Tembagapura Demo Bupati",https://news.detik.com/berita/d-5811952/minta-saham-freeport-4-persen-warga-3-kampung-tembagapura-demo-bupati
2021-11-15_de_18_18,2021-11-15,Detik,"Fadli Ditegur Prabowo, Dulu Jokowi Bilang Tetap Berkawan Meski Berlawanan",https://news.detik.com/berita/d-5811949/fadli-ditegur-prabowo-dulu-jokowi-bilang-tetap-berkawan-meski-berlawanan
2021-11-15_de_18_19,2021-11-15,Detik,"Hari Toleransi Internasional 16 November, Simak Serba-serbi Peringatannya",https://news.detik.com/berita/d-5811947/hari-toleransi-internasional-16-november-simak-serba-serbi-peringatannya
2021-11-15_de_19_0,2021-11-15,Detik,Potret Relawan Jokpro Gelar Aksi di Patung Kuda,https://news.detik.com/foto-news/d-5811920/potret-relawan-jokpro-gelar-aksi-di-patung-kuda
2021-11-15_de_19_1,2021-11-15,Detik,Satgas Sebut Kasus COVID-19 di Surabaya Masih Fluktuatif,https://news.detik.com/berita-jawa-timur/d-5811941/satgas-sebut-kasus-covid-19-di-surabaya-masih-fluktuatif
2021-11-15_de_19_2,2021-11-15,Detik,Arti Operasi Zebra yang Berlaku Mulai Hari Ini,https://news.detik.com/berita/d-5811942/arti-operasi-zebra-yang-berlaku-mulai-hari-ini
2021-11-15_de_19_3,2021-11-15,Detik,"Kebakaran Kilang Pertamina Cilacap Akibat Sambaran Petir, Ini Penjelasan BMKG",https://news.detik.com/berita-jawa-tengah/d-5811939/kebakaran-kilang-pertamina-cilacap-akibat-sambaran-petir-ini-penjelasan-bmkg
2021-11-15_de_19_4,2021-11-15,Detik,Luhut Soal Haris-Fatia Tak Hadir Mediasi: Lebih Baik Ketemu di Pengadilan,https://news.detik.com/detiktv/d-5811937/luhut-soal-haris-fatia-tak-hadir-mediasi-lebih-baik-ketemu-di-pengadilan
2021-11-15_de_19_5,2021-11-15,Detik,Jorok! Sampah Menumpuk di Pasar Gedebage Bandung,https://news.detik.com/berita-jawa-barat/d-5811936/jorok-sampah-menumpuk-di-pasar-gedebage-bandung
2021-11-15_de_19_6,2021-11-15,Detik,Anggota Ormas FBR Tewas Dikeroyok 10 Orang di Jakbar,https://news.detik.com/berita/d-5811934/anggota-ormas-fbr-tewas-dikeroyok-10-orang-di-jakbar
2021-11-15_de_19_7,2021-11-15,Detik,"Jumlah Kapal yang Ditahan TNI AL Meningkat, Liberia Terbitkan Maklumat",https://news.detik.com/berita/d-5811919/jumlah-kapal-yang-ditahan-tni-al-meningkat-liberia-terbitkan-maklumat
