unique_id,date,source,headline,url
2021-11-15_de_19_8,2021-11-15,Detik,Salah Kaprah Bupati Banyumas Minta 'Dipanggil KPK Dulu' Sebelum OTT,https://news.detik.com/berita/d-5811918/salah-kaprah-bupati-banyumas-minta-dipanggil-kpk-dulu-sebelum-ott
2021-11-15_de_19_9,2021-11-15,Detik,Survei PRC: Ahok Masuk Bursa Cawapres 2024,https://news.detik.com/berita/d-5811915/survei-prc-ahok-masuk-bursa-cawapres-2024
2021-11-15_de_19_10,2021-11-15,Detik,Luhut dan Erick Thohir Bakal Dipolisikan soal Isu Bisnis PCR,https://news.detik.com/berita/d-5811914/luhut-dan-erick-thohir-bakal-dipolisikan-soal-isu-bisnis-pcr
2021-11-15_de_19_11,2021-11-15,Detik,ISIS-K Dalangi Serangan Bom yang Tewaskan Jurnalis Afghanistan,https://news.detik.com/internasional/d-5811913/isis-k-dalangi-serangan-bom-yang-tewaskan-jurnalis-afghanistan
2021-11-15_de_19_12,2021-11-15,Detik,Kondisi Penjara Ekuador Usai Kerusuhan Mengerikan Tewaskan 68 Napi,https://news.detik.com/internasional/d-5811911/kondisi-penjara-ekuador-usai-kerusuhan-mengerikan-tewaskan-68-napi
2021-11-15_de_19_13,2021-11-15,Detik,"Bupati Banyumas Sebut OTT Bikin Takut Inovasi, KPK Siap Dampingi",https://news.detik.com/berita/d-5811907/bupati-banyumas-sebut-ott-bikin-takut-inovasi-kpk-siap-dampingi
2021-11-15_de_19_14,2021-11-15,Detik,Klarifikasi Bupati Banyumas di IG soal 'Dipanggil Sebelum OTT' Raib!,https://news.detik.com/berita-jawa-tengah/d-5811905/klarifikasi-bupati-banyumas-di-ig-soal-dipanggil-sebelum-ott-raib
2021-11-15_de_19_15,2021-11-15,Detik,Kemenlu Gelar Serangkaian Kegiatan Jelang Acara Puncak ICDD,https://news.detik.com/berita/d-5811726/kemenlu-gelar-serangkaian-kegiatan-jelang-acara-puncak-icdd
2021-11-15_de_19_16,2021-11-15,Detik,"Operasi Zebra Jaya 2021 Dimulai, Ini 5 Hal yang Wajib Diketahui",https://news.detik.com/berita/d-5811910/operasi-zebra-jaya-2021-dimulai-ini-5-hal-yang-wajib-diketahui
2021-11-15_de_19_17,2021-11-15,Detik,"Fadli Zon Sindir Jokowi, Ngabalin Singgung Bintang Mahaputera",https://news.detik.com/berita/d-5811901/fadli-zon-sindir-jokowi-ngabalin-singgung-bintang-mahaputera
2021-11-15_de_19_18,2021-11-15,Detik,DPRD Dorong Pemkot Bandung Bangun Tempat Pengelolaan Sampah Mandiri,https://news.detik.com/berita-jawa-barat/d-5811895/dprd-dorong-pemkot-bandung-bangun-tempat-pengelolaan-sampah-mandiri
2021-11-15_de_19_19,2021-11-15,Detik,Admin Twitter Polda Sumut Diperiksa Buntut Like Konten Porno,https://news.detik.com/berita/d-5811894/admin-twitter-polda-sumut-diperiksa-buntut-like-konten-porno
2021-11-15_de_20_0,2021-11-15,Detik,"Lagi Tidur, Pria di Majalengka Dibacok Gerombolan Bermotor hingga Masuk ICU",https://news.detik.com/berita-jawa-barat/d-5811892/lagi-tidur-pria-di-majalengka-dibacok-gerombolan-bermotor-hingga-masuk-icu
2021-11-15_de_20_1,2021-11-15,Detik,KPK Periksa Eks Bupati Kukar di Lapas Tangerang Terkait Azis Syamsuddin,https://news.detik.com/berita/d-5811889/kpk-periksa-eks-bupati-kukar-di-lapas-tangerang-terkait-azis-syamsuddin
2021-11-15_de_20_2,2021-11-15,Detik,"Survei Capres PRC: Prabowo-Ganjar Beda Tipis, Andika Perkasa Muncul Lagi",https://news.detik.com/berita/d-5811826/survei-capres-prc-prabowo-ganjar-beda-tipis-andika-perkasa-muncul-lagi
2021-11-15_de_20_3,2021-11-15,Detik,PPP: PDIP Vs Golkar soal Ganjar Nggak Penting!,https://news.detik.com/berita/d-5811823/ppp-pdip-vs-golkar-soal-ganjar-nggak-penting
2021-11-15_de_20_4,2021-11-15,Detik,"DPRD DKI Usul Dana Dapil Rp 49 Miliar, F-PKS: Harus Efisien",https://news.detik.com/berita/d-5811822/dprd-dki-usul-dana-dapil-rp-49-miliar-f-pks-harus-efisien
2021-11-15_de_20_5,2021-11-15,Detik,Pengungsi Afghanistan Kembali Geruduk Kantor UNHCR Jakpus,https://news.detik.com/foto-news/d-5811809/pengungsi-afghanistan-kembali-geruduk-kantor-unhcr-jakpus
2021-11-15_de_20_6,2021-11-15,Detik,"Ditegur Prabowo, Fadli Zon Sudah Tak Ngetweet 2 Hari",https://news.detik.com/berita/d-5811808/ditegur-prabowo-fadli-zon-sudah-tak-ngetweet-2-hari
2021-11-15_de_20_7,2021-11-15,Detik,"Gudang Rokok di Solo Dirampok, Satpam Tewas-Duit Ratusan Juta Raib",https://news.detik.com/berita-jawa-tengah/d-5811807/gudang-rokok-di-solo-dirampok-satpam-tewas-duit-ratusan-juta-raib
2021-11-15_de_20_8,2021-11-15,Detik,"Mandalika Sirkuit Sudah Diresmikan Presiden Jokowi, Ini Fakta-faktanya",https://news.detik.com/berita/d-5811820/mandalika-sirkuit-sudah-diresmikan-presiden-jokowi-ini-fakta-faktanya
2021-11-15_de_20_9,2021-11-15,Detik,detikcom do Your Magic: Kondisi Got di Petamburan III yang Tak Lagi Sebabkan Banjir,https://news.detik.com/berita/d-5811805/detikcom-do-your-magic-kondisi-got-di-petamburan-iii-yang-tak-lagi-sebabkan-banjir
2021-11-15_de_20_10,2021-11-15,Detik,KPK Panggil Aliza Gunado Terkait Kasus Azis Syamsuddin,https://news.detik.com/berita/d-5811802/kpk-panggil-aliza-gunado-terkait-kasus-azis-syamsuddin
2021-11-15_de_20_11,2021-11-15,Detik,Situasi Area Rumah Sakit Liverpool Usai Ledakan yang Menelan Korban,https://news.detik.com/detiktv/d-5811801/situasi-area-rumah-sakit-liverpool-usai-ledakan-yang-menelan-korban
2021-11-15_de_20_12,2021-11-15,Detik,Alasan Kapolri Bakal Naikkan Dankor Brimob Jadi Jenderal Bintang Tiga,https://news.detik.com/berita/d-5811800/alasan-kapolri-bakal-naikkan-dankor-brimob-jadi-jenderal-bintang-tiga
2021-11-15_de_20_13,2021-11-15,Detik,"Gelar Operasi Zebra, Kapolda Riau Minta Anggota Jaga Citra Polri",https://news.detik.com/berita/d-5811799/gelar-operasi-zebra-kapolda-riau-minta-anggota-jaga-citra-polri
2021-11-15_de_20_14,2021-11-15,Detik,"Akun Twitter Like Konten Porno, Polda Sumut Ngaku Diretas",https://news.detik.com/berita/d-5811798/akun-twitter-like-konten-porno-polda-sumut-ngaku-diretas
2021-11-15_de_20_15,2021-11-15,Detik,23 Tahanan Polres Batanghari Kabur Saat Dititipkan di Lapas Jambi,https://news.detik.com/berita/d-5811796/23-tahanan-polres-batanghari-kabur-saat-dititipkan-di-lapas-jambi
2021-11-15_de_20_16,2021-11-15,Detik,Saran Novel ke Bupati Banyumas: Takut OTT? Ya Jangan Terima Suap,https://news.detik.com/detiktv/d-5811794/saran-novel-ke-bupati-banyumas-takut-ott-ya-jangan-terima-suap
2021-11-15_de_20_17,2021-11-15,Detik,Viral Pegawai KA Berangkat Kerja Dijemput Kereta Api di Depan Rumah,https://news.detik.com/berita-jawa-timur/d-5811792/viral-pegawai-ka-berangkat-kerja-dijemput-kereta-api-di-depan-rumah
2021-11-15_de_20_18,2021-11-15,Detik,"Haris-Fatia Tak Hadiri Mediasi, Luhut: Lebih Bagus Ketemu di Pengadilan!",https://news.detik.com/berita/d-5811791/haris-fatia-tak-hadiri-mediasi-luhut-lebih-bagus-ketemu-di-pengadilan
2021-11-15_de_20_19,2021-11-15,Detik,Elektabilitas Prabowo Tertinggi Versi Riset Indonesia Survey Center,https://news.detik.com/berita/d-5811761/elektabilitas-prabowo-tertinggi-versi-riset-indonesia-survey-center
2021-11-15_de_21_0,2021-11-15,Detik,Vokalis Musik Metal di Lamongan Bikin Usaha Bonsai Kelapa Modal Rp 50 Ribu,https://news.detik.com/berita-jawa-timur/d-5811779/vokalis-musik-metal-di-lamongan-bikin-usaha-bonsai-kelapa-modal-rp-50-ribu
2021-11-15_de_21_1,2021-11-15,Detik,"Mardani Puji Ganjar, tapi PKS Fokus Sorongkan Salim Segaf",https://news.detik.com/berita/d-5811786/mardani-puji-ganjar-tapi-pks-fokus-sorongkan-salim-segaf
2021-11-15_de_21_2,2021-11-15,Detik,"Ikuti Arahan Jokowi, Koster Tata Hutan Mangrove di Bali untuk KTT G20",https://news.detik.com/berita/d-5811783/ikuti-arahan-jokowi-koster-tata-hutan-mangrove-di-bali-untuk-ktt-g20
2021-11-15_de_21_3,2021-11-15,Detik,"Kecewa, Gubernur NTB Ungkap Sebab Balap ATC Sirkuit Mandalika Ditunda",https://news.detik.com/berita/d-5811824/kecewa-gubernur-ntb-ungkap-sebab-balap-atc-sirkuit-mandalika-ditunda
2021-11-15_de_21_4,2021-11-15,Detik,Terungkap! Ini Dia Penyebab Kebakaran Tangki Pertamina Cilacap,https://news.detik.com/berita-jawa-tengah/d-5811782/terungkap-ini-dia-penyebab-kebakaran-tangki-pertamina-cilacap
2021-11-15_de_21_5,2021-11-15,Detik,"Antisipasi Banjir, Walkot Jakbar Minta Waduk Diperbaiki-Bersihkan Saluran Air",https://news.detik.com/berita/d-5811778/antisipasi-banjir-walkot-jakbar-minta-waduk-diperbaiki-bersihkan-saluran-air
2021-11-15_de_21_6,2021-11-15,Detik,"Operasi Zebra Semeru 2021 Digelar Dua Pekan, Catat Target Operasinya",https://news.detik.com/berita-jawa-timur/d-5811777/operasi-zebra-semeru-2021-digelar-dua-pekan-catat-target-operasinya
2021-11-15_de_21_7,2021-11-15,Detik,6 Pengunjung Tempat Hiburan Malam Positif Narkoba di Medan Bakal Direhab,https://news.detik.com/berita/d-5811776/6-pengunjung-tempat-hiburan-malam-positif-narkoba-di-medan-bakal-direhab
2021-11-15_de_21_8,2021-11-15,Detik,"Warga Protes Lockdown di Belanda, 15 Orang Ditangkap",https://news.detik.com/internasional/d-5811769/warga-protes-lockdown-di-belanda-15-orang-ditangkap
2021-11-15_de_21_9,2021-11-15,Detik,"Anies: Operasi Zebra, Babak Baru Disiplin Lantas Usai Kurangi Mobilitas",https://news.detik.com/berita/d-5811768/anies-operasi-zebra-babak-baru-disiplin-lantas-usai-kurangi-mobilitas
2021-11-15_de_21_10,2021-11-15,Detik,Bupati Taput Bantah Kabar Siswa SD Turun Kelas Gegara Masalah Pilkades,https://news.detik.com/berita/d-5811767/bupati-taput-bantah-kabar-siswa-sd-turun-kelas-gegara-masalah-pilkades
2021-11-15_de_21_11,2021-11-15,Detik,"Pasal 5 Ayat 2 Permendikbud 30 Jadi Sorotan, Ini Isinya",https://news.detik.com/berita/d-5811770/pasal-5-ayat-2-permendikbud-30-jadi-sorotan-ini-isinya
2021-11-15_de_21_12,2021-11-15,Detik,Akhir Sengketa Kemhan Vs Angkasa Pura II soal Lahan Bandara Palembang,https://news.detik.com/berita/d-5811762/akhir-sengketa-kemhan-vs-angkasa-pura-ii-soal-lahan-bandara-palembang
2021-11-15_de_21_13,2021-11-15,Detik,Polisi Ungkap Modus Pemasok SIM Card ke Pinjol Ilegal Bikin Ibu Bunuh Diri,https://news.detik.com/berita/d-5811760/polisi-ungkap-modus-pemasok-sim-card-ke-pinjol-ilegal-bikin-ibu-bunuh-diri
2021-11-15_de_21_14,2021-11-15,Detik,"Apel Operasi Zebra Jaya, Kakorlantas hingga Anies Hadir",https://news.detik.com/detiktv/d-5811759/apel-operasi-zebra-jaya-kakorlantas-hingga-anies-hadir
2021-11-15_de_21_15,2021-11-15,Detik,"Kebakaran 2 Toko di Klaten, SPBU Mini-Mobil Ludes",https://news.detik.com/berita-jawa-tengah/d-5811757/kebakaran-2-toko-di-klaten-spbu-mini-mobil-ludes
2021-11-15_de_21_16,2021-11-15,Detik,Firli Bahuri Puji Brimob 'Tameng Hidup' KPK ke Sarang Korupsi,https://news.detik.com/berita/d-5811748/firli-bahuri-puji-brimob-tameng-hidup-kpk-ke-sarang-korupsi
2021-11-15_de_21_17,2021-11-15,Detik,"Anggota Terlibat Video Call Sex Masih Ngantor, Ketua DPRD Merangin Berang",https://news.detik.com/berita/d-5811740/anggota-terlibat-video-call-sex-masih-ngantor-ketua-dprd-merangin-berang
2021-11-15_de_21_18,2021-11-15,Detik,"Hasil Survei: Pemilih Jokowi Jatuh Hati ke Prabowo, Ini Alasannya",https://news.detik.com/berita/d-5811739/hasil-survei-pemilih-jokowi-jatuh-hati-ke-prabowo-ini-alasannya
2021-11-15_de_21_19,2021-11-15,Detik,"Urai Kemacetan di Flyover Aloha, Bupati Sidoarjo Kejar Target Hibah Tuntas 2022",https://news.detik.com/berita-jawa-timur/d-5811758/urai-kemacetan-di-flyover-aloha-bupati-sidoarjo-kejar-target-hibah-tuntas-2022
2021-11-15_de_22_0,2021-11-15,Detik,Pencari Suaka WN Afghanistan Kembali Demo di Kantor UNHCR Jakpus,https://news.detik.com/berita/d-5811729/pencari-suaka-wn-afghanistan-kembali-demo-di-kantor-unhcr-jakpus
2021-11-15_de_22_1,2021-11-15,Detik,Jatuh Bangun RS Anak di Haiti Tetap Beroperasi di Tengah Krisis BBM,https://news.detik.com/foto-news/d-5811711/jatuh-bangun-rs-anak-di-haiti-tetap-beroperasi-di-tengah-krisis-bbm
2021-11-15_de_22_2,2021-11-15,Detik,Bupati Kebumen Gelar HUT Brimob Ke-76 di Pendopo Rumah Dinas,https://news.detik.com/berita/d-5811728/bupati-kebumen-gelar-hut-brimob-ke-76-di-pendopo-rumah-dinas
2021-11-15_de_22_3,2021-11-15,Detik,"Seorang Wanita Jadi Tersangka Investasi Bodong di Jepara, Korbannya Ratusan",https://news.detik.com/berita-jawa-tengah/d-5811727/seorang-wanita-jadi-tersangka-investasi-bodong-di-jepara-korbannya-ratusan
2021-11-15_de_22_4,2021-11-15,Detik,Polisi Pakai Pendeteksi Kebohongan Periksa Dosen Diduga Ciumi Mahasiswi Unri,https://news.detik.com/berita/d-5811725/polisi-pakai-pendeteksi-kebohongan-periksa-dosen-diduga-ciumi-mahasiswi-unri
2021-11-15_de_22_5,2021-11-15,Detik,"Kejari Bandung Masih Dalami Korupsi Rp 1,2 M di Perum Damri",https://news.detik.com/berita-jawa-barat/d-5811724/kejari-bandung-masih-dalami-korupsi-rp-12-m-di-perum-damri
2021-11-15_de_22_6,2021-11-15,Detik,Penguin Langka dari Antartika Nyasar 3.000 Kilometer ke Selandia Baru,https://news.detik.com/bbc-world/d-5811723/penguin-langka-dari-antartika-nyasar-3000-kilometer-ke-selandia-baru
2021-11-15_de_22_7,2021-11-15,Detik,Permendikbud Masih Berbuntut,https://news.detik.com/kolom/d-5811710/permendikbud-masih-berbuntut
2021-11-15_de_22_8,2021-11-15,Detik,"Kejagung Lelang Mobil Mercy S500-Audi Q7 dari Kasus Jiwasraya, Berminat?",https://news.detik.com/berita/d-5811704/kejagung-lelang-mobil-mercy-s500-audi-q7-dari-kasus-jiwasraya-berminat
2021-11-15_de_22_9,2021-11-15,Detik,3 Pria Ditangkap Usai Ledakan Guncang Liverpool,https://news.detik.com/internasional/d-5811702/3-pria-ditangkap-usai-ledakan-guncang-liverpool
2021-11-15_de_22_10,2021-11-15,Detik,"Evaluasi PPKM Jawa-Bali Digelar Hari Ini, DKI Terbanyak Tambahan COVID Sepekan",https://news.detik.com/berita/d-5811701/evaluasi-ppkm-jawa-bali-digelar-hari-ini-dki-terbanyak-tambahan-covid-sepekan
2021-11-15_de_22_11,2021-11-15,Detik,"Tahun Depan, RS di Banten Selatan Mulai Dibangun",https://news.detik.com/berita-jawa-barat/d-5811700/tahun-depan-rs-di-banten-selatan-mulai-dibangun
2021-11-15_de_22_12,2021-11-15,Detik,Pria Bergolok Ngamuk dan Rusak Motor Warga di Muara Angke Jakut,https://news.detik.com/berita/d-5811699/pria-bergolok-ngamuk-dan-rusak-motor-warga-di-muara-angke-jakut
2021-11-15_de_22_13,2021-11-15,Detik,Luhut Hadiri Mediasi Kasus ITE Haris-Fatia di Polda Metro Pagi Ini,https://news.detik.com/berita/d-5811694/luhut-hadiri-mediasi-kasus-ite-haris-fatia-di-polda-metro-pagi-ini
2021-11-15_de_22_14,2021-11-15,Detik,KPK Jawab Bupati Banyumas yang Minta 'Dipanggil Sebelum OTT',https://news.detik.com/berita/d-5811691/kpk-jawab-bupati-banyumas-yang-minta-dipanggil-sebelum-ott
2021-11-15_de_22_15,2021-11-15,Detik,Hujan hingga Angin Kencang Masih Ancam Jatim Mulai Pagi hingga Dini Hari,https://news.detik.com/berita-jawa-timur/d-5811689/hujan-hingga-angin-kencang-masih-ancam-jatim-mulai-pagi-hingga-dini-hari
2021-11-15_de_22_16,2021-11-15,Detik,"Masih Ada Kerumunan, Akses Masuk Taman Alun-alun Bandung Akan Dievaluasi",https://news.detik.com/berita-jawa-barat/d-5811686/masih-ada-kerumunan-akses-masuk-taman-alun-alun-bandung-akan-dievaluasi
2021-11-15_de_22_17,2021-11-15,Detik,Kejari Pandeglang Bidik Dugaan Korupsi Hibah-Bansos Rp 65 M,https://news.detik.com/berita-jawa-barat/d-5811683/kejari-pandeglang-bidik-dugaan-korupsi-hibah-bansos-rp-65-m
2021-11-15_de_22_18,2021-11-15,Detik,"Polda Metro: Pelanggar Operasi Zebra Tak Akan Ditangkap, tapi Diedukasi",https://news.detik.com/berita/d-5811681/polda-metro-pelanggar-operasi-zebra-tak-akan-ditangkap-tapi-diedukasi
2021-11-15_de_22_19,2021-11-15,Detik,"Ini Seif Al-Islam Khadafi, Terpidana Mati yang Daftar Jadi Capres Libya",https://news.detik.com/foto-news/d-5811668/ini-seif-al-islam-khadafi-terpidana-mati-yang-daftar-jadi-capres-libya
2021-11-15_de_23_0,2021-11-15,Detik,Novel Baswedan Komentari Bupati Banyumas: Nggak Mau OTT ya Jangan Terima Suap,https://news.detik.com/berita/d-5811676/novel-baswedan-komentari-bupati-banyumas-nggak-mau-ott-ya-jangan-terima-suap
2021-11-15_de_23_1,2021-11-15,Detik,Polisi Sidoarjo Akan Gelar Operasi Zebra Semeru Selama 2 Pekan,https://news.detik.com/berita-jawa-timur/d-5811708/polisi-sidoarjo-akan-gelar-operasi-zebra-semeru-selama-2-pekan
2021-11-15_de_23_2,2021-11-15,Detik,LBH: Siswa di Taput Turun Kelas Gegara Ortu Tak Pilih Suami Kepsek Jadi Kades,https://news.detik.com/berita/d-5811658/lbh-siswa-di-taput-turun-kelas-gegara-ortu-tak-pilih-suami-kepsek-jadi-kades
2021-11-15_de_23_3,2021-11-15,Detik,DPO Eksekutor Begal Tewaskan Pegawai Basarnas di Jakpus Ditangkap!,https://news.detik.com/berita/d-5811657/dpo-eksekutor-begal-tewaskan-pegawai-basarnas-di-jakpus-ditangkap
2021-11-15_de_23_4,2021-11-15,Detik,Taliban Gelar Parade Militer Pakai Senjata Peninggalan AS,https://news.detik.com/internasional/d-5811653/taliban-gelar-parade-militer-pakai-senjata-peninggalan-as
2021-11-15_de_23_5,2021-11-15,Detik,"Operasi Zebra Dimulai, Kakorlantas Minta Masyarakat Tak Hindari Polisi",https://news.detik.com/berita/d-5811652/operasi-zebra-dimulai-kakorlantas-minta-masyarakat-tak-hindari-polisi
2021-11-15_de_23_6,2021-11-15,Detik,"Hanya 4 Kecamatan Capai Target Vaksinasi, Kab Blitar Jauh dari Herd Immunity",https://news.detik.com/berita-jawa-timur/d-5811629/hanya-4-kecamatan-capai-target-vaksinasi-kab-blitar-jauh-dari-herd-immunity
2021-11-15_de_23_7,2021-11-15,Detik,"PKB Sarankan Demokrat Jadikan JK Ketum Mereka, Bukan di PBNU",https://news.detik.com/berita/d-5811627/pkb-sarankan-demokrat-jadikan-jk-ketum-mereka-bukan-di-pbnu
2021-11-15_de_23_8,2021-11-15,Detik,Pemerintah Gelar Evaluasi Nasib PPKM Jawa-Bali Hari Ini,https://news.detik.com/berita/d-5811615/pemerintah-gelar-evaluasi-nasib-ppkm-jawa-bali-hari-ini
2021-11-15_de_23_9,2021-11-15,Detik,Seorang Napi Tewas Gantung Diri di Rutan Aceh,https://news.detik.com/berita/d-5811613/seorang-napi-tewas-gantung-diri-di-rutan-aceh
2021-11-15_de_23_10,2021-11-15,Detik,Ricuh Ojol Vs Karyawan Mie Gacoan Yogya Berujung Penggerudukan,https://news.detik.com/berita-jawa-tengah/d-5811610/ricuh-ojol-vs-karyawan-mie-gacoan-yogya-berujung-penggerudukan
2021-11-15_de_23_11,2021-11-15,Detik,"Kabar Kapal Asing Bayar Rp 4,2 M ke Perwira TNI AL Dibantah Mentah-mentah",https://news.detik.com/berita/d-5811609/kabar-kapal-asing-bayar-rp-42-m-ke-perwira-tni-al-dibantah-mentah-mentah
2021-11-15_de_23_12,2021-11-15,Detik,Prof Romli Nilai Permendikbud PPKS Ternodai Kata 'Tanpa Persetujuan Korban',https://news.detik.com/berita/d-5811606/prof-romli-nilai-permendikbud-ppks-ternodai-kata-tanpa-persetujuan-korban
2021-11-15_de_23_13,2021-11-15,Detik,"Prabowo Tegur Fadli Zon, PKB: Silakan Kalau Diingatkan atau Dipecat",https://news.detik.com/berita/d-5811591/prabowo-tegur-fadli-zon-pkb-silakan-kalau-diingatkan-atau-dipecat
2021-11-15_de_23_14,2021-11-15,Detik,Polisi Olah TKP Kebakaran Tangki Kilang Pertamina Cilacap,https://news.detik.com/berita/d-5811587/polisi-olah-tkp-kebakaran-tangki-kilang-pertamina-cilacap
2021-11-15_de_23_15,2021-11-15,Detik,Tragedi Warung Kopi Tertimpa Pohon Tumbang yang Tewaskan 3 Orang,https://news.detik.com/berita-jawa-timur/d-5811583/tragedi-warung-kopi-tertimpa-pohon-tumbang-yang-tewaskan-3-orang
2021-11-15_de_23_16,2021-11-15,Detik,"Tangki Pertamina Cilacap Terbakar, PD: Audit Kelayakan Prasarana Kilang",https://news.detik.com/berita/d-5811582/tangki-pertamina-cilacap-terbakar-pd-audit-kelayakan-prasarana-kilang
2021-11-15_de_23_17,2021-11-15,Detik,"Daftar Jadi Capres Libya, Anak Muammar Khadafi Merupakan Terpidana Mati",https://news.detik.com/internasional/d-5811578/daftar-jadi-capres-libya-anak-muammar-khadafi-merupakan-terpidana-mati
2021-11-15_de_23_18,2021-11-15,Detik,Kata Mahfud Soal Dugaan Bisnis PCR Luhut-Erick,https://news.detik.com/berita/d-5811577/kata-mahfud-soal-dugaan-bisnis-pcr-luhut-erick
2021-11-15_de_23_19,2021-11-15,Detik,"Epidemiolog Nilai Jakarta Bisa Tetap PPKM Level 1, tapi Harus Hati-hati",https://news.detik.com/berita/d-5811575/epidemiolog-nilai-jakarta-bisa-tetap-ppkm-level-1-tapi-harus-hati-hati
2021-11-15_de_24_0,2021-11-15,Detik,"Sebuah Mobil Tertabrak KA Komuter di Pasuruan, Empat Mahasiswa Tewas",https://news.detik.com/berita-jawa-timur/d-5811576/sebuah-mobil-tertabrak-ka-komuter-di-pasuruan-empat-mahasiswa-tewas
2021-11-15_de_24_1,2021-11-15,Detik,Menengok Aktivitas Warga Terdampak Banjir di Sintang,https://news.detik.com/foto-news/d-5811569/menengok-aktivitas-warga-terdampak-banjir-di-sintang
2021-11-15_de_24_2,2021-11-15,Detik,"Pimpin Apel Operasi Zebra, Kapolda Metro Ingatkan Polantas Profesional",https://news.detik.com/berita/d-5811568/pimpin-apel-operasi-zebra-kapolda-metro-ingatkan-polantas-profesional
2021-11-15_de_24_3,2021-11-15,Detik,"Saya Berselisih dengan Kakak Soal Status Rumah, Bagaimana Solusinya?",https://news.detik.com/berita/d-5811566/saya-berselisih-dengan-kakak-soal-status-rumah-bagaimana-solusinya
2021-11-15_de_24_4,2021-11-15,Detik,Gempar Elite PDIP vs Golkar Gegara Urusan Ganjar,https://news.detik.com/berita/d-5811530/gempar-elite-pdip-vs-golkar-gegara-urusan-ganjar
2021-11-15_de_24_5,2021-11-15,Detik,KLT.Official Dukung Mahasiswa UNESA di Kompetisi Teknologi Nasional,https://news.detik.com/adv-nhl-detikcom/d-5811935/kltofficial-dukung-mahasiswa-unesa-di-kompetisi-teknologi-nasional
2021-11-15_de_24_6,2021-11-15,Detik,Kala Jokowi Kenalkan Outfit Anak Bangsa di Sirkuit Event Kelas Dunia,https://news.detik.com/berita/d-5811527/kala-jokowi-kenalkan-outfit-anak-bangsa-di-sirkuit-event-kelas-dunia
2021-11-15_de_24_7,2021-11-15,Detik,Hitung-hitungan Anies soal Target 6 Jam Banjir Surut,https://news.detik.com/berita/d-5811526/hitung-hitungan-anies-soal-target-6-jam-banjir-surut
2021-11-15_de_24_8,2021-11-15,Detik,Maunya Bupati Banyumas: KPK Panggil Dulu Kepala Daerah yang Akan Di-OTT,https://news.detik.com/berita-jawa-tengah/d-5811525/maunya-bupati-banyumas-kpk-panggil-dulu-kepala-daerah-yang-akan-di-ott
2021-11-15_de_24_9,2021-11-15,Detik,Nadiem Ancam Turunkan Akreditasi Kampus Tak Jalankan Permendikbud 30,https://news.detik.com/berita/d-5811524/nadiem-ancam-turunkan-akreditasi-kampus-tak-jalankan-permendikbud-30
2021-11-15_de_24_10,2021-11-15,Detik,"Fakta-fakta Kebakaran Tangki Pertamina Cilacap, Bahkan Air Hujan Menghitam",https://news.detik.com/berita-jawa-tengah/d-5811517/fakta-fakta-kebakaran-tangki-pertamina-cilacap-bahkan-air-hujan-menghitam
2021-11-15_de_24_11,2021-11-15,Detik,Gelegar Petir Menyambar Sebelum Tangki Kilang Pertamina Terbakar,https://news.detik.com/berita/d-5811515/gelegar-petir-menyambar-sebelum-tangki-kilang-pertamina-terbakar
2021-11-15_de_24_12,2021-11-15,Detik,Peringatan Keras Luhut ke LSM Penyebar Berita Tidak Benar,https://news.detik.com/berita/d-5811513/peringatan-keras-luhut-ke-lsm-penyebar-berita-tidak-benar
2021-11-15_de_24_13,2021-11-15,Detik,"Polda Metro Gelar Operasi Zebra Jaya, Ini Sasarannya",https://news.detik.com/berita/d-5811512/polda-metro-gelar-operasi-zebra-jaya-ini-sasarannya
2021-11-15_de_24_14,2021-11-15,Detik,PKS Minta Pemprov DKI Tak Buru-buru Izinkan Konser: Sulit Pastikan Prokes,https://news.detik.com/berita/d-5811496/pks-minta-pemprov-dki-tak-buru-buru-izinkan-konser-sulit-pastikan-prokes
2021-11-15_de_24_15,2021-11-15,Detik,"Survei DTS: Ganjar di Atas Prabowo, Jokowi Tak Direstui 3 Periode",https://news.detik.com/detiktv/d-5811495/survei-dts-ganjar-di-atas-prabowo-jokowi-tak-direstui-3-periode
2021-11-15_de_24_16,2021-11-15,Detik,Anak Muammar Khadafi Daftarkan Diri Jadi Calon Presiden Libya,https://news.detik.com/internasional/d-5811494/anak-muammar-khadafi-daftarkan-diri-jadi-calon-presiden-libya
2021-11-15_de_24_17,2021-11-15,Detik,Sindiran Fadli Zon ke Jokowi Bikin Prabowo Turun Tangan,https://news.detik.com/berita/d-5811490/sindiran-fadli-zon-ke-jokowi-bikin-prabowo-turun-tangan
2021-11-15_de_24_18,2021-11-15,Detik,PDIP Usul Penonton Konser Musik di Jakarta Wajib Tes Antigen,https://news.detik.com/berita/d-5811476/pdip-usul-penonton-konser-musik-di-jakarta-wajib-tes-antigen
2021-11-15_de_24_19,2021-11-15,Detik,Mabuk-mabukan di Kasus Pemerkosaan Tentara Prancis di Istana Kepresidenan,https://news.detik.com/internasional/d-5811471/mabuk-mabukan-di-kasus-pemerkosaan-tentara-prancis-di-istana-kepresidenan
2021-11-15_de_25_0,2021-11-15,Detik,Kontroversi Data Deforestasi Bikin Greenpeace Dilaporkan ke Polisi,https://news.detik.com/berita/d-5811466/kontroversi-data-deforestasi-bikin-greenpeace-dilaporkan-ke-polisi
2021-11-15_de_25_1,2021-11-15,Detik,Serba-serbi Keamanan Jokowi Lahap Tikungan Sirkuit Mandalika,https://news.detik.com/berita/d-5811464/serba-serbi-keamanan-jokowi-lahap-tikungan-sirkuit-mandalika
2021-11-15_de_25_2,2021-11-15,Detik,Legislator Gerindra Cek Cipinang Melayu: Sekarang Banjirnya Cepat Surut,https://news.detik.com/berita/d-5811474/legislator-gerindra-cek-cipinang-melayu-sekarang-banjirnya-cepat-surut
2021-11-15_de_25_3,2021-11-15,Detik,BMKG: Waspada Potensi Hujan Disertai Petir di Jakpus hingga Jaksel,https://news.detik.com/berita/d-5811456/bmkg-waspada-potensi-hujan-disertai-petir-di-jakpus-hingga-jaksel
2021-11-15_de_25_4,2021-11-15,Detik,Heboh Oknum Satpam di Kawasan PIK 2 Lakukan Pungli,https://news.detik.com/detiktv/d-5811453/heboh-oknum-satpam-di-kawasan-pik-2-lakukan-pungli
2021-11-15_de_25_5,2021-11-15,Detik,"22 Desa di Kotim Kalteng Terendam Banjir, Tinggi Air Capai 1 Meter",https://news.detik.com/berita/d-5811450/22-desa-di-kotim-kalteng-terendam-banjir-tinggi-air-capai-1-meter
2021-11-15_de_25_6,2021-11-15,Detik,Viral Nikah di Malang Diiringi Monster,https://news.detik.com/detiktv/d-5811447/viral-nikah-di-malang-diiringi-monster
2021-11-15_de_25_7,2021-11-15,Detik,Italia Terima 550 Migran dalam Sehari,https://news.detik.com/detiktv/d-5811445/italia-terima-550-migran-dalam-sehari
2021-11-15_de_25_8,2021-11-15,Detik,"Sebuah Mobil Meledak di Depan Rumah Sakit di Liverpool, 1 Orang Tewas",https://news.detik.com/internasional/d-5811444/sebuah-mobil-meledak-di-depan-rumah-sakit-di-liverpool-1-orang-tewas
2021-11-15_de_25_9,2021-11-15,Detik,"Diterjang Arus Banjir, Jembatan di Mamuju Sulbar Rusak",https://news.detik.com/berita/d-5811443/diterjang-arus-banjir-jembatan-di-mamuju-sulbar-rusak
2021-11-15_de_25_10,2021-11-15,Detik,"Pohon Tumbang Timpa Warung di Mojokerto, 3 Orang Tewas",https://news.detik.com/detiktv/d-5811426/pohon-tumbang-timpa-warung-di-mojokerto-3-orang-tewas
2021-11-15_de_25_11,2021-11-15,Detik,Istana Buckingham Sebut Ratu Elizabeth II Alami Punggung Terkilir,https://news.detik.com/internasional/d-5811425/istana-buckingham-sebut-ratu-elizabeth-ii-alami-punggung-terkilir
