unique_id,date,source,headline,url
2022-01-04_de_19_7,2022-01-04,Detik,"Habib Bahar Jadi Tersangka, Pengacara: Luar Biasa Kilat",https://news.detik.com/detiktv/d-5883189/habib-bahar-jadi-tersangka-pengacara-luar-biasa-kilat
2022-01-04_de_19_8,2022-01-04,Detik,"2 Jam Dicari, Ular Piton di Ruang COVID RS Wahidin Makassar Belum Ditemukan",https://news.detik.com/berita/d-5883185/2-jam-dicari-ular-piton-di-ruang-covid-rs-wahidin-makassar-belum-ditemukan
2022-01-04_de_19_9,2022-01-04,Detik,Uji Klinik Vaksin Merah Putih Unair Sempat Terkendala Syarat dari BPOM,https://news.detik.com/berita-jawa-timur/d-5883183/uji-klinik-vaksin-merah-putih-unair-sempat-terkendala-syarat-dari-bpom
2022-01-04_de_19_10,2022-01-04,Detik,Awas! Nama Kapolres Madina Sumut Dicatut Penipu Minta Uang Via WA,https://news.detik.com/berita/d-5883174/awas-nama-kapolres-madina-sumut-dicatut-penipu-minta-uang-via-wa
2022-01-04_de_19_11,2022-01-04,Detik,Ini Dia 7 Daerah di Jateng yang Statusnya Naik Jadi PPKM Level 2,https://news.detik.com/berita-jawa-tengah/d-5883173/ini-dia-7-daerah-di-jateng-yang-statusnya-naik-jadi-ppkm-level-2
2022-01-04_de_19_12,2022-01-04,Detik,Tolong! Bantu Wanita Asal Depok Ini Menyusuri Jejak Ayahnya yang Hilang,https://news.detik.com/berita/d-5883163/tolong-bantu-wanita-asal-depok-ini-menyusuri-jejak-ayahnya-yang-hilang
2022-01-04_de_19_13,2022-01-04,Detik,Pengacara Ungkap Isi Ucapan Habib Bahar soal Penyebaran Berita Bohong,https://news.detik.com/berita-jawa-barat/d-5883161/pengacara-ungkap-isi-ucapan-habib-bahar-soal-penyebaran-berita-bohong
2022-01-04_de_19_14,2022-01-04,Detik,Iran Ancam Balas Kematian Jenderal Soleimani Jika Trump Tak Diadili,https://news.detik.com/internasional/d-5883160/iran-ancam-balas-kematian-jenderal-soleimani-jika-trump-tak-diadili
2022-01-04_de_19_15,2022-01-04,Detik,"Daftar Lengkap PPKM di Jatim, Daerah Kamu Level Berapa?",https://news.detik.com/berita-jawa-timur/d-5883158/daftar-lengkap-ppkm-di-jatim-daerah-kamu-level-berapa
2022-01-04_de_19_16,2022-01-04,Detik,Beda PDIP dan Gerindra soal Larangan Ekspor Batu Bara,https://news.detik.com/berita/d-5883150/beda-pdip-dan-gerindra-soal-larangan-ekspor-batu-bara
2022-01-04_de_19_17,2022-01-04,Detik,"Jakarta PPKM Level 2, Simak Aturan Terbaru yang Perlu Kamu Tahu",https://news.detik.com/berita/d-5883149/jakarta-ppkm-level-2-simak-aturan-terbaru-yang-perlu-kamu-tahu
2022-01-04_de_19_18,2022-01-04,Detik,"Gagal Nanjak, Truk Pasir Terguling-Timpa Pemotor di Bogor Hingga Tewas",https://news.detik.com/berita-jawa-barat/d-5883148/gagal-nanjak-truk-pasir-terguling-timpa-pemotor-di-bogor-hingga-tewas
2022-01-04_de_19_19,2022-01-04,Detik,Ini Rumah Tersangka Investasi Bodong Alkes yang Jadi Target Vandalisme,https://news.detik.com/foto-news/d-5883134/ini-rumah-tersangka-investasi-bodong-alkes-yang-jadi-target-vandalisme
2022-01-04_de_20_0,2022-01-04,Detik,"Terkendala Capaian Vaksinasi, PTM Tahun 2022 di Cilegon Masih 50 Persen",https://news.detik.com/berita/d-5883145/terkendala-capaian-vaksinasi-ptm-tahun-2022-di-cilegon-masih-50-persen
2022-01-04_de_20_1,2022-01-04,Detik,"2 Tahun Berlalu, PK Setya Novanto Belum Diketok Palu",https://news.detik.com/berita/d-5883143/2-tahun-berlalu-pk-setya-novanto-belum-diketok-palu
2022-01-04_de_20_2,2022-01-04,Detik,Hermawan Sulistyo Apresiasi Penetapan Tersangka Bahar Smith oleh Polri,https://news.detik.com/berita/d-5883155/hermawan-sulistyo-apresiasi-penetapan-tersangka-bahar-smith-oleh-polri
2022-01-04_de_20_3,2022-01-04,Detik,"Vaksinasi Anak di Kulon Progo Baru Capai 77%, Kapan Target Rampungnya?",https://news.detik.com/berita-jawa-tengah/d-5883131/vaksinasi-anak-di-kulon-progo-baru-capai-77-kapan-target-rampungnya
2022-01-04_de_20_4,2022-01-04,Detik,"Buntut Cekcok dengan Mertua, Pria di Pekanbaru Sayat Leher Pakai Cutter",https://news.detik.com/berita/d-5883128/buntut-cekcok-dengan-mertua-pria-di-pekanbaru-sayat-leher-pakai-cutter
2022-01-04_de_20_5,2022-01-04,Detik,Catat! Ini Aturan dan Daftar Daerah PPKM Level 1-2 di Jawa Barat,https://news.detik.com/berita-jawa-barat/d-5883124/catat-ini-aturan-dan-daftar-daerah-ppkm-level-1-2-di-jawa-barat
2022-01-04_de_20_6,2022-01-04,Detik,"PPKM di Jawa Timur Diperpanjang, Madura Raya Masih Level 3",https://news.detik.com/berita-jawa-timur/d-5883120/ppkm-di-jawa-timur-diperpanjang-madura-raya-masih-level-3
2022-01-04_de_20_7,2022-01-04,Detik,19 Warga di Makassar Tertipu Investasi Bodong Tambang Digital Rp 10 Miliar,https://news.detik.com/berita/d-5883119/19-warga-di-makassar-tertipu-investasi-bodong-tambang-digital-rp-10-miliar
2022-01-04_de_20_8,2022-01-04,Detik,Andre Rosiade Dukung Setop Ekspor Batu Bara: Demi Listrik dalam Negeri,https://news.detik.com/berita/d-5883117/andre-rosiade-dukung-setop-ekspor-batu-bara-demi-listrik-dalam-negeri
2022-01-04_de_20_9,2022-01-04,Detik,"Bus Transmusi Palembang Berhenti Beroperasi, 200 Pegawai Dirumahkan-Dipecat",https://news.detik.com/berita/d-5883115/bus-transmusi-palembang-berhenti-beroperasi-200-pegawai-dirumahkan-dipecat
2022-01-04_de_20_10,2022-01-04,Detik,"Harga Cabai Merah hingga Telur Meroket, DKI Prediksi Turun Bulan Depan",https://news.detik.com/berita/d-5883114/harga-cabai-merah-hingga-telur-meroket-dki-prediksi-turun-bulan-depan
2022-01-04_de_20_11,2022-01-04,Detik,"Awal Tahun, Ratusan Warga Jepang Penuhi Kuil Memohon Keberuntungan",https://news.detik.com/foto-news/d-5883107/awal-tahun-ratusan-warga-jepang-penuhi-kuil-memohon-keberuntungan
2022-01-04_de_20_12,2022-01-04,Detik,Ular Piton 5 Meter di RS Wahidin Makassar Lari ke Ruang Isolasi COVID,https://news.detik.com/berita/d-5883101/ular-piton-5-meter-di-rs-wahidin-makassar-lari-ke-ruang-isolasi-covid
2022-01-04_de_20_13,2022-01-04,Detik,"Polisi Ungkap Pelanggan Kasus Cassandra Angelie Bisa Dipidana, Ini Syaratnya",https://news.detik.com/berita/d-5883100/polisi-ungkap-pelanggan-kasus-cassandra-angelie-bisa-dipidana-ini-syaratnya
2022-01-04_de_20_14,2022-01-04,Detik,"PPKM di Jatim Diperpanjang, Daerah yang Terapkan Level 1 Makin Turun",https://news.detik.com/berita-jawa-timur/d-5883095/ppkm-di-jatim-diperpanjang-daerah-yang-terapkan-level-1-makin-turun
2022-01-04_de_20_15,2022-01-04,Detik,Viral! Pemuda Klaten Disebut Kelaparan Gegara Ditipu Calo Tenaga Kerja,https://news.detik.com/berita-jawa-tengah/d-5883090/viral-pemuda-klaten-disebut-kelaparan-gegara-ditipu-calo-tenaga-kerja
2022-01-04_de_20_16,2022-01-04,Detik,Pengurus BPET MUI Apresiasi Polri Tersangkakan dan Tahan Bahar Smith,https://news.detik.com/berita/d-5883106/pengurus-bpet-mui-apresiasi-polri-tersangkakan-dan-tahan-bahar-smith
2022-01-04_de_20_17,2022-01-04,Detik,"Helikopter Militer Israel Jatuh di Laut Mediterania, 2 Pilot Tewas",https://news.detik.com/internasional/d-5883077/helikopter-militer-israel-jatuh-di-laut-mediterania-2-pilot-tewas
2022-01-04_de_20_18,2022-01-04,Detik,"Gegara Corona, Kapal Pesiar Ini Akhiri Perjalanan di Portugal",https://news.detik.com/foto-news/d-5883068/gegara-corona-kapal-pesiar-ini-akhiri-perjalanan-di-portugal
2022-01-04_de_20_19,2022-01-04,Detik,Yuk Lawan Omicron dengan Vaksinasi! Ini Jadwalnya di Surabaya,https://news.detik.com/berita-jawa-timur/d-5883121/yuk-lawan-omicron-dengan-vaksinasi-ini-jadwalnya-di-surabaya
2022-01-04_de_21_0,2022-01-04,Detik,Mayat Pria Tanpa Identitas Ditemukan Membusuk di Sukaraja Bogor,https://news.detik.com/berita/d-5883060/mayat-pria-tanpa-identitas-ditemukan-membusuk-di-sukaraja-bogor
2022-01-04_de_21_1,2022-01-04,Detik,"Tito Terbitkan Inmendagri, Jakarta PPKM Level 2 Lagi",https://news.detik.com/detiktv/d-5883058/tito-terbitkan-inmendagri-jakarta-ppkm-level-2-lagi
2022-01-04_de_21_2,2022-01-04,Detik,"Banjir Aceh Utara Meluas, 32 Ribu Warga Mengungsi-2 Anak Meninggal",https://news.detik.com/berita/d-5883055/banjir-aceh-utara-meluas-32-ribu-warga-mengungsi-2-anak-meninggal
2022-01-04_de_21_3,2022-01-04,Detik,Eks Dirut ASABRI Sonny Widjaja dkk Jalani Sidang Vonis Hari Ini,https://news.detik.com/berita/d-5883054/eks-dirut-asabri-sonny-widjaja-dkk-jalani-sidang-vonis-hari-ini
2022-01-04_de_21_4,2022-01-04,Detik,"20 Warga Jabar Terinfeksi Omicron, Ridwan Kamil Minta Warga Waspada",https://news.detik.com/berita-jawa-barat/d-5883052/20-warga-jabar-terinfeksi-omicron-ridwan-kamil-minta-warga-waspada
2022-01-04_de_21_5,2022-01-04,Detik,Tahap Uji Klinis Vaksin Merah Putih Unair Pada Manusia Mulai Februari,https://news.detik.com/berita-jawa-timur/d-5883049/tahap-uji-klinis-vaksin-merah-putih-unair-pada-manusia-mulai-februari
2022-01-04_de_21_6,2022-01-04,Detik,"Brrrrrrr...! Embun Es Turun, Dieng Membeku Pagi Ini",https://news.detik.com/berita-jawa-tengah/d-5883048/brrrrrrr-embun-es-turun-dieng-membeku-pagi-ini
2022-01-04_de_21_7,2022-01-04,Detik,51 Eks Anggota DPRD Kuansing Balikin Lebih Bayar Insentif Rp 906 Juta,https://news.detik.com/berita/d-5883047/51-eks-anggota-dprd-kuansing-balikin-lebih-bayar-insentif-rp-906-juta
2022-01-04_de_21_8,2022-01-04,Detik,"Kabupaten Sukabumi Masuk PPKM Level 1, Warga Wajib Tetap Taat Prokes",https://news.detik.com/berita-jawa-barat/d-5883045/kabupaten-sukabumi-masuk-ppkm-level-1-warga-wajib-tetap-taat-prokes
2022-01-04_de_21_9,2022-01-04,Detik,Legislator PKS Khawatir Eijkman Mudah Diintervensi Politik Usai Integrasi,https://news.detik.com/berita/d-5883039/legislator-pks-khawatir-eijkman-mudah-diintervensi-politik-usai-integrasi
2022-01-04_de_21_10,2022-01-04,Detik,Data GISAID: Ada 164 Kasus Omicron di Indonesia,https://news.detik.com/berita/d-5883038/data-gisaid-ada-164-kasus-omicron-di-indonesia
2022-01-04_de_21_11,2022-01-04,Detik,Peristiwa 100 Tahun Lalu Ubah Sejarah Dunia: Insulin Obati Diabetes-Mumi Firaun,https://news.detik.com/bbc-world/d-5883035/peristiwa-100-tahun-lalu-ubah-sejarah-dunia-insulin-obati-diabetes-mumi-firaun
2022-01-04_de_21_12,2022-01-04,Detik,"Geger Dugaan Pemerkosaan Mahasiswa, UMY Siapkan Pendampingan Korban",https://news.detik.com/berita-jawa-tengah/d-5883034/geger-dugaan-pemerkosaan-mahasiswa-umy-siapkan-pendampingan-korban
2022-01-04_de_21_13,2022-01-04,Detik,Penampakan Gedung Parlemen Afrika Selatan yang Hangus Dilalap Api,https://news.detik.com/foto-news/d-5883026/penampakan-gedung-parlemen-afrika-selatan-yang-hangus-dilalap-api
2022-01-04_de_21_14,2022-01-04,Detik,Mencekam! PM Haiti Jadi Target Percobaan Pembunuhan Saat Kunjungi Gereja,https://news.detik.com/internasional/d-5883025/mencekam-pm-haiti-jadi-target-percobaan-pembunuhan-saat-kunjungi-gereja
2022-01-04_de_21_15,2022-01-04,Detik,"Daftar Lengkap PPKM di Jateng, Banyak Daerah dari Level 1 Naik ke 2",https://news.detik.com/berita-jawa-tengah/d-5883024/daftar-lengkap-ppkm-di-jateng-banyak-daerah-dari-level-1-naik-ke-2
2022-01-04_de_21_16,2022-01-04,Detik,Saat Komda KIPI Simpulkan Meninggalnya Naura Usai Vaksin karena Tukak Lambung,https://news.detik.com/berita-jawa-timur/d-5883022/saat-komda-kipi-simpulkan-meninggalnya-naura-usai-vaksin-karena-tukak-lambung
2022-01-04_de_21_17,2022-01-04,Detik,Mayat Pria di Kebun Karet Bandung Barat Diduga Korban Pembunuhan,https://news.detik.com/berita-jawa-barat/d-5883021/mayat-pria-di-kebun-karet-bandung-barat-diduga-korban-pembunuhan
2022-01-04_de_21_18,2022-01-04,Detik,Kini ASN dari Jakarta Gugat Presidential Threshold ke MK Agar Jadi 0 Persen,https://news.detik.com/berita/d-5883019/kini-asn-dari-jakarta-gugat-presidential-threshold-ke-mk-agar-jadi-0-persen
2022-01-04_de_21_19,2022-01-04,Detik,Ngeri! Ular Piton 5 Meter Gegerkan Warga di RS Wahidin Makassar,https://news.detik.com/berita/d-5883016/ngeri-ular-piton-5-meter-gegerkan-warga-di-rs-wahidin-makassar
2022-01-04_de_22_0,2022-01-04,Detik,BMKG: Waspada Hujan Disertai Petir di Bogor-Bekasi Hari Ini,https://news.detik.com/berita-jawa-barat/d-5883014/bmkg-waspada-hujan-disertai-petir-di-bogor-bekasi-hari-ini
2022-01-04_de_22_1,2022-01-04,Detik,"UMY Usut Dugaan Pemerkosaan Mahasiswa, Pelaku Dimintai Klarifikasi",https://news.detik.com/berita-jawa-tengah/d-5883012/umy-usut-dugaan-pemerkosaan-mahasiswa-pelaku-dimintai-klarifikasi
2022-01-04_de_22_2,2022-01-04,Detik,"Sidang Pemerkosaan 13 Santriwati, Herry Wirawan Diperiksa Hari Ini",https://news.detik.com/berita-jawa-barat/d-5883010/sidang-pemerkosaan-13-santriwati-herry-wirawan-diperiksa-hari-ini
2022-01-04_de_22_3,2022-01-04,Detik,Kondisi Presiden Bolsonaro saat Masuk Rumah Sakit Lagi,https://news.detik.com/detiktv/d-5883007/kondisi-presiden-bolsonaro-saat-masuk-rumah-sakit-lagi
2022-01-04_de_22_4,2022-01-04,Detik,KPK Jawab Tudingan Azis Syamsuddin soal Bukti Jaksa Ilegal,https://news.detik.com/berita/d-5883000/kpk-jawab-tudingan-azis-syamsuddin-soal-bukti-jaksa-ilegal
2022-01-04_de_22_5,2022-01-04,Detik,"Viral, Aktivis Mahasiswa UMY Diduga Lakukan Pemerkosaan",https://news.detik.com/berita-jawa-tengah/d-5882999/viral-aktivis-mahasiswa-umy-diduga-lakukan-pemerkosaan
2022-01-04_de_22_6,2022-01-04,Detik,KPK Akan Tentukan Sikap atas Kesaksian Aliza Gunado di Sidang Azis Syamsuddin,https://news.detik.com/berita/d-5882996/kpk-akan-tentukan-sikap-atas-kesaksian-aliza-gunado-di-sidang-azis-syamsuddin
2022-01-04_de_22_7,2022-01-04,Detik,"Tak Khawatir Omicron, Pemkot Makassar Gelar PTM Pekan Depan",https://news.detik.com/berita/d-5882995/tak-khawatir-omicron-pemkot-makassar-gelar-ptm-pekan-depan
2022-01-04_de_22_8,2022-01-04,Detik,PKB soal Sekdes Beri Anak Kado Ultah Alphard: Lebih Baik Kita Husnuzan,https://news.detik.com/berita/d-5882994/pkb-soal-sekdes-beri-anak-kado-ultah-alphard-lebih-baik-kita-husnuzan
2022-01-04_de_22_9,2022-01-04,Detik,"Pemkot Bekasi Anggarkan Rp 1,1 Miliar untuk Karangan Bunga dari APBD 2022",https://news.detik.com/berita/d-5882992/pemkot-bekasi-anggarkan-rp-11-miliar-untuk-karangan-bunga-dari-apbd-2022
2022-01-04_de_22_10,2022-01-04,Detik,"Saya Mahasiswa Tertipu Investasi Kripto Rp 18 Juta, Bagaimana Solusinya?",https://news.detik.com/berita/d-5882991/saya-mahasiswa-tertipu-investasi-kripto-rp-18-juta-bagaimana-solusinya
2022-01-04_de_22_11,2022-01-04,Detik,Polisi Ungkap Kronologi Habib Bahar Tersangka Penyebaran Berita Bohong,https://news.detik.com/berita-jawa-barat/d-5882990/polisi-ungkap-kronologi-habib-bahar-tersangka-penyebaran-berita-bohong
2022-01-04_de_22_12,2022-01-04,Detik,Mesum di Ruang Terbuka Bikin Jejaka Asal Sunter Jadi Tersangka,https://news.detik.com/berita/d-5882988/mesum-di-ruang-terbuka-bikin-jejaka-asal-sunter-jadi-tersangka
2022-01-04_de_22_13,2022-01-04,Detik,"Jakarta Kembali Berstatus PPKM Level 2, Gegara Omicron?",https://news.detik.com/berita/d-5882986/jakarta-kembali-berstatus-ppkm-level-2-gegara-omicron
2022-01-04_de_22_14,2022-01-04,Detik,"Waspada Lur, Sleman Utara Diprediksi Hujan Lebat",https://news.detik.com/berita-jawa-tengah/d-5882985/waspada-lur-sleman-utara-diprediksi-hujan-lebat
2022-01-04_de_22_15,2022-01-04,Detik,Kakorlantas Pastikan Puncak Arus Balik Nataru 2021 Berjalan Lancar,https://news.detik.com/detiktv/d-5882981/kakorlantas-pastikan-puncak-arus-balik-nataru-2021-berjalan-lancar
2022-01-04_de_22_16,2022-01-04,Detik,"PTM 100 Persen, DPRD DKI Sorot Prokes Ortu Saat Antar Anak",https://news.detik.com/berita/d-5882978/ptm-100-persen-dprd-dki-sorot-prokes-ortu-saat-antar-anak
2022-01-04_de_22_17,2022-01-04,Detik,Longsor di Kabupaten Batang Tutup Akses Jalan Dua Desa,https://news.detik.com/foto-news/d-5882973/longsor-di-kabupaten-batang-tutup-akses-jalan-dua-desa
2022-01-04_de_22_18,2022-01-04,Detik,Alasan-alasan Cassandra Angelie Tersangka Prostitusi Tak Ditahan,https://news.detik.com/berita/d-5882972/alasan-alasan-cassandra-angelie-tersangka-prostitusi-tak-ditahan
2022-01-04_de_22_19,2022-01-04,Detik,Habib Bahar Tersangka Kasus Berita Bohong dan Ditahan Polisi,https://news.detik.com/berita-jawa-barat/d-5882970/habib-bahar-tersangka-kasus-berita-bohong-dan-ditahan-polisi
2022-01-04_de_23_0,2022-01-04,Detik,Lamongan Lakukan Antisipasi Ini Sejak Omicron Masuk Jatim,https://news.detik.com/berita-jawa-timur/d-5882969/lamongan-lakukan-antisipasi-ini-sejak-omicron-masuk-jatim
2022-01-04_de_23_1,2022-01-04,Detik,Fenomena Pesohor Adopsi Boneka Arwah tapi Bukan untuk Horor,https://news.detik.com/berita/d-5882968/fenomena-pesohor-adopsi-boneka-arwah-tapi-bukan-untuk-horor
2022-01-04_de_23_2,2022-01-04,Detik,Pengacara Ajukan Penangguhan Penahanan Habib Bahar Smith,https://news.detik.com/berita/d-5882954/pengacara-ajukan-penangguhan-penahanan-habib-bahar-smith
2022-01-04_de_23_3,2022-01-04,Detik,Kata Muhammadiyah soal Fenomena Adopsi Boneka Arwah,https://news.detik.com/berita/d-5882951/kata-muhammadiyah-soal-fenomena-adopsi-boneka-arwah
2022-01-04_de_23_4,2022-01-04,Detik,Misteri 3 Sosok Diduga Pembuang Kepala Anjing ke Ponpes Bahar Smith,https://news.detik.com/berita/d-5882947/misteri-3-sosok-diduga-pembuang-kepala-anjing-ke-ponpes-bahar-smith
2022-01-04_de_23_5,2022-01-04,Detik,"Situs Sempat Diretas, Ditjen Imigrasi Jamin Data Aman",https://news.detik.com/berita/d-5882942/situs-sempat-diretas-ditjen-imigrasi-jamin-data-aman
2022-01-04_de_23_6,2022-01-04,Detik,Heboh Leburnya Lembaga Eijkman,https://news.detik.com/foto-news/d-5882936/heboh-leburnya-lembaga-eijkman
2022-01-04_de_23_7,2022-01-04,Detik,Alasan Bupati Bogor Tak Bubarkan Milad Front Persaudaraan Islam,https://news.detik.com/berita/d-5882935/alasan-bupati-bogor-tak-bubarkan-milad-front-persaudaraan-islam
2022-01-04_de_23_8,2022-01-04,Detik,Polda Sumut Ambil Alih Kasus Pria Ngaku Bela Diri-Tikam Begal di Medan,https://news.detik.com/berita/d-5882933/polda-sumut-ambil-alih-kasus-pria-ngaku-bela-diri-tikam-begal-di-medan
2022-01-04_de_23_9,2022-01-04,Detik,Terungkap Cara Trio TNI Buang Handi-Salsa di Sungai Banyumas,https://news.detik.com/detiktv/d-5882932/terungkap-cara-trio-tni-buang-handi-salsa-di-sungai-banyumas
2022-01-04_de_23_10,2022-01-04,Detik,Aturan Baru Lagi Waktu Karantina Pelaku Perjalanan Luar Negeri,https://news.detik.com/berita/d-5882929/aturan-baru-lagi-waktu-karantina-pelaku-perjalanan-luar-negeri
2022-01-04_de_23_11,2022-01-04,Detik,Wanti-wanti Menkes India saat Catat Corona Nyaris Naik 5 Kali Lipat,https://news.detik.com/internasional/d-5882928/wanti-wanti-menkes-india-saat-catat-corona-nyaris-naik-5-kali-lipat
2022-01-04_de_23_12,2022-01-04,Detik,"Bahar Smith Jadi Tersangka Kasus Berita Bohong, Pengacara: Innalillahi",https://news.detik.com/berita/d-5882923/bahar-smith-jadi-tersangka-kasus-berita-bohong-pengacara-innalillahi
2022-01-04_de_23_13,2022-01-04,Detik,"162 Kasus Omicron di DKI, Komisi IX DPR: Gejala Ringan, Tak Perlu Panik",https://news.detik.com/berita/d-5882918/162-kasus-omicron-di-dki-komisi-ix-dpr-gejala-ringan-tak-perlu-panik
2022-01-04_de_23_14,2022-01-04,Detik,Gerindra Usul Vaksin Booster Gratis atau Berbayar Tapi Harga Terjangkau,https://news.detik.com/berita/d-5882913/gerindra-usul-vaksin-booster-gratis-atau-berbayar-tapi-harga-terjangkau
2022-01-04_de_23_15,2022-01-04,Detik,Terjawab Polisi Tilang-Kuras Moge Sunmori yang Viral Lagi,https://news.detik.com/berita/d-5882911/terjawab-polisi-tilang-kuras-moge-sunmori-yang-viral-lagi
2022-01-04_de_23_16,2022-01-04,Detik,Detik-detik Sepasang WNA Panjat Pagar Kompleks Candi Prambanan,https://news.detik.com/detiktv/d-5882910/detik-detik-sepasang-wna-panjat-pagar-kompleks-candi-prambanan
2022-01-04_de_23_17,2022-01-04,Detik,Membedah Fenomena Adopsi Boneka Arwah dari Sisi Psikologi,https://news.detik.com/berita/d-5882906/membedah-fenomena-adopsi-boneka-arwah-dari-sisi-psikologi
2022-01-04_de_23_18,2022-01-04,Detik,"Ada 162 Kasus Omicron di DKI, PAN: Alkes dan Oksigen Sudah Siap?",https://news.detik.com/berita/d-5882905/ada-162-kasus-omicron-di-dki-pan-alkes-dan-oksigen-sudah-siap
2022-01-04_de_23_19,2022-01-04,Detik,Prakiraan Cuaca: Jabodetabek Cerah Berawan Hari Ini,https://news.detik.com/berita/d-5882898/prakiraan-cuaca-jabodetabek-cerah-berawan-hari-ini
2022-01-04_de_24_0,2022-01-04,Detik,Puan Minta Kebijakan PTM 100% Dievaluasi,https://news.detik.com/berita/d-5882896/puan-minta-kebijakan-ptm-100-dievaluasi
2022-01-04_de_24_1,2022-01-04,Detik,Video Pemobil Diduga Tenteng Pistol Usai Tabrak Motor di Tangsel,https://news.detik.com/detiktv/d-5882894/video-pemobil-diduga-tenteng-pistol-usai-tabrak-motor-di-tangsel
2022-01-04_de_24_2,2022-01-04,Detik,Mantan Menteri Kehakiman Tunisia Ditahan Atas Dugaan Terorisme,https://news.detik.com/internasional/d-5882893/mantan-menteri-kehakiman-tunisia-ditahan-atas-dugaan-terorisme
2022-01-04_de_24_3,2022-01-04,Detik,"Tinjau Banjir Aceh Utara, Pangdam IM Serahkan 1 Ton Beras ke Pengungsi",https://news.detik.com/berita/d-5882895/tinjau-banjir-aceh-utara-pangdam-im-serahkan-1-ton-beras-ke-pengungsi
2022-01-04_de_24_4,2022-01-04,Detik,Polda Jabar Ungkap Alasan Tahan Habib Bahar,https://news.detik.com/detiktv/d-5882892/polda-jabar-ungkap-alasan-tahan-habib-bahar
2022-01-04_de_24_5,2022-01-04,Detik,Belanda Akan Kembali Buka Sekolah Meski Kasus Omicron Meningkat,https://news.detik.com/internasional/d-5882891/belanda-akan-kembali-buka-sekolah-meski-kasus-omicron-meningkat
2022-01-04_de_24_6,2022-01-04,Detik,Dua Jenazah Korban Erupsi Semeru Kembali Ditemukan,https://news.detik.com/detiktv/d-5882890/dua-jenazah-korban-erupsi-semeru-kembali-ditemukan
2022-01-04_de_24_7,2022-01-04,Detik,Pengunggah Video Ceramah Berita Bohong Bahar Juga Jadi Tersangka!,https://news.detik.com/detiktv/d-5882889/pengunggah-video-ceramah-berita-bohong-bahar-juga-jadi-tersangka
2022-01-04_de_24_8,2022-01-04,Detik,"Kane Tanaka, Orang Tertua di Dunia Kini Berusia 119 Tahun",https://news.detik.com/internasional/d-5882885/kane-tanaka-orang-tertua-di-dunia-kini-berusia-119-tahun
2022-01-04_de_24_9,2022-01-04,Detik,"Kedapatan Miliki 9 Kg Sabu-2.800 Butir Ekstasi, IRT di Sumut Ditangkap Polisi",https://news.detik.com/berita/d-5882882/kedapatan-miliki-9-kg-sabu-2800-butir-ekstasi-irt-di-sumut-ditangkap-polisi
2022-01-04_de_24_10,2022-01-04,Detik,Habib Bahar Ditetapkan Jadi Tersangka!,https://news.detik.com/detiktv/d-5882879/habib-bahar-ditetapkan-jadi-tersangka
2022-01-04_de_24_11,2022-01-04,Detik,Si Jago Merah Lahap 4 Kios di Kendari,https://news.detik.com/detiktv/d-5882877/si-jago-merah-lahap-4-kios-di-kendari
2022-01-04_de_24_12,2022-01-04,Detik,Dinkes Tegaskan Jumlah Pasien Omicron di Jatim Baru Satu Orang,https://news.detik.com/berita-jawa-timur/d-5882875/dinkes-tegaskan-jumlah-pasien-omicron-di-jatim-baru-satu-orang
2022-01-04_de_24_13,2022-01-04,Detik,14 Kepala Puskesmas di Kepri Kembalikan Uang Korupsi Insentif Nakes COVID,https://news.detik.com/berita/d-5882876/14-kepala-puskesmas-di-kepri-kembalikan-uang-korupsi-insentif-nakes-covid
2022-01-04_de_24_14,2022-01-04,Detik,Tiga Korban Erupsi Semeru Berhasil Diidentifikasi,https://news.detik.com/berita-jawa-timur/d-5882871/tiga-korban-erupsi-semeru-berhasil-diidentifikasi
2022-01-04_de_24_15,2022-01-04,Detik,Pengunggah Video Ceramah Berita Bohong Bahar Smith Juga Jadi Tersangka,https://news.detik.com/berita/d-5882868/pengunggah-video-ceramah-berita-bohong-bahar-smith-juga-jadi-tersangka
2022-01-04_de_24_16,2022-01-04,Detik,Banyuwangi Kini Punya Dinas Pemadam Kebakaran Sendiri,https://news.detik.com/berita-jawa-timur/d-5882867/banyuwangi-kini-punya-dinas-pemadam-kebakaran-sendiri
2022-01-04_de_24_17,2022-01-04,Detik,Polda Jabar Ungkap Alasan Tahan Bahar Smith,https://news.detik.com/berita/d-5882866/polda-jabar-ungkap-alasan-tahan-bahar-smith
2022-01-04_de_24_18,2022-01-04,Detik,"Jadi Tersangka Penyebaran Berita Bohong, Bahar Smith Ditahan!",https://news.detik.com/berita/d-5882865/jadi-tersangka-penyebaran-berita-bohong-bahar-smith-ditahan
