unique_id,date,source,headline,url
2021-11-15_de_07_1,2021-11-15,Detik,"Ancam Pakai Sajam, Kakek di Serang Cabuli Bocah Tetangganya",https://news.detik.com/berita-jawa-barat/d-5812628/ancam-pakai-sajam-kakek-di-serang-cabuli-bocah-tetangganya
2021-11-15_de_07_2,2021-11-15,Detik,7 Anak Diduga Keracunan Usai Santap Makanan Pesta Ultah di Penjaringan,https://news.detik.com/berita/d-5812627/7-anak-diduga-keracunan-usai-santap-makanan-pesta-ultah-di-penjaringan
2021-11-15_de_07_3,2021-11-15,Detik,Klarifikasi Bupati Banyumas soal Minta 'Dipanggil KPK Dulu' Sebelum OTT,https://news.detik.com/berita-jawa-tengah/d-5812625/klarifikasi-bupati-banyumas-soal-minta-dipanggil-kpk-dulu-sebelum-ott
2021-11-15_de_07_4,2021-11-15,Detik,"Viral Napi Pesta Sabu di Lapas, Kemenkumham Sumsel Akui Petugas Lalai",https://news.detik.com/berita/d-5812624/viral-napi-pesta-sabu-di-lapas-kemenkumham-sumsel-akui-petugas-lalai
2021-11-15_de_07_5,2021-11-15,Detik,Tahanan Polres Batanghari Kabur Usai Rusak Sel-Lompati Tembok Lapas,https://news.detik.com/berita/d-5812602/tahanan-polres-batanghari-kabur-usai-rusak-sel-lompati-tembok-lapas
2021-11-15_de_07_6,2021-11-15,Detik,"Ini TKP Anggota Ormas Dikeroyok di Jakbar, Berjarak 10 Meter dari Posko FBR",https://news.detik.com/berita/d-5812599/ini-tkp-anggota-ormas-dikeroyok-di-jakbar-berjarak-10-meter-dari-posko-fbr
2021-11-15_de_07_7,2021-11-15,Detik,"UMP Jatim Tahun 2022 Diusulkan ke Gubernur, Angkanya Naik Rp 22 Ribu",https://news.detik.com/berita-jawa-timur/d-5812598/ump-jatim-tahun-2022-diusulkan-ke-gubernur-angkanya-naik-rp-22-ribu
2021-11-15_de_07_8,2021-11-15,Detik,Pemerintah Ingin Kuatkan Restorative Justice di RUU Kejaksaan,https://news.detik.com/berita/d-5812597/pemerintah-ingin-kuatkan-restorative-justice-di-ruu-kejaksaan
2021-11-15_de_07_9,2021-11-15,Detik,Longsor Tutup Jalan Kabupaten di Perbukitan Menoreh Kulon Progo,https://news.detik.com/berita-jawa-tengah/d-5812596/longsor-tutup-jalan-kabupaten-di-perbukitan-menoreh-kulon-progo
2021-11-15_de_7_10,2021-11-15,Detik,PDIP Desak Investigasi Menyeluruh soal Kebakaran Tangki Pertamina Cilacap,https://news.detik.com/detiktv/d-5812595/pdip-desak-investigasi-menyeluruh-soal-kebakaran-tangki-pertamina-cilacap
2021-11-15_de_7_11,2021-11-15,Detik,Heboh Aksi Pengacara di Banyuwangi Hambur-hamburkan Uang Rp 40 Juta,https://news.detik.com/detiktv/d-5812591/heboh-aksi-pengacara-di-banyuwangi-hambur-hamburkan-uang-rp-40-juta
2021-11-15_de_7_12,2021-11-15,Detik,Sahabat Airlangga Dukung Airlangga Hartarto Maju Pilpres 2024,https://news.detik.com/berita-jawa-barat/d-5812590/sahabat-airlangga-dukung-airlangga-hartarto-maju-pilpres-2024
2021-11-15_de_7_13,2021-11-15,Detik,Operasi Zebra Semeru 2021 Polresta Banyuwangi Sasar Kaum Milineal,https://news.detik.com/berita-jawa-timur/d-5812732/operasi-zebra-semeru-2021-polresta-banyuwangi-sasar-kaum-milineal
2021-11-15_de_7_14,2021-11-15,Detik,"6 Rampok di PIK Jakut Gasak Rp 400 Juta, Beraksi dengan Modus Gembos Ban",https://news.detik.com/detiktv/d-5812586/6-rampok-di-pik-jakut-gasak-rp-400-juta-beraksi-dengan-modus-gembos-ban
2021-11-15_de_7_15,2021-11-15,Detik,5 Pesan KSAL Buat Prajurit Baret Ungu di HUT ke-76 Korps Marinir,https://news.detik.com/detiktv/d-5812582/5-pesan-ksal-buat-prajurit-baret-ungu-di-hut-ke-76-korps-marinir
2021-11-15_de_7_16,2021-11-15,Detik,"Akhirnya! Setelah 20 Bulan, India Dibuka untuk Turis Asing",https://news.detik.com/internasional/d-5812581/akhirnya-setelah-20-bulan-india-dibuka-untuk-turis-asing
2021-11-15_de_7_17,2021-11-15,Detik,"Jadwal SKB CPNS 2021, Cek di Sini!",https://news.detik.com/berita/d-5812580/jadwal-skb-cpns-2021-cek-di-sini
2021-11-15_de_7_18,2021-11-15,Detik,Istilah 'Belah Semangka' di Korupsi Hibah Ponpes Banten,https://news.detik.com/berita-jawa-barat/d-5812563/istilah-belah-semangka-di-korupsi-hibah-ponpes-banten
2021-11-15_de_7_19,2021-11-15,Detik,"Kali Dadap Tangerang Masih Diselimuti Sampah, Begini Kondisinya Sekarang",https://news.detik.com/berita/d-5812557/kali-dadap-tangerang-masih-diselimuti-sampah-begini-kondisinya-sekarang
2021-11-15_de_08_0,2021-11-15,Detik,"Gerhana Bulan Sebagian 19 November, Ini 5 Hal yang Menarik Diketahui",https://news.detik.com/berita/d-5812555/gerhana-bulan-sebagian-19-november-ini-5-hal-yang-menarik-diketahui
2021-11-15_de_08_1,2021-11-15,Detik,"PD Kritik Pemko Medan Tak Alokasi Anggaran Pendidikan 20%, Ingatkan UU",https://news.detik.com/berita/d-5812553/pd-kritik-pemko-medan-tak-alokasi-anggaran-pendidikan-20-ingatkan-uu
2021-11-15_de_08_2,2021-11-15,Detik,MA Sunat Hukuman Habib Rizieq Jadi 2 Tahun Bui di Kasus Swab RS Ummi,https://news.detik.com/berita/d-5812552/ma-sunat-hukuman-habib-rizieq-jadi-2-tahun-bui-di-kasus-swab-rs-ummi
2021-11-15_de_08_3,2021-11-15,Detik,Pemuda di Tulungagung Perkosa Emak-emak Usai Pesta Miras,https://news.detik.com/berita-jawa-timur/d-5812551/pemuda-di-tulungagung-perkosa-emak-emak-usai-pesta-miras
2021-11-15_de_08_4,2021-11-15,Detik,Bali Akan Batasi Kunjungan Wisatawan Asing Saat Libur Natal-Tahun Baru,https://news.detik.com/berita/d-5812541/bali-akan-batasi-kunjungan-wisatawan-asing-saat-libur-natal-tahun-baru
2021-11-15_de_08_5,2021-11-15,Detik,"Sebaran 221 Kasus Positif Corona 15 November, DKI Jakarta Terbanyak",https://news.detik.com/berita/d-5812533/sebaran-221-kasus-positif-corona-15-november-dki-jakarta-terbanyak
2021-11-15_de_08_6,2021-11-15,Detik,Pikap Dicuci di Sungai di Polman Sulbar Terseret Banjir,https://news.detik.com/berita/d-5812534/pikap-dicuci-di-sungai-di-polman-sulbar-terseret-banjir
2021-11-15_de_08_7,2021-11-15,Detik,"RAPBD 2022 Rp 84,8 Triliun Naik 6,25%, Anies Optimistis Ekonomi DKI Tumbuh",https://news.detik.com/berita/d-5812532/rapbd-2022-rp-848-triliun-naik-625-anies-optimistis-ekonomi-dki-tumbuh
2021-11-15_de_08_8,2021-11-15,Detik,Mendes PDTT Minta Pengembangan Smart Village Tak Gerus Kearifan Lokal,https://news.detik.com/berita/d-5812529/mendespdtt-minta-pengembangan-smart-village-tak-gerus-kearifan-lokal
2021-11-15_de_08_9,2021-11-15,Detik,Momen Nurdin Abdullah Dituntut 6 Tahun Penjara,https://news.detik.com/foto-news/d-5812525/momen-nurdin-abdullah-dituntut-6-tahun-penjara
2021-11-15_de_8_10,2021-11-15,Detik,"Polda Jatim Luncurkan Mobil INCAR dan Aplikasi SKRIP, Apa Itu?",https://news.detik.com/berita-jawa-timur/d-5812511/polda-jatim-luncurkan-mobil-incar-dan-aplikasi-skrip-apa-itu
2021-11-15_de_8_11,2021-11-15,Detik,"Kasus Corona RI 15 November Tambah 221, Pasien Meninggal 11",https://news.detik.com/berita/d-5812507/kasus-corona-ri-15-november-tambah-221-pasien-meninggal-11
2021-11-15_de_8_12,2021-11-15,Detik,"4 Tersangka di Kasus Anak Nia Daniaty Diperiksa Polisi, Ini Perannya",https://news.detik.com/berita/d-5812506/4-tersangka-di-kasus-anak-nia-daniaty-diperiksa-polisi-ini-perannya
2021-11-15_de_8_13,2021-11-15,Detik,Pria Bersenjata Pisau Serang Nenek 80 Tahun di Stasiun Kereta Jepang,https://news.detik.com/internasional/d-5812504/pria-bersenjata-pisau-serang-nenek-80-tahun-di-stasiun-kereta-jepang
2021-11-15_de_8_14,2021-11-15,Detik,Hari Anak Sedunia 20 November: Ini Sejarah dan Serba-serbinya,https://news.detik.com/berita/d-5812505/hari-anak-sedunia-20-november-ini-sejarah-dan-serba-serbinya
2021-11-15_de_8_15,2021-11-15,Detik,"Dankor Brimob Bakal Jadi Jenderal Bintang 3, Personel-Markas Ditambah",https://news.detik.com/berita/d-5812502/dankor-brimob-bakal-jadi-jenderal-bintang-3-personel-markas-ditambah
2021-11-15_de_8_16,2021-11-15,Detik,"Australia Klaim Gugusan Pulau Pasir, YPTB Desak Tunjukkan Bukti",https://news.detik.com/berita/d-5812501/australia-klaim-gugusan-pulau-pasir-yptb-desak-tunjukkan-bukti
2021-11-15_de_8_17,2021-11-15,Detik,"Cara Mengurus KK Penambahan Anggota Keluarga Baru Online, Ikuti Langkah Ini",https://news.detik.com/berita/d-5812496/cara-mengurus-kk-penambahan-anggota-keluarga-baru-online-ikuti-langkah-ini
2021-11-15_de_8_18,2021-11-15,Detik,"Gugat TV Lokal Surabaya soal Hak Cipta, Pencipta Lagu Ini Digugat Balik Rp 1 T",https://news.detik.com/berita-jawa-timur/d-5812478/gugat-tv-lokal-surabaya-soal-hak-cipta-pencipta-lagu-ini-digugat-balik-rp-1-t
2021-11-15_de_8_19,2021-11-15,Detik,"Terekam CCTV, Detik-detik Truk Boks Terjun ke Jurang di Purwakarta!",https://news.detik.com/detiktv/d-5812495/terekam-cctv-detik-detik-truk-boks-terjun-ke-jurang-di-purwakarta
2021-11-15_de_09_0,2021-11-15,Detik,"Demi Judi Slot, 2 Pria di Palembang Gadaikan Cincin Pacar-Gasak ATM Tante",https://news.detik.com/berita/d-5812494/demi-judi-slot-2-pria-di-palembang-gadaikan-cincin-pacar-gasak-atm-tante
2021-11-15_de_09_1,2021-11-15,Detik,Ingat! Ini 4 Kawasan Tanpa Rokok Baru di Kota Bandung,https://news.detik.com/berita-jawa-barat/d-5812493/ingat-ini-4-kawasan-tanpa-rokok-baru-di-kota-bandung
2021-11-15_de_09_2,2021-11-15,Detik,Korban Banjir Rob di Pekalongan Dievakuasi,https://news.detik.com/foto-news/d-5812485/korban-banjir-rob-di-pekalongan-dievakuasi
2021-11-15_de_09_3,2021-11-15,Detik,Polisi Tolak Laporan Aktivis ke Luhut-Erick Thohir soal Isu Bisnis PCR,https://news.detik.com/berita/d-5812483/polisi-tolak-laporan-aktivis-ke-luhut-erick-thohir-soal-isu-bisnis-pcr
2021-11-15_de_09_4,2021-11-15,Detik,LDII Kota Tangsel Dirikan SMP-SMA Berasrama Citra Insan Mulia,https://news.detik.com/berita/d-5812480/ldii-kota-tangsel-dirikan-smp-sma-berasrama-citra-insan-mulia
2021-11-15_de_09_5,2021-11-15,Detik,Belasan Siswa PTM SD-SMP Surabaya Positif COVID-19 Sempat Diisolasi di Asrama haji,https://news.detik.com/berita-jawa-timur/d-5812477/belasan-siswa-ptm-sd-smp-surabaya-positif-covid-19-sempat-diisolasi-di-asrama-haji
2021-11-15_de_09_6,2021-11-15,Detik,Adian Napitupulu Bicara Sabotase Kebakaran Tangki Pertamina Jelang Pemilu,https://news.detik.com/berita/d-5812476/adian-napitupulu-bicara-sabotase-kebakaran-tangki-pertamina-jelang-pemilu
2021-11-15_de_09_7,2021-11-15,Detik,Komisi III DPR Bentuk Panja RUU Kejaksaan,https://news.detik.com/berita/d-5812473/komisi-iii-dpr-bentuk-panja-ruu-kejaksaan
2021-11-15_de_09_8,2021-11-15,Detik,Aliza Gunado Bungkam Usai Diperiksa KPK di Kasus Azis Syamsuddin,https://news.detik.com/berita/d-5812467/aliza-gunado-bungkam-usai-diperiksa-kpk-di-kasus-azis-syamsuddin
2021-11-15_de_09_9,2021-11-15,Detik,"Operasi Zebra Lodaya di Jabar, Polisi Kedepankan Preventif",https://news.detik.com/berita-jawa-barat/d-5812465/operasi-zebra-lodaya-di-jabar-polisi-kedepankan-preventif
2021-11-15_de_9_10,2021-11-15,Detik,"Balapan IATC Mandalika Diundur, Bamsoet: Saya yang Tanggung Jawab!",https://news.detik.com/berita/d-5812462/balapan-iatc-mandalika-diundur-bamsoet-saya-yang-tanggung-jawab
2021-11-15_de_9_11,2021-11-15,Detik,Airlangga Klaim Kasus Covid RI Lebih Baik Dibanding Singapura dkk,https://news.detik.com/detiktv/d-5812459/airlangga-klaim-kasus-covid-ri-lebih-baik-dibanding-singapura-dkk
2021-11-15_de_9_12,2021-11-15,Detik,Cegah Money Laundering pada Jasa Layanan Pinjol,https://news.detik.com/kolom/d-5812458/cegah-money-laundering-pada-jasa-layanan-pinjol
2021-11-15_de_9_13,2021-11-15,Detik,Greenpeace Apresiasi Aduan soal Deforestasi Dicabut: Pelapor Sadar,https://news.detik.com/berita/d-5812455/greenpeace-apresiasi-aduan-soal-deforestasi-dicabut-pelapor-sadar
2021-11-15_de_9_14,2021-11-15,Detik,"Terdampak Longsor, Belasan Warga Bandung Barat Terpaksa Mengungsi",https://news.detik.com/berita-jawa-barat/d-5812454/terdampak-longsor-belasan-warga-bandung-barat-terpaksa-mengungsi
2021-11-15_de_9_15,2021-11-15,Detik,Nani 'Takjil Sianida' Dituntut 18 Tahun Penjara,https://news.detik.com/detiktv/d-5812451/nani-takjil-sianida-dituntut-18-tahun-penjara
2021-11-15_de_9_16,2021-11-15,Detik,Kejaksaan CPNS 2021: Pengumuman Peserta-Jadwal Pelaksanaan SKB,https://news.detik.com/berita/d-5812449/kejaksaan-cpns-2021-pengumuman-peserta-jadwal-pelaksanaan-skb
2021-11-15_de_9_17,2021-11-15,Detik,"Pasca-Pohon Tumbang Tewaskan 3 Orang, Petirtaan Jolotundo Ditutup Sementara",https://news.detik.com/berita-jawa-timur/d-5812448/pasca-pohon-tumbang-tewaskan-3-orang-petirtaan-jolotundo-ditutup-sementara
2021-11-15_de_9_18,2021-11-15,Detik,Airlangga Sebut Tak Ada Provinsi yang Berlakukan PPKM Level 4,https://news.detik.com/detiktv/d-5812447/airlangga-sebut-tak-ada-provinsi-yang-berlakukan-ppkm-level-4
2021-11-15_de_9_19,2021-11-15,Detik,Cak Imin Minta Kader PKB Pusat-Daerah Bantu Korban Banjir Sintang,https://news.detik.com/berita/d-5812446/cak-imin-minta-kader-pkb-pusat-daerah-bantu-korban-banjir-sintang
2021-11-15_de_10_0,2021-11-15,Detik,Respons Greenpeace Indonesia Usai Sempat Dilaporkan ke Polda Metro Jaya,https://news.detik.com/detiktv/d-5812437/respons-greenpeace-indonesia-usai-sempat-dilaporkan-ke-polda-metro-jaya
2021-11-15_de_10_1,2021-11-15,Detik,Polisi Ungkap Identitas 4 Tersangka Kasus CPNS Bodong Olivia Nathania,https://news.detik.com/detiktv/d-5812436/polisi-ungkap-identitas-4-tersangka-kasus-cpns-bodong-olivia-nathania
2021-11-15_de_10_2,2021-11-15,Detik,PDIP Minta Pertamina Investigasi Kebakaran Kilang Minyak,https://news.detik.com/foto-news/d-5812431/pdip-minta-pertamina-investigasi-kebakaran-kilang-minyak
2021-11-15_de_10_3,2021-11-15,Detik,"Taliban Gempur Persembunyian ISIS, 4 Orang Tewas-10 Ditangkap",https://news.detik.com/internasional/d-5812430/taliban-gempur-persembunyian-isis-4-orang-tewas-10-ditangkap
2021-11-15_de_10_4,2021-11-15,Detik,Kapan Ada Gerhana Bulan? Catat Jadwal Terdekatnya di Indonesia,https://news.detik.com/berita/d-5812438/kapan-ada-gerhana-bulan-catat-jadwal-terdekatnya-di-indonesia
2021-11-15_de_10_5,2021-11-15,Detik,"Ungkap Proges Rekrutmen Novel dkk Jadi ASN, Polri Klaim Tak Ada Kendala",https://news.detik.com/berita/d-5812427/ungkap-proges-rekrutmen-novel-dkk-jadi-asn-polri-klaim-tak-ada-kendala
2021-11-15_de_10_6,2021-11-15,Detik,"Heboh Video Napi Pesta Sabu di Sumsel, Kalapas Banyuasin Benarkan Kejadian",https://news.detik.com/detiktv/d-5812425/heboh-video-napi-pesta-sabu-di-sumsel-kalapas-banyuasin-benarkan-kejadian
2021-11-15_de_10_7,2021-11-15,Detik,Pergub yang Diteken Jokowi Jadi Dasar Anies Lanjutkan Program Sumur Resapan,https://news.detik.com/berita/d-5812421/pergub-yang-diteken-jokowi-jadi-dasar-anies-lanjutkan-program-sumur-resapan
2021-11-15_de_10_8,2021-11-15,Detik,Momen Kericuhan Demo Pencari Suaka Afghanistan di Kantor UNHCR,https://news.detik.com/detiktv/d-5812418/momen-kericuhan-demo-pencari-suaka-afghanistan-di-kantor-unhcr
2021-11-15_de_10_9,2021-11-15,Detik,"Pelapor Greenpeace Cabut Aduan, Khawatir Jokowi Cap Anti Kritik",https://news.detik.com/detiktv/d-5812417/pelapor-greenpeace-cabut-aduan-khawatir-jokowi-cap-anti-kritik
2021-11-15_de_10_10,2021-11-15,Detik,"Hari Terakhir Perpanjangan PPKM, Kasus Aktif COVID-19 di Jatim 264 Pasien",https://news.detik.com/berita-jawa-timur/d-5812404/hari-terakhir-perpanjangan-ppkm-kasus-aktif-covid-19-di-jatim-264-pasien
2021-11-15_de_10_11,2021-11-15,Detik,"Kuasai Lahan Pemkot Semarang, Massa Pemuda Pancasila Dibubarkan Polisi",https://news.detik.com/detiktv/d-5812411/kuasai-lahan-pemkot-semarang-massa-pemuda-pancasila-dibubarkan-polisi
2021-11-15_de_10_12,2021-11-15,Detik,Alasan Pelapor Cabut Laporan ke Greenpeace: Saya Dianggap Antikritik,https://news.detik.com/berita/d-5812410/alasan-pelapor-cabut-laporan-ke-greenpeace-saya-dianggap-antikritik
2021-11-15_de_10_13,2021-11-15,Detik,Lihat! Ada Spanduk Dukungan Anies Capres 2024 di JPO Ciputat,https://news.detik.com/foto-news/d-5812406/lihat-ada-spanduk-dukungan-anies-capres-2024-di-jpo-ciputat
2021-11-15_de_10_14,2021-11-15,Detik,Polri Ungkap Isi Rekaman CCTV di TKP Kebakaran Kilang Pertamina Cilacap,https://news.detik.com/berita/d-5812405/polri-ungkap-isi-rekaman-cctv-di-tkp-kebakaran-kilang-pertamina-cilacap
2021-11-15_de_10_15,2021-11-15,Detik,Besar Sanksi daripada Edukasi Uji Emisi,https://news.detik.com/investigasi/d-5812402/besar-sanksi-daripada-edukasi-uji-emisi
2021-11-15_de_10_16,2021-11-15,Detik,"Anak 9 Tahun Meninggal, Korban Jiwa Konser Travis Scott Jadi 10 Orang",https://news.detik.com/internasional/d-5812401/anak-9-tahun-meninggal-korban-jiwa-konser-travis-scott-jadi-10-orang
2021-11-15_de_10_17,2021-11-15,Detik,Kisah Dapiel Bayage Cleaning Service Pemecah Rekor Lompat Tinggi Peparnas,https://news.detik.com/berita/d-5812400/kisah-dapiel-bayage-cleaning-service-pemecah-rekor-lompat-tinggi-peparnas
2021-11-15_de_10_18,2021-11-15,Detik,Menengok Kampung Adat Kuta Ciamis yang Rumah Warganya Masih Panggung,https://news.detik.com/berita-jawa-barat/d-5812399/menengok-kampung-adat-kuta-ciamis-yang-rumah-warganya-masih-panggung
2021-11-15_de_10_19,2021-11-15,Detik,Yenti Garnasih soal Pasal 5 Permendikbud PPKS: Apa Kita Ingin Seperti Barat?,https://news.detik.com/berita/d-5812396/yenti-garnasih-soal-pasal-5-permendikbud-ppks-apa-kita-ingin-seperti-barat
2021-11-15_de_11_0,2021-11-15,Detik,detikcom Do Your Magic: Bekas Galian di Jl MT Haryono Sudah Rapi,https://news.detik.com/berita/d-5812395/detikcom-do-your-magic-bekas-galian-di-jl-mt-haryono-sudah-rapi
2021-11-15_de_11_1,2021-11-15,Detik,SKB CPNS Kota Bogor 2021 Kapan? Ini Serba-serbi Informasinya,https://news.detik.com/berita/d-5812394/skb-cpns-kota-bogor-2021-kapan-ini-serba-serbi-informasinya
2021-11-15_de_11_2,2021-11-15,Detik,Warga Probolinggo Laporkan Dugaan Pemotongan Dana Program Keluarga Harapan,https://news.detik.com/berita-jawa-timur/d-5812393/warga-probolinggo-laporkan-dugaan-pemotongan-dana-program-keluarga-harapan
2021-11-15_de_11_3,2021-11-15,Detik,Polisi Tolak Penangguhan Penahanan 2 Tersangka Diksar Maut Menwa UNS Solo,https://news.detik.com/berita-jawa-tengah/d-5812391/polisi-tolak-penangguhan-penahanan-2-tersangka-diksar-maut-menwa-uns-solo
2021-11-15_de_11_4,2021-11-15,Detik,"Warga Gotong Keranda Terjang Sungai, Pemkab Pidie Upayakan Bangun Jembatan",https://news.detik.com/berita/d-5812390/warga-gotong-keranda-terjang-sungai-pemkab-pidie-upayakan-bangun-jembatan
2021-11-15_de_11_5,2021-11-15,Detik,Materi Pokok SKB CPNS 2021 Apa Saja? Ini Link Downloadnya!,https://news.detik.com/berita/d-5812389/materi-pokok-skb-cpns-2021-apa-saja-ini-link-downloadnya
2021-11-15_de_11_6,2021-11-15,Detik,Bali Tetapkan Dana Cadangan Rp 250 M untuk Pileg-Pilgub 2024,https://news.detik.com/berita/d-5812386/bali-tetapkan-dana-cadangan-rp-250-m-untuk-pileg-pilgub-2024
2021-11-15_de_11_7,2021-11-15,Detik,Pemerintah Yakin Kekebalan Warga RI Bisa Lawan Anak-Cucu Varian Delta,https://news.detik.com/berita/d-5812379/pemerintah-yakin-kekebalan-warga-ri-bisa-lawan-anak-cucu-varian-delta
2021-11-15_de_11_8,2021-11-15,Detik,174 Daerah di Luar Jawa Bali Kini Berstatus PPKM Level 1,https://news.detik.com/berita/d-5812376/174-daerah-di-luar-jawa-bali-kini-berstatus-ppkm-level-1
2021-11-15_de_11_9,2021-11-15,Detik,PPP Buka Lagi Sekolah Politik hingga Tingkat DPC-DPW,https://news.detik.com/berita/d-5812375/ppp-buka-lagi-sekolah-politik-hingga-tingkat-dpc-dpw
2021-11-15_de_11_10,2021-11-15,Detik,"Polisi Ungkap Peran 6 Perampok Rp 400 Juta di PIK, Kenali Modusnya",https://news.detik.com/berita/d-5812374/polisi-ungkap-peran-6-perampok-rp-400-juta-di-pik-kenali-modusnya
2021-11-15_de_11_11,2021-11-15,Detik,Eks Sekdis PUTR Sulsel Dituntut 4 Tahun Penjara Terkait Suap Nurdin Abdullah,https://news.detik.com/berita/d-5812373/eks-sekdis-putr-sulsel-dituntut-4-tahun-penjara-terkait-suap-nurdin-abdullah
2021-11-15_de_11_12,2021-11-15,Detik,Potret Banjir Rob di Pekalongan,https://news.detik.com/foto-news/d-5812366/potret-banjir-rob-di-pekalongan
2021-11-15_de_11_13,2021-11-15,Detik,Polisi Fokus Pengamanan Prokes Saat Amankan Libur Nataru di Surabaya,https://news.detik.com/berita-jawa-timur/d-5812439/polisi-fokus-pengamanan-prokes-saat-amankan-libur-nataru-di-surabaya
2021-11-15_de_11_14,2021-11-15,Detik,"Anies Teken MoU Rancangan APBD 2022 Rp 84,88 Triliun",https://news.detik.com/berita/d-5812363/anies-teken-mou-rancangan-apbd-2022-rp-8488-triliun
2021-11-15_de_11_15,2021-11-15,Detik,Jokowi Wanti-wanti Jangan Sampai Vaksin Corona Kedaluwarsa!,https://news.detik.com/berita/d-5812362/jokowi-wanti-wanti-jangan-sampai-vaksin-corona-kedaluwarsa
2021-11-15_de_11_16,2021-11-15,Detik,"Kampung Adat Kuta Ciamis, Pertahankan Tradisi hingga Rumah Anti Gempa",https://news.detik.com/berita-jawa-barat/d-5812361/kampung-adat-kuta-ciamis-pertahankan-tradisi-hingga-rumah-anti-gempa
2021-11-15_de_11_17,2021-11-15,Detik,"Kasus Corona Naik karena PTM-Takziah, 2 Menteri Jokowi Turun Tangan",https://news.detik.com/berita/d-5812359/kasus-corona-naik-karena-ptm-takziah-2-menteri-jokowi-turun-tangan
2021-11-15_de_11_18,2021-11-15,Detik,Eks Kowad Ini Minta Anggota TNI Berkeahlian Khusus Pensiun di Usia 60 Tahun,https://news.detik.com/berita/d-5812358/eks-kowad-ini-minta-anggota-tni-berkeahlian-khusus-pensiun-di-usia-60-tahun
2021-11-15_de_11_19,2021-11-15,Detik,Vaksinasi Corona RI Diperkirakan Capai 300 Juta Suntikan di Akhir Tahun,https://news.detik.com/berita/d-5812357/vaksinasi-corona-ri-diperkirakan-capai-300-juta-suntikan-di-akhir-tahun
2021-11-15_de_12_0,2021-11-15,Detik,Airlangga Bandingkan COVID RI dan Singapura dkk: Relatif Lebih Baik,https://news.detik.com/berita/d-5812353/airlangga-bandingkan-covid-ri-dan-singapura-dkk-relatif-lebih-baik
2021-11-15_de_12_1,2021-11-15,Detik,Kondisi Terkini 3 Korban Luka Berat Pohon Tumbang Timpa Warung Kopi di Mojokerto,https://news.detik.com/berita-jawa-timur/d-5812349/kondisi-terkini-3-korban-luka-berat-pohon-tumbang-timpa-warung-kopi-di-mojokerto
2021-11-15_de_12_2,2021-11-15,Detik,Mabes Polri Luruskan Isu Habib Rizieq Ditahan di Bawah Tanah,https://news.detik.com/berita/d-5812347/mabes-polri-luruskan-isu-habib-rizieq-ditahan-di-bawah-tanah
2021-11-15_de_12_3,2021-11-15,Detik,Komplotan Perampok 'Main' di Lampung Sebelum Gasak Rp 400 Juta di PIK,https://news.detik.com/berita/d-5812346/komplotan-perampok-main-di-lampung-sebelum-gasak-rp-400-juta-di-pik
2021-11-15_de_12_4,2021-11-15,Detik,JPU Nilai Kebun-Masjid di Lahan Nurdin Dibeli Pakai Gratifikasi: Harus Disita,https://news.detik.com/berita/d-5812343/jpu-nilai-kebun-masjid-di-lahan-nurdin-dibeli-pakai-gratifikasi-harus-disita
2021-11-15_de_12_5,2021-11-15,Detik,PKB Buka Peluang Gaet Ganjar: Menarik Jadi Cawapres Cak Imin,https://news.detik.com/berita/d-5812342/pkb-buka-peluang-gaet-ganjar-menarik-jadi-cawapres-cak-imin
2021-11-15_de_12_6,2021-11-15,Detik,"Jadi Pemicu Elite Golkar-PDIP Bertengkar Soal Pencapresan, Ini Kata Ganjar",https://news.detik.com/berita-jawa-tengah/d-5812341/jadi-pemicu-elite-golkar-pdip-bertengkar-soal-pencapresan-ini-kata-ganjar
2021-11-15_de_12_7,2021-11-15,Detik,Biadab! Kakek di Cianjur Perkosa Gadis 15 Tahun hingga Melahirkan,https://news.detik.com/berita-jawa-barat/d-5812340/biadab-kakek-di-cianjur-perkosa-gadis-15-tahun-hingga-melahirkan
2021-11-15_de_12_8,2021-11-15,Detik,Pertamina Salurkan Bantuan ke Warga di Wilayah Kilang Cilacap,https://news.detik.com/berita/d-5812338/pertamina-salurkan-bantuan-ke-warga-di-wilayah-kilang-cilacap
2021-11-15_de_12_9,2021-11-15,Detik,China Terus Berjuang Perangi Varian Delta yang Mengamuk,https://news.detik.com/internasional/d-5812337/china-terus-berjuang-perangi-varian-delta-yang-mengamuk
2021-11-15_de_12_10,2021-11-15,Detik,"Pergerakan Tanah, Ratusan Warga Sukawangi Bogor Mengungsi",https://news.detik.com/berita-jawa-barat/d-5812336/pergerakan-tanah-ratusan-warga-sukawangi-bogor-mengungsi
2021-11-15_de_12_11,2021-11-15,Detik,PAN: Zulhas dan Ganjar Sohib Sekental Kopi Hitam,https://news.detik.com/berita/d-5812325/pan-zulhas-dan-ganjar-sohib-sekental-kopi-hitam
2021-11-15_de_12_12,2021-11-15,Detik,detikcom Do Your Magic: Before-After Pengerukan Got di Petamburan III yang Sebabkan Banjir,https://news.detik.com/berita/d-5812324/detikcom-do-your-magic-before-after-pengerukan-got-di-petamburan-iii-yang-sebabkan-banjir
2021-11-15_de_12_13,2021-11-15,Detik,Biadab! Pria di Kota Tegal Ini Tega Perkosa ABG Tetangga Sendiri,https://news.detik.com/berita-jawa-tengah/d-5812322/biadab-pria-di-kota-tegal-ini-tega-perkosa-abg-tetangga-sendiri
2021-11-15_de_12_14,2021-11-15,Detik,Fatia Maulidiyanti Jelaskan Alasan Tak Datangi Mediasi dengan Luhut,https://news.detik.com/berita/d-5812318/fatia-maulidiyanti-jelaskan-alasan-tak-datangi-mediasi-dengan-luhut
2021-11-15_de_12_15,2021-11-15,Detik,Dosen hingga Dokter Bisa Naik Kereta Api Jarak Jauh Gratis,https://news.detik.com/berita-jawa-timur/d-5812304/dosen-hingga-dokter-bisa-naik-kereta-api-jarak-jauh-gratis
2021-11-15_de_12_16,2021-11-15,Detik,"Demo Ricuh, Pengungsi Afghanistan Menangis hingga Anak-anak Terjepit",https://news.detik.com/foto-news/d-5812306/demo-ricuh-pengungsi-afghanistan-menangis-hingga-anak-anak-terjepit
2021-11-15_de_12_17,2021-11-15,Detik,"Tuntut Kenaikan UMK, Buruh di Majalengka Gelar Aksi Demo",https://news.detik.com/berita-jawa-barat/d-5812303/tuntut-kenaikan-umk-buruh-di-majalengka-gelar-aksi-demo
2021-11-15_de_12_18,2021-11-15,Detik,Mendorong Ekonomi Hijau Melalui Investasi ESG dan Pajak Karbon,https://news.detik.com/kolom/d-5812296/mendorong-ekonomi-hijau-melalui-investasi-esg-dan-pajak-karbon
2021-11-15_de_12_19,2021-11-15,Detik,Pria di Surabaya Terciduk Congkel Kotak Amal Pakai Linggis,https://news.detik.com/berita-jawa-timur/d-5812287/pria-di-surabaya-terciduk-congkel-kotak-amal-pakai-linggis
2021-11-15_de_13_0,2021-11-15,Detik,Perampok Rp 400 Juta Modus Gembos Ban di Pantai Indah Kapuk Ditangkap!,https://news.detik.com/berita/d-5812295/perampok-rp-400-juta-modus-gembos-ban-di-pantai-indah-kapuk-ditangkap
2021-11-15_de_13_1,2021-11-15,Detik,Menlu AS-Prancis Bahas Aktivitas Militer Rusia di Perbatasan Ukraina,https://news.detik.com/dw/d-5812294/menlu-as-prancis-bahas-aktivitas-militer-rusia-di-perbatasan-ukraina
2021-11-15_de_13_2,2021-11-15,Detik,"Jelang Derby Mataram Nanti Malam, Polisi Sekat Perbatasan Solo",https://news.detik.com/berita-jawa-tengah/d-5812292/jelang-derby-mataram-nanti-malam-polisi-sekat-perbatasan-solo
2021-11-15_de_13_3,2021-11-15,Detik,"Australia Kekurangan Ratusan Ribu Pekerja, Berikut Daftar Pekerjaan Paling Dicari",https://news.detik.com/abc-australia/d-5812291/australia-kekurangan-ratusan-ribu-pekerja-berikut-daftar-pekerjaan-paling-dicari
