unique_id,date,source,headline,url
2022-01-04_de_13_4,2022-01-04,Detik,"Banjir Lhoksukon Bikin Puluhan Ribu Warga Ngungsi, Ini Fakta-faktanya",https://news.detik.com/berita/d-5883603/banjir-lhoksukon-bikin-puluhan-ribu-warga-ngungsi-ini-fakta-faktanya
2022-01-04_de_13_5,2022-01-04,Detik,Priyanto Perintahkan Kopda Ahmad Ganti Cat Mobil Usai Buang Handi-Salsa,https://news.detik.com/berita-jawa-barat/d-5883602/priyanto-perintahkan-kopda-ahmad-ganti-cat-mobil-usai-buang-handi-salsa
2022-01-04_de_13_6,2022-01-04,Detik,PPKM Jawa Bali Diperpanjang Sampai Kapan? Simak Informasi Lengkapnya,https://news.detik.com/berita/d-5883600/ppkm-jawa-bali-diperpanjang-sampai-kapan-simak-informasi-lengkapnya
2022-01-04_de_13_7,2022-01-04,Detik,"Evaluasi Masa Nataru, Jasa Marga: Kendaraan Keluar Jabodetabek Naik 9,9%",https://news.detik.com/detiktv/d-5883599/evaluasi-masa-nataru-jasa-marga-kendaraan-keluar-jabodetabek-naik-99
2022-01-04_de_13_8,2022-01-04,Detik,SMP di Lamongan PTM 100% Sedangkan SD Masih 50%,https://news.detik.com/berita-jawa-timur/d-5883598/smp-di-lamongan-ptm-100-sedangkan-sd-masih-50
2022-01-04_de_13_9,2022-01-04,Detik,"Pria di Cinere Depok Diduga Curi Kotak Amal, Wajahnya Terekam CCTV",https://news.detik.com/berita/d-5883596/pria-di-cinere-depok-diduga-curi-kotak-amal-wajahnya-terekam-cctv
2022-01-04_de_13_10,2022-01-04,Detik,"Ada Riza dan Sahroni, Ini Kandidat Gubernur Jakarta Pengganti Anies",https://news.detik.com/berita/d-5883595/ada-riza-dan-sahroni-ini-kandidat-gubernur-jakarta-pengganti-anies
2022-01-04_de_13_11,2022-01-04,Detik,"Alhamdulillah, Kabupaten Magelang Kini PPKM Level 1",https://news.detik.com/berita-jawa-tengah/d-5883587/alhamdulillah-kabupaten-magelang-kini-ppkm-level-1
2022-01-04_de_13_12,2022-01-04,Detik,"Traffic Light Pertigaan Jl Ahmad Yani Pemalang Sempat Bikin Bingung, Kenapa?",https://news.detik.com/berita-jawa-tengah/d-5883586/traffic-light-pertigaan-jl-ahmad-yani-pemalang-sempat-bikin-bingung-kenapa
2022-01-04_de_13_13,2022-01-04,Detik,Isu Riza-Airin Bakal Jadi Penerus Anies yang Akhirnya Dibantah Ketua Gerindra,https://news.detik.com/berita/d-5883585/isu-riza-airin-bakal-jadi-penerus-anies-yang-akhirnya-dibantah-ketua-gerindra
2022-01-04_de_13_14,2022-01-04,Detik,"Dilaporkan Sering Kejar Warga, Seekor Monyet Ditangkap di Tangsel",https://news.detik.com/berita/d-5883584/dilaporkan-sering-kejar-warga-seekor-monyet-ditangkap-di-tangsel
2022-01-04_de_13_15,2022-01-04,Detik,"Janjian Kencan di Kuburan, Pria Asal Tangsel Malah Diancam Pakai Sajam",https://news.detik.com/berita/d-5883583/janjian-kencan-di-kuburan-pria-asal-tangsel-malah-diancam-pakai-sajam
2022-01-04_de_13_16,2022-01-04,Detik,Bejat! Pria di Pekanbaru Perkosa Anak Tiri Berulang Kali,https://news.detik.com/berita/d-5883582/bejat-pria-di-pekanbaru-perkosa-anak-tiri-berulang-kali
2022-01-04_de_13_17,2022-01-04,Detik,Ahmad Panjang Akan Dimakamkan Dekat Ali Kalora,https://news.detik.com/berita/d-5883580/ahmad-panjang-akan-dimakamkan-dekat-ali-kalora
2022-01-04_de_13_18,2022-01-04,Detik,"Banjir Rendam Puluhan Rumah di Lumajang Surut, Warga Mulai Beraktivitas",https://news.detik.com/berita-jawa-timur/d-5883568/banjir-rendam-puluhan-rumah-di-lumajang-surut-warga-mulai-beraktivitas
2022-01-04_de_13_19,2022-01-04,Detik,Polisi Kembali Tangkap 4 Pelaku Pemerkosaan-Penjualan ABG di Bandung,https://news.detik.com/berita-jawa-barat/d-5883567/polisi-kembali-tangkap-4-pelaku-pemerkosaan-penjualan-abg-di-bandung
2022-01-04_de_14_0,2022-01-04,Detik,Gibran Mulai Proyek Rel Layang Joglo Solo Akhir Pekan Ini,https://news.detik.com/berita-jawa-tengah/d-5883565/gibran-mulai-proyek-rel-layang-joglo-solo-akhir-pekan-ini
2022-01-04_de_14_1,2022-01-04,Detik,Kilas Balik Anies Makan di Warteg saat Kampanye hingga Berujung Jadi Meme,https://news.detik.com/berita/d-5883561/kilas-balik-anies-makan-di-warteg-saat-kampanye-hingga-berujung-jadi-meme
2022-01-04_de_14_2,2022-01-04,Detik,Keluarga Ikhlaskan Meninggalnya Siswa MI Magetan Sehari Usai Vaksinasi,https://news.detik.com/berita-jawa-timur/d-5883558/keluarga-ikhlaskan-meninggalnya-siswa-mi-magetan-sehari-usai-vaksinasi
2022-01-04_de_14_3,2022-01-04,Detik,"Jakarta PPKM Level 2, PTM 100 Persen Tetap Digelar di DKI",https://news.detik.com/foto-news/d-5883545/jakarta-ppkm-level-2-ptm-100-persen-tetap-digelar-di-dki
2022-01-04_de_14_4,2022-01-04,Detik,Curhat Ibu di Sumut Uang Bantuan Sekolah Anaknya Dipotong Rp 675 Ribu,https://news.detik.com/berita/d-5883543/curhat-ibu-di-sumut-uang-bantuan-sekolah-anaknya-dipotong-rp-675-ribu
2022-01-04_de_14_5,2022-01-04,Detik,PDIP Tak Masalah PTM 100% Lanjut Meski Jakarta Balik PPKM Level 2,https://news.detik.com/berita/d-5883533/pdip-tak-masalah-ptm-100-lanjut-meski-jakarta-balik-ppkm-level-2
2022-01-04_de_14_6,2022-01-04,Detik,"Dirawat di RS, Presiden Brasil Alami Penyumbatan Usus-Mungkin Dioperasi",https://news.detik.com/internasional/d-5883531/dirawat-di-rs-presiden-brasil-alami-penyumbatan-usus-mungkin-dioperasi
2022-01-04_de_14_7,2022-01-04,Detik,5 Fakta Dugaan Pemerkosaan Mahasiswa UMY yang Terungkap Sejauh Ini,https://news.detik.com/berita-jawa-tengah/d-5883530/5-fakta-dugaan-pemerkosaan-mahasiswa-umy-yang-terungkap-sejauh-ini
2022-01-04_de_14_8,2022-01-04,Detik,Polres Tasik Ubah Knalpot Brong Jadi Patung Robot Transformers,https://news.detik.com/berita-jawa-barat/d-5883528/polres-tasik-ubah-knalpot-brong-jadi-patung-robot-transformers
2022-01-04_de_14_9,2022-01-04,Detik,Narji PKS Minta Maaf Sempat Dukung Dudung Copot Baliho HRS,https://news.detik.com/berita/d-5883527/narji-pks-minta-maaf-sempat-dukung-dudung-copot-baliho-hrs
2022-01-04_de_14_10,2022-01-04,Detik,Hasil Visum Briptu Fikri: Ada Luka Lecet dan Memar Akibat Benda Tumpul,https://news.detik.com/berita/d-5883526/hasil-visum-briptu-fikri-ada-luka-lecet-dan-memar-akibat-benda-tumpul
2022-01-04_de_14_11,2022-01-04,Detik,"8 Mobil Dinas Pimpinan DPRD Klaten Ditarik, Ada Apa?",https://news.detik.com/berita-jawa-tengah/d-5883525/8-mobil-dinas-pimpinan-dprd-klaten-ditarik-ada-apa
2022-01-04_de_14_12,2022-01-04,Detik,"Ahli: Pemilu untuk Pilih Wakil Rakyat, Bukan untuk Presidential Threshold",https://news.detik.com/berita/d-5883522/ahli-pemilu-untuk-pilih-wakil-rakyat-bukan-untuk-presidential-threshold
2022-01-04_de_14_13,2022-01-04,Detik,"Habib Bahar Tersangka, Pengacara Singgung Teror Kepala Anjing di Ponpes",https://news.detik.com/detiktv/d-5883519/habib-bahar-tersangka-pengacara-singgung-teror-kepala-anjing-di-ponpes
2022-01-04_de_14_14,2022-01-04,Detik,Pemprov Jelaskan Beda Data Kasus Omicron DKI dan Pusat,https://news.detik.com/berita/d-5883518/pemprov-jelaskan-beda-data-kasus-omicron-dki-dan-pusat
2022-01-04_de_14_15,2022-01-04,Detik,Malangnya Siswa Pelosok NTT: Masker Medis Cuci Kering hingga Tas Kresek,https://news.detik.com/berita/d-5883515/malangnya-siswa-pelosok-ntt-masker-medis-cuci-kering-hingga-tas-kresek
2022-01-04_de_14_16,2022-01-04,Detik,20.500 Lebih Pengunjung Berlibur di KBS Saat Tahun Baru 2022,https://news.detik.com/berita-jawa-timur/d-5883504/20500-lebih-pengunjung-berlibur-di-kbs-saat-tahun-baru-2022
2022-01-04_de_14_17,2022-01-04,Detik,"Usul Polri di Bawah Kementerian, Dasco: Bisa Bikin Gaduh",https://news.detik.com/detiktv/d-5883512/usul-polri-di-bawah-kementerian-dasco-bisa-bikin-gaduh
2022-01-04_de_14_18,2022-01-04,Detik,Pengacara Harap Kasus Pria Ngaku Bela Diri-Tikam Begal Jadi Tersangka Disetop,https://news.detik.com/berita/d-5883511/pengacara-harap-kasus-pria-ngaku-bela-diri-tikam-begal-jadi-tersangka-disetop
2022-01-04_de_14_19,2022-01-04,Detik,NasDem Jagokan OC Formula E Ahmad Sahroni Gubernur Pengganti Anies,https://news.detik.com/berita/d-5883510/nasdem-jagokan-oc-formula-e-ahmad-sahroni-gubernur-pengganti-anies
2022-01-04_de_15_0,2022-01-04,Detik,"Karawang Nol Kasus Positif COVID-19, Bupati Cellica: Tetap Siaga",https://news.detik.com/berita-jawa-barat/d-5883506/karawang-nol-kasus-positif-covid-19-bupati-cellica-tetap-siaga
2022-01-04_de_15_1,2022-01-04,Detik,"Imbas Napi Narkoba Kabur, Salat di Musala Lapas Sumsel Dibatasi",https://news.detik.com/berita/d-5883503/imbas-napi-narkoba-kabur-salat-di-musala-lapas-sumsel-dibatasi
2022-01-04_de_15_2,2022-01-04,Detik,"DPO MIT Poso Ditembak, Jenazah Masih Dievakuasi",https://news.detik.com/berita/d-5883501/dpo-mit-poso-ditembak-jenazah-masih-dievakuasi
2022-01-04_de_15_3,2022-01-04,Detik,Kata Orang Tua Siswa MI Magetan yang Meninggal Sehari Usai Vaksinasi,https://news.detik.com/berita-jawa-timur/d-5883500/kata-orang-tua-siswa-mi-magetan-yang-meninggal-sehari-usai-vaksinasi
2022-01-04_de_15_4,2022-01-04,Detik,"Kota Semarang Kembali Naik ke PPKM Level 2, Ternyata Ini Dia Sebabnya",https://news.detik.com/berita-jawa-tengah/d-5883499/kota-semarang-kembali-naik-ke-ppkm-level-2-ternyata-ini-dia-sebabnya
2022-01-04_de_15_5,2022-01-04,Detik,"Dugaan Pemerkosaan Mahasiswa, UMY: Terduga Pelaku Anggota BEM",https://news.detik.com/berita-jawa-tengah/d-5883498/dugaan-pemerkosaan-mahasiswa-umy-terduga-pelaku-anggota-bem
2022-01-04_de_15_6,2022-01-04,Detik,"PD Setuju Batu Bara Diutamakan Bagi Kepentingan Dalam Negeri, tapi...",https://news.detik.com/berita/d-5883478/pd-setuju-batu-bara-diutamakan-bagi-kepentingan-dalam-negeri-tapi
2022-01-04_de_15_7,2022-01-04,Detik,"Polisi Usut Dugaan Rumah Terbakar Usai Dilempar Benda Misterius, Ini Hasilnya",https://news.detik.com/berita/d-5883476/polisi-usut-dugaan-rumah-terbakar-usai-dilempar-benda-misterius-ini-hasilnya
2022-01-04_de_15_8,2022-01-04,Detik,"Tak Biasanya Embun Dieng Membeku Awal Tahun, Ini Penjelasan BMKG",https://news.detik.com/berita-jawa-tengah/d-5883473/tak-biasanya-embun-dieng-membeku-awal-tahun-ini-penjelasan-bmkg
2022-01-04_de_15_9,2022-01-04,Detik,"Belajar dari Fenomena ""No Viral No Justice""",https://news.detik.com/kolom/d-5883436/belajar-dari-fenomena-no-viral-no-justice
2022-01-04_de_15_10,2022-01-04,Detik,"Soal Penangguhan Penahanan Habib Bahar, Ini Respons Polda Jabar",https://news.detik.com/berita-jawa-barat/d-5883472/soal-penangguhan-penahanan-habib-bahar-ini-respons-polda-jabar
2022-01-04_de_15_11,2022-01-04,Detik,"Ciamis PPKM Level 1, Pasar-Swalayan Buka 100 Persen",https://news.detik.com/berita-jawa-barat/d-5883470/ciamis-ppkm-level-1-pasar-swalayan-buka-100-persen
2022-01-04_de_15_12,2022-01-04,Detik,detikcom do Your Magic: Pot di Sumur Resapan Pondok Labu Sudah Disingkirkan,https://news.detik.com/berita/d-5883457/detikcom-do-your-magic-pot-di-sumur-resapan-pondok-labu-sudah-disingkirkan
2022-01-04_de_15_13,2022-01-04,Detik,"Pemda DIY Menyoal Istilah Klithih, Sosiolog: Yang Penting Diagnosis Problem!",https://news.detik.com/berita-jawa-tengah/d-5883456/pemda-diy-menyoal-istilah-klithih-sosiolog-yang-penting-diagnosis-problem
2022-01-04_de_15_14,2022-01-04,Detik,Potret Gedung Putih Saat Diselimuti Salju Tebal,https://news.detik.com/foto-news/d-5883355/potret-gedung-putih-saat-diselimuti-salju-tebal
2022-01-04_de_15_15,2022-01-04,Detik,Tampang Suami yang Gorok Mati Istri di Garut,https://news.detik.com/berita-jawa-barat/d-5883453/tampang-suami-yang-gorok-mati-istri-di-garut
2022-01-04_de_15_16,2022-01-04,Detik,"Sebulan 'Hilang' Tanpa Izin, 2 Polisi di Gorontalo Dipecat!",https://news.detik.com/berita/d-5883452/sebulan-hilang-tanpa-izin-2-polisi-di-gorontalo-dipecat
2022-01-04_de_15_17,2022-01-04,Detik,Pemkot Jakpus Buka Suara soal Jalan Rusak Gegara Proyek Sumur Resapan,https://news.detik.com/berita/d-5883451/pemkot-jakpus-buka-suara-soal-jalan-rusak-gegara-proyek-sumur-resapan
2022-01-04_de_15_18,2022-01-04,Detik,"Kondisi Semeru Tenang, Masyarakat Tetep Diimbau Waspada Guguran Awan Panas",https://news.detik.com/berita-jawa-timur/d-5883445/kondisi-semeru-tenang-masyarakat-tetep-diimbau-waspada-guguran-awan-panas
2022-01-04_de_15_19,2022-01-04,Detik,Momen Tim Damkar Buru Ular Piton Masuk Ruang Covid RS di Makassar,https://news.detik.com/detiktv/d-5883444/momen-tim-damkar-buru-ular-piton-masuk-ruang-covid-rs-di-makassar
2022-01-04_de_16_0,2022-01-04,Detik,"Jalan Licin Imbas Tumpahan Oli, Pemotor di Bekasi Tewas Terlindas Truk",https://news.detik.com/berita/d-5883438/jalan-licin-imbas-tumpahan-oli-pemotor-di-bekasi-tewas-terlindas-truk
2022-01-04_de_16_1,2022-01-04,Detik,"Aturan PTM 2022 Sesuai SKB 4 Menteri, Ini Syaratnya",https://news.detik.com/berita/d-5883435/aturan-ptm-2022-sesuai-skb-4-menteri-ini-syaratnya
2022-01-04_de_16_2,2022-01-04,Detik,Surat Menyentuh Keluarga Wanita Peserta Meditation Camp Hilang di Tangsel,https://news.detik.com/berita/d-5883434/surat-menyentuh-keluarga-wanita-peserta-meditation-camp-hilang-di-tangsel
2022-01-04_de_16_3,2022-01-04,Detik,Runutan Pemeriksaan Habib Bahar hingga Tersangka Penyebaran Berita Bohong,https://news.detik.com/berita-jawa-barat/d-5883432/runutan-pemeriksaan-habib-bahar-hingga-tersangka-penyebaran-berita-bohong
2022-01-04_de_16_4,2022-01-04,Detik,"Diduga Korsleting Listrik, 3 Rumah Kontrakan di Tangsel Ludes Terbakar",https://news.detik.com/berita/d-5883430/diduga-korsleting-listrik-3-rumah-kontrakan-di-tangsel-ludes-terbakar
2022-01-04_de_16_5,2022-01-04,Detik,"Pandemi dan PPKM Diperpanjang, Bupati-DPRD Klaten Kompak Bilang Begini",https://news.detik.com/berita-jawa-tengah/d-5883421/pandemi-dan-ppkm-diperpanjang-bupati-dprd-klaten-kompak-bilang-begini
2022-01-04_de_16_6,2022-01-04,Detik,Pengadilan Kanada Putuskan Keluarga Korban Pesawat Ditembak Iran Terima Rp 1 T,https://news.detik.com/bbc-world/d-5883420/pengadilan-kanada-putuskan-keluarga-korban-pesawat-ditembak-iran-terima-rp-1-t
2022-01-04_de_16_7,2022-01-04,Detik,"Singgung Indeks Kebahagiaan Warga DKI Turun, Giring Sindir Anies?",https://news.detik.com/detiktv/d-5883419/singgung-indeks-kebahagiaan-warga-dki-turun-giring-sindir-anies
2022-01-04_de_16_8,2022-01-04,Detik,"Viral Dugaan Pemerkosaan Mahasiswa UMY, Korban Lain Angkat Bicara",https://news.detik.com/berita-jawa-tengah/d-5883415/viral-dugaan-pemerkosaan-mahasiswa-umy-korban-lain-angkat-bicara
2022-01-04_de_16_9,2022-01-04,Detik,"Fenomena Aphelion Viral Disebut Bikin Cuaca Dingin, BMKG Luruskan Info",https://news.detik.com/berita/d-5883414/fenomena-aphelion-viral-disebut-bikin-cuaca-dingin-bmkg-luruskan-info
2022-01-04_de_16_10,2022-01-04,Detik,Unik! Domba-Kambing Ikut Kampanye Vaksinasi COVID-19 di Jerman,https://news.detik.com/foto-news/d-5883325/unik-domba-kambing-ikut-kampanye-vaksinasi-covid-19-di-jerman
2022-01-04_de_16_11,2022-01-04,Detik,Bocah Korban Pemerkosaan di Kabupaten Serang Cari Keadilan ke Polisi,https://news.detik.com/berita-jawa-barat/d-5883400/bocah-korban-pemerkosaan-di-kabupaten-serang-cari-keadilan-ke-polisi
2022-01-04_de_16_12,2022-01-04,Detik,"Jakarta PPKM Level 2 Lagi, Berikut Aturannya!",https://news.detik.com/detiktv/d-5883399/jakarta-ppkm-level-2-lagi-berikut-aturannya
2022-01-04_de_16_13,2022-01-04,Detik,Tiga Warga Jember Dilarikan ke RS Setelah Kena Sembur Bisa Kobra,https://news.detik.com/berita-jawa-timur/d-5883390/tiga-warga-jember-dilarikan-ke-rs-setelah-kena-sembur-bisa-kobra
2022-01-04_de_16_14,2022-01-04,Detik,Anies Kembali ke Warteg Zaman Kampanye yang Pernah Jadi Meme Legendaris,https://news.detik.com/berita/d-5883397/anies-kembali-ke-warteg-zaman-kampanye-yang-pernah-jadi-meme-legendaris
2022-01-04_de_16_15,2022-01-04,Detik,Koalisi Militer AS Gagalkan Serangan 2 Drone Bersenjata di Bandara Irak,https://news.detik.com/internasional/d-5883391/koalisi-militer-as-gagalkan-serangan-2-drone-bersenjata-di-bandara-irak
2022-01-04_de_16_16,2022-01-04,Detik,"Riza-Airin Disebut Calon Pengganti Anies, Dasco: Bukan Sikap Resmi Gerindra",https://news.detik.com/berita/d-5883389/riza-airin-disebut-calon-pengganti-anies-dasco-bukan-sikap-resmi-gerindra
2022-01-04_de_16_17,2022-01-04,Detik,Jumlah Kasus Aktif COVID-19 di Jatim Tersisa 99 Pasien,https://news.detik.com/berita-jawa-timur/d-5883388/jumlah-kasus-aktif-covid-19-di-jatim-tersisa-99-pasien
2022-01-04_de_16_18,2022-01-04,Detik,"Mobil Pengangkut BBM Terperosok, Jalur Medan-Berastagi Tersendat",https://news.detik.com/berita/d-5883387/mobil-pengangkut-bbm-terperosok-jalur-medan-berastagi-tersendat
2022-01-04_de_16_19,2022-01-04,Detik,Dinkes: 6 dari 162 Kasus Omicron di Jakarta Transmisi Lokal,https://news.detik.com/berita/d-5883386/dinkes-6-dari-162-kasus-omicron-di-jakarta-transmisi-lokal
2022-01-04_de_17_0,2022-01-04,Detik,"Padang Lawas Diterjang Bandang, Tumpukan Gelondongan Kayu Berserakan!",https://news.detik.com/detiktv/d-5883384/padang-lawas-diterjang-bandang-tumpukan-gelondongan-kayu-berserakan
2022-01-04_de_17_1,2022-01-04,Detik,Eks Waka MK: Apa Artinya Pemilu Kalau Semua Parpol Diberi Hak yang Sama?,https://news.detik.com/berita/d-5883383/eks-waka-mk-apa-artinya-pemilu-kalau-semua-parpol-diberi-hak-yang-sama
2022-01-04_de_17_2,2022-01-04,Detik,Jakarta PPKM Level Berapa Hari Ini? Simak Informasinya di Sini,https://news.detik.com/berita/d-5883385/jakarta-ppkm-level-berapa-hari-ini-simak-informasinya-di-sini
2022-01-04_de_17_3,2022-01-04,Detik,"Ada ASN Gugat Presidential Threshold ke MK, MenPAN-RB: Harus Izin Pimpinan",https://news.detik.com/berita/d-5883378/ada-asn-gugat-presidential-threshold-ke-mk-menpan-rb-harus-izin-pimpinan
2022-01-04_de_17_4,2022-01-04,Detik,NU dan Politik Substansialistik,https://news.detik.com/kolom/d-5883374/nu-dan-politik-substansialistik
2022-01-04_de_17_5,2022-01-04,Detik,"Usai Xi'an, China Lockdown 1 Kota Lagi Gegara Corona",https://news.detik.com/foto-news/d-5883302/usai-xian-china-lockdown-1-kota-lagi-gegara-corona
2022-01-04_de_17_6,2022-01-04,Detik,Polisi Periksa 3 Saksi Kasus Teror Kepala Anjing ke Ponpes Bahar Smith,https://news.detik.com/berita/d-5883364/polisi-periksa-3-saksi-kasus-teror-kepala-anjing-ke-ponpes-bahar-smith
2022-01-04_de_17_7,2022-01-04,Detik,Partai Amien Rais Gugat Presidential Threshold!,https://news.detik.com/detiktv/d-5883362/partai-amien-rais-gugat-presidential-threshold
2022-01-04_de_17_8,2022-01-04,Detik,detikcom Do Your Magic: Akhirnya! Traffic Light Simpang JICT Sudah Dipasang!,https://news.detik.com/berita/d-5883361/detikcom-do-your-magic-akhirnya-traffic-light-simpang-jict-sudah-dipasang
2022-01-04_de_17_9,2022-01-04,Detik,Karcis Pembongkar Sandiwara Kolonel,https://news.detik.com/investigasi/d-5883354/karcis-pembongkar-sandiwara-kolonel
2022-01-04_de_17_10,2022-01-04,Detik,Cak Imin Dukung Ekspor Batu Bara Disetop: Jangan Cuma Sebulan!,https://news.detik.com/berita/d-5883342/cak-imin-dukung-ekspor-batu-bara-disetop-jangan-cuma-sebulan
2022-01-04_de_17_11,2022-01-04,Detik,"Habib Bahar Tersangka Penyebaran Berita Bohong, Polda Jabar: Sudah di Sel",https://news.detik.com/berita-jawa-barat/d-5883338/habib-bahar-tersangka-penyebaran-berita-bohong-polda-jabar-sudah-di-sel
2022-01-04_de_17_12,2022-01-04,Detik,Warga di Depok Protes Ada Tetangga Bikin Tembok di Jalan-Halangi Saluran Air,https://news.detik.com/berita/d-5883329/warga-di-depok-protes-ada-tetangga-bikin-tembok-di-jalan-halangi-saluran-air
2022-01-04_de_17_13,2022-01-04,Detik,Viral Jalan Rusak Gegara Bekas Proyek Sumur Resapan di Senen Jakpus,https://news.detik.com/berita/d-5883324/viral-jalan-rusak-gegara-bekas-proyek-sumur-resapan-di-senen-jakpus
2022-01-04_de_17_14,2022-01-04,Detik,Mahasiswa Jakarta Ditemukan Tewas Gantung Diri di Warkop di Aceh,https://news.detik.com/berita/d-5883322/mahasiswa-jakarta-ditemukan-tewas-gantung-diri-di-warkop-di-aceh
2022-01-04_de_17_15,2022-01-04,Detik,"Omicron Masuk Jatim, Petugas Gabungan Pelototi Tempat Wisata Lamongan",https://news.detik.com/berita-jawa-timur/d-5883367/omicron-masuk-jatim-petugas-gabungan-pelototi-tempat-wisata-lamongan
2022-01-04_de_17_16,2022-01-04,Detik,Bejat! Pria di Palopo Perkosa Anak Tiri Saat Istri ke Luar Rumah,https://news.detik.com/berita/d-5883321/bejat-pria-di-palopo-perkosa-anak-tiri-saat-istri-ke-luar-rumah
2022-01-04_de_17_17,2022-01-04,Detik,Melihat Lagi Jejak Keji Kolonel Priyanto cs di Nagreg-Jembatan 'Maut',https://news.detik.com/berita-jawa-barat/d-5883318/melihat-lagi-jejak-keji-kolonel-priyanto-cs-di-nagreg-jembatan-maut
2022-01-04_de_17_18,2022-01-04,Detik,"Petugas Kebersihan di Medan Kehilangan Motor Saat Nyapu Jalan, Polisi Selidiki",https://news.detik.com/berita/d-5883314/petugas-kebersihan-di-medan-kehilangan-motor-saat-nyapu-jalan-polisi-selidiki
2022-01-04_de_17_19,2022-01-04,Detik,Pemberontak Houthi Sita Kapal Militer Berbendera UEA di Laut Merah,https://news.detik.com/internasional/d-5883311/pemberontak-houthi-sita-kapal-militer-berbendera-uea-di-laut-merah
2022-01-04_de_18_0,2022-01-04,Detik,"3 Jam Tak Didapat, Piton di Ruang COVID RS Wahidin Tidak Lagi Dicari",https://news.detik.com/berita/d-5883300/3-jam-tak-didapat-piton-di-ruang-covid-rs-wahidin-tidak-lagi-dicari
2022-01-04_de_18_1,2022-01-04,Detik,Polisi Usut Pemobil Diduga Tenteng Pistol Usai Tabrak Motor di Tangsel,https://news.detik.com/berita/d-5883299/polisi-usut-pemobil-diduga-tenteng-pistol-usai-tabrak-motor-di-tangsel
2022-01-04_de_18_2,2022-01-04,Detik,Napi yang Kabur dari Lapas Sumsel Terpidana Narkoba 9 Tahun Bui,https://news.detik.com/berita/d-5883289/napi-yang-kabur-dari-lapas-sumsel-terpidana-narkoba-9-tahun-bui
2022-01-04_de_18_3,2022-01-04,Detik,"Vaksin Merah Putih Disebut Mampu Netralisir Omicron, Apa Kelebihannya?",https://news.detik.com/berita-jawa-timur/d-5883286/vaksin-merah-putih-disebut-mampu-netralisir-omicron-apa-kelebihannya
2022-01-04_de_18_4,2022-01-04,Detik,Pengacara Habib Bahar Sebut Hukum Tajam ke Oposisi!,https://news.detik.com/detiktv/d-5883285/pengacara-habib-bahar-sebut-hukum-tajam-ke-oposisi
2022-01-04_de_18_5,2022-01-04,Detik,"Walkot Bekasi Jelaskan Alasan Anggarkan Rp 1,1 M untuk Karangan Bunga",https://news.detik.com/berita/d-5883284/walkot-bekasi-jelaskan-alasan-anggarkan-rp-11-m-untuk-karangan-bunga
2022-01-04_de_18_6,2022-01-04,Detik,"Dear Warga Ciamis, Yuk Daftar Pelatihan Kerja Gratis di Disnaker",https://news.detik.com/berita-jawa-barat/d-5883282/dear-warga-ciamis-yuk-daftar-pelatihan-kerja-gratis-di-disnaker
2022-01-04_de_18_7,2022-01-04,Detik,"Bupati Bogor Soroti Kerumunan Milad Front Persaudaraan Islam, Rumuskan Denda",https://news.detik.com/berita/d-5883281/bupati-bogor-soroti-kerumunan-milad-front-persaudaraan-islam-rumuskan-denda
2022-01-04_de_18_8,2022-01-04,Detik,"Giring Singgung Indeks Kebahagiaan Warga Jakarta Turun, Ini Katanya",https://news.detik.com/berita/d-5883278/giring-singgung-indeks-kebahagiaan-warga-jakarta-turun-ini-katanya
2022-01-04_de_18_9,2022-01-04,Detik,China-AS Sepakat Cegah Perang Nuklir!,https://news.detik.com/detiktv/d-5883275/china-as-sepakat-cegah-perang-nuklir
2022-01-04_de_18_10,2022-01-04,Detik,"Hilang Kendali, Truk Pengangkut Campuran Batu Bara Terguling di Tol JORR",https://news.detik.com/berita/d-5883271/hilang-kendali-truk-pengangkut-campuran-batu-bara-terguling-di-tol-jorr
2022-01-04_de_18_11,2022-01-04,Detik,1 DPO Teroris MIT Poso Tewas Ditembak,https://news.detik.com/berita/d-5883268/1-dpo-teroris-mit-poso-tewas-ditembak
2022-01-04_de_18_12,2022-01-04,Detik,"Habib Bahar bin Smith Ditahan, Ini 3 Reaksi Pengacara",https://news.detik.com/berita/d-5883270/habib-bahar-bin-smith-ditahan-ini-3-reaksi-pengacara
2022-01-04_de_18_13,2022-01-04,Detik,Sosok Kopral Dwi Pembuang Handi-Salsa di Mata Tetangga: Sering Pulang Malam,https://news.detik.com/berita-jawa-tengah/d-5883227/sosok-kopral-dwi-pembuang-handi-salsa-di-mata-tetangga-sering-pulang-malam
2022-01-04_de_18_14,2022-01-04,Detik,"Jakarta PPKM Level 2, Bagaimana Nasib Belajar Tatap Muka 100%?",https://news.detik.com/berita/d-5883225/jakarta-ppkm-level-2-bagaimana-nasib-belajar-tatap-muka-100
2022-01-04_de_18_15,2022-01-04,Detik,"Dikoordinir Buni Yani, Partainya Amien Rais Gugat Presidential Threshold!",https://news.detik.com/berita/d-5883223/dikoordinir-buni-yani-partainya-amien-rais-gugat-presidential-threshold
2022-01-04_de_18_16,2022-01-04,Detik,KSAD: Jangan Sampai Ada Tradisi Satuan yang Akibatkan Korban Jiwa,https://news.detik.com/berita/d-5883221/ksad-jangan-sampai-ada-tradisi-satuan-yang-akibatkan-korban-jiwa
2022-01-04_de_18_17,2022-01-04,Detik,detikcom Do Your Magic: Warga Sebut Sumur Resapan Cipinang Indah Tak Atasi Genangan,https://news.detik.com/berita/d-5883219/detikcom-do-your-magic-warga-sebut-sumur-resapan-cipinang-indah-tak-atasi-genangan
2022-01-04_de_18_18,2022-01-04,Detik,"KSP Beberkan Alasan PTM 100%: Selama Pandemi, Pendidikan RI Tertinggal",https://news.detik.com/berita/d-5883216/ksp-beberkan-alasan-ptm-100-selama-pandemi-pendidikan-ri-tertinggal
2022-01-04_de_18_19,2022-01-04,Detik,Pemkot Cimahi Segera Gelar PTM 100 Persen di Januari Ini,https://news.detik.com/berita-jawa-barat/d-5883215/pemkot-cimahi-segera-gelar-ptm-100-persen-di-januari-ini
2022-01-04_de_19_0,2022-01-04,Detik,Korban Lumpur di Sidoarjo Sulap Sungai Kumuh Jadi Destinasi Wisata,https://news.detik.com/berita-jawa-timur/d-5883209/korban-lumpur-di-sidoarjo-sulap-sungai-kumuh-jadi-destinasi-wisata
2022-01-04_de_19_1,2022-01-04,Detik,"Habib Bahar Tersangka, Ini Penjelasan Polisi dan Alasan Penahanan",https://news.detik.com/berita/d-5883210/habib-bahar-tersangka-ini-penjelasan-polisi-dan-alasan-penahanan
2022-01-04_de_19_2,2022-01-04,Detik,"China Lockdown Kota Berpenduduk 1,2 Juta Orang Gegara 3 Kasus Corona",https://news.detik.com/internasional/d-5883205/china-lockdown-kota-berpenduduk-12-juta-orang-gegara-3-kasus-corona
2022-01-04_de_19_3,2022-01-04,Detik,Pemuda Muhammadiyah: Langkah Polisi Tindak Bahar Smith Tindakan Tepat,https://news.detik.com/berita/d-5883211/pemuda-muhammadiyah-langkah-polisi-tindak-bahar-smith-tindakan-tepat
2022-01-04_de_19_4,2022-01-04,Detik,Jerit Penjual Gorengan di Tengah 'Panasnya' Harga Minyak Goreng,https://news.detik.com/detiktv/d-5883195/jerit-penjual-gorengan-di-tengah-panasnya-harga-minyak-goreng
2022-01-04_de_19_5,2022-01-04,Detik,Driver Ojol-Staf Kampus Jadi Korban Investasi Bodong Rp 10 M di Makassar,https://news.detik.com/berita/d-5883193/driver-ojol-staf-kampus-jadi-korban-investasi-bodong-rp-10-m-di-makassar
2022-01-04_de_19_6,2022-01-04,Detik,Ini Penyebab Status PPKM Jakarta Balik ke Level 2,https://news.detik.com/berita/d-5883191/ini-penyebab-status-ppkm-jakarta-balik-ke-level-2
