unique_id,date,source,headline,url
2022-01-04_de_07_2,2022-01-04,Detik,"Satgas: 86,6% Populasi RI Memiliki Antibodi COVID-19",https://news.detik.com/berita/d-5883950/satgas-866-populasi-ri-memiliki-antibodi-covid-19
2022-01-04_de_07_3,2022-01-04,Detik,LaNyalla: Kemandirian Pesantren Tekan Ketergantungan Sumbangan Donatur,https://news.detik.com/berita/d-5883924/lanyalla-kemandirian-pesantren-tekan-ketergantungan-sumbangan-donatur
2022-01-04_de_07_4,2022-01-04,Detik,Potret Airin hingga Sahroni Kandidat Gubernur Pengganti Anies,https://news.detik.com/foto-news/d-5883943/potret-airin-hingga-sahroni-kandidat-gubernur-pengganti-anies
2022-01-04_de_07_5,2022-01-04,Detik,Kenapa Serangan terhadap Minoritas Kristen di India Meningkat?,https://news.detik.com/dw/d-5883942/kenapa-serangan-terhadap-minoritas-kristen-di-india-meningkat
2022-01-04_de_07_6,2022-01-04,Detik,Pasutri Buronan Kasus Penipuan Asal Bondowoso Dibekuk di Bali,https://news.detik.com/berita-jawa-timur/d-5883934/pasutri-buronan-kasus-penipuan-asal-bondowoso-dibekuk-di-bali
2022-01-04_de_07_7,2022-01-04,Detik,TransJakarta Sampai Jam Berapa Hari Ini? Simak Jadwal Terbarunya!,https://news.detik.com/berita/d-5883938/transjakarta-sampai-jam-berapa-hari-ini-simak-jadwal-terbarunya
2022-01-04_de_07_8,2022-01-04,Detik,Anjuran Satgas COVID-19 Cegah Transmisi Komunitas Kasus Omicron,https://news.detik.com/berita/d-5883937/anjuran-satgas-covid-19-cegah-transmisi-komunitas-kasus-omicron
2022-01-04_de_07_9,2022-01-04,Detik,Dinkes Jatim Beberkan Kondisi Pasien Asal Surabaya yang Terpapar Omicron,https://news.detik.com/berita-jawa-timur/d-5883933/dinkes-jatim-beberkan-kondisi-pasien-asal-surabaya-yang-terpapar-omicron
2022-01-04_de_7_10,2022-01-04,Detik,"Viral Oknum TNI di Maluku Telanjang Dada Pukul Remaja, Pelaku Diamankan POM",https://news.detik.com/berita/d-5883932/viral-oknum-tni-di-maluku-telanjang-dada-pukul-remaja-pelaku-diamankan-pom
2022-01-04_de_7_11,2022-01-04,Detik,"PTM Adalah Pembelajaran Tatap Muka, Ini Ketentuan di SKB 4 Menteri",https://news.detik.com/berita/d-5883930/ptm-adalah-pembelajaran-tatap-muka-ini-ketentuan-di-skb-4-menteri
2022-01-04_de_7_12,2022-01-04,Detik,Jack Lapian Dituntut Bebas di Kasus Pencemaran Nama Baik Pendiri Kaskus,https://news.detik.com/berita/d-5883929/jack-lapian-dituntut-bebas-di-kasus-pencemaran-nama-baik-pendiri-kaskus
2022-01-04_de_7_13,2022-01-04,Detik,"Boneka Arwah Spirit Doll Heboh, Simak Pandangan MUI hingga Sosiolog",https://news.detik.com/berita/d-5883926/boneka-arwah-spirit-doll-heboh-simak-pandangan-mui-hingga-sosiolog
2022-01-04_de_7_14,2022-01-04,Detik,Alhamdulillah...Wanita Klaten yang Hilang-Disayembarakan Rp 5 Juta Pulang!,https://news.detik.com/berita-jawa-tengah/d-5883920/alhamdulillahwanita-klaten-yang-hilang-disayembarakan-rp-5-juta-pulang
2022-01-04_de_7_15,2022-01-04,Detik,"Puji Tingkat Vaksinasi Sulbar, LaNyalla Bahas Upaya Pemulihan Ekonomi",https://news.detik.com/berita/d-5883918/puji-tingkat-vaksinasi-sulbar-lanyalla-bahas-upaya-pemulihan-ekonomi
2022-01-04_de_7_16,2022-01-04,Detik,Dalang Penyelundup PMI Ilegal yang Tewas di Perairan Malaysia Ditangkap!,https://news.detik.com/detiktv/d-5883917/dalang-penyelundup-pmi-ilegal-yang-tewas-di-perairan-malaysia-ditangkap
2022-01-04_de_7_17,2022-01-04,Detik,"Covid RI 4 Januari: Tambah 299 Kasus, 3 Kematian",https://news.detik.com/detiktv/d-5883915/covid-ri-4-januari-tambah-299-kasus-3-kematian
2022-01-04_de_7_18,2022-01-04,Detik,"Polisi Pamerkan Hendi, Pria yang Tega Bunuh Istri Sendiri di Garut",https://news.detik.com/foto-news/d-5883570/polisi-pamerkan-hendi-pria-yang-tega-bunuh-istri-sendiri-di-garut
2022-01-04_de_7_19,2022-01-04,Detik,Jatim Diguncang 878 Gempa Bumi Selama 2021,https://news.detik.com/berita-jawa-timur/d-5883913/jatim-diguncang-878-gempa-bumi-selama-2021
2022-01-04_de_08_0,2022-01-04,Detik,Dokter Pembakar Bengkel di Tangerang Didakwa Pembunuhan Berencana,https://news.detik.com/berita/d-5883912/dokter-pembakar-bengkel-di-tangerang-didakwa-pembunuhan-berencana
2022-01-04_de_08_1,2022-01-04,Detik,"Pemuda Sumsel Tewas Dikeroyok, Belasan Orang Diamankan",https://news.detik.com/berita/d-5883910/pemuda-sumsel-tewas-dikeroyok-belasan-orang-diamankan
2022-01-04_de_08_2,2022-01-04,Detik,"Habib Bahar Tersangka, Begini Proses Penyidikan hingga Penemuan 2 Alat Bukti",https://news.detik.com/detiktv/d-5883908/habib-bahar-tersangka-begini-proses-penyidikan-hingga-penemuan-2-alat-bukti
2022-01-04_de_08_3,2022-01-04,Detik,Kontras! Begini Beda Perkembangan COVID-19 di Awal Tahun 2021 Vs 2022,https://news.detik.com/berita/d-5883907/kontras-begini-beda-perkembangan-covid-19-di-awal-tahun-2021-vs-2022
2022-01-04_de_08_4,2022-01-04,Detik,Oknum ASN Pandeglang Jadi Tersangka Penganiayaan Anak Tiri,https://news.detik.com/berita-jawa-barat/d-5883902/oknum-asn-pandeglang-jadi-tersangka-penganiayaan-anak-tiri
2022-01-04_de_08_5,2022-01-04,Detik,Anak Ular Piton Muncul di Pagar Rumah Warga di Makassar,https://news.detik.com/berita/d-5883901/anak-ular-piton-muncul-di-pagar-rumah-warga-di-makassar
2022-01-04_de_08_6,2022-01-04,Detik,"Dulu Dilindas Mobil Isyana, Sumur Resapan Ini Sudah Rampung Dibangun",https://news.detik.com/berita/d-5883900/dulu-dilindas-mobil-isyana-sumur-resapan-ini-sudah-rampung-dibangun
2022-01-04_de_08_7,2022-01-04,Detik,"Perkosa 13 Santriwati hingga Hamil-Melahirkan, Herry Wirawan Minta Maaf",https://news.detik.com/berita-jawa-barat/d-5883897/perkosa-13-santriwati-hingga-hamil-melahirkan-herry-wirawan-minta-maaf
2022-01-04_de_08_8,2022-01-04,Detik,"Pemerintah Setop Ekspor Batu Bara, Golkar: Terpaksa Dukung",https://news.detik.com/berita/d-5883893/pemerintah-setop-ekspor-batu-bara-golkar-terpaksa-dukung
2022-01-04_de_08_9,2022-01-04,Detik,"1 Keluarga di Cilincing Derita Lumpuh, Kelurahan Jamin Hak Terpenuhi",https://news.detik.com/berita/d-5883892/1-keluarga-di-cilincing-derita-lumpuh-kelurahan-jamin-hak-terpenuhi
2022-01-04_de_8_10,2022-01-04,Detik,Cetak Rekor Global! AS Catat Lebih dari 1 Juta Kasus Corona Sehari,https://news.detik.com/internasional/d-5883879/cetak-rekor-global-as-catat-lebih-dari-1-juta-kasus-corona-sehari
2022-01-04_de_8_11,2022-01-04,Detik,PKS soal Pemerintah Setop Ekspor Batu Bara: Jangan Cuma Gertak Sambal!,https://news.detik.com/berita/d-5883877/pks-soal-pemerintah-setop-ekspor-batu-bara-jangan-cuma-gertak-sambal
2022-01-04_de_8_12,2022-01-04,Detik,Arema FC Siap Ladeni Tira Persikabo di Laga Perdana Putaran Kedua Liga 1,https://news.detik.com/berita-jawa-timur/d-5883875/arema-fc-siap-ladeni-tira-persikabo-di-laga-perdana-putaran-kedua-liga-1
2022-01-04_de_8_13,2022-01-04,Detik,"Kecelakaan Beruntun, Fortuner Tabrak Jimny hingga Taksi di Tol Serpong",https://news.detik.com/berita/d-5883872/kecelakaan-beruntun-fortuner-tabrak-jimny-hingga-taksi-di-tol-serpong
2022-01-04_de_8_14,2022-01-04,Detik,"Pria di Asahan Disiram Air Keras, Pelakunya Orang Suruhan Istri",https://news.detik.com/berita/d-5883870/pria-di-asahan-disiram-air-keras-pelakunya-orang-suruhan-istri
2022-01-04_de_8_15,2022-01-04,Detik,Jokowi Dorong RUU Tindak Pidana Kekerasan Seksual Segera Disahkan!,https://news.detik.com/detiktv/d-5883868/jokowi-dorong-ruu-tindak-pidana-kekerasan-seksual-segera-disahkan
2022-01-04_de_8_16,2022-01-04,Detik,"GP Ansor Dukung Proses Hukum, Harap Tak Ada Lagi Politisasi Kasus Bahar Smith",https://news.detik.com/berita/d-5883866/gp-ansor-dukung-proses-hukum-harap-tak-ada-lagi-politisasi-kasus-bahar-smith
2022-01-04_de_8_17,2022-01-04,Detik,"Bupati Gunungkidul Rotasi ASN, Ada yang Hanya Menjabat 5 Hari Saja",https://news.detik.com/berita-jawa-tengah/d-5883855/bupati-gunungkidul-rotasi-asn-ada-yang-hanya-menjabat-5-hari-saja
2022-01-04_de_8_18,2022-01-04,Detik,"Cianjur Masih PPKM Level 2, Bupati Herman: Harusnya Level 1",https://news.detik.com/berita-jawa-barat/d-5883853/cianjur-masih-ppkm-level-2-bupati-herman-harusnya-level-1
2022-01-04_de_8_19,2022-01-04,Detik,Eks Direktur Ditjen Pajak Tak Setor LHKPN Bisnis Permata: Saya Tak Paham,https://news.detik.com/detiktv/d-5883851/eks-direktur-ditjen-pajak-tak-setor-lhkpn-bisnis-permata-saya-tak-paham
2022-01-04_de_09_0,2022-01-04,Detik,Retrospeksi Narji PKS Dukung Jenderal Dudung Copot Baliho HRS,https://news.detik.com/berita/d-5883849/retrospeksi-narji-pks-dukung-jenderal-dudung-copot-baliho-hrs
2022-01-04_de_09_1,2022-01-04,Detik,"Peduli Lingkungan, Galeri 24 Tanam 1.000 Bibit Pohon di Sentul",https://news.detik.com/berita/d-5883315/peduli-lingkungan-galeri-24-tanam-1000-bibit-pohon-di-sentul
2022-01-04_de_09_2,2022-01-04,Detik,"Respons Jokowi, Pimpinan DPR Pastikan RUU TPKS Segera Dirampungkan",https://news.detik.com/berita/d-5883848/respons-jokowi-pimpinan-dpr-pastikan-ruu-tpks-segera-dirampungkan
2022-01-04_de_09_3,2022-01-04,Detik,1 Tersangka Investasi Kripto Bodong Rp 10 M di Makassar Masuk DPO,https://news.detik.com/berita/d-5883847/1-tersangka-investasi-kripto-bodong-rp-10-m-di-makassar-masuk-dpo
2022-01-04_de_09_4,2022-01-04,Detik,"Menhub: Penumpang Meningkat Saat Nataru 2021, Paling Banyak Kereta Api",https://news.detik.com/berita/d-5883843/menhub-penumpang-meningkat-saat-nataru-2021-paling-banyak-kereta-api
2022-01-04_de_09_5,2022-01-04,Detik,"Siap-siap, Relokasi PKL Malioboro Dimulai Bulan Ini",https://news.detik.com/berita-jawa-tengah/d-5883842/siap-siap-relokasi-pkl-malioboro-dimulai-bulan-ini
2022-01-04_de_09_6,2022-01-04,Detik,"Korupsi Hibah Ponpes, 2 Pejabat Pemprov Banten Dituntut 6,5 Tahun Bui",https://news.detik.com/berita-jawa-barat/d-5883841/korupsi-hibah-ponpes-2-pejabat-pemprov-banten-dituntut-65-tahun-bui
2022-01-04_de_09_7,2022-01-04,Detik,"Massa Bakar Atribut, Ketua DPD Demokrat NTT Terpilih Bela AHY",https://news.detik.com/berita/d-5883839/massa-bakar-atribut-ketua-dpd-demokrat-ntt-terpilih-bela-ahy
2022-01-04_de_09_8,2022-01-04,Detik,"Lika-liku RUU TPKS: Ganti Nama, Gagal Paripurna, Kini Jokowi Minta Dikebut",https://news.detik.com/berita/d-5883836/lika-liku-ruu-tpks-ganti-nama-gagal-paripurna-kini-jokowi-minta-dikebut
2022-01-04_de_09_9,2022-01-04,Detik,Momen Terdakwa Angin Prayitno Menangis di dalam Persidangan,https://news.detik.com/detiktv/d-5883835/momen-terdakwa-angin-prayitno-menangis-di-dalam-persidangan
2022-01-04_de_9_10,2022-01-04,Detik,"PTM 100 Persen di Jabar Mulai 10 Januari, Maksimal Belajar 6 Jam",https://news.detik.com/berita-jawa-barat/d-5883834/ptm-100-persen-di-jabar-mulai-10-januari-maksimal-belajar-6-jam
2022-01-04_de_9_11,2022-01-04,Detik,Ahli Tak Temukan Luka Bakar-Kuku Dicopot Pada Laskar FPI yang Tewas,https://news.detik.com/detiktv/d-5883833/ahli-tak-temukan-luka-bakar-kuku-dicopot-pada-laskar-fpi-yang-tewas
2022-01-04_de_9_12,2022-01-04,Detik,"Lapas Lhoksukon Kebanjiran-Listrik Padam, Napi Pakai Lilin untuk Penerangan",https://news.detik.com/berita/d-5883831/lapas-lhoksukon-kebanjiran-listrik-padam-napi-pakai-lilin-untuk-penerangan
2022-01-04_de_9_13,2022-01-04,Detik,Njepat! Penutup Saluran Air Underpass Makamhaji Rusak Bikin Pemotor Kebanan,https://news.detik.com/berita-jawa-tengah/d-5883828/njepat-penutup-saluran-air-underpass-makamhaji-rusak-bikin-pemotor-kebanan
2022-01-04_de_9_14,2022-01-04,Detik,Kilas Global: Joe Biden Jadi Presiden AS-Kim Jong-un Sempat Menghilang,https://news.detik.com/foto-news/d-5883819/kilas-global-joe-biden-jadi-presiden-as-kim-jong-un-sempat-menghilang
2022-01-04_de_9_15,2022-01-04,Detik,"Demokrat NTT Ricuh, Massa Bakar Atribut Partai Gegara Urusan Ketua DPD",https://news.detik.com/berita/d-5883817/demokrat-ntt-ricuh-massa-bakar-atribut-partai-gegara-urusan-ketua-dpd
2022-01-04_de_9_16,2022-01-04,Detik,Warga Boyolali Ditemukan Tewas Misterius di Bawah Jembatan,https://news.detik.com/berita-jawa-tengah/d-5883816/warga-boyolali-ditemukan-tewas-misterius-di-bawah-jembatan
2022-01-04_de_9_17,2022-01-04,Detik,China Serukan AS-Rusia Kurangi Pasokan Senjata Nuklir,https://news.detik.com/internasional/d-5883810/china-serukan-as-rusia-kurangi-pasokan-senjata-nuklir
2022-01-04_de_9_18,2022-01-04,Detik,Kejati Jabar Telaah Penyimpangan Revitalisasi Taman Pramuka Bandung,https://news.detik.com/berita-jawa-barat/d-5883808/kejati-jabar-telaah-penyimpangan-revitalisasi-taman-pramuka-bandung
2022-01-04_de_9_19,2022-01-04,Detik,"Hendak Setop Truk, ABG 16 Tahun di Tangsel Terseret hingga Luka Parah",https://news.detik.com/berita/d-5883806/hendak-setop-truk-abg-16-tahun-di-tangsel-terseret-hingga-luka-parah
2022-01-04_de_10_0,2022-01-04,Detik,"Pemkot-Budayawan Rapat Bahas Bentuk Tugu Sa Gunung Tidar, Ini Hasilnya",https://news.detik.com/berita-jawa-tengah/d-5883802/pemkot-budayawan-rapat-bahas-bentuk-tugu-sa-gunung-tidar-ini-hasilnya
2022-01-04_de_10_1,2022-01-04,Detik,"Jadi Buruh Panggul, Mahasiswi Cantik di Pinrang Dapat Beasiswa",https://news.detik.com/detiktv/d-5883786/jadi-buruh-panggul-mahasiswi-cantik-di-pinrang-dapat-beasiswa
2022-01-04_de_10_2,2022-01-04,Detik,Ahli Forensik Ungkap Penyebab Kematian Laskar FPI: Luka Tembak di Dada,https://news.detik.com/berita/d-5883785/ahli-forensik-ungkap-penyebab-kematian-laskar-fpi-luka-tembak-di-dada
2022-01-04_de_10_3,2022-01-04,Detik,"Dampak Banjir Bandang Ditangani, 42 KK di Kediri Tak Lagi Terisolasi",https://news.detik.com/berita-jawa-timur/d-5883782/dampak-banjir-bandang-ditangani-42-kk-di-kediri-tak-lagi-terisolasi
2022-01-04_de_10_4,2022-01-04,Detik,Cekcok Rumah Tangga Picu Suami Aniaya Istri di Bandung,https://news.detik.com/berita-jawa-barat/d-5883780/cekcok-rumah-tangga-picu-suami-aniaya-istri-di-bandung
2022-01-04_de_10_5,2022-01-04,Detik,Polda Sumut Akan Panggil Gubsu Edy soal Laporan Pelatih Biliar,https://news.detik.com/berita/d-5883779/polda-sumut-akan-panggil-gubsu-edy-soal-laporan-pelatih-biliar
2022-01-04_de_10_6,2022-01-04,Detik,"30 Pesilat Keroyok 5 Pemuda di Alun-alun Jombang, 3 Pelaku Dibui",https://news.detik.com/berita-jawa-timur/d-5883765/30-pesilat-keroyok-5-pemuda-di-alun-alun-jombang-3-pelaku-dibui
2022-01-04_de_10_7,2022-01-04,Detik,PT KAI Batalkan 9.000 Tiket Selama Libur Nataru,https://news.detik.com/detiktv/d-5883777/pt-kai-batalkan-9000-tiket-selama-libur-nataru
2022-01-04_de_10_8,2022-01-04,Detik,Kapolri Tekankan Pentingnya Perlindungan untuk Pekerja Migran,https://news.detik.com/berita/d-5883776/kapolri-tekankan-pentingnya-perlindungan-untuk-pekerja-migran
2022-01-04_de_10_9,2022-01-04,Detik,"13 Provinsi Nihil Tambahan, Ini Sebaran 299 Kasus COVID di RI 4 Januari",https://news.detik.com/berita/d-5883775/13-provinsi-nihil-tambahan-ini-sebaran-299-kasus-covid-di-ri-4-januari
2022-01-04_de_10_10,2022-01-04,Detik,"Gempa Magnitudo 3,4 Guncang Malang",https://news.detik.com/berita-jawa-timur/d-5883774/gempa-magnitudo-34-guncang-malang
2022-01-04_de_10_11,2022-01-04,Detik,PTUN Menangkan IPHI Erman Suparno atas Ismed Hasan Putro,https://news.detik.com/berita/d-5883772/ptun-menangkan-iphi-erman-suparno-atas-ismed-hasan-putro
2022-01-04_de_10_12,2022-01-04,Detik,Polri Ungkap Dua Alasan Penahanan Habib Bahar,https://news.detik.com/detiktv/d-5883771/polri-ungkap-dua-alasan-penahanan-habib-bahar
2022-01-04_de_10_13,2022-01-04,Detik,"Cegah Jakarta Tenggelam, Sedot Air Tanah Akan Diubah ke Air Minum Perpipaan",https://news.detik.com/berita/d-5883770/cegah-jakarta-tenggelam-sedot-air-tanah-akan-diubah-ke-air-minum-perpipaan
2022-01-04_de_10_14,2022-01-04,Detik,Herry Wirawan Ngaku Khilaf Perkosa 13 Santriwati hingga Hamil-Melahirkan,https://news.detik.com/berita-jawa-barat/d-5883767/herry-wirawan-ngaku-khilaf-perkosa-13-santriwati-hingga-hamil-melahirkan
2022-01-04_de_10_15,2022-01-04,Detik,Jokowi Minta RUU TPKS Fokus Perlindungan Korban Kekerasan Seksual,https://news.detik.com/berita/d-5883764/jokowi-minta-ruu-tpks-fokus-perlindungan-korban-kekerasan-seksual
2022-01-04_de_10_16,2022-01-04,Detik,"Alat Bukti Penahanan Dipertanyakan, Habib Bahar Ajukan Praperadilan",https://news.detik.com/berita/d-5883762/alat-bukti-penahanan-dipertanyakan-habib-bahar-ajukan-praperadilan
2022-01-04_de_10_17,2022-01-04,Detik,Penampakan Isi Kapal Uni Emirat Arab yang Disita Kelompok Houthi,https://news.detik.com/detiktv/d-5883761/penampakan-isi-kapal-uni-emirat-arab-yang-disita-kelompok-houthi
2022-01-04_de_10_18,2022-01-04,Detik,"Ditutup Setahun, Jembatan Glendeng Perbatasan Bojonegoro-Tuban Akhirnya Dibuka",https://news.detik.com/berita-jawa-timur/d-5883754/ditutup-setahun-jembatan-glendeng-perbatasan-bojonegoro-tuban-akhirnya-dibuka
2022-01-04_de_10_19,2022-01-04,Detik,Ini Motif Suami Gorok Mati Istri di Garut,https://news.detik.com/berita-jawa-barat/d-5883760/ini-motif-suami-gorok-mati-istri-di-garut
2022-01-04_de_11_0,2022-01-04,Detik,2 Menteri Ini Ditugaskan Jokowi Gas RUU Tindak Pidana Kekerasan Seksual,https://news.detik.com/berita/d-5883759/2-menteri-ini-ditugaskan-jokowi-gas-ruu-tindak-pidana-kekerasan-seksual
2022-01-04_de_11_1,2022-01-04,Detik,"Evakuasi Jasad DPO MIT Ahmad Panjang Selesai, Diautopsi di Palu",https://news.detik.com/berita/d-5883757/evakuasi-jasad-dpo-mit-ahmad-panjang-selesai-diautopsi-di-palu
2022-01-04_de_11_2,2022-01-04,Detik,Polisi Telusuri Jejak Peserta Meditation Camp yang Hilang di Tangsel,https://news.detik.com/berita/d-5883755/polisi-telusuri-jejak-peserta-meditation-camp-yang-hilang-di-tangsel
2022-01-04_de_11_3,2022-01-04,Detik,Jokowi Harap RUU Tindak Pidana Kekerasan Seksual Segera Disahkan!,https://news.detik.com/berita/d-5883750/jokowi-harap-ruu-tindak-pidana-kekerasan-seksual-segera-disahkan
2022-01-04_de_11_4,2022-01-04,Detik,"Putusan Hakim Belum Siap, Sidang 2 Terdakwa Kasus Asabri Ditunda",https://news.detik.com/detiktv/d-5883748/putusan-hakim-belum-siap-sidang-2-terdakwa-kasus-asabri-ditunda
2022-01-04_de_11_5,2022-01-04,Detik,Jerman Cabut Pembatasan Perjalanan terkait Omicron untuk Inggris dan Afsel,https://news.detik.com/dw/d-5883747/jerman-cabut-pembatasan-perjalanan-terkait-omicron-untuk-inggris-dan-afsel
2022-01-04_de_11_6,2022-01-04,Detik,Vaksinasi di Magetan Terus Berlanjut Pasca-meninggalnya Siswa MI Usai Divaksin,https://news.detik.com/berita-jawa-timur/d-5883746/vaksinasi-di-magetan-terus-berlanjut-pasca-meninggalnya-siswa-mi-usai-divaksin
2022-01-04_de_11_7,2022-01-04,Detik,Dinkes DKI Tunggu Teknis Pelaksanaan Vaksin Booster dari Kemenkes,https://news.detik.com/berita/d-5883745/dinkes-dki-tunggu-teknis-pelaksanaan-vaksin-booster-dari-kemenkes
2022-01-04_de_11_8,2022-01-04,Detik,Polisi Periksa 17 Saksi Kasus Dugaan Pencabulan Pengasuh Ponpes Sentolo,https://news.detik.com/berita-jawa-tengah/d-5883744/polisi-periksa-17-saksi-kasus-dugaan-pencabulan-pengasuh-ponpes-sentolo
2022-01-04_de_11_9,2022-01-04,Detik,"Corona RI 4 Januari: Tambah 299, Sembuh 168, Meninggal 3",https://news.detik.com/berita/d-5883743/corona-ri-4-januari-tambah-299-sembuh-168-meninggal-3
2022-01-04_de_11_10,2022-01-04,Detik,Herry Wirawan Akui Perkosa 13 Santriwati hingga Hamil-Melahirkan,https://news.detik.com/berita-jawa-barat/d-5883740/herry-wirawan-akui-perkosa-13-santriwati-hingga-hamil-melahirkan
2022-01-04_de_11_11,2022-01-04,Detik,"Dituding Memiliki Ilmu Hitam, Rumah Pasutri di Sultra Dibakar Warga",https://news.detik.com/detiktv/d-5883736/dituding-memiliki-ilmu-hitam-rumah-pasutri-di-sultra-dibakar-warga
2022-01-04_de_11_12,2022-01-04,Detik,"Polri Perpanjang Operasi Nemangkawi, Siapkan Pendekatan Kesejahteraan",https://news.detik.com/berita/d-5883735/polri-perpanjang-operasi-nemangkawi-siapkan-pendekatan-kesejahteraan
2022-01-04_de_11_13,2022-01-04,Detik,"Kontak Langsung Wisatawan Jatim Positif Omicron, 11 Warga Bali Negatif COVID",https://news.detik.com/berita/d-5883734/kontak-langsung-wisatawan-jatim-positif-omicron-11-warga-bali-negatif-covid
2022-01-04_de_11_14,2022-01-04,Detik,Ketua Kadin Jabar Diperiksa Polisi soal Dugaan Pencemaran Nama Baik,https://news.detik.com/berita-jawa-barat/d-5883731/ketua-kadin-jabar-diperiksa-polisi-soal-dugaan-pencemaran-nama-baik
2022-01-04_de_11_15,2022-01-04,Detik,"Mikrobus di Pemalang Terguling Gegara Gagal Nanjak, 1 Penumpang Tewas",https://news.detik.com/berita-jawa-tengah/d-5883720/mikrobus-di-pemalang-terguling-gegara-gagal-nanjak-1-penumpang-tewas
2022-01-04_de_11_16,2022-01-04,Detik,"Sangkal Kepemilikan 81 Bidang Lahan, Angin Prayitno: Saya Hanya Memiliki 5 Bidang",https://news.detik.com/detiktv/d-5883705/sangkal-kepemilikan-81-bidang-lahan-angin-prayitno-saya-hanya-memiliki-5-bidang
2022-01-04_de_11_17,2022-01-04,Detik,"Para Anggota Keluarga Cilincing Lumpuh Tak Bisa Jalan, Begini Kisah Mereka",https://news.detik.com/berita/d-5883706/para-anggota-keluarga-cilincing-lumpuh-tak-bisa-jalan-begini-kisah-mereka
2022-01-04_de_11_18,2022-01-04,Detik,NasDem Tertarik Usung Sahroni-Airin di Pilgub DKI: Pasangan Ganteng-Cantik,https://news.detik.com/berita/d-5883704/nasdem-tertarik-usung-sahroni-airin-di-pilgub-dki-pasangan-ganteng-cantik
2022-01-04_de_11_19,2022-01-04,Detik,Polisi Sidoarjo Edukasi hingga Pantau Vaksinasi Siswa SD,https://news.detik.com/berita-jawa-timur/d-5883916/polisi-sidoarjo-edukasi-hingga-pantau-vaksinasi-siswa-sd
2022-01-04_de_12_0,2022-01-04,Detik,"Kota Cirebon PPKM Level 2, Sekda Sebut Tracing Jadi Penentu",https://news.detik.com/berita-jawa-barat/d-5883702/kota-cirebon-ppkm-level-2-sekda-sebut-tracing-jadi-penentu
2022-01-04_de_12_1,2022-01-04,Detik,Motif Suami Gorok Istri di Garut Gegara Ada 'PIL',https://news.detik.com/detiktv/d-5883701/motif-suami-gorok-istri-di-garut-gegara-ada-pil
2022-01-04_de_12_2,2022-01-04,Detik,Tersangka Investasi Kripto Bodong Rp 10 M di Makassar Ngaku Jadi Korban,https://news.detik.com/berita/d-5883700/tersangka-investasi-kripto-bodong-rp-10-m-di-makassar-ngaku-jadi-korban
2022-01-04_de_12_3,2022-01-04,Detik,"Petugas Vaksinasi ODGJ Brebes: Banyak Yang Ngaku Sudah Divaksin, Ternyata...",https://news.detik.com/berita-jawa-tengah/d-5883695/petugas-vaksinasi-odgj-brebes-banyak-yang-ngaku-sudah-divaksin-ternyata
2022-01-04_de_12_4,2022-01-04,Detik,"Aceh Utara-Langsa Dilanda Banjir, 4 Anak Meninggal Terseret Arus",https://news.detik.com/berita/d-5883693/aceh-utara-langsa-dilanda-banjir-4-anak-meninggal-terseret-arus
2022-01-04_de_12_5,2022-01-04,Detik,"Terobos Perbatasan Demi Pulang, Pembelot Korut Hidup Susah di Korsel",https://news.detik.com/internasional/d-5883691/terobos-perbatasan-demi-pulang-pembelot-korut-hidup-susah-di-korsel
2022-01-04_de_12_6,2022-01-04,Detik,"Cara Membuat Paspor Via M-Paspor, Ini Langkah-langkahnya",https://news.detik.com/berita/d-5883694/cara-membuat-paspor-via-m-paspor-ini-langkah-langkahnya
2022-01-04_de_12_7,2022-01-04,Detik,"Viral Gadis di Bekasi Dipersekusi Diduga Gegara Cowok, Polisi Selidiki",https://news.detik.com/berita/d-5883690/viral-gadis-di-bekasi-dipersekusi-diduga-gegara-cowok-polisi-selidiki
2022-01-04_de_12_8,2022-01-04,Detik,Dalam Sepekan 3 Pelajar SD di Jatim Meninggal Usai Divaksin COVID-19,https://news.detik.com/berita-jawa-timur/d-5883689/dalam-sepekan-3-pelajar-sd-di-jatim-meninggal-usai-divaksin-covid-19
2022-01-04_de_12_9,2022-01-04,Detik,Bus Sekolah Wara-wiri Lagi Saat PTM 100 Persen Digelar di DKI,https://news.detik.com/foto-news/d-5883406/bus-sekolah-wara-wiri-lagi-saat-ptm-100-persen-digelar-di-dki
2022-01-04_de_12_10,2022-01-04,Detik,"Bersamaan PPKM Level 1, Kabupaten Magelang Nol Kasus COVID Hari Ini",https://news.detik.com/berita-jawa-tengah/d-5883678/bersamaan-ppkm-level-1-kabupaten-magelang-nol-kasus-covid-hari-ini
2022-01-04_de_12_11,2022-01-04,Detik,Janji China hingga AS untuk Cegah Perang Nuklir,https://news.detik.com/dw/d-5883676/janji-china-hingga-as-untuk-cegah-perang-nuklir
2022-01-04_de_12_12,2022-01-04,Detik,Dua Begal Bersajam Diringkus Polisi di Medan,https://news.detik.com/berita/d-5883670/dua-begal-bersajam-diringkus-polisi-di-medan
2022-01-04_de_12_13,2022-01-04,Detik,Potret Ancilla Peserta Meditation Camp yang Hilang di Tangsel,https://news.detik.com/foto-news/d-5883664/potret-ancilla-peserta-meditation-camp-yang-hilang-di-tangsel
2022-01-04_de_12_14,2022-01-04,Detik,"PTM 100 Persen di Jabar, Ridwan Kamil Serahkan Kewenangan ke Daerah",https://news.detik.com/berita-jawa-barat/d-5883663/ptm-100-persen-di-jabar-ridwan-kamil-serahkan-kewenangan-ke-daerah
2022-01-04_de_12_15,2022-01-04,Detik,Pekerja di Tulungagung Tewas Terjatuh dari Ketinggian 12 Meter Saat Pasang Atap,https://news.detik.com/berita-jawa-timur/d-5883643/pekerja-di-tulungagung-tewas-terjatuh-dari-ketinggian-12-meter-saat-pasang-atap
2022-01-04_de_12_16,2022-01-04,Detik,Pemprov DKI Akan Tutup Sekolah 5 Hari Jika Ada Kasus Omicron Saat PTM 100%,https://news.detik.com/berita/d-5883640/pemprov-dki-akan-tutup-sekolah-5-hari-jika-ada-kasus-omicron-saat-ptm-100
2022-01-04_de_12_17,2022-01-04,Detik,"Napi Narkoba di Sumsel Kabur, Kemenkum Akan Sanksi Petugas Lalai",https://news.detik.com/berita/d-5883639/napi-narkoba-di-sumsel-kabur-kemenkum-akan-sanksi-petugas-lalai
2022-01-04_de_12_18,2022-01-04,Detik,MA Tolak Permohonan Fatwa Wenny Ariani soal Tes DNA Rezky Aditya,https://news.detik.com/berita/d-5883638/ma-tolak-permohonan-fatwa-wenny-ariani-soal-tes-dna-rezky-aditya
2022-01-04_de_12_19,2022-01-04,Detik,Remaja Tewas Tersambar Kereta di Perlintasan Dukuh Janti Sleman,https://news.detik.com/berita-jawa-tengah/d-5883636/remaja-tewas-tersambar-kereta-di-perlintasan-dukuh-janti-sleman
2022-01-04_de_13_0,2022-01-04,Detik,"7 Daerah di Jateng Naik Jadi PPKM Level 2, Ganjar: Belum Mencemaskan",https://news.detik.com/berita-jawa-tengah/d-5883631/7-daerah-di-jateng-naik-jadi-ppkm-level-2-ganjar-belum-mencemaskan
2022-01-04_de_13_1,2022-01-04,Detik,"Gugat Presidential Threshold, Partainya Amien Rais Mau Usung Siapa?",https://news.detik.com/berita/d-5883620/gugat-presidential-threshold-partainya-amien-rais-mau-usung-siapa
2022-01-04_de_13_2,2022-01-04,Detik,Hakim Tunda Putusan terhadap 2 Terdakwa Kasus ASABRI,https://news.detik.com/berita/d-5883619/hakim-tunda-putusan-terhadap-2-terdakwa-kasus-asabri
2022-01-04_de_13_3,2022-01-04,Detik,"Yogyakarta Mulai PTM Full, Ortu Berburu Seragam Sekolah",https://news.detik.com/detiktv/d-5883614/yogyakarta-mulai-ptm-full-ortu-berburu-seragam-sekolah
