unique_id,date,source,headline,url
2021-12-29_ja_0353,2021-12-29,Jawa Pos,"MoU dengan Politeknik Caltex Riau, H Adil Siapkan Kuota Anak Meranti",https://riaupos.jawapos.com/kepulauan-meranti/29/12/2021/264706/mou-dengan-politeknik-caltex-riau-h-adil-siapkan-kuota-anak-meranti.html
2021-12-29_ja_0354,2021-12-29,Jawa Pos,Terus Hidupkan Semangat Kolaborasi untuk Atasi Dampak Pandemi,https://radarkudus.jawapos.com/nasional/29/12/2021/terus-hidupkan-semangat-kolaborasi-untuk-atasi-dampak-pandemi/
2021-12-29_ja_0355,2021-12-29,Jawa Pos,Final Piala AFF 2020 Indonesia vs Thailand: Momentum Timnas Akhiri Kutukan,https://radarkudus.jawapos.com/olahraga/29/12/2021/final-piala-aff-2020-indonesia-vs-thailand-momentum-timnas-akhiri-kutukan/
2021-12-29_ja_0356,2021-12-29,Jawa Pos,"Sakit Tenggorokan Jadi Gejala Omicron, Kapan Harus Tes Swab?",https://www.jawapos.com/kesehatan/29/12/2021/sakit-tenggorokan-jadi-gejala-omicron-kapan-harus-tes-swab/
2021-12-29_ja_0357,2021-12-29,Jawa Pos,Menko Airlangga Hartarto Berharap Sekolah Tatap Muka Bisa Dimulai,https://radarmadura.jawapos.com/berita-daerah/29/12/2021/menko-airlangga-hartarto-berharap-sekolah-tatap-muka-bisa-dimulai
2021-12-29_ja_0358,2021-12-29,Jawa Pos,TNI AU Selidiki Dugaan Anggotanya Terlibat Pengiriman TMI Ilegal,https://www.jawapos.com/nasional/hukum-kriminal/29/12/2021/tni-au-selidiki-dugaan-anggotanya-terlibat-pengiriman-tmi-ilegal/
2021-12-29_ja_0359,2021-12-29,Jawa Pos,"Setahun, 53 Orang Tewas di Jalan",https://radarmojokerto.jawapos.com/hukum-kriminal/29/12/2021/setahun-53-orang-tewas-di-jalan
2021-12-29_ja_0360,2021-12-29,Jawa Pos,Forum Umat Muslim Minta Kemenkes Vaksin Halal untuk Tangani Covid-19,https://www.jawapos.com/nasional/29/12/2021/forum-umat-muslim-minta-kemenkes-vaksin-halal-untuk-tangani-covid-19/
2021-12-29_ja_0361,2021-12-29,Jawa Pos,Pendakian Welirang-Arjuno Ditutup karena Bahaya Hujan dan Badai,https://radarbromo.jawapos.com/pandaan/29/12/2021/pendakian-welirang-arjuno-ditutup-karena-bahaya-hujan-dan-badai/
2021-12-29_ja_0362,2021-12-29,Jawa Pos,"Genjot Penyelidikan, Polisi Periksa 15 Saksi",https://radarbali.jawapos.com/hukum-kriminal/29/12/2021/genjot-penyelidikan-polisi-periksa-15-saksi
2021-12-29_ja_0363,2021-12-29,Jawa Pos,Sang Ayah: Asnawi Harus Berjuang sampai Titik Darah Penghabisan,https://www.jawapos.com/sepak-bola/sepak-bola-indonesia/29/12/2021/sang-ayah-asnawi-harus-berjuang-sampai-titik-darah-penghabisan/
2021-12-29_ja_0364,2021-12-29,Jawa Pos,Risma: Tempat Relokasi Warga Korban Erupsi Semeru Ditentukan Hari ini,https://www.jawapos.com/nasional/29/12/2021/risma-tempat-relokasi-warga-korban-erupsi-semeru-ditentukan-hari-ini/
2021-12-29_ja_0365,2021-12-29,Jawa Pos,"Suguhkan Pesona Alam, Sisi Barat Coffee Cocok untuk Tempat Bersantai",https://www.radarbogor.id/2021/12/29/suguhkan-pesona-alam-sisi-barat-coffee-cocok-untuk-tempat-bersantai/
2021-12-29_ja_0366,2021-12-29,Jawa Pos,"Kaleidoskop 2021: Muncul di Afsel, Omicron Membuat Dunia Lebih Waspada",https://www.jawapos.com/internasional/29/12/2021/kaleidoskop-2021-muncul-di-afsel-omicron-membuat-dunia-lebih-waspada/
2021-12-29_ja_0367,2021-12-29,Jawa Pos,"Lawan Thailand, Shin Tae-yong Indikasikan bakal Bermain Menyerang",https://radarsolo.jawapos.com/nasional/29/12/2021/lawan-thailand-shin-tae-yong-indikasikan-bakal-bermain-menyerang/
2021-12-29_ja_0368,2021-12-29,Jawa Pos,"Ada Sengketa yang Berakhir Damai, Pemkab Hormati Upaya Hukum Warga",https://radarjember.jawapos.com/berita-bondowoso/29/12/2021/ada-sengketa-yang-berakhir-damai-pemkab-hormati-upaya-hukum-warga/
2021-12-29_ja_0369,2021-12-29,Jawa Pos,"Salurkan Bantuan Bencana Rp 221,6 Juta",https://radarsemarang.jawapos.com/berita/jateng/mungkid/2021/12/29/salurkan-bantuan-bencana-rp-2216-juta/
2021-12-29_ja_0370,2021-12-29,Jawa Pos,Masih Banyak Tempat Wisata yang Abai Prokes,https://radarsemarang.jawapos.com/berita/jateng/wonosobo/2021/12/29/masih-banyak-tempat-wisata-yang-abai-prokes/
2021-12-29_ja_0371,2021-12-29,Jawa Pos,Menkes: Kasus Covid-19 Omicron Naik Jadi 68 Orang,https://www.jawapos.com/nasional/29/12/2021/menkes-kasus-covid-19-omicron-naik-jadi-68-orang/
2021-12-29_ja_0372,2021-12-29,Jawa Pos,"Hebat, Dua Sekolah Raih Adiwiyata Provinsi",https://radarjember.jawapos.com/berita-bondowoso/29/12/2021/hebat-dua-sekolah-raih-adiwiyata-provinsi/
2021-12-29_ja_0373,2021-12-29,Jawa Pos,"Korsleting, Lima Rumah di Dusun Gintung Terbakar",https://radarsemarang.jawapos.com/berita/jateng/wonosobo/2021/12/29/korsleting-lima-rumah-di-dusun-gintung-terbakar/
2021-12-29_ja_0374,2021-12-29,Jawa Pos,Cabai Rawit Setan Tembus Rp 100 Ribu Per Kilogram,https://radarsemarang.jawapos.com/berita/jateng/wonosobo/2021/12/29/cabai-rawit-setan-tembus-rp-100-ribu-per-kilogram/
2021-12-29_ja_0375,2021-12-29,Jawa Pos,"Pengunjung Perpustakaan Daerah Meningkat, Didominasi Pelajar",https://radarbromo.jawapos.com/pandaan/29/12/2021/pengunjung-perpustakaan-daerah-meningkat-didominasi-pelajar/
2021-12-29_ja_0376,2021-12-29,Jawa Pos,Penculik Bayi Berdalih Dapat Perintah dari Dua Guru Spritual,https://radarbanyuwangi.jawapos.com/berita-daerah/situbondo/29/12/2021/penculik-bayi-berdalih-dapat-perintah-dari-dua-guru-spritual
2021-12-29_ja_0377,2021-12-29,Jawa Pos,"Tahun Baru, Kafe dan Tempat Nongkrong  Biang Kerumunan Bakal Diobrak",https://radarmalang.jawapos.com/malang-raya/kota-malang/29/12/2021/tahun-baru-kafe-dan-tempat-nongkrong-biang-kerumunan-bakal-diobrak/
2021-12-29_ja_0378,2021-12-29,Jawa Pos,Pemberian Bansos dan Permintaan Tinggi Bikin Harga Telur Melambung,https://www.jawapos.com/jpg-today/29/12/2021/pemberian-bansos-dan-permintaan-tinggi-bikin-harga-telur-melambung/
2021-12-29_ja_0379,2021-12-29,Jawa Pos,"Tingkatkan Sumber Daya, IBT Pelita Indonesia MoU dengan Pemda Bengkalis",https://riaupos.jawapos.com/riau/29/12/2021/264703/tingkatkan-sumber-daya-ibt-pelita-indonesia-mou-dengan-pemda-bengkalis.html
2021-12-29_ja_0380,2021-12-29,Jawa Pos,"Razman Yakin dr. Richard Tak Bersalah, Persidangan Minta Dipercepat",https://www.jawapos.com/entertainment/infotainment/29/12/2021/razman-yakin-dr-richard-tak-bersalah-persidangan-minta-dipercepat/
2021-12-29_ja_0381,2021-12-29,Jawa Pos,Shin Tae-yong Khawatir Kondisi Fisik Tak Optimal karena Nasi Kotak,https://www.jawapos.com/sepak-bola/sepak-bola-indonesia/29/12/2021/shin-tae-yong-khawatir-kondisi-fisik-tak-optimal-karena-nasi-kotak/
2021-12-29_ja_0382,2021-12-29,Jawa Pos,Kylian Mbappe Tegaskan Tak Akan Tinggalkan PSG,https://radarsolo.jawapos.com/sport/sport-internasional/29/12/2021/kylian-mbappe-tegaskan-tak-akan-tinggalkan-psg/
2021-12-29_ja_0383,2021-12-29,Jawa Pos,8.000 Anak di Temanggung Sudah Divaksin,https://radarsemarang.jawapos.com/berita/jateng/temanggung/2021/12/29/8-000-anak-di-temanggung-sudah-divaksin/
2021-12-29_ja_0384,2021-12-29,Jawa Pos,"Bupati Jepara Nyetir Mobil Dalmas, Hibah untuk Polres",https://radarkudus.jawapos.com/jepara/29/12/2021/bupati-jepara-nyetir-mobil-dalmas-hibah-untuk-polres/
2021-12-29_ja_0385,2021-12-29,Jawa Pos,Irfan Jaya Kecil Latihan Menyepak Pakai Gumpalan Sarung dan Jeruk Bali,https://www.jawapos.com/sepak-bola/sepak-bola-indonesia/29/12/2021/irfan-jaya-kecil-latihan-menyepak-pakai-gumpalan-sarung-dan-jeruk-bali/
2021-12-29_ja_0386,2021-12-29,Jawa Pos,"Bawa Kabur Motor, Ngaku Cuma Pinjam",https://radarsemarang.jawapos.com/berita/jateng/temanggung/2021/12/29/bawa-kabur-motor-ngaku-cuma-pinjam/
2021-12-29_ja_0387,2021-12-29,Jawa Pos,"Sakit Tenggorokan Jadi Gejala Awal Covid-19 Omicron, Ini Kata Ahli",https://www.jawapos.com/kesehatan/29/12/2021/sakit-tenggorokan-jadi-gejala-awal-covid-19-omicron-ini-kata-ahli/
2021-12-29_ja_0388,2021-12-29,Jawa Pos,"Di Pasar Soponyono Surabaya, Harga Cabai Tembus Rp 100 Ribu per Kg",https://www.jawapos.com/surabaya/29/12/2021/di-pasar-soponyono-surabaya-harga-cabai-tembus-rp-100-ribu-per-kg/
2021-12-29_ja_0389,2021-12-29,Jawa Pos,Who Are You Milik BamBam GOT7-Seulgi Red Velvet Puncaki Tangga Lagu 21 Negara,https://radarsolo.jawapos.com/entertainment/29/12/2021/who-are-you-milik-bambam-got7-seulgi-red-velvet-puncaki-tangga-lagu-21-negara/
2021-12-29_ja_0390,2021-12-29,Jawa Pos,Sopandi Minta Pemda Meranti Perpanjang Kontrak THL,https://riaupos.jawapos.com/kepulauan-meranti/29/12/2021/264699/sopandi-minta-pemda-meranti-perpanjang-kontrak-thl.html
2021-12-29_ja_0391,2021-12-29,Jawa Pos,"Tetapkan Kegiatan Pengabdian Masyarakat Terbaik, Senat Unida Selenggarakan Rapat Penetapan Bersama",https://www.radarbogor.id/2021/12/29/tetapkan-kegiatan-pengabdian-masyarakat-terbaik-senat-unida-selenggarakan-rapat-penetapan-bersama/
2021-12-29_ja_0392,2021-12-29,Jawa Pos,Tahun 2022 Jadi Harapan Baru Bagi Angga Yunanda,https://www.radarbogor.id/2021/12/29/tahun-2022-jadi-harapan-baru-bagi-angga-yunanda/
2021-12-29_ja_0393,2021-12-29,Jawa Pos,"Lawan Thailand, Shin Tae-yong Indikasikan bakal Bermain Menyerang",https://www.jawapos.com/sepak-bola/sepak-bola-indonesia/29/12/2021/lawan-thailand-shin-tae-yong-indikasikan-bakal-bermain-menyerang/
2021-12-29_ja_0394,2021-12-29,Jawa Pos,Perpanjangan Kontrak Proyek Diobral,https://radarmojokerto.jawapos.com/berita-daerah/mojokerto/29/12/2021/perpanjangan-kontrak-proyek-diobral
2021-12-29_ja_0395,2021-12-29,Jawa Pos,"FGD Tingkat Universitas, Unida Bahas Dampak Implementasi Program MBKM Terhadap Performa Mahasiswa dan Dosen",https://www.radarbogor.id/2021/12/29/fgd-tingkat-universitas-unida-bahas-dampak-implementasi-program-mbkm-terhadap-performa-mahasiswa-dan-dosen/
2021-12-29_ja_0396,2021-12-29,Jawa Pos,Jurnalis se-Jawa Timur Sambang PTSG,https://radarkudus.jawapos.com/rembang/29/12/2021/jurnalis-se-jawa-timur-sambang-ptsg/
2021-12-29_ja_0397,2021-12-29,Jawa Pos,Polda Jateng Bongkar TPPU Narkoba Senilai Rp 4 Miliar yang Dikendalikan Napi,https://radarsemarang.jawapos.com/berita/hukum-dan-kriminal/2021/12/29/polda-jateng-bongkar-tppu-narkoba-senilai-rp-4-miliar-yang-dikendalikan-napi/
2021-12-29_ja_0398,2021-12-29,Jawa Pos,5 Daftar Periksa Untuk Sekolah Tatap Muka,https://www.jawapos.com/photo/5-daftar-periksa-untuk-sekolah-tatap-muka/
2021-12-29_ja_0399,2021-12-29,Jawa Pos,BRI Hadirkan Fresh Market UMKM Binaan dan Klaster Usaha lewat Localoka,https://radarsolo.jawapos.com/ekonomi/29/12/2021/bri-hadirkan-fresh-market-umkm-binaan-dan-klaster-usaha-lewat-localoka/
2021-12-29_ja_0400,2021-12-29,Jawa Pos,"Anggaran Terbatas, Rutan Bangil Belum Mampu Tambah CCTV",https://radarbromo.jawapos.com/bangil/29/12/2021/anggaran-terbatas-rutan-bangil-belum-mampu-tambah-cctv/
2021-12-29_ja_0401,2021-12-29,Jawa Pos,"Ibu-ibu Mengeluh Harga Sembako Naik, Puan Minta Pemerintah Tegas",https://www.radarbogor.id/2021/12/29/ibu-ibu-mengeluh-harga-sembako-naik-puan-minta-pemerintah-tegas/
2021-12-29_ja_0402,2021-12-29,Jawa Pos,22 Pejabat Adu Nasib Lagi,https://radarbanyuwangi.jawapos.com/berita-daerah/situbondo/29/12/2021/22-pejabat-adu-nasib-lagi
2021-12-29_ja_0403,2021-12-29,Jawa Pos,Kurikulum Prototipe Diterapkan Tahun Depan,https://riaupos.jawapos.com/nasional/29/12/2021/264690/kurikulum-prototipe-diterapkan-tahun-depan.html
2021-12-29_ja_0404,2021-12-29,Jawa Pos,"Bangun Informasi Sehat, Fasilitasi Uji Kompetensi Wartawan",https://radarkudus.jawapos.com/rembang/29/12/2021/bangun-informasi-sehat-fasilitasi-uji-kompetensi-wartawan/
2021-12-29_ja_0405,2021-12-29,Jawa Pos,"Meski Tanpa Gejala, Ini Alasan Kasus Lokal Omicron Diisolasi di RS",https://www.jawapos.com/nasional/29/12/2021/meski-tanpa-gejala-ini-alasan-kasus-lokal-omicron-diisolasi-di-rs/
2021-12-29_ja_0406,2021-12-29,Jawa Pos,Sita 125 Botol Miras dari Warkop,https://radarmojokerto.jawapos.com/hukum-kriminal/29/12/2021/sita-125-botol-miras-dari-warkop
2021-12-29_ja_0407,2021-12-29,Jawa Pos,Sektor Ritel di Bali Diperkirakan Tumbuh 5 Persen Tahun 2022,https://baliexpress.jawapos.com/bisnis/29/12/2021/sektor-ritel-di-bali-diperkirakan-tumbuh-5-persen-tahun-2022
2021-12-29_ja_0408,2021-12-29,Jawa Pos,"Dituding Kecolongan Soal KTP Ganda, Kadisdukcapil Diminta Mundur dari Jabatannya",https://www.radarbogor.id/2021/12/29/dituding-kecolongan-soal-ktp-ganda-kadisdukcapil-diminta-mundur-dari-jabatannya/
2021-12-29_ja_0409,2021-12-29,Jawa Pos,Waspada! Harga Telur Ayam Ras Mulai Naik di Bali,https://baliexpress.jawapos.com/bisnis/29/12/2021/waspada-harga-telur-ayam-ras-mulai-naik-di-bali
2021-12-29_ja_0410,2021-12-29,Jawa Pos,Kenaikan Tarif Bus Dinilai Masih Normal,https://radarsemarang.jawapos.com/berita/jateng/magelang/2021/12/29/kenaikan-tarif-bus-dinilai-masih-normal/
2021-12-29_ja_0411,2021-12-29,Jawa Pos,"Truk Tronton Tergelincir, Eskavator Masuk Jurang",https://radarbali.jawapos.com/berita-daerah/dwipa/29/12/2021/truk-tronton-tergelincir-eskavator-masuk-jurang
2021-12-29_ja_0412,2021-12-29,Jawa Pos,Angka Kasus Curanmor yang Dilaporkan ke Polres Probolinggo di 2021,https://radarbromo.jawapos.com/kraksaan/29/12/2021/angka-kasus-curanmor-yang-dilaporkan-ke-polres-probolinggo-di-2021/
2021-12-29_ja_0413,2021-12-29,Jawa Pos,Dishub Kabupaten Magelang Siapkan Tiga Kantong Parkir Borobudur,https://radarsemarang.jawapos.com/berita/jateng/mungkid/2021/12/29/dishub-kabupaten-magelang-siapkan-tiga-kantong-parkir-borobudur/
2021-12-29_ja_0414,2021-12-29,Jawa Pos,"Artos Mall Buka, Siapkan Antisipasi Lonjakan Pengunjung",https://radarsemarang.jawapos.com/berita/jateng/magelang/2021/12/29/artos-mall-buka-siapkan-antisipasi-lonjakan-pengunjung/
2021-12-29_ja_0415,2021-12-29,Jawa Pos,Polisi Sudah Miliki Sketsa Pelaku Pembunuhan Ibu dan Anak di Subang,https://www.jawapos.com/jpg-today/29/12/2021/polisi-sudah-miliki-sketsa-pelaku-pembunuhan-ibu-dan-anak-di-subang/
2021-12-29_ja_0416,2021-12-29,Jawa Pos,Meningkatkan Aktivitas Belajar IPS Melalui Metode Mind-Mapping,https://radarsemarang.jawapos.com/artikel/untukmu-guruku/2021/12/29/meningkatkan-aktivitas-belajar-ips-melalui-metode-mind-mapping/
2021-12-29_ja_0417,2021-12-29,Jawa Pos,"MA Alami Penurunan Pemutusan Perkara 7,17 Persen Sepanjang 2021",https://www.jawapos.com/nasional/29/12/2021/ma-alami-penurunan-pemutusan-perkara-717-persen-sepanjang-2021/
2021-12-29_ja_0418,2021-12-29,Jawa Pos,"Penyederhanaan Birokrasi, Mahayastra Lantik 339 Pejabat Fungsional",https://baliexpress.jawapos.com/bali/29/12/2021/penyederhanaan-birokrasi-mahayastra-lantik-339-pejabat-fungsional
2021-12-29_ja_0419,2021-12-29,Jawa Pos,Kominfo Siapkan 200 Akses Internet Baru Buat TNI di Wilayah 3T,https://www.jawapos.com/nasional/29/12/2021/kominfo-siapkan-200-akses-internet-baru-buat-tni-di-wilayah-3t/
2021-12-29_ja_0420,2021-12-29,Jawa Pos,Reshuffle 1.502 Pejabat Pemprov Jatim,https://www.jawapos.com/surabaya/29/12/2021/reshuffle-1-502-pejabat-pemprov-jatim/
2021-12-29_ja_0421,2021-12-29,Jawa Pos,"Waktu Mepet, Empat Hari Rampung",https://radarbojonegoro.jawapos.com/boks/29/12/2021/waktu-mepet-empat-hari-rampung
2021-12-29_ja_0422,2021-12-29,Jawa Pos,Tiga Mobil Pengiring Menhub Budi Karya Sumadi Tabrakan Beruntun,https://radarbanyuwangi.jawapos.com/berita-daerah/banyuwangi/29/12/2021/tiga-mobil-pengiring-menhub-budi-karya-sumadi-tabrakan-beruntun
2021-12-29_ja_0423,2021-12-29,Jawa Pos,"Latihan, Dua Pemain Muda Arema FC Alami Cedera",https://radarmalang.jawapos.com/olahraga/29/12/2021/latihan-dua-pemain-muda-arema-fc-alami-cedera/
2021-12-29_ja_0424,2021-12-29,Jawa Pos,"Tatsuma Yoshida Mundur, Timnas Singapura Cari Pelatih Pengganti",https://www.jawapos.com/sepak-bola/sepak-bola-dunia/29/12/2021/tatsuma-yoshida-mundur-timnas-singapura-cari-pelatih-pengganti/
2021-12-29_ja_0425,2021-12-29,Jawa Pos,Panglima TNI dan Pemuka Agama Bahas Upaya Perdamaian di Papua,https://www.jawapos.com/jpg-today/29/12/2021/panglima-tni-dan-pemuka-agama-bahas-upaya-perdamaian-di-papua/
2021-12-29_ja_0426,2021-12-29,Jawa Pos,Ini Harapan Bupati Bengkalis kepada Pengurus Dekranasda,https://riaupos.jawapos.com/bengkalis/29/12/2021/264675/ini-harapan-bupati-bengkalis-kepada-pengurus-dekranasda.html
2021-12-29_ja_0427,2021-12-29,Jawa Pos,Kronologi Menularnya Varian Omicron yang Dialami Warga Medan,https://www.jawapos.com/nasional/29/12/2021/kronologi-menularnya-varian-omicron-yang-dialami-warga-medan/
2021-12-29_ja_0428,2021-12-29,Jawa Pos,"Akhir Tahun, Bali Safari Park Kembali Sambut Kelahiran Bayi Satwa",https://baliexpress.jawapos.com/bali/29/12/2021/akhir-tahun-bali-safari-park-kembali-sambut-kelahiran-bayi-satwa
2021-12-29_ja_0429,2021-12-29,Jawa Pos,Tokoh Puri Peliatan Gelar Pertemuan dengan Dinas PU Gianyar,https://baliexpress.jawapos.com/bali/29/12/2021/tokoh-puri-peliatan-gelar-pertemuan-dengan-dinas-pu-gianyar
2021-12-29_ja_0430,2021-12-29,Jawa Pos,"Cek Syarat Perjalanan Balik ke Jakarta, Berlaku Sampai 2 Januari 2022",https://www.jawapos.com/ekonomi/29/12/2021/cek-syarat-perjalanan-balik-ke-jakarta-berlaku-sampai-2-januari-2022/
2021-12-29_ja_0431,2021-12-29,Jawa Pos,34 Orang Bersaing Isi 13 Jabatan Kepala OPD Pemkot Surabaya,https://www.jawapos.com/surabaya/29/12/2021/34-orang-bersaing-isi-13-jabatan-kepala-opd-pemkot-surabaya/
2021-12-29_ja_0432,2021-12-29,Jawa Pos,Gianyar Akan Terapkan E-Parkir yang Dikerjasamakan dengan Desa Adat,https://baliexpress.jawapos.com/bali/29/12/2021/gianyar-akan-terapkan-e-parkir-yang-dikerjasamakan-dengan-desa-adat
2021-12-29_ja_0433,2021-12-29,Jawa Pos,Bappenas Sebut Bentuk Pemerintahan IKN Berdasar Konstitusi,https://www.jawapos.com/ibu-kota-baru/29/12/2021/bappenas-sebut-bentuk-pemerintahan-ikn-berdasar-konstitusi/
2021-12-29_ja_0434,2021-12-29,Jawa Pos,Dua Pemain Inti Persekap Jr Harus Absen saat Babak 16 Besar,https://radarbromo.jawapos.com/sportainment/29/12/2021/dua-pemain-inti-persekap-jr-harus-absen-saat-babak-16-besar/
2021-12-29_ja_0435,2021-12-29,Jawa Pos,Yasonna: Pandemi Paksa Kita untuk Bekerja dan Berpikir Extra Ordinary,https://www.jawapos.com/nasional/29/12/2021/yasonna-pandemi-paksa-kita-untuk-bekerja-dan-berpikir-extra-ordinary/
2021-12-29_ja_0436,2021-12-29,Jawa Pos,Ganjar Ingatkan Vaksinasi Anak Tak Hanya Pelajar: Jangan Lupakan Anak Jalanan,https://radarsolo.jawapos.com/nasional/29/12/2021/ganjar-ingatkan-vaksinasi-anak-tak-hanya-pelajar-jangan-lupakan-anak-jalanan/
2021-12-29_ja_0437,2021-12-29,Jawa Pos,Menag Ungkap Capaian Strategis Pendidikan 2021,https://www.jawapos.com/nasional/29/12/2021/menag-ungkap-capaian-strategis-pendidikan-2021/
2021-12-29_ja_0438,2021-12-29,Jawa Pos,Mengenal Jenis-Jenis Linux dan Keunggulannya,https://radarsurabaya.jawapos.com/tekno-oto/29/12/2021/mengenal-jenis-jenis-linux-dan-keunggulannya/
2021-12-29_ja_0439,2021-12-29,Jawa Pos,Komunal Sejahtera Indonesia Kirim Bantuan Pada Korban Bencana Semeru,https://www.jawapos.com/nasional/29/12/2021/komunal-sejahtera-indonesia-kirim-bantuan-pada-korban-bencana-semeru/
2021-12-29_ja_0440,2021-12-29,Jawa Pos,"Resmikan PLTD, PLN Sumbar Nyalakan Listrik Desa di Siberut Utara",https://padek.jawapos.com/sumbar/mentawai/29/12/2021/resmikan-pltd-pln-sumbar-nyalakan-listrik-desa-di-siberut-utara/
2021-12-29_ja_0441,2021-12-29,Jawa Pos,"Tingkatkan Stamina dan Kecepatan, Pesan Wapres Jelang Final AFF 2020",https://www.jawapos.com/nasional/29/12/2021/tingkatkan-stamina-dan-kecepatan-pesan-wapres-jelang-final-aff-2020/
2021-12-29_ja_0442,2021-12-29,Jawa Pos,"Natal, Penumpang dan Pesawat di Bizam Berkurang",https://lombokpost.jawapos.com/ekonomi-bisnis/29/12/2021/natal-penumpang-dan-pesawat-di-bizam-berkurang/
2021-12-29_ja_0443,2021-12-29,Jawa Pos,Tularkan Ilmu Gandrung pada Sinden-Sinden Muda,https://radarbanyuwangi.jawapos.com/features/29/12/2021/tularkan-ilmu-gandrung-pada-sinden-sinden-muda
2021-12-29_ja_0444,2021-12-29,Jawa Pos,DPD Puji Langkah Presiden Jokowi Bangun RS Internasional,https://riaupos.jawapos.com/nasional/29/12/2021/264670/dpd-puji-langkah-presiden-jokowi-bangun-rs-internasional.html
2021-12-29_ja_0445,2021-12-29,Jawa Pos,"Luncurkan Localoka, BRI Hadirkan Fresh Market UMKM Binaan dan Klaster Usaha",https://www.radarbogor.id/2021/12/29/luncurkan-localoka-bri-hadirkan-fresh-market-umkm-binaan-dan-klaster-usaha/
2021-12-29_ja_0446,2021-12-29,Jawa Pos,"Luncurkan Localoka, BRI Hadirkan Fresh Market UMKM Binaan & Klaster Usaha",https://radarsurabaya.jawapos.com/ekonomi/29/12/2021/luncurkan-localoka-bri-hadirkan-fresh-market-umkm-binaan-klaster-usaha/
2021-12-29_ja_0447,2021-12-29,Jawa Pos,Tantangan Tarik Pesawat Nomad Seberat 2 Ton,https://www.jawapos.com/surabaya/29/12/2021/tantangan-tarik-pesawat-nomad-seberat-2-ton/
2021-12-29_ja_0448,2021-12-29,Jawa Pos,"Wiku: Pemerintah Sudah Transparan, Masyarakat Diminta Tak Jalan-jalan",https://www.jawapos.com/kesehatan/29/12/2021/wiku-pemerintah-sudah-transparan-masyarakat-diminta-tak-jalan-jalan/
2021-12-29_ja_0449,2021-12-29,Jawa Pos,Hak Cipta Selawat Badar-Syubbanul Wathon Tercatat di Kemenkumham,https://www.jawapos.com/jpg-today/29/12/2021/hak-cipta-selawat-badar-syubbanul-wathon-tercatat-di-kemenkumham/
2021-12-29_ja_0450,2021-12-29,Jawa Pos,Wisatawan ke Lereng Merapi Terus Meningkat,https://radarjogja.jawapos.com/sleman-bantul/2021/12/29/wisatawan-ke-lereng-merapi-terus-meningkat/
2021-12-29_ja_0451,2021-12-29,Jawa Pos,"Luncurkan Localoka, BRI hadirkan Fresh Market UMKM Binaan & Klaster Usaha",https://padek.jawapos.com/kerjasama/bankbri/29/12/2021/luncurkan-localoka-bri-hadirkan-fresh-market-umkm-binaan-klaster-usaha/
2021-12-29_ja_0452,2021-12-29,Jawa Pos,"Pegang HP, Teknisi AC Tewas Tersambar Petir di Cileungsi",https://www.radarbogor.id/2021/12/29/pegang-hp-teknisi-ac-tewas-tersambar-petir-di-cileungsi/
2021-12-29_ja_0453,2021-12-29,Jawa Pos,"Jelang Rencana Mogok Karyawan Pertamina, Stok BBM Masih Aman",https://radarbromo.jawapos.com/probolinggo/29/12/2021/jelang-rencana-mogok-karyawan-pertamina-stok-bbm-masih-aman/
2021-12-29_ja_0454,2021-12-29,Jawa Pos,"Gandeng Kampus, Kasus Gizi Buruk dan Stunting di Surabaya Menurun",https://radarsurabaya.jawapos.com/surabaya/29/12/2021/gandeng-kampus-kasus-gizi-buruk-dan-stunting-di-surabaya-menurun/
2021-12-29_ja_0455,2021-12-29,Jawa Pos,"KPK Rayakan HUT, Febri: Ingat, Di Luar Gedung Banyak yang Sulit Makan",https://www.jawapos.com/nasional/29/12/2021/kpk-rayakan-hut-febri-ingat-di-luar-gedung-banyak-yang-sulit-makan/
2021-12-29_ja_0456,2021-12-29,Jawa Pos,WASPADA! Kasus Gigitan Anjing di Karangasem Meningkat,https://radarbali.jawapos.com/berita-daerah/dwipa/29/12/2021/waspada-kasus-gigitan-anjing-di-karangasem-meningkat
2021-12-29_ja_0457,2021-12-29,Jawa Pos,"Malam Tahun Baru, Jalan Pajajaran dan SSA Ditutup",https://www.radarbogor.id/2021/12/29/malam-tahun-baru-jalan-pajajaran-dan-ssa-ditutup/
2021-12-29_ja_0458,2021-12-29,Jawa Pos,"BERITA DUKA: Suami Ketua PD Kota Manado Noortje Van Bone, Wakil Ketua DPRD, Berpulang ke Rumah Bapa",https://manadopost.jawapos.com/berita-terbaru/29/12/2021/berita-duka-suami-ketua-pd-kota-manado-noortje-van-bone-wakil-ketua-dprd-berpulang-ke-rumah-bapa/
2021-12-29_ja_0459,2021-12-29,Jawa Pos,IndiHome Resmi Jalin Kerja Sama dengan MNC Group,https://radarmadura.jawapos.com/berita-daerah/29/12/2021/indihome-resmi-jalin-kerja-sama-dengan-mnc-group
2021-12-29_ja_0460,2021-12-29,Jawa Pos,Kaleidoskop 2021: Taliban Kembali Berkuasa di Afghanistan,https://www.jawapos.com/internasional/29/12/2021/kaleidoskop-2021-taliban-kembali-berkuasa-di-afghanistan/
2021-12-29_ja_0461,2021-12-29,Jawa Pos,Pengamat Sebut Andre Rosiade Kuasai Seni Berpolitik,https://padek.jawapos.com/sumbar/29/12/2021/pengamat-sebut-andre-rosiade-kuasai-seni-berpolitik/
2021-12-29_ja_0462,2021-12-29,Jawa Pos,"Booster AstraZeneca Manjur Cegah Omicron, 12,4 Juta Vaksin Tiba",https://www.jawapos.com/kesehatan/29/12/2021/booster-astrazeneca-manjur-cegah-omicron-124-juta-vaksin-tiba/
2021-12-29_ja_0463,2021-12-29,Jawa Pos,"Harga Naik, Satgas Pangan Pastikan Stok Aman",https://www.jawapos.com/ekonomi/29/12/2021/harga-naik-satgas-pangan-pastikan-stok-aman/
2021-12-29_ja_0464,2021-12-29,Jawa Pos,"Survei Terbaru, Nama Ahok Tiba-tiba Muncul Sebagai Kandidat Calon Presiden 2024",https://manadopost.jawapos.com/nasional/29/12/2021/survei-terbaru-nama-ahok-tiba-tiba-muncul-sebagai-kandidat-calon-presiden-2024/
2021-12-29_ja_0465,2021-12-29,Jawa Pos,"Survei Terbaru Calon Presiden 2024, Nama Ahok Tiba-tiba Muncul",https://manadopost.jawapos.com/nasional/29/12/2021/survei-terbaru-calon-presiden-2024-nama-ahok-tiba-tiba-muncul/
2021-12-29_ja_0466,2021-12-29,Jawa Pos,"Lewat Localoka, BRI Hadirkan Fresh Market UMKM Binaan&Klaster Usaha",https://radarmalang.jawapos.com/ekonomi-bisnis/29/12/2021/lewat-localoka-bri-hadirkan-fresh-market-umkm-binaanklaster-usaha/
2021-12-29_ja_0467,2021-12-29,Jawa Pos,"Peduli Sedekah Ketua DPRD Mas Mujib, Bulan Ini Digelar 3 Kali",https://radarbromo.jawapos.com/politik/29/12/2021/peduli-sedekah-ketua-dprd-mas-mujib-bulan-ini-digelar-3-kali/
2021-12-29_ja_0468,2021-12-29,Jawa Pos,"Viral Spion Dirusak Paspampres, Pengunggah Minta Maaf",https://baliexpress.jawapos.com/nasional/29/12/2021/viral-spion-dirusak-paspampres-pengunggah-minta-maaf
2021-12-29_ja_0469,2021-12-29,Jawa Pos,"Warga Dilarang Rayakan Malam Tahun Baru, Bima Arya : Sebaiknya di Rumah!",https://www.radarbogor.id/2021/12/29/warga-dilarang-rayakan-malam-tahun-baru-bima-arya-sebaiknya-di-rumah/
2021-12-29_ja_0470,2021-12-29,Jawa Pos,"Semester Genap, Sekolah Bisa PTM Full",https://radarbanyuwangi.jawapos.com/edukasi/29/12/2021/semester-genap-sekolah-bisa-ptm-full
2021-12-29_ja_0471,2021-12-29,Jawa Pos,"Gegara Rebutan Gono-Gini, Rumah Senilai Rp 25,5 M “Raib” Mendadak",https://radarmalang.jawapos.com/malang-raya/29/12/2021/gegara-rebutan-gono-gini-rumah-senilai-rp-255-m-raib-mendadak/
2021-12-29_ja_0472,2021-12-29,Jawa Pos,Partai Final Piala AFF 2020 : INDONESIA vs THAILAND,https://lombokpost.jawapos.com/sportivo/29/12/2021/partai-final-piala-aff-2020-indonesia-vs-thailand/
2021-12-29_ja_0473,2021-12-29,Jawa Pos,"Soal Tim PPIU Berangkat Umrah, Begini Kata Menag Yaqut Cholil",https://www.jawapos.com/nasional/29/12/2021/soal-tim-ppiu-berangkat-umrah-begini-kata-menag-yaqut-cholil/
