unique_id,date,source,headline,url
2021-12-09_ja_0597,2021-12-09,Jawa Pos,60 PNS Pemkot Denpasar Rebutan 12 Kursi Kepala OPD,https://radarbali.jawapos.com/berita-daerah/metro-denpasar/09/12/2021/60-pns-pemkot-denpasar-rebutan-12-kursi-kepala-opd
2021-12-09_ja_0598,2021-12-09,Jawa Pos,Pengerjaan Stadion Joyokusumo Pati Dilanjut hingga 15 Desember,https://radarkudus.jawapos.com/pati/09/12/2021/pengerjaan-stadion-joyokusumo-pati-dilanjut-hingga-15-desember/
2021-12-09_ja_0599,2021-12-09,Jawa Pos,"11 Bulan, Kejari Kota Pasuruan Tahan 6 Koruptor, Polresta 0 Kasus",https://radarbromo.jawapos.com/hukrim/09/12/2021/11-bulan-kejari-kota-pasuruan-tahan-6-koruptor-polresta-0-kasus/
2021-12-09_ja_0600,2021-12-09,Jawa Pos,"Rangkaian G20 di Bali Mulai Digelar, Delegasi Diangkut Pesawat Khusus",https://riaupos.jawapos.com/riau/09/12/2021/263482/rangkaian-g20-di-bali-mulai-digelar-delegasi-diangkut-pesawat-khusus.html
2021-12-09_ja_0601,2021-12-09,Jawa Pos,Perkuat Komitmen Sebagai Kota Layak Anak,https://padek.jawapos.com/sumbar/padang/09/12/2021/perkuat-komitmen-sebagai-kota-layak-anak/
2021-12-09_ja_0602,2021-12-09,Jawa Pos,"Ada yang Datang Terlambat, Bupati Lotim Ajak Lurah dan Kades Hargai Waktu",https://lombokpost.jawapos.com/selong/09/12/2021/ada-yang-datang-terlambat-bupati-lotim-ajak-lurah-dan-kades-hargai-waktu/
2021-12-09_ja_0603,2021-12-09,Jawa Pos,MTsN 1 Pati Kembali Raih Medali Robotik Internasional,https://radarkudus.jawapos.com/pendidikan/09/12/2021/mtsn-1-pati-kembali-raih-medali-robotik-internasional/
2021-12-09_ja_0604,2021-12-09,Jawa Pos,"22 Desember Terminal Anakaie Dioperasikan, Bus Wajib Masuk Terminal",https://padek.jawapos.com/sumbar/padang/09/12/2021/22-desember-terminal-anakaie-dioperasikan-bus-wajib-masuk-terminal/
2021-12-09_ja_0605,2021-12-09,Jawa Pos,Menag: Berantas Korupsi Harus Dimulai dari Keluarga,https://www.jawapos.com/nasional/09/12/2021/menag-berantas-korupsi-harus-dimulai-dari-keluarga/
2021-12-09_ja_0606,2021-12-09,Jawa Pos,"Ingatkan Pemilik Warung Jangan Putar Musik Keras, Bidan Disiram Air Panas",https://padek.jawapos.com/sumbar/padang/09/12/2021/ingatkan-pemilik-warung-jangan-putar-musik-keras-bidan-disiram-air-panas/
2021-12-09_ja_0607,2021-12-09,Jawa Pos,"Hindari Longsor, Wisatawan Bromo Pasuruan Disarankan Lewat Purwodadi",https://radarbromo.jawapos.com/pasuruan/09/12/2021/hindari-longsor-wisatawan-bromo-pasuruan-disarankan-lewat-purwodadi/
2021-12-09_ja_0608,2021-12-09,Jawa Pos,"Lanjutan Kasus Korupsi KONI Padang, Tunggu Hasil Audit Kerugian Negara",https://padek.jawapos.com/sumbar/09/12/2021/lanjutan-kasus-korupsi-koni-padang-tunggu-hasil-audit-kerugian-negara/
2021-12-09_ja_0609,2021-12-09,Jawa Pos,Menko Airlangga: 2022 Pemerintah Jaga Penanganan Pandemi dan Ekonomi,https://radarsidoarjo.jawapos.com/ekonomi-bisnis/09/12/2021/menko-airlangga-2022-pemerintah-jaga-penanganan-pandemi-dan-ekonomi/
2021-12-09_ja_0610,2021-12-09,Jawa Pos,Bali Siap Jadi Tuan Rumah World Water Forum 2024,https://baliexpress.jawapos.com/bali/09/12/2021/bali-siap-jadi-tuan-rumah-world-water-forum-2024
2021-12-09_ja_0611,2021-12-09,Jawa Pos,"Pencairan Dana Desa di Jepara Tersendat, Apa Sih Faktor Penyebabnya?",https://radarkudus.jawapos.com/jepara/09/12/2021/pencairan-dana-desa-di-jepara-tersendat-apa-sih-faktor-penyebabnya/
2021-12-09_ja_0612,2021-12-09,Jawa Pos,"Diduga karena Korsleting, Ritel Modern di Bypass Batu Bolong Terbakar",https://lombokpost.jawapos.com/praya/09/12/2021/diduga-karena-korsleting-ritel-modern-di-bypass-batu-bolong-terbakar/
2021-12-09_ja_0613,2021-12-09,Jawa Pos,Empat Pengunjung Pulau Merah Terseret Ombak,https://radarbanyuwangi.jawapos.com/berita-daerah/genteng/09/12/2021/empat-pengunjung-pulau-merah-terseret-ombak
2021-12-09_ja_0614,2021-12-09,Jawa Pos,Jangan Lengah meski Tak Ada Penyekatan,https://riaupos.jawapos.com/riau/09/12/2021/263480/jangan-lengah-meski-tak-ada-penyekatan.html
2021-12-09_ja_0615,2021-12-09,Jawa Pos,"Salah Sebut Wilayah, Video Desa Wisata Kemenparekraf Diprotes",https://radarsemarang.jawapos.com/berita/jateng/wonosobo/2021/12/09/salah-sebut-wilayah-video-desa-wisata-kemenparekraf-diprotes/
2021-12-09_ja_0616,2021-12-09,Jawa Pos,Vaksin Booster Pfizer/BioNTech Diklaim Bisa Melawan Omicron,https://www.jawapos.com/kesehatan/09/12/2021/vaksin-booster-pfizer-biontech-diklaim-bisa-melawan-omicron/
2021-12-09_ja_0617,2021-12-09,Jawa Pos,Terlapor Masih Berstatus Saksi,https://radarbojonegoro.jawapos.com/hukum-kriminal/09/12/2021/terlapor-masih-berstatus-saksi
2021-12-09_ja_0618,2021-12-09,Jawa Pos,Disperdagin Kota Blitar Upayakan Mitigasi Bencana di Pasar Tradisional,https://radartulungagung.jawapos.com/berita-daerah/blitar/09/12/2021/disperdagin-kota-blitar-upayakan-mitigasi-bencana-di-pasar-tradisional
2021-12-09_ja_0619,2021-12-09,Jawa Pos,"Pemkab Blitar Siap Wujudkan Kabupaten Cepat, Nyaman, dan Sejahtera",https://radartulungagung.jawapos.com/berita-daerah/blitar/09/12/2021/pemkab-blitar-siap-wujudkan-kabupaten-cepat-nyaman-dan-sejahtera
2021-12-09_ja_0620,2021-12-09,Jawa Pos,Warga Swadaya Tinggikan Tanggul Kali Tuntang,https://radarsemarang.jawapos.com/berita/jateng/demak/2021/12/09/warga-swadaya-tinggikan-tanggul-kali-tuntang/
2021-12-09_ja_0621,2021-12-09,Jawa Pos,"Kunjungi Bali, Republik Ceko Ingin Jalin Kerjasama Pariwisata",https://baliexpress.jawapos.com/bali/09/12/2021/kunjungi-bali-republik-ceko-ingin-jalin-kerjasama-pariwisata
2021-12-09_ja_0622,2021-12-09,Jawa Pos,LPMUKP Tingkatkan Kompetensi Staf Menilai Agunan,https://www.jawapos.com/ekonomi/09/12/2021/lpmukp-tingkatkan-kompetensi-staf-menilai-agunan/
2021-12-09_ja_0623,2021-12-09,Jawa Pos,"Adu Banteng Bus vs Motor di Jepara, Satu Orang Tewas di Tempat",https://radarkudus.jawapos.com/jepara/09/12/2021/adu-banteng-bus-vs-motor-di-jepara-satu-orang-tewas-di-tempat/
2021-12-09_ja_0624,2021-12-09,Jawa Pos,"Tujuh Kali Dipenjara, Tak Kapok",https://radarbojonegoro.jawapos.com/hukum-kriminal/09/12/2021/tujuh-kali-dipenjara-tak-kapok
2021-12-09_ja_0625,2021-12-09,Jawa Pos,"Bak Bonnie and Clyde, Pasangan Kekasih di Kendal Kompak Rampok Minimarket",https://radarsemarang.jawapos.com/berita/jateng/kendal/2021/12/09/bak-bonnie-and-clyde-pasangan-kekasih-di-kendal-kompak-rampok-minimarket/
2021-12-09_ja_0626,2021-12-09,Jawa Pos,"Dari 'Gelay' sampai 'BTS', ini Keywords Paling Banyak di-Googling 2021",https://www.jawapos.com/oto-dan-tekno/teknologi/09/12/2021/dari-gelay-sampai-bts-ini-keywords-paling-banyak-di-googling-2021/
2021-12-09_ja_0627,2021-12-09,Jawa Pos,"Sumur Resapan Gubernur Anies Baswedan Jebol, Kualitas Pekerjaan Sembrono",https://gorontalopost.jawapos.com/berita-terbaru/09/12/2021/sumur-resapan-gubernur-anies-baswedan-jebol-kualitas-pekerjaan-sembrono/
2021-12-09_ja_0628,2021-12-09,Jawa Pos,"Sumur Resapan Gubernur Anies Baswedan Jebol, Kualitas Pekerjaan Sembrono",https://radarpapua.jawapos.com/nusantara/09/12/2021/sumur-resapan-gubernur-anies-baswedan-jebol-kualitas-pekerjaan-sembrono/
2021-12-09_ja_0629,2021-12-09,Jawa Pos,"Potret Warga Miskin Ekstrem Kab Probolinggo; Rumah Gedek, Alas Tanah",https://radarbromo.jawapos.com/features/09/12/2021/potret-warga-miskin-ekstrem-kab-probolinggo-rumah-gedek-alas-tanah/
2021-12-09_ja_0630,2021-12-09,Jawa Pos,Seto Sebut Jadwal Pertandingan Tak Ideal,https://radarjogja.jawapos.com/jogja-sport/2021/12/09/seto-sebut-jadwal-pertandingan-tak-ideal/
2021-12-09_ja_0631,2021-12-09,Jawa Pos,Bupati Perintahkan Dinkes Gerak Cepat,https://radarmojokerto.jawapos.com/berita-daerah/mojokerto/09/12/2021/bupati-perintahkan-dinkes-gerak-cepat
2021-12-09_ja_0632,2021-12-09,Jawa Pos,Kemenkominfo Apresiasi Perkembangan Smart City Jepara,https://radarkudus.jawapos.com/jepara/09/12/2021/kemenkominfo-apresiasi-perkembangan-smart-city-jepara/
2021-12-09_ja_0633,2021-12-09,Jawa Pos,"Di Lotim, Warga yang Vaksin Dapat Kupon Undian Berhadiah Sepeda Motor",https://lombokpost.jawapos.com/selong/09/12/2021/di-lotim-warga-yang-vaksin-dapat-kupon-undian-berhadiah-sepeda-motor/
2021-12-09_ja_0634,2021-12-09,Jawa Pos,"Suami Kecantol Siswi SMA, Lady Minta Cerai",https://radarsemarang.jawapos.com/features/ambyar/2021/12/09/suami-kecantol-siswi-sma-lady-minta-cerai/
2021-12-09_ja_0635,2021-12-09,Jawa Pos,"Waspada! Jelang Libur Nararu, Empat Suspek Covid-19 Dirawat di RSUD Ciawi",https://www.radarbogor.id/2021/12/09/waspada-jelang-libur-nararu-empat-suspek-covid-19-dirawat-di-rsud-ciawi/
2021-12-09_ja_0636,2021-12-09,Jawa Pos,BNPB Laporkan 39 Orang Meninggal akibat Bencana Gunung Semeru,https://baliexpress.jawapos.com/nasional/09/12/2021/bnpb-laporkan-39-orang-meninggal-akibat-bencana-gunung-semeru
2021-12-09_ja_0637,2021-12-09,Jawa Pos,"Tagar Siskaeee Bukan Muslim Seret Rizieq, Guntur Romli: Oh Iya Imamnya",https://gorontalopost.jawapos.com/news/berita-utama/09/12/2021/tagar-siskaeee-bukan-muslim-seret-rizieq-guntur-romli-oh-iya-imamnya/
2021-12-09_ja_0638,2021-12-09,Jawa Pos,Verstappen vs Hamilton di GP Abu Dhabi: The Winner Takes All,https://www.jawapos.com/sports/09/12/2021/verstappen-vs-hamilton-di-gp-abu-dhabi-the-winner-takes-all/
2021-12-09_ja_0639,2021-12-09,Jawa Pos,Kejari Tulungagung Optimalkan Pencegahan dan Penindakan Korupsi,https://radartulungagung.jawapos.com/berita-daerah/tulungagung/09/12/2021/kejari-tulungagung-optimalkan-pencegahan-dan-penindakan-korupsi
2021-12-09_ja_0640,2021-12-09,Jawa Pos,"Oleng, Avanza Seruduk Rumah Warga",https://radarbanyuwangi.jawapos.com/berita-daerah/genteng/09/12/2021/oleng-avanza-seruduk-rumah-warga
2021-12-09_ja_0641,2021-12-09,Jawa Pos,SEA Games Vietnam Dipastikan Dihelat 12-23 Mei 2022,https://www.jawapos.com/sports/09/12/2021/sea-games-vietnam-dipastikan-dihelat-12-23-mei-2022/
2021-12-09_ja_0642,2021-12-09,Jawa Pos,"Tagar Siskaeee Bukan Muslim Seret Rizieq, Guntur Romli: Oh Iya Imamnya",https://radarpapua.jawapos.com/berita-utama/09/12/2021/tagar-siskaeee-bukan-muslim-seret-rizieq-guntur-romli-oh-iya-imamnya/
2021-12-09_ja_0643,2021-12-09,Jawa Pos,"Polisi Sita 534 Kg Ganja, 9 Tersangka Ditangkap",https://www.jawapos.com/nasional/hukum-kriminal/09/12/2021/polisi-sita-534-kg-ganja-9-tersangka-ditangkap/
2021-12-09_ja_0644,2021-12-09,Jawa Pos,Komitmen Pendidikan Vokasi dan Industri Harus Selaras demi Pembangunan,https://www.jawapos.com/nasional/pendidikan/09/12/2021/komitmen-pendidikan-vokasi-dan-industri-harus-selaras-demi-pembangunan/
2021-12-09_ja_0645,2021-12-09,Jawa Pos,”Pacar Lamo” (Episode 13),https://padek.jawapos.com/minang/09/12/2021/pacar-lamo-episode-13-3/
2021-12-09_ja_0646,2021-12-09,Jawa Pos,"Berbekal Rekaman CCTV, Polres Lotim Bekuk Dua Terduga Jambret Asal Loteng",https://lombokpost.jawapos.com/selong/09/12/2021/berbekal-rekaman-cctv-polres-lotim-bekuk-dua-terduga-jambret-asal-loteng/
2021-12-09_ja_0647,2021-12-09,Jawa Pos,Bibi Dorong Ponakan ke Tebing,https://radarjogja.jawapos.com/kulon-progo-gunung-kidul/2021/12/09/bibi-dorong-ponakan-ke-tebing/
2021-12-09_ja_0648,2021-12-09,Jawa Pos,"Komitmen Berantas Korupsi, bank bjb Peringati Hakordia 2021",https://www.jawapos.com/ekonomi/09/12/2021/komitmen-berantas-korupsi-bank-bjb-peringati-hakordia-2021/
2021-12-09_ja_0649,2021-12-09,Jawa Pos,RSKW Harus Bisa Lebih Adaptif dan Inspiratif,https://radarsemarang.jawapos.com/berita/jateng/demak/2021/12/09/rskw-harus-bisa-lebih-adaptif-dan-inspiratif/
2021-12-09_ja_0650,2021-12-09,Jawa Pos,"Pertahankan Keseimbangan Pemulihan Ekonomi Nasional, Ini yang Akan Dilakukan Pemerintah di 2022",https://www.radarbogor.id/2021/12/09/pertahankan-keseimbangan-pemulihan-ekonomi-nasional-ini-yang-akan-dilakukan-pemerintah-di-2022/
2021-12-09_ja_0651,2021-12-09,Jawa Pos,Bupati Jepara Dukung Gagasan Kenalkan Pancasila ke Kancah Dunia,https://radarkudus.jawapos.com/jepara/09/12/2021/bupati-jepara-dukung-gagasan-kenalkan-pancasila-ke-kancah-dunia/
2021-12-09_ja_0652,2021-12-09,Jawa Pos,"KKB Tewas Ditembak, Satu Senjata Diamankan, Ternyata Milik Personel TNI…",https://gorontalopost.jawapos.com/nasional/09/12/2021/kkb-tewas-ditembak-satu-senjata-diamankan-ternyata-milik-personel-tni/
2021-12-09_ja_0653,2021-12-09,Jawa Pos,"KKB Tewas Ditembak, Satu Senjata Diamankan, Ternyata Milik Personel TNI…",https://radarpapua.jawapos.com/berita-utama/09/12/2021/kkb-tewas-ditembak-satu-senjata-diamankan-ternyata-milik-personel-tni/
2021-12-09_ja_0654,2021-12-09,Jawa Pos,Kabar Gembira! Wings Air Terbang Perdana Manado – Balikpapan – Manado,https://manadopost.jawapos.com/ekonomi-bisnis/09/12/2021/kabar-gembira-wings-air-terbang-perdana-manado-balikpapan-manado/
2021-12-09_ja_0655,2021-12-09,Jawa Pos,SMPN 3 Tulungagung Makin Keren dengan Prestasi Non-Akademik,https://radartulungagung.jawapos.com/pendidikan/09/12/2021/smpn-3-tulungagung-makin-keren-dengan-prestasi-non-akademik
2021-12-09_ja_0656,2021-12-09,Jawa Pos,PT Dalam Ekspektasi Publik dan Tuntutan Inovasi,https://padek.jawapos.com/opini/09/12/2021/pt-dalam-ekspektasi-publik-dan-tuntutan-inovasi/
2021-12-09_ja_0657,2021-12-09,Jawa Pos,KPP Pratama Tulungagung Launching Tax Center di UIN SATU,https://radartulungagung.jawapos.com/berita-daerah/tulungagung/09/12/2021/kpp-pratama-tulungagung-launching-tax-center-di-uin-satu
2021-12-09_ja_0658,2021-12-09,Jawa Pos,Menko Perekonomian Airlangga: Ekonomi Terus Tumbuh,https://radarkediri.jawapos.com/show-case/09/12/2021/menko-perekonomian-airlangga-ekonomi-terus-tumbuh
2021-12-09_ja_0659,2021-12-09,Jawa Pos,Siskaeee Sudah Buat 2.000 Video dan 3.700 Foto Porno,https://www.jawapos.com/nasional/hukum-kriminal/09/12/2021/siskaeee-sudah-buat-2-000-video-dan-3-700-foto-porno/
2021-12-09_ja_0660,2021-12-09,Jawa Pos,Vaksinasi BIN Sasar Empat Daerah,https://radarsemarang.jawapos.com/berita/jateng/kendal/2021/12/09/vaksinasi-bin-sasar-empat-daerah/
2021-12-09_ja_0661,2021-12-09,Jawa Pos,Benfica Dampingi Bayern Lolos 16 Besar Liga Champions,https://baliexpress.jawapos.com/sportainment/09/12/2021/benfica-dampingi-bayern-lolos-16-besar-liga-champions
2021-12-09_ja_0662,2021-12-09,Jawa Pos,"Harapan Baru di Generasi 23,8 Tahun",https://padek.jawapos.com/nasional/09/12/2021/harapan-baru-di-generasi-238-tahun/
2021-12-09_ja_0663,2021-12-09,Jawa Pos,Produk Unggulan Suzuki Manggung di GIIAS Surabaya,https://www.jawapos.com/oto-dan-tekno/otomotif/09/12/2021/produk-unggulan-suzuki-manggung-di-giias-surabaya/
2021-12-09_ja_0664,2021-12-09,Jawa Pos,"Hari Antikorupsi, Ini Tipikor Ditangani Kejari Kota-Kab Probolinggo",https://radarbromo.jawapos.com/probolinggo/09/12/2021/hari-antikorupsi-ini-tipikor-ditangani-kejari-kota-kab-probolinggo/
2021-12-09_ja_0665,2021-12-09,Jawa Pos,Persikas Jr Siap Bertarung di Piala Soeratin,https://radarsemarang.jawapos.com/sport/2021/12/09/persikas-jr-siap-bertarung-di-piala-soeratin/
2021-12-09_ja_0666,2021-12-09,Jawa Pos,IDI Salatiga Belum Punya Homebase,https://radarsemarang.jawapos.com/berita/jateng/salatiga/2021/12/09/idi-salatiga-belum-punya-homebase/
2021-12-09_ja_0667,2021-12-09,Jawa Pos,"Usai Teori, 73 Mahasiswi Universitas An Nur Purwodadi Dilepas Praktik",https://radarkudus.jawapos.com/grobogan/09/12/2021/usai-teori-73-mahasiswi-universitas-an-nur-purwodadi-dilepas-praktik/
2021-12-09_ja_0668,2021-12-09,Jawa Pos,"Berpotensi Jadi Silpa dan Rancangan APBDes 2022, Inspektorat Turun",https://radarbali.jawapos.com/hukum-kriminal/09/12/2021/berpotensi-jadi-silpa-dan-rancangan-apbdes-2022-inspektorat-turun
2021-12-09_ja_0669,2021-12-09,Jawa Pos,"Ditahan Imbang Young Boys, MU Istirahatkan Banyak Pemain",https://baliexpress.jawapos.com/sportainment/09/12/2021/ditahan-imbang-young-boys-mu-istirahatkan-banyak-pemain
2021-12-09_ja_0670,2021-12-09,Jawa Pos,Polres Semarang Pastikan Keamanan Gereja Selama Natal,https://radarsemarang.jawapos.com/berita/jateng/ungaran/2021/12/09/polres-semarang-pastikan-keamanan-gereja-selama-natal/
2021-12-09_ja_0671,2021-12-09,Jawa Pos,Pertahankan Keseimbangan Penanganan Pandemi dan Pemulihan Ekonomi,https://radarsurabaya.jawapos.com/nasional/09/12/2021/pertahankan-keseimbangan-penanganan-pandemi-dan-pemulihan-ekonomi/
2021-12-09_ja_0672,2021-12-09,Jawa Pos,"Tahun 2022, Pemerintah Pertahankan Keseimbangan dalam Penanganan",https://radarbojonegoro.jawapos.com/berita-daerah/bojonegoro/09/12/2021/tahun-2022-pemerintah-pertahankan-keseimbangan-dalam-penanganan
2021-12-09_ja_0673,2021-12-09,Jawa Pos,"Bejad! Belasan Santri Dicabuli Oknum Guru Pesantren, 8 Diantaranya Melahirkan",https://www.radarbogor.id/2021/12/09/bejad-belasan-santri-dicabuli-oknum-guru-pesantren-8-diantaranya-melahirkan/
2021-12-09_ja_0674,2021-12-09,Jawa Pos,Sea Games 2021 Bakal Digelar 12-23 Mei 2022,https://www.jawapos.com/sports/09/12/2021/sea-games-2021-bakal-digelar-12-23-mei-2022/
2021-12-09_ja_0675,2021-12-09,Jawa Pos,"Sumur Resapan Gubernur Anies Baswedan Jebol, Kualitas Pekerjaan Sembrono, Dilaporkan Arnold Mamesah",https://manadopost.jawapos.com/berita-terbaru/09/12/2021/sumur-resapan-gubernur-anies-baswedan-jebol-kualitas-pekerjaan-sembrono-dilaporkan-arnold-mamesah/
2021-12-09_ja_0676,2021-12-09,Jawa Pos,Pertamina Kirim Bantuan Bencana Semeru dan Pastikan Pasokan Energi Lancar,https://radarsurabaya.jawapos.com/nasional/09/12/2021/pertamina-kirim-bantuan-bencana-semeru-dan-pastikan-pasokan-energi-lancar/
2021-12-09_ja_0677,2021-12-09,Jawa Pos,"Di Sini Rp 100 Ribu, Di Belanda Laku Rp 350 Ribu",https://www.jawapos.com/surabaya/09/12/2021/di-sini-rp-100-ribu-di-belanda-laku-rp-350-ribu/
2021-12-09_ja_0678,2021-12-09,Jawa Pos,"Dolar Tergelincir karena Kekhawatiran Omicron Mereda, Aussie Menguat",https://baliexpress.jawapos.com/bisnis/09/12/2021/dolar-tergelincir-karena-kekhawatiran-omicron-mereda-aussie-menguat
2021-12-09_ja_0679,2021-12-09,Jawa Pos,"Akhir Tahun, IWAPI Jakarta Siap Ekspor ke Belanda",https://www.jawapos.com/jabodetabek/09/12/2021/akhir-tahun-iwapi-jakarta-siap-ekspor-ke-belanda/
2021-12-09_ja_0680,2021-12-09,Jawa Pos,"Angkut Sampah Libur Nataru di Puncak, UPT Kerahkan 27 truk, Satu Tronton",https://www.radarbogor.id/2021/12/09/angkut-sampah-libur-nataru-di-puncak-upt-kerahkan-27-truk-satu-tronton/
2021-12-09_ja_0681,2021-12-09,Jawa Pos,Dispenduk Capil Kota Probolinggo Permudah Layanan Kependudukan,https://radarbromo.jawapos.com/probolinggo/09/12/2021/dispenduk-capil-kota-probolinggo-permudah-layanan-kependudukan/
2021-12-09_ja_0682,2021-12-09,Jawa Pos,Tidak Fokus di Satu Bidang,https://radarbojonegoro.jawapos.com/perempuan/yuk/09/12/2021/tidak-fokus-di-satu-bidang
2021-12-09_ja_0683,2021-12-09,Jawa Pos,Kodim Grobogan Lepas Dua Satgas Apter Koramil ke Papua,https://radarkudus.jawapos.com/grobogan/09/12/2021/kodim-grobogan-lepas-dua-satgas-apter-koramil-ke-papua/
2021-12-09_ja_0684,2021-12-09,Jawa Pos,Tampilkan Potensi Ikan Hias dan Kembangkan BBI,https://radarbanyuwangi.jawapos.com/berita-daerah/genteng/09/12/2021/tampilkan-potensi-ikan-hias-dan-kembangkan-bbi
2021-12-09_ja_0685,2021-12-09,Jawa Pos,"Ini Keunggulan Sanankerto, Pujon Kidul, dan Gubugklakah",https://radarmalang.jawapos.com/malang-raya/09/12/2021/ini-keunggulan-sanankerto-pujon-kidul-dan-gubugklakah/
2021-12-09_ja_0686,2021-12-09,Jawa Pos,Ujian Susulan Minggu,https://radarbojonegoro.jawapos.com/berita-daerah/lamongan/09/12/2021/ujian-susulan-minggu
2021-12-09_ja_0687,2021-12-09,Jawa Pos,"Berikut 15 Klub Lolos 16 Besar Liga Champions, Atalanta vs Villareal Tertunda",https://www.radarbogor.id/2021/12/09/berikut-15-klub-lolos-16-besar-liga-champions-atalanta-vs-villareal-tertunda/
2021-12-09_ja_0688,2021-12-09,Jawa Pos,Korban Banjir di Lobar Keluhkan Bantuan Tidak Merata,https://lombokpost.jawapos.com/giri-menang/09/12/2021/korban-banjir-di-lobar-keluhkan-bantuan-tidak-merata/
2021-12-09_ja_0689,2021-12-09,Jawa Pos,Solidaritas Mahasiswa di Jakarta untuk Korban Erupsi Gunung Semeru,https://www.jawapos.com/jabodetabek/09/12/2021/solidaritas-mahasiswa-di-jakarta-untuk-korban-erupsi-gunung-semeru/
2021-12-09_ja_0690,2021-12-09,Jawa Pos,Thak-thakan Diinventarisir Jadi Aset Budaya,https://radarbojonegoro.jawapos.com/berita-daerah/tuban/09/12/2021/thak-thakan-diinventarisir-jadi-aset-budaya
2021-12-09_ja_0691,2021-12-09,Jawa Pos,"Hamili Santriwati, Guru Pesantren Janjikan jadi Polisi Wanita, Mengurus Pesantren, Membiayai Kuliah",https://manadopost.jawapos.com/berita-terbaru/09/12/2021/hamili-santriwati-guru-pesantren-janjikan-jadi-polisi-wanita-mengurus-pesantren-membiayai-kuliah/
2021-12-09_ja_0692,2021-12-09,Jawa Pos,Revitalisasi Pasar Dukung Pemulihan Ekonomi,https://lombokpost.jawapos.com/ekonomi-bisnis/09/12/2021/revitalisasi-pasar-dukung-pemulihan-ekonomi/
2021-12-09_ja_0693,2021-12-09,Jawa Pos,"Klaim Punya DNA Liga Champions, tapi AC Milan Finis Juru Kunci",https://www.jawapos.com/sepak-bola/sepak-bola-dunia/09/12/2021/klaim-punya-dna-liga-champions-tapi-ac-milan-finis-juru-kunci/
2021-12-09_ja_0694,2021-12-09,Jawa Pos,"Demi Prestasi Wushu Indonesia, Ketum PB WI Akan Bangun Pusat Pelatihan",https://radarbojonegoro.jawapos.com/berita-daerah/bojonegoro/09/12/2021/demi-prestasi-wushu-indonesia-ketum-pb-wi-akan-bangun-pusat-pelatihan
2021-12-09_ja_0695,2021-12-09,Jawa Pos,"Tugu Adipura di Simpang Penjara Dibongkar, Diganti Jam Era Kolonial",https://radarbromo.jawapos.com/pasuruan/09/12/2021/tugu-adipura-di-simpang-penjara-dibongkar-diganti-jam-era-kolonial/
2021-12-09_ja_0696,2021-12-09,Jawa Pos,NIP Dituding Jadi Biang Banjir,https://radarmojokerto.jawapos.com/berita-daerah/mojokerto/09/12/2021/nip-dituding-jadi-biang-banjir
2021-12-09_ja_0697,2021-12-09,Jawa Pos,Dorong Motivasi Belajar via Refleksi Terbimbing,https://radarsolo.jawapos.com/pendidikan/09/12/2021/dorong-motivasi-belajar-via-refleksi-terbimbing/
2021-12-09_ja_0698,2021-12-09,Jawa Pos,"Barcelona Terlempar ke Liga Europa,  Busquets : Sangat Menyakitkan",https://www.radarbogor.id/2021/12/09/barcelona-terlempar-ke-liga-europa-busquets-sangat-menyakitkan/
2021-12-09_ja_0699,2021-12-09,Jawa Pos,Robot Pintar Antarkan Abas Shofwan Jadi Guru Berprestasi Nasional 2021,https://radarkediri.jawapos.com/features/09/12/2021/robot-pintar-antarkan-abas-shofwan-jadi-guru-berprestasi-nasional-2021
2021-12-09_ja_0700,2021-12-09,Jawa Pos,"Anthony Ginting: Waktunya Istirahat, Capek Banget!",https://www.jawapos.com/sports/09/12/2021/anthony-ginting-waktunya-istirahat-capek-banget/
2021-12-09_ja_0701,2021-12-09,Jawa Pos,Tahun Ini Pemkab Grobogan Targetkan Tanam Kedelai di Lahan 15.355 Hektare,https://radarkudus.jawapos.com/grobogan/09/12/2021/tahun-ini-pemkab-grobogan-targetkan-tanam-kedelai-di-lahan-15-355-hektare/
2021-12-09_ja_0702,2021-12-09,Jawa Pos,"Pertama Kali dalam 20 Tahun Gagal ke 16 Besar, Barcelona Bukan Tim Terbaik Lagi",https://www.radarbogor.id/2021/12/09/pertama-kali-dalam-20-tahun-gagal-ke-16-besar-barcelona-bukan-tim-terbaik-lagi/
2021-12-09_ja_0703,2021-12-09,Jawa Pos,Ketika Korupsi Menjarah Bantuan Sosial,https://radarkediri.jawapos.com/hukum-kriminal/09/12/2021/ketika-korupsi-menjarah-bantuan-sosial
2021-12-09_ja_0704,2021-12-09,Jawa Pos,Warga Bersikeras Minta Harga Tanah Bandara Dhoho Naik,https://radarkediri.jawapos.com/politik/09/12/2021/warga-bersikeras-minta-harga-tanah-bandara-dhoho-naik
2021-12-09_ja_0705,2021-12-09,Jawa Pos,Tambah Fee hingga Beli di Bawah HET,https://radarkediri.jawapos.com/hukum-kriminal/09/12/2021/tambah-fee-hingga-beli-di-bawah-het
2021-12-09_ja_0706,2021-12-09,Jawa Pos,"Ditinggal Salat Istri, Warga Mojoroto Setubuhi Keponakan",https://radarkediri.jawapos.com/hukum-kriminal/09/12/2021/ditinggal-salat-istri-warga-mojoroto-setubuhi-keponakan
2021-12-09_ja_0707,2021-12-09,Jawa Pos,Dispendukcapil Kota Pasuruan Sosialisasikan Dukcapil Go-Digital,https://radarbromo.jawapos.com/pasuruan/09/12/2021/dispendukcapil-kota-pasuruan-sosialisasikan-dukcapil-go-digital/
2021-12-09_ja_0708,2021-12-09,Jawa Pos,Proyek Jembatan Baru Ploso Tunggu Seluruh Girder Terpasang,https://radarjombang.jawapos.com/berita-daerah/09/12/2021/proyek-jembatan-baru-ploso-tunggu-seluruh-girder-terpasang
2021-12-09_ja_0709,2021-12-09,Jawa Pos,"Terkait Pemilihan KDAW Mayangan, Mantan Kades Menang Lewat Voting",https://radarjombang.jawapos.com/berita-daerah/09/12/2021/terkait-pemilihan-kdaw-mayangan-mantan-kades-menang-lewat-voting
2021-12-09_ja_0710,2021-12-09,Jawa Pos,"Adu Kuat Tahan Napas Dalam Kolam, Bocah 12 Tahun Meninggal",https://radarbanyuwangi.jawapos.com/berita-daerah/banyuwangi/09/12/2021/adu-kuat-tahan-napas-dalam-kolam-bocah-12-tahun-meninggal
2021-12-09_ja_0711,2021-12-09,Jawa Pos,Begini Sekolah yang Siaga Pandemi,https://radarmalang.jawapos.com/malang-raya/09/12/2021/begini-sekolah-yang-siaga-pandemi/
2021-12-09_ja_0712,2021-12-09,Jawa Pos,Fraksi PDIP Dharmasraya Bangun Masjid dengan Dana Pokir,https://padek.jawapos.com/sumbar/dharmasraya/09/12/2021/51988/
2021-12-09_ja_0713,2021-12-09,Jawa Pos,"KAPOLRI DIGUGAT: Angkat ASN Polri Novel Baswedan, Sepupu Gubernur DKI Anies",https://gorontalopost.jawapos.com/news/berita-utama/09/12/2021/kapolri-digugat-angkat-asn-polri-novel-baswedan-sepupu-gubernur-dki-anies/
2021-12-09_ja_0714,2021-12-09,Jawa Pos,"KAPOLRI DIGUGAT: Angkat ASN Polri Novel Baswedan, Sepupu Gubernur DKI Anies",https://radarpapua.jawapos.com/berita-utama/09/12/2021/kapolri-digugat-angkat-asn-polri-novel-baswedan-sepupu-gubernur-dki-anies/
2021-12-09_ja_0715,2021-12-09,Jawa Pos,Mengenal Dirut PLN Darmawan Prasodjo: Ahli Perubahan Iklim dan EBT,https://radarkudus.jawapos.com/ekonomi/09/12/2021/mengenal-dirut-pln-darmawan-prasodjo-ahli-perubahan-iklim-dan-ebt/
2021-12-09_ja_0716,2021-12-09,Jawa Pos,Target Capai Herd Immunity Full Akhir Tahun,https://radarjogja.jawapos.com/jogja-raya/2021/12/09/target-capai-herd-immunity-full-akhir-tahun/
2021-12-09_ja_0717,2021-12-09,Jawa Pos,"Serahkan Bantuan Bencana, Pertamina Pastikan Pasokan Energi Lancar",https://radarmalang.jawapos.com/malang-raya/09/12/2021/serahkan-bantuan-bencana-pertamina-pastikan-pasokan-energi-lancar/
2021-12-09_ja_0718,2021-12-09,Jawa Pos,"Tagar Siskaeee Bukan Muslim Seret Rizieq, Guntur Romli: Oh Iya Imamnya Kena Kasus Chat Cabul Kan",https://manadopost.jawapos.com/berita-utama/09/12/2021/tagar-siskaeee-bukan-muslim-seret-rizieq-guntur-romli-oh-iya-imamnya-kena-kasus-chat-cabul-kan/
