unique_id,date,source,headline,url
2021-07-25_ja_0000,2021-07-25,Jawa Pos,Pemotor asal Tunggulwulung jadi Korban Tabrak Lari,https://radarbromo.jawapos.com/pandaan/25/07/2021/pemotor-asal-tunggulwulung-jadi-korban-tabrak-lari/
2021-07-25_ja_0001,2021-07-25,Jawa Pos,Wali Kota Bogor Klaim Ganjil Genap Diapresiasi Dua Menteri,https://www.radarbogor.id/2021/07/25/wali-kota-bogor-klaim-ganjil-genap-diapresiasi-dua-menteri/
2021-07-25_ja_0002,2021-07-25,Jawa Pos,KRI dr Soeharso Disiapkan Jadi Depo Isi Ulang Oksigen 24 Jam,https://radarsurabaya.jawapos.com/read/2021/07/25/277839/kri-dr-soeharso-disiapkan-jadi-depo-isi-ulang-oksigen-24-jam
2021-07-25_ja_0003,2021-07-25,Jawa Pos,"Boyong Batman, Wali Kota Habib Hadi Kunjungi Warga Isoman",https://radarbromo.jawapos.com/probolinggo/25/07/2021/boyong-batman-wali-kota-habib-hadi-kunjungi-warga-isoman/
2021-07-25_ja_0004,2021-07-25,Jawa Pos,Menang Banyak! Service Motor Yamaha dapat potongan Oli Rp15.000,https://www.radarbogor.id/2021/07/25/menang-banyak-service-motor-yamaha-dapat-potongan-oli-rp15-000/
2021-07-25_ja_0005,2021-07-25,Jawa Pos,"Usai Dikalahkan Telak Ginting, No 1 Hungaria: Gila, Dia Bagus Sekali",https://www.jawapos.com/sports/25/07/2021/usai-dikalahkan-telak-ginting-no-1-hungaria-gila-dia-bagus-sekali/
2021-07-25_ja_0006,2021-07-25,Jawa Pos,20 Bus BTS Segera Mengaspal di Kota Bogor,https://www.radarbogor.id/2021/07/25/20-bus-bts-segera-mengaspal-di-kota-bogor/
2021-07-25_ja_0007,2021-07-25,Jawa Pos,Angka Kematian Covid di Jatim Tertinggi Kedua di Indonesia,https://radarsurabaya.jawapos.com/read/2021/07/25/277836/angka-kematian-covid-di-jatim-tertinggi-kedua-di-indonesia
2021-07-25_ja_0008,2021-07-25,Jawa Pos,"PPKM Level 4 Berakhir, Penutupan Jalan Hanya pada Malam Hari",https://radarsolo.jawapos.com/daerah/solo/25/07/2021/ppkm-level-4-berakhir-penutupan-jalan-hanya-pada-malam-hari/
2021-07-25_ja_0009,2021-07-25,Jawa Pos,"Jadi Yatim Piatu karena Covid-19, Dapat Beasiswa dari Sandiaga",https://radarsidoarjo.jawapos.com/ekonomi-bisnis/25/07/2021/jadi-yatim-piatu-karena-covid-19-dapat-beasiswa-dari-sandiaga/
2021-07-25_ja_0010,2021-07-25,Jawa Pos,"Diduga Korsleting Listrik, Rumah Gus Krisna Ludes Terbakar",https://radarbali.jawapos.com/read/2021/07/25/277821/diduga-korsleting-listrik-rumah-gus-krisna-ludes-terbakar
2021-07-25_ja_0011,2021-07-25,Jawa Pos,"Lewat Pertarungan Sangat Dramatis, No 1 Indonesia Lolos Perempat Final",https://www.jawapos.com/sports/25/07/2021/lewat-pertarungan-sangat-dramatis-no-1-indonesia-lolos-perempat-final/
2021-07-25_ja_0012,2021-07-25,Jawa Pos,Eko Yuli Pertahankan Medali Perak Olimpiade,https://www.radarbogor.id/2021/07/25/eko-yuli-pertahankan-medali-perak-olimpiade/
2021-07-25_ja_0013,2021-07-25,Jawa Pos,Tekan Laju Infeksi Covid-19 dengan Opsi Longstay,https://radarsidoarjo.jawapos.com/ekonomi-bisnis/25/07/2021/tekan-laju-infeksi-covid-19-dengan-opsi-longstay/
2021-07-25_ja_0014,2021-07-25,Jawa Pos,Pemerintah Guyur Insentif untuk Masyarakat Selama PPKM,https://www.jawapos.com/nasional/25/07/2021/pemerintah-guyur-insentif-untuk-masyarakat-selama-ppkm/
2021-07-25_ja_0015,2021-07-25,Jawa Pos,Madurasa Dhek Lanjeng Sajikan Menu Baru,https://radarmadura.jawapos.com/read/2021/07/25/277823/madurasa-dhek-lanjeng-sajikan-menu-baru
2021-07-25_ja_0016,2021-07-25,Jawa Pos,"Perpanjang PPKM, Pemerintah Tanggung Pajak Tenant Mal 2 Bulan",https://www.jawapos.com/nasional/25/07/2021/perpanjang-ppkm-pemerintah-tanggung-pajak-tenant-mal-2-bulan/
2021-07-25_ja_0017,2021-07-25,Jawa Pos,Pemkot Surakarta Siapkan Manajemen Pemanfaatan Oksigen,https://radarsolo.jawapos.com/daerah/solo/25/07/2021/pemkot-surakarta-siapkan-manajemen-pemanfaatan-oksigen/
2021-07-25_ja_0018,2021-07-25,Jawa Pos,"Izin Poligami Tak Dikasih, Pilih Kabur dengan Wanita Lain",https://radarsurabaya.jawapos.com/read/2021/07/25/277822/izin-poligami-tak-dikasih-pilih-kabur-dengan-wanita-lain
2021-07-25_ja_0019,2021-07-25,Jawa Pos,Ini Wajah Para Pelaku hingga Tewasnya De Budi di Monang Maning,https://radarbali.jawapos.com/read/2021/07/25/277820/ini-wajah-para-pelaku-hingga-tewasnya-de-budi-di-monang-maning
2021-07-25_ja_0020,2021-07-25,Jawa Pos,Menko Airlangga: Pemerintah Tambah Bansos di Level IV,https://radarbali.jawapos.com/read/2021/07/25/277803/menko-airlangga-pemerintah-tambah-bansos-di-level-iv
2021-07-25_ja_0021,2021-07-25,Jawa Pos,"Pabrik Diizinkan Buka 100 Persen, Jika Melanggar Dihentikan Lagi",https://www.jawapos.com/nasional/25/07/2021/pabrik-diizinkan-buka-100-persen-jika-melanggar-dihentikan-lagi/
2021-07-25_ja_0022,2021-07-25,Jawa Pos,Luhut Ungkap Jurus Turunkan Angka Kematian akibat Covid-19,https://www.jawapos.com/nasional/25/07/2021/luhut-ungkap-jurus-turunkan-angka-kematian-akibat-covid-19/
2021-07-25_ja_0023,2021-07-25,Jawa Pos,"PPKM Level 4 Lanjut Tapi Mal Boleh Buka, Dibatasi Sampai Jam Segini",https://radarmalang.jawapos.com/ekonomi-bisnis/25/07/2021/ppkm-level-4-lanjut-tapi-mal-boleh-buka-dibatasi-sampai-jam-segini/
2021-07-25_ja_0024,2021-07-25,Jawa Pos,"Kejutan, Prancis Bikin Amerika Kalah untuk Kali Pertama Sejak 2004",https://www.jawapos.com/sports/25/07/2021/kejutan-prancis-bikin-amerika-kalah-untuk-kali-pertama-sejak-2004/
2021-07-25_ja_0025,2021-07-25,Jawa Pos,"Apresiasi Sembako JPS, Rezka Minta Pemda Fokus & Taktis Atasi Pandemi",https://padek.jawapos.com/sumbar/25/07/2021/apresiasi-sembako-jps-rezka-minta-pemda-fokus-taktis-atasi-pandemi/
2021-07-25_ja_0026,2021-07-25,Jawa Pos,Pasien Isolasi di Asrama Haji Surabaya Terus Menurun,https://radarsurabaya.jawapos.com/read/2021/07/25/277819/pasien-isolasi-di-asrama-haji-surabaya-terus-menurun
2021-07-25_ja_0027,2021-07-25,Jawa Pos,Airlangga: Pemerintah Tambah Bansos di Level IV,https://radarjember.jawapos.com/berita-jember/25/07/2021/airlangga-pemerintah-tambah-bansos-di-level-iv/
2021-07-25_ja_0028,2021-07-25,Jawa Pos,"Presiden Beri Kelonggaran Buka untuk Pasar, Warung Makan dan PKL",https://radarsurabaya.jawapos.com/read/2021/07/25/277818/presiden-beri-kelonggaran-buka-untuk-pasar-warung-makan-dan-pkl
2021-07-25_ja_0029,2021-07-25,Jawa Pos,"Agar Tidak Panik Ketika Anak Kena Covid-19 dan Isoman di Rumah, Ini Kiatnya",https://www.radarbogor.id/2021/07/25/agar-tidak-panik-ketika-anak-kena-covid-19-dan-isoman-di-rumah-ini-kiatnya/
2021-07-25_ja_0030,2021-07-25,Jawa Pos,"PPKM Level 4 Diberlakukan, Soal Bansos Jokowi Bilang Begini",https://www.jawapos.com/nasional/25/07/2021/ppkm-level-4-diberlakukan-soal-bansos-jokowi-bilang-begini/
2021-07-25_ja_0031,2021-07-25,Jawa Pos,PQ4R untuk Meningkatkan Prestasi Belajar Siswa,https://radarkudus.jawapos.com/read/2021/07/25/277817/pq4r-untuk-meningkatkan-prestasi-belajar-siswa
2021-07-25_ja_0032,2021-07-25,Jawa Pos,Reward dan Kedisiplinan Siswa dalam PJJ,https://radarkudus.jawapos.com/read/2021/07/25/277816/reward-dan-kedisiplinan-siswa-dalam-pjj
2021-07-25_ja_0033,2021-07-25,Jawa Pos,Ini Penyesuaian Aturan PPKM Level 4 yang Diperpanjang,https://baliexpress.jawapos.com/read/2021/07/25/277815/ini-penyesuaian-aturan-ppkm-level-4-yang-diperpanjang
2021-07-25_ja_0034,2021-07-25,Jawa Pos,Menko Airlangga: Pemerintah Tambah Bansos di Level IV,https://radarbromo.jawapos.com/news/25/07/2021/menko-airlangga-pemerintah-tambah-bansos-di-level-iv/
2021-07-25_ja_0035,2021-07-25,Jawa Pos,Terapi hanya Ringankan Gejala Asma,https://radarkudus.jawapos.com/read/2021/07/25/277814/terapi-hanya-ringankan-gejala-asma
2021-07-25_ja_0036,2021-07-25,Jawa Pos,"Luhut: Boleh Gelar Resepsi Pernikahan, Asal Tak Lebih dari 20 Orang",https://www.jawapos.com/nasional/25/07/2021/luhut-boleh-gelar-resepsi-pernikahan-asal-tak-lebih-dari-20-orang/
2021-07-25_ja_0037,2021-07-25,Jawa Pos,Airlangga: Pemerintah Tambah Bansos di Level IV,https://manadopost.jawapos.com/nasional/25/07/2021/airlangga-pemerintah-tambah-bansos-di-level-iv/
2021-07-25_ja_0038,2021-07-25,Jawa Pos,"Masyarakat Tenang, Airlangga Jamin Pemerintah Tambah Bansos di Level IV",https://gorontalopost.jawapos.com/news/25/07/2021/masyarakat-tenang-airlangga-jamin-pemerintah-tambah-bansos-di-level-iv/
2021-07-25_ja_0039,2021-07-25,Jawa Pos,Peran Orang Tua dalam Pembelajaran Daring,https://radarkudus.jawapos.com/read/2021/07/25/277813/peran-orang-tua-dalam-pembelajaran-daring
2021-07-25_ja_0040,2021-07-25,Jawa Pos,Menko Airlangga: Pemerintah Tambah Bansos di Level IV,https://radarpapua.jawapos.com/berita-utama/25/07/2021/menko-airlangga-pemerintah-tambah-bansos-di-level-iv/
2021-07-25_ja_0041,2021-07-25,Jawa Pos,Mahasiswa Minta Dilibatkan dalam Penanganan Covid-19,https://radarbanyuwangi.jawapos.com/read/2021/07/25/277713/mahasiswa-minta-dilibatkan-dalam-penanganan-covid-19
2021-07-25_ja_0042,2021-07-25,Jawa Pos,Airlangga: Pemerintah Akan Tambah Bansos di PPKM Level IV,https://radarsurabaya.jawapos.com/read/2021/07/25/277812/airlangga-pemerintah-akan-tambah-bansos-di-ppkm-level-iv
2021-07-25_ja_0043,2021-07-25,Jawa Pos,Pembelajaran Daring dan Luring di Masa Pandemi,https://radarkudus.jawapos.com/read/2021/07/25/277811/pembelajaran-daring-dan-luring-di-masa-pandemi
2021-07-25_ja_0044,2021-07-25,Jawa Pos,Papua Bakal Tutup Akses Keluar-Masuk 1 Bulan,https://radarpapua.jawapos.com/berita-utama/25/07/2021/papua-bakal-tutup-akses-keluar-masuk-1-bulan/
2021-07-25_ja_0045,2021-07-25,Jawa Pos,Kurban Muslim Singapura untuk Warga RI Terdampak Pandemi & Bencana,https://radarsurabaya.jawapos.com/read/2021/07/25/277808/kurban-muslim-singapura-untuk-warga-ri-terdampak-pandemi-bencana
2021-07-25_ja_0046,2021-07-25,Jawa Pos,"PPKM Level 3, Mal Sudah Buka Lagi Tapi Sampai Jam 5 Sore",https://www.jawapos.com/nasional/25/07/2021/ppkm-level-3-mal-sudah-buka-lagi-tapi-sampai-jam-5-sore/
2021-07-25_ja_0047,2021-07-25,Jawa Pos,JNE Salurkan 2275 Antigen dan 2720 Masker N95 untuk Pemkot Surabaya,https://radarsurabaya.jawapos.com/read/2021/07/25/277807/jne-salurkan-2275-antigen-dan-2720-masker-n95-untuk-pemkot-surabaya
2021-07-25_ja_0048,2021-07-25,Jawa Pos,Gubernur dan Direktur RSUD NTB Bantu Keluarga Pasien Kurang Mampu,https://lombokpost.jawapos.com/ntb/25/07/2021/gubernur-dan-direktur-rsud-ntb-bantu-keluarga-pasien-kurang-mampu/
2021-07-25_ja_0049,2021-07-25,Jawa Pos,Vaksinasi Pelajar di Jatim Baru Tercapai 2 Persen,https://radarsurabaya.jawapos.com/read/2021/07/25/277805/vaksinasi-pelajar-di-jatim-baru-tercapai-2-persen
2021-07-25_ja_0050,2021-07-25,Jawa Pos,Warga Swedia Ditemukan Tewas di Kamar Apartemen Bali,https://radarbali.jawapos.com/read/2021/07/25/277793/warga-swedia-ditemukan-tewas-di-kamar-apartemen-bali
2021-07-25_ja_0051,2021-07-25,Jawa Pos,Jokowi: Pedagang Hingga Pangkas Rambut Boleh Buka Sampai Jam 9 Malam,https://www.jawapos.com/nasional/25/07/2021/jokowi-pedagang-hingga-pangkas-rambut-boleh-buka-sampai-jam-9-malam/
2021-07-25_ja_0052,2021-07-25,Jawa Pos,Review Asus ZenBook UM325S dengan OLED Display dan Ryzen 7 5800U,https://www.jawapos.com/oto-dan-tekno/review/25/07/2021/review-asus-zenbook-um325s-dengan-oled-display-dan-ryzen-7-5800u/
2021-07-25_ja_0053,2021-07-25,Jawa Pos,Mahasiswa Antusias Jadi Relawan Tenaga Kesehatan,https://www.jawapos.com/surabaya/25/07/2021/mahasiswa-antusias-jadi-relawan-tenaga-kesehatan/
2021-07-25_ja_0054,2021-07-25,Jawa Pos,"PPKM Level 4 Diperpanjang hingga 2 Agustus,Warung Buka Terbatas",https://radargresik.jawapos.com/ekonomi-bisnis/25/07/2021/ppkm-level-4-diperpanjang-hingga-2-agustuswarung-buka-terbatas/
2021-07-25_ja_0055,2021-07-25,Jawa Pos,"PPKM Level 4, Pengunjung Restoran Bisa Makan di Tempat",https://www.jawapos.com/nasional/25/07/2021/ppkm-level-4-pengunjung-restoran-bisa-makan-di-tempat/
2021-07-25_ja_0056,2021-07-25,Jawa Pos,"Seleksi PPPK, 620 Ribuan Guru non ASN Mendaftar",https://www.radarbogor.id/2021/07/25/seleksi-pppk-620-ribuan-guru-non-asn-mendaftar/
2021-07-25_ja_0057,2021-07-25,Jawa Pos,"Awas Muncul Varian Covid-19 yang Lebih Menular, Jokowi: Genjot Testing",https://www.jawapos.com/nasional/25/07/2021/awas-muncul-varian-covid-19-yang-lebih-menular-jokowi-genjot-testing/
2021-07-25_ja_0058,2021-07-25,Jawa Pos,"Seribu Orang Meninggal per Hari, Kasus Covid-19 Bisa 120 Ribu Per Hari",https://www.jawapos.com/nasional/25/07/2021/seribu-orang-meninggal-per-hari-kasus-covid-19-bisa-120-ribu-per-hari/
2021-07-25_ja_0059,2021-07-25,Jawa Pos,"Putus Nasib Sial Selama 2 Tahun, Kento Momota Buru Emas Olimpiade",https://www.jawapos.com/sports/25/07/2021/putus-nasib-sial-selama-2-tahun-kento-momota-buru-emas-olimpiade/
2021-07-25_ja_0060,2021-07-25,Jawa Pos,Jokowi Klaim Kasus Penularan Covid-19 Menurun Selama 23 Hari PPKM,https://www.jawapos.com/nasional/25/07/2021/jokowi-klaim-kasus-penularan-covid-19-menurun-selama-23-hari-ppkm/
2021-07-25_ja_0061,2021-07-25,Jawa Pos,"PPKM Boleh Dine-in 20 Menit, Epidemiolog: Siapa yang Awasi?",https://www.jawapos.com/nasional/25/07/2021/ppkm-boleh-dine-in-20-menit-epidemiolog-siapa-yang-awasi/
2021-07-25_ja_0062,2021-07-25,Jawa Pos,"Melumbung, Tradisi yang Mengusang",https://www.jawapos.com/wisata-dan-kuliner/25/07/2021/melumbung-tradisi-yang-mengusang/
2021-07-25_ja_0063,2021-07-25,Jawa Pos,"Jokowi Longgarkan Pembatasan Bertahap, Epidemiolog: Pilihan yang Berat",https://www.jawapos.com/nasional/25/07/2021/jokowi-longgarkan-pembatasan-bertahap-epidemiolog-pilihan-yang-berat/
2021-07-25_ja_0064,2021-07-25,Jawa Pos,"Right Issue BRI Disetujui, Holding Ultra Mikro Segera Terbentuk Beri Manfaat bagi Pelaku Usaha",https://www.radarbogor.id/2021/07/25/right-issue-bri-disetujui-holding-ultra-mikro-segera-terbentuk-beri-manfaat-bagi-pelaku-usaha/
2021-07-25_ja_0065,2021-07-25,Jawa Pos,KONI Bali ‘Tenget’ Terapkan Prokes di TC Sentralisasi,https://baliexpress.jawapos.com/read/2021/07/25/277800/koni-bali-tenget-terapkan-prokes-di-tc-sentralisasi
2021-07-25_ja_0066,2021-07-25,Jawa Pos,"Vario Nyeberang Tertabrak RX King di Watukosek Gempol, 1 Tewas",https://radarbromo.jawapos.com/pandaan/25/07/2021/vario-nyeberang-tertabrak-rx-king-di-watukosek-gempol-1-tewas/
2021-07-25_ja_0067,2021-07-25,Jawa Pos,"Ibu Amanda Manopo Meninggal, Kalangan Selebriti Sampaikan Duka",https://www.jawapos.com/entertainment/infotainment/25/07/2021/ibu-amanda-manopo-meninggal-kalangan-selebriti-sampaikan-duka/
2021-07-25_ja_0068,2021-07-25,Jawa Pos,"Dari Kasus Monang Maning, YLPK: Debt Collector Ambil Paksa Itu Pidana",https://radarbali.jawapos.com/read/2021/07/25/277784/dari-kasus-monang-maning-ylpk-debt-collector-ambil-paksa-itu-pidana
2021-07-25_ja_0069,2021-07-25,Jawa Pos,"Malaysia Cetak Rekor, Sehari 17.045 Kasus Baru Covid-19",https://radarmalang.jawapos.com/internasional/25/07/2021/malaysia-cetak-rekor-sehari-17-045-kasus-baru-covid-19/
2021-07-25_ja_0070,2021-07-25,Jawa Pos,PPKM Level 4 Jawa Bali Diperpanjang Hingga 2 Agustus 2021,https://baliexpress.jawapos.com/read/2021/07/25/277799/ppkm-level-4-jawa-bali-diperpanjang-hingga-2-agustus-2021
2021-07-25_ja_0071,2021-07-25,Jawa Pos,"Angka Kematian Tinggi, Vaksinasi di Boyolali Baru 12 Persen",https://radarsolo.jawapos.com/daerah/boyolali/25/07/2021/angka-kematian-tinggi-vaksinasi-di-boyolali-baru-12-persen/
2021-07-25_ja_0072,2021-07-25,Jawa Pos,Diskon untuk Pedagang Terdampak Covid-19,https://radarbanyuwangi.jawapos.com/read/2021/07/25/277611/diskon-untuk-pedagang-terdampak-covid-19
2021-07-25_ja_0073,2021-07-25,Jawa Pos,"Kalah Telak dari No 1 Indonesia, Bangga Cetak Sejarah untuk Myanmar",https://lombokpost.jawapos.com/sportivo/25/07/2021/kalah-telak-dari-no-1-indonesia-bangga-cetak-sejarah-untuk-myanmar/
2021-07-25_ja_0074,2021-07-25,Jawa Pos,Tiga Pasien Covid yang Jalani Isoman Terpusat di GOR Gelarsena Sembuh,https://radarsolo.jawapos.com/daerah/klaten/25/07/2021/tiga-pasien-covid-yang-jalani-isoman-terpusat-di-gor-gelarsena-sembuh/
2021-07-25_ja_0075,2021-07-25,Jawa Pos,"PPKM Level 4 Diberlakukan, Jokowi: Pasar Rakyat Boleh Tetap Buka",https://www.jawapos.com/nasional/25/07/2021/ppkm-level-4-diberlakukan-jokowi-pasar-rakyat-boleh-tetap-buka/
2021-07-25_ja_0076,2021-07-25,Jawa Pos,"Selama PPKM, Sejumlah Kafe di Caringin dan Ciawi Pilih Tutup",https://www.radarbogor.id/2021/07/25/selama-ppkm-sejumlah-kafe-di-caringin-dan-ciawi-pilih-tutup/
2021-07-25_ja_0077,2021-07-25,Jawa Pos,Breaking News! Jokowi Perpanjang PPKM Level 4 sampai 2 Agustus 2021,https://radarbali.jawapos.com/read/2021/07/25/277797/breaking-news-jokowi-perpanjang-ppkm-level-4-sampai-2-agustus-2021
2021-07-25_ja_0078,2021-07-25,Jawa Pos,"Nongkrong saat PPKM, Puluhan Anggota Silat Diamankan",https://radarsolo.jawapos.com/daerah/karanganyar/25/07/2021/nongkrong-saat-ppkm-puluhan-anggota-silat-diamankan/
2021-07-25_ja_0079,2021-07-25,Jawa Pos,"Cedera Lutut, Sayaka Hirota Sudah Siap Jadi Sasaran Tembak Greys/Apri",https://www.jawapos.com/sports/25/07/2021/cedera-lutut-sayaka-hirota-sudah-siap-jadi-sasaran-tembak-greys-apri/
2021-07-25_ja_0080,2021-07-25,Jawa Pos,"Eko Yuli Raih Perak Olimpiade Tokyo, Sejarah Besar Nasional Tercipta",https://lombokpost.jawapos.com/sportivo/25/07/2021/eko-yuli-raih-perak-olimpiade-tokyo-sejarah-besar-nasional-tercipta/
2021-07-25_ja_0081,2021-07-25,Jawa Pos,"Diduga Curi HP, Babak Belur Dihajar Warga Gedangan",https://radarsidoarjo.jawapos.com/kriminal-delta/25/07/2021/diduga-curi-hp-babak-belur-dihajar-warga-gedangan/
2021-07-25_ja_0082,2021-07-25,Jawa Pos,Budi Gunawan: Sebar 15 Ribu Vaksin dan Bansos ke Tujuh Provinsi,https://radarjogja.jawapos.com/jateng/2021/07/25/budi-gunawan-sebar-15-ribu-vaksin-dan-bansos-ke-tujuh-provinsi/
2021-07-25_ja_0083,2021-07-25,Jawa Pos,"Update! PPKM Level 4 Berlanjut hingga 2 Agustus, Cek Perbedaannya",https://radarmalang.jawapos.com/politik-pemerintahan/25/07/2021/update-ppkm-level-4-berlanjut-hingga-2-agustus-cek-perbedaannya/
2021-07-25_ja_0084,2021-07-25,Jawa Pos,Komitmen Kuat Pemerintah dan Masyarakat Prasyarat Pengendalian Covid,https://radarkudus.jawapos.com/read/2021/07/25/277796/komitmen-kuat-pemerintah-dan-masyarakat-prasyarat-pengendalian-covid
2021-07-25_ja_0085,2021-07-25,Jawa Pos,"PPKM Level IV, Pemkot Bitung Diminta Tegas",https://manadopost.jawapos.com/minahasa-raya/bitung/25/07/2021/ppkm-level-iv-pemkot-bitung-diminta-tegas/
2021-07-25_ja_0086,2021-07-25,Jawa Pos,"Dua Hari Penerapan Ganjil Genap di Kota Bogor, 13.140 Kendaraan Dipaksa Putar Balik",https://www.radarbogor.id/2021/07/25/dua-hari-penerapan-ganjil-genap-di-kota-bogor-13-140-kendaraan-dipaksa-putar-balik/
2021-07-25_ja_0087,2021-07-25,Jawa Pos,"Astaga! Dinkes Bitung Tabrak Peraturan Menteri Kesehatan, Terkait Pembangunan RS Pratama",https://manadopost.jawapos.com/minahasa-raya/bitung/25/07/2021/astaga-dinkes-bitung-tabrak-peraturan-menteri-kesehatan-terkait-pembangunan-rs-pratama/
2021-07-25_ja_0088,2021-07-25,Jawa Pos,Breaking News: Jokowi Putuskan Kembali Lanjutkan PPKM!,https://www.jawapos.com/nasional/25/07/2021/breaking-news-jokowi-putuskan-kembali-lanjutkan-ppkm/
2021-07-25_ja_0089,2021-07-25,Jawa Pos,"Finis Urutan Keenam, Pedayung Mutiara/Melani Gagal ke Semifinal Olimpiade Tokyo 2020",https://www.radarbogor.id/2021/07/25/finis-urutan-keenam-pedayung-mutiara-melani-gagal-ke-semifinal-olimpiade-tokyo-2020/
2021-07-25_ja_0090,2021-07-25,Jawa Pos,"Zona Merah, Perketat Akses Keluar Masuk Bitung",https://manadopost.jawapos.com/minahasa-raya/bitung/25/07/2021/zona-merah-perketat-akses-keluar-masuk-bitung/
2021-07-25_ja_0091,2021-07-25,Jawa Pos,BPN Segera Tinjau Lapang ke HGU PT Bumi Sari,https://radarbanyuwangi.jawapos.com/read/2021/07/25/277609/bpn-segera-tinjau-lapang-ke-hgu-pt-bumi-sari
2021-07-25_ja_0092,2021-07-25,Jawa Pos,"Angka Pengangguran Naik, Aplikasi Ini Bantu Cari Kerja di Masa Pandemi",https://www.jawapos.com/oto-dan-tekno/25/07/2021/angka-pengangguran-naik-aplikasi-ini-bantu-cari-kerja-di-masa-pandemi/
2021-07-25_ja_0093,2021-07-25,Jawa Pos,Astaga! Pelabuhan Perikanan Samudera Bitung Diduga Keluarkan Dokumen Palsu,https://manadopost.jawapos.com/minahasa-raya/bitung/25/07/2021/astaga-pelabuhan-perikanan-samudera-bitung-diduga-keluarkan-dokumen-palsu/
2021-07-25_ja_0094,2021-07-25,Jawa Pos,"Bagi Wisatawan yang Ingin ke Puncak, Lihat Nih!",https://www.radarbogor.id/2021/07/25/bagi-wisatawan-yang-ingin-ke-puncak-lihat-nih/
2021-07-25_ja_0095,2021-07-25,Jawa Pos,"Gelar Aksi Sosial, Srikandi Komisi IV Sasar Lansia",https://baliexpress.jawapos.com/read/2021/07/25/277795/gelar-aksi-sosial-srikandi-komisi-iv-sasar-lansia
2021-07-25_ja_0096,2021-07-25,Jawa Pos,"Malaysia Cetak Rekor Baru Covid-19, Sehari Ada 17.045 Kasus",https://www.jawapos.com/internasional/25/07/2021/malaysia-cetak-rekor-baru-covid-19-sehari-ada-17-045-kasus/
2021-07-25_ja_0097,2021-07-25,Jawa Pos,"Bonus Mengalir, Lifter Windy Baru Kumpulkan Bonus Rp 1,4 Miliar",https://baliexpress.jawapos.com/read/2021/07/25/277792/bonus-mengalir-lifter-windy-baru-kumpulkan-bonus-rp-14-miliar
2021-07-25_ja_0098,2021-07-25,Jawa Pos,"Rangkaian Kegiatan Mengenang Kepergian Istri Tercinta Rampung, Epe: Terima Kasih Pemerintah dan Warga Kota Tomohon",https://manadopost.jawapos.com/minahasa-raya/tomohon/25/07/2021/rangkaian-kegiatan-mengenang-kepergian-istri-tercinta-rampung-epe-terima-kasih-pemerintah-dan-warga-kota-tomohon/
2021-07-25_ja_0099,2021-07-25,Jawa Pos,"Kasus Covid-19 di Bali Masih Tinggi, PPKM Level 3 Berlanjut?",https://radarbali.jawapos.com/read/2021/07/25/277778/kasus-covid-19-di-bali-masih-tinggi-ppkm-level-3-berlanjut
2021-07-25_ja_0100,2021-07-25,Jawa Pos,"Bahaya, Sakit Covid-19 Parah Bisa Turunkan Kecerdasan",https://www.radarbogor.id/2021/07/25/bahaya-sakit-covid-19-parah-bisa-turunkan-kecerdasan/
2021-07-25_ja_0101,2021-07-25,Jawa Pos,"1 Dekade Lebih Bersama, Setia Band-Trinity Optima Production Berpisah",https://radarsolo.jawapos.com/entertainment/25/07/2021/1-dekade-lebih-bersama-setia-band-trinity-optima-production-berpisah/
2021-07-25_ja_0102,2021-07-25,Jawa Pos,Antivirus Covid-19 Tak Diperlukan untuk Anak OTG dan Gejala Ringan,https://www.jawapos.com/kesehatan/25/07/2021/antivirus-covid-19-tak-diperlukan-untuk-anak-otg-dan-gejala-ringan/
2021-07-25_ja_0103,2021-07-25,Jawa Pos,"Jadi Tersangka, Mantan Sekda Buleleng Minta Kejati Adil",https://baliexpress.jawapos.com/read/2021/07/25/277789/jadi-tersangka-mantan-sekda-buleleng-minta-kejati-adil
2021-07-25_ja_0104,2021-07-25,Jawa Pos,Sistem Rujukan Pasien Covid-19 Ditata Ulang,https://baliexpress.jawapos.com/read/2021/07/25/277788/sistem-rujukan-pasien-covid-19-ditata-ulang
2021-07-25_ja_0105,2021-07-25,Jawa Pos,Vaksinasi Tahap Dua Polresta Sidoarjo Dibuat Bergelombang,https://radarsidoarjo.jawapos.com/kota-delta/25/07/2021/vaksinasi-tahap-dua-polresta-sidoarjo-dibuat-bergelombang/
2021-07-25_ja_0106,2021-07-25,Jawa Pos,"Patroli Skala Besar Malam Hari, Dibarengi Bagi-Bagi Sembako",https://www.jawapos.com/surabaya/25/07/2021/patroli-skala-besar-malam-hari-dibarengi-bagi-bagi-sembako/
2021-07-25_ja_0107,2021-07-25,Jawa Pos,"Bareng KTH, Wabup Ipat Pasang Papan Zona Larangan Kawasan Hutan",https://baliexpress.jawapos.com/read/2021/07/25/277787/bareng-kth-wabup-ipat-pasang-papan-zona-larangan-kawasan-hutan
2021-07-25_ja_0108,2021-07-25,Jawa Pos,Bagi Nasi Bungkus untuk Warga Terdampak PPKM,https://radarbanyuwangi.jawapos.com/read/2021/07/25/277608/bagi-nasi-bungkus-untuk-warga-terdampak-ppkm
2021-07-25_ja_0109,2021-07-25,Jawa Pos,Sandiaga Bantu Beasiswa Anak Yatim Piatu Akibat COVID-19,https://www.jawapos.com/nasional/pendidikan/25/07/2021/sandiaga-bantu-beasiswa-anak-yatim-piatu-akibat-covid-19/
2021-07-25_ja_0110,2021-07-25,Jawa Pos,"Raih Perunggu, Windy dapat Bonus Ratusan Juta dari Pemprov Jabar",https://www.jawapos.com/sports/all-sports/25/07/2021/raih-perunggu-windy-dapat-bonus-ratusan-juta-dari-pemprov-jabar/
2021-07-25_ja_0111,2021-07-25,Jawa Pos,"Pantau Pergerakan Praveen/Melati, Yuta/Arisa: Kami Tidak Mau Kalah!",https://www.jawapos.com/sports/25/07/2021/pantau-pergerakan-praveen-melati-yuta-arisa-kami-tidak-mau-kalah/
2021-07-25_ja_0112,2021-07-25,Jawa Pos,"Sah, Perda RPJMD 2021-2026 Pemkab Sidoarjo Sudah Digedok",https://radarsidoarjo.jawapos.com/politika/politik-dan-pemerintahan/25/07/2021/sah-perda-rpjmd-2021-2026-pemkab-sidoarjo-sudah-digedok/
2021-07-25_ja_0113,2021-07-25,Jawa Pos,"Sering Makan Korban, Perbaikan Gorong-gorong Diharapkan Cepat Rampung",https://baliexpress.jawapos.com/read/2021/07/25/277782/sering-makan-korban-perbaikan-gorong-gorong-diharapkan-cepat-rampung
2021-07-25_ja_0114,2021-07-25,Jawa Pos,"Maneskin dari Italia, Bukti Rock (Masih) Bergema di Seantero Dunia",https://www.jawapos.com/entertainment/music-movie/25/07/2021/maneskin-dari-italia-bukti-rock-masih-bergema-di-seantero-dunia/
2021-07-25_ja_0115,2021-07-25,Jawa Pos,Warga Desa Bulurejo Keberatan PKD Jadi Tempat Isoman,https://radarsolo.jawapos.com/daerah/wonogiri/25/07/2021/warga-desa-bulurejo-keberatan-pkd-jadi-tempat-isoman/
2021-07-25_ja_0116,2021-07-25,Jawa Pos,Sejumlah Warga Surabaya masih Protes Sekolah jadi Tempat Isolasi Covid,https://www.jawapos.com/surabaya/25/07/2021/sejumlah-warga-surabaya-masih-protes-sekolah-jadi-tempat-isolasi-covid/
2021-07-25_ja_0117,2021-07-25,Jawa Pos,Dipaksa Putar Balik malah Dapat Sembako,https://radarbanyuwangi.jawapos.com/read/2021/07/25/277602/dipaksa-putar-balik-malah-dapat-sembako
2021-07-25_ja_0118,2021-07-25,Jawa Pos,"PPKM Level 3, Ratusan Anak Muda Gelar Aksi Balap Liar di Pengambengan",https://baliexpress.jawapos.com/read/2021/07/25/277774/ppkm-level-3-ratusan-anak-muda-gelar-aksi-balap-liar-di-pengambengan
2021-07-25_ja_0119,2021-07-25,Jawa Pos,DPRD Bali Desak Pelabuhan Segitiga Emas Beroperasi 2022,https://baliexpress.jawapos.com/read/2021/07/25/277773/dprd-bali-desak-pelabuhan-segitiga-emas-beroperasi-2022
2021-07-25_ja_0120,2021-07-25,Jawa Pos,"Tes Covid-19 Anjlok Lagi, Angka Kematian 1.266 Jiwa per Hari",https://www.jawapos.com/nasional/25/07/2021/tes-covid-19-anjlok-lagi-angka-kematian-1-266-jiwa-per-hari/
2021-07-25_ja_0121,2021-07-25,Jawa Pos,Tim PKM Unwar Menggarap Pararem di Desa Adat Antap Gawang,https://radarbali.jawapos.com/read/2021/07/25/277759/tim-pkm-unwar-menggarap-pararem-di-desa-adat-antap-gawang
2021-07-25_ja_0122,2021-07-25,Jawa Pos,Awas Varian Delta Mulai Masuk Sukoharjo,https://radarsolo.jawapos.com/daerah/sukoharjo/25/07/2021/awas-varian-delta-mulai-masuk-sukoharjo/
