unique_id,date,source,headline,url
2021-12-29_ja_0474,2021-12-29,Jawa Pos,"Istri Nadiem Makarim Beragama Kristen, Politisi Partai Ummat: Haram, Seumur Hidup Terhitung Zina",https://manadopost.jawapos.com/nasional/29/12/2021/keluarga-nadiem-makarim-jadi-sorotan-politisi-partai-ummat-itu-haram-seumur-hidup-terhitung-zina/
2021-12-29_ja_0475,2021-12-29,Jawa Pos,"Kasus Covid-19 Di DKI Naik 118 Orang, Positif Tambah 278",https://www.radarbogor.id/2021/12/29/kasus-covid-19-di-dki-naik-118-orang-positif-tambah-278/
2021-12-29_ja_0476,2021-12-29,Jawa Pos,"Resmikan Bendungan Pidekso, Jokowi Bicara Upaya Kemandirian Pangan",https://www.jawapos.com/infrastruktur/29/12/2021/resmikan-bendungan-pidekso-jokowi-bicara-upaya-kemandirian-pangan/
2021-12-29_ja_0477,2021-12-29,Jawa Pos,Mengatasi Kejenuhan Belajar dengan Pembelajaran Berbasis Picture and Picture,https://radarsemarang.jawapos.com/artikel/untukmu-guruku/2021/12/29/mengatasi-kejenuhan-belajar-dengan-pembelajaran-berbasis-picture-and-picture/
2021-12-29_ja_0478,2021-12-29,Jawa Pos,Jatim Sediakan 1.256 Bed Karantina untuk Pekerja Migran Indonesia,https://www.jawapos.com/jpg-today/29/12/2021/jatim-sediakan-1-256-bed-karantina-untuk-pekerja-migran-indonesia/
2021-12-29_ja_0479,2021-12-29,Jawa Pos,"dr. Richard Lee Ditahan, Pengacara: Ngapain Saya Marah, Suatu Keharusan",https://manadopost.jawapos.com/show-celebrities/29/12/2021/dr-richard-lee-ditahan-pengacara-ngapain-saya-marah-suatu-keharusan/
2021-12-29_ja_0480,2021-12-29,Jawa Pos,"Ubah Kentut Jadi Cuan, Stephanie Matto Raup Rp 640 Juta Seminggu",https://baliexpress.jawapos.com/hiburan/29/12/2021/ubah-kentut-jadi-cuan-stephanie-matto-raup-rp-640-juta-seminggu
2021-12-29_ja_0481,2021-12-29,Jawa Pos,Hujan Disertai Angin Kencang di MERR Robohkan PJU dan Pohon,https://www.jawapos.com/surabaya/29/12/2021/hujan-disertai-angin-kencang-di-merr-robohkan-pju-dan-pohon/
2021-12-29_ja_0482,2021-12-29,Jawa Pos,TNI AL Cari Pemilik ”Tank” dari Styrofoam,https://www.jawapos.com/nasional/hukum-kriminal/29/12/2021/tni-al-cari-pemilik-tank-dari-styrofoam/
2021-12-29_ja_0483,2021-12-29,Jawa Pos,Cerita Para Juara Lomba Foto “Air untuk Penghidupan”,https://radarbromo.jawapos.com/features/29/12/2021/cerita-para-juara-lomba-foto-air-untuk-penghidupan/
2021-12-29_ja_0484,2021-12-29,Jawa Pos,"Tiket Kereta Bisa Dikembalikan 100 Persen, Catat Syaratnya",https://www.jawapos.com/ekonomi/bisnis/29/12/2021/tiket-kereta-bisa-dikembalikan-100-persen-catat-syaratnya/
2021-12-29_ja_0485,2021-12-29,Jawa Pos,"Eksplorasi Wisata, DKKB Gelar Pesta Seni Akhir Tahun 2021",https://www.radarbogor.id/2021/12/29/eksplorasi-wisata-dkkb-gelar-pesta-seni-akhir-tahun-2021/
2021-12-29_ja_0486,2021-12-29,Jawa Pos,"Puji Tuhan! Ustaz Asal Manado Yahya Waloni Bertobat, Minta Maaf Sakiti Umat Kristiani se Indonesia",https://manadopost.jawapos.com/berita-utama/29/12/2021/puji-tuhan-ustaz-asal-manado-yahya-waloni-bertobat-minta-maaf-sakiti-umat-kristiani-se-indonesia/
2021-12-29_ja_0487,2021-12-29,Jawa Pos,"Hotman Paris Bikin Surat Terbuka, Siap Kucurkan 1 Miliar Jika Timnas Juara Piala AFF",https://manadopost.jawapos.com/nasional/29/12/2021/hotman-paris-bikin-surat-terbuka-siap-kucurkan-1-miliar-jika-timnas-juara-piala-aff/
2021-12-29_ja_0488,2021-12-29,Jawa Pos,IndiHome Hadirkan Paket Promo Akhir Tahun,https://radarmadura.jawapos.com/berita-daerah/29/12/2021/indihome-hadirkan-paket-promo-akhir-tahun
2021-12-29_ja_0489,2021-12-29,Jawa Pos,"Fakta, Penyebab Harga Minyak Goreng Mengalami Kenaikan",https://www.radarbogor.id/2021/12/29/fakta-penyebab-harga-minyak-goreng-mengalami-kenaikan/
2021-12-29_ja_0490,2021-12-29,Jawa Pos,Sentra Pengasapan Ikan Wonosari dan POD Bisa Jadi Ikon Demak,https://radarsemarang.jawapos.com/berita/jateng/demak/2021/12/29/sentra-pengasapan-ikan-wonosari-dan-pod-bisa-jadi-ikon-demak/
2021-12-29_ja_0491,2021-12-29,Jawa Pos,"Tren Elektabilitas-AHY Terus Naik, Demokrat: Apresiasi Publik",https://www.jawapos.com/nasional/politik/29/12/2021/tren-elektabilitas-ahy-terus-naik-demokrat-apresiasi-publik/
2021-12-29_ja_0492,2021-12-29,Jawa Pos,"Pekerjaan Selesai, Datang Lagi untuk Mencuri",https://lombokpost.jawapos.com/kriminal/29/12/2021/pekerjaan-selesai-datang-lagi-untuk-mencuri/
2021-12-29_ja_0493,2021-12-29,Jawa Pos,Kiai Mutawakkil Berharap NU Izinkan Kiai Miftach Tetap Pimpin MUI,https://www.jawapos.com/jpg-today/29/12/2021/kiai-mutawakkil-berharap-nu-izinkan-kiai-miftach-tetap-pimpin-mui/
2021-12-29_ja_0494,2021-12-29,Jawa Pos,Kejar Target Vaksin 928.303 Jiwa hingga Awal Tahun,https://radarsemarang.jawapos.com/berita/jateng/demak/2021/12/29/kejar-target-vaksin-928-303-jiwa-hingga-awal-tahun/
2021-12-29_ja_0495,2021-12-29,Jawa Pos,Kantor Desa Selolembu Diluruk Warga Tuntut Pergantian Perangkat Desa,https://radarjember.jawapos.com/berita-bondowoso/29/12/2021/kantor-desa-selolembu-diluruk-warga-tuntut-pergantian-perangkat-desa/
2021-12-29_ja_0496,2021-12-29,Jawa Pos,"Nyalakan Api dalam Rumah, Kediaman Tunem Terbakar",https://radarsemarang.jawapos.com/berita/jateng/demak/2021/12/29/nyalakan-api-dalam-rumah-kediaman-tunem-terbakar/
2021-12-29_ja_0497,2021-12-29,Jawa Pos,"Keji! ABG Diculik, Diperkosa Ramai-ramai Lalu Dijual di Michat",https://baliexpress.jawapos.com/nasional/29/12/2021/keji-abg-diculik-diperkosa-ramai-ramai-lalu-dijual-di-michat
2021-12-29_ja_0498,2021-12-29,Jawa Pos,Kehidupan Asmara 3 Zodiak Ini Bakal Bahagia Pada 2022,https://www.jawapos.com/lifestyle/29/12/2021/kehidupan-asmara-3-zodiak-ini-bakal-bahagia-pada-2022/
2021-12-29_ja_0499,2021-12-29,Jawa Pos,"Cegah Banjir, Bersihkan Sampah di Sungai Jamus",https://radarsemarang.jawapos.com/berita/jateng/demak/2021/12/29/cegah-banjir-bersihkan-sampah-di-sungai-jamus/
2021-12-29_ja_0500,2021-12-29,Jawa Pos,Musnahkan Ribuan Miras dan Puluhan Knalpot Brong,https://radarbanyuwangi.jawapos.com/berita-daerah/banyuwangi/29/12/2021/musnahkan-ribuan-miras-dan-puluhan-knalpot-brong
2021-12-29_ja_0501,2021-12-29,Jawa Pos,"Rencana KIH Gresik, Pansus: Lha Wong Panceng-Pangkah Banyak Sapi",https://www.jawapos.com/surabaya/29/12/2021/rencana-kih-gresik-pansus-lha-wong-panceng-pangkah-banyak-sapi/
2021-12-29_ja_0502,2021-12-29,Jawa Pos,"Bagi 70 Traktor Tangan, PDIP Rembang Ingin Petani Makmur",https://radarkudus.jawapos.com/rembang/29/12/2021/bagi-70-traktor-tangan-pdip-rembang-ingin-petani-makmur/
2021-12-29_ja_0503,2021-12-29,Jawa Pos,Lebih Senang Naik Kereta,https://radarbojonegoro.jawapos.com/perempuan/yuk/29/12/2021/lebih-senang-naik-kereta
2021-12-29_ja_0504,2021-12-29,Jawa Pos,"Gandeng Supermarket, Beri Tempat bagi UMKM",https://radarjogja.jawapos.com/jogja-utama/2021/12/29/gandeng-supermarket-beri-tempat-bagi-umkm/
2021-12-29_ja_0505,2021-12-29,Jawa Pos,Bersarang di Plafon Selama Seminggu,https://radarmojokerto.jawapos.com/hukum-kriminal/29/12/2021/bersarang-di-plafon-selama-seminggu
2021-12-29_ja_0506,2021-12-29,Jawa Pos,Kabel Terurai,https://radarbojonegoro.jawapos.com/berita-daerah/lamongan/29/12/2021/kabel-terurai
2021-12-29_ja_0507,2021-12-29,Jawa Pos,"Rumah Dibobol, Uang Rp 27 Juta Raib",https://radarjogja.jawapos.com/kulonprogo/2021/12/29/rumah-dibobol-uang-rp-27-juta-raib/
2021-12-29_ja_0508,2021-12-29,Jawa Pos,"Tegas, Golkar Konsisten jadikan Airlangga Capres 2024",https://www.radarbogor.id/2021/12/29/tegas-golkar-konsisten-jadikan-airlangga-capres-2024/
2021-12-29_ja_0509,2021-12-29,Jawa Pos,"Indonesia vs Thailand, STY Indikasikan Skuadnya Tampil Disiplin dan Menyerang",https://radarmadiun.jawapos.com/sport/29/12/2021/indonesia-vs-thailand-sty-indikasikan-skuadnya-tampil-disiplin-dan-menyerang/
2021-12-29_ja_0510,2021-12-29,Jawa Pos,Persekap Jr Ajukan Tuan Rumah Lagi di Babak 16 Besar,https://radarbromo.jawapos.com/sportainment/29/12/2021/persekap-jr-ajukan-tuan-rumah-lagi-di-babak-16-besar/
2021-12-29_ja_0511,2021-12-29,Jawa Pos,Terima Hibah dari Dirjen Dikti Ristek,https://radarbojonegoro.jawapos.com/berita-daerah/lamongan/29/12/2021/terima-hibah-dari-dirjen-dikti-ristek
2021-12-29_ja_0512,2021-12-29,Jawa Pos,KPK Duga Terdapat Dugaan Suap Pengajuan PEN Daerah di Kolaka Timur,https://www.jawapos.com/nasional/hukum-kriminal/29/12/2021/kpk-duga-terdapat-dugaan-suap-pengajuan-pen-daerah-di-kolaka-timur/
2021-12-29_ja_0513,2021-12-29,Jawa Pos,"3 HP Xiaomi 12 Series Resmi Launching di Tiongkok, Ini Spesifikasi dan Harganya",https://radarsolo.jawapos.com/tekno-oto/teknologi/29/12/2021/3-hp-xiaomi-12-series-resmi-launching-di-tiongkok-ini-spesifikasi-dan-harganya/
2021-12-29_ja_0514,2021-12-29,Jawa Pos,Tak Ada Perayaan,https://radarbojonegoro.jawapos.com/berita-daerah/lamongan/29/12/2021/tak-ada-perayaan
2021-12-29_ja_0515,2021-12-29,Jawa Pos,Alasan Razman Tidak Marah dr. Richard Lee Dijebloskan ke Dalam Tahanan,https://www.jawapos.com/entertainment/infotainment/29/12/2021/alasan-razman-tidak-marah-dr-richard-lee-dijebloskan-ke-dalam-tahanan/
2021-12-29_ja_0516,2021-12-29,Jawa Pos,"Ngaku Lulusan S-1 Kedokteran dan S-2 Hukum, Jaksa Gadungan Diadili",https://radarbali.jawapos.com/hukum-kriminal/29/12/2021/ngaku-lulusan-s-1-kedokteran-dan-s-2-hukum-jaksa-gadungan-diadili
2021-12-29_ja_0517,2021-12-29,Jawa Pos,Puncak Hujan Lebat Diprediksi Januari-Februari,https://radarbojonegoro.jawapos.com/berita-daerah/tuban/29/12/2021/puncak-hujan-lebat-diprediksi-januari-februari
2021-12-29_ja_0518,2021-12-29,Jawa Pos,Raih Penghargaan Perhutanan Sosial,https://radarjember.jawapos.com/berita-lumajang/29/12/2021/raih-penghargaan-perhutanan-sosial/
2021-12-29_ja_0519,2021-12-29,Jawa Pos,Kemendikbudristek: Kurikulum Prototipe untuk Pemulihan Pembelajaran,https://www.jawapos.com/nasional/pendidikan/29/12/2021/kemendikbudristek-kurikulum-prototipe-untuk-pemulihan-pembelajaran/
2021-12-29_ja_0520,2021-12-29,Jawa Pos,Penjaga Warung Kopi Digerebek karena Nyambi Jadi Makelar Sabu,https://radarsurabaya.jawapos.com/surabaya/29/12/2021/penjaga-warung-kopi-digerebek-karena-nyambi-jadi-makelar-sabu/
2021-12-29_ja_0521,2021-12-29,Jawa Pos,Pelayanan SKCK Dibatasi Wilayah,https://radarbojonegoro.jawapos.com/berita-daerah/lamongan/29/12/2021/pelayanan-skck-dibatasi-wilayah
2021-12-29_ja_0522,2021-12-29,Jawa Pos,"Musim Hujan, Waspadai Penyakit Hewan Peliharaan",https://radarsemarang.jawapos.com/berita/jateng/salatiga/2021/12/29/musim-hujan-waspadai-penyakit-hewan-peliharaan/
2021-12-29_ja_0523,2021-12-29,Jawa Pos,2 Januari dan 1 Februari Lautan Pasir Bromo Bebas Kendaraan,https://radarbromo.jawapos.com/probolinggo/29/12/2021/2-januari-dan-1-februari-lautan-pasir-bromo-bebas-kendaraan/
2021-12-29_ja_0524,2021-12-29,Jawa Pos,Pentingnya Bela Diri,https://radarbojonegoro.jawapos.com/perempuan/nduk/29/12/2021/pentingnya-bela-diri
2021-12-29_ja_0525,2021-12-29,Jawa Pos,PAD Wisata Lamongan Belum Target,https://radarbojonegoro.jawapos.com/berita-daerah/lamongan/29/12/2021/pad-wisata-lamongan-belum-target
2021-12-29_ja_0526,2021-12-29,Jawa Pos,Tujuh Rumah di Bandungan Rusak Disapu Puting Beliung,https://radarsemarang.jawapos.com/berita/jateng/ungaran/2021/12/29/tujuh-rumah-di-bandungan-rusak-disapu-puting-beliung/
2021-12-29_ja_0527,2021-12-29,Jawa Pos,"Parah, Ajukan Normalisasi Berkali-Kali Tak Digubris",https://radarjember.jawapos.com/berita-lumajang/29/12/2021/parah-ajukan-normalisasi-berkali-kali-tak-digubris/
2021-12-29_ja_0528,2021-12-29,Jawa Pos,Kaki Palsu dan Laptop untuk Reno,https://radarsemarang.jawapos.com/berita/jateng/semarang/2021/12/29/kaki-palsu-dan-laptop-untuk-reno/
2021-12-29_ja_0529,2021-12-29,Jawa Pos,TPA Landoh Rembang Masih Jadi Momok untuk Dapatkan Adipura,https://radarkudus.jawapos.com/rembang/29/12/2021/tpa-landoh-rembang-masih-jadi-momok-untuk-dapatkan-adipura/
2021-12-29_ja_0530,2021-12-29,Jawa Pos,Gundah Garuda,https://radarsolo.jawapos.com/opini/29/12/2021/gundah-garuda/
2021-12-29_ja_0531,2021-12-29,Jawa Pos,"Mobil Tabrak Truk Dekat Pintu Tol Gunungputri, Mahasiswa Tewas",https://www.radarbogor.id/2021/12/29/mobil-tabrak-truk-dekat-pintu-tol-gunungputri-mahasiswa-tewas/
2021-12-29_ja_0532,2021-12-29,Jawa Pos,"VIRALKAN! Presiden Jokowi:Tidak Ada Toleransi Pelayanan Publik Lambat, Berbelit",https://radarpapua.jawapos.com/berita-terbaru/29/12/2021/viralkan-presiden-jokowitidak-ada-toleransi-pelayanan-publik-lambat-berbelit/
2021-12-29_ja_0533,2021-12-29,Jawa Pos,Didominasi Kejahatan Jalanan dan Narkoba,https://radarbanyuwangi.jawapos.com/berita-daerah/banyuwangi/29/12/2021/didominasi-kejahatan-jalanan-dan-narkoba
2021-12-29_ja_0534,2021-12-29,Jawa Pos,BMKG: Waspadai Hujan Sedang Hingga Lebat Disertai Angin Kencang,https://www.jawapos.com/jabodetabek/29/12/2021/bmkg-waspadai-hujan-sedang-hingga-lebat-disertai-angin-kencang/
2021-12-29_ja_0535,2021-12-29,Jawa Pos,"2022, Pemkab Loteng Siapkan Rp 90 Miliar untuk Penanganan Kemiskinan",https://lombokpost.jawapos.com/praya/29/12/2021/2022-pemkab-loteng-siapkan-rp-90-miliar-untuk-penanganan-kemiskinan/
2021-12-29_ja_0536,2021-12-29,Jawa Pos,Dua Striker Berbahaya di Liga 1 Versi Adilson Maringa,https://radarmalang.jawapos.com/olahraga/29/12/2021/dua-striker-berbahaya-di-liga-1-versi-adilson-maringa/
2021-12-29_ja_0537,2021-12-29,Jawa Pos,"VIRALKAN! Presiden Jokowi:Tidak Ada Toleransi Pelayanan Publik Lambat, Berbelit",https://gorontalopost.jawapos.com/berita-terbaru/29/12/2021/viralkan-presiden-jokowitidak-ada-toleransi-pelayanan-publik-lambat-berbelit/
2021-12-29_ja_0538,2021-12-29,Jawa Pos,"Motivasi Pemainnya, Presiden Arema FC Bagi-Bagi iPhone",https://radarmalang.jawapos.com/olahraga/29/12/2021/motivasi-pemainnya-presiden-arema-fc-bagi-bagi-iphone/
2021-12-29_ja_0539,2021-12-29,Jawa Pos,PAD Jadi Atensi Bupati Lindra,https://radarbojonegoro.jawapos.com/ekonomi/29/12/2021/pad-jadi-atensi-bupati-lindra
2021-12-29_ja_0540,2021-12-29,Jawa Pos,"Déjà vu Tahun Lalu, Grande Partita Liha Italia Berpotensi Ditunda",https://www.jawapos.com/sepak-bola/sepak-bola-dunia/29/12/2021/deja-vu-tahun-lalu-grande-partita-liha-italia-berpotensi-ditunda/
2021-12-29_ja_0541,2021-12-29,Jawa Pos,"Jelang Indonesia vs Thailand, Mental Bisa Menentukan Hasil Final Piala AFF 2020",https://radarsemarang.jawapos.com/sport/sepakbola/2021/12/29/jelang-indonesia-vs-thailand-mental-bisa-menentukan-hasil-final-piala-aff-2020/
2021-12-29_ja_0542,2021-12-29,Jawa Pos,Dirut Pertamina Bantah Kabar Pertalite Tak Dijual Lagi,https://riaupos.jawapos.com/nasional/29/12/2021/264685/dirut-pertamina-bantah-kabar-pertalite-tak-dijual-lagi.html
2021-12-29_ja_0543,2021-12-29,Jawa Pos,"Anak Kurang Pintar, Pasangan yang Disalahkan",https://radarsurabaya.jawapos.com/surabaya/isoooae/29/12/2021/anak-kurang-pintar-pasangan-yang-disalahkan/
2021-12-29_ja_0544,2021-12-29,Jawa Pos,Ratu Cabai Kediri Atasi Masalah Harga Mahal,https://radarkediri.jawapos.com/show-case/29/12/2021/ratu-cabai-kediri-atasi-masalah-harga-mahal
2021-12-29_ja_0545,2021-12-29,Jawa Pos,"NYALI KECIL? Dulu Serang Jokowi, Begitu Dipenjara Ustaz Yahya Waloni: Saya…",https://radarpapua.jawapos.com/nasional/29/12/2021/nyali-kecil-dulu-serang-jokowi-begitu-dipenjara-ustaz-yahya-waloni-saya/
2021-12-29_ja_0546,2021-12-29,Jawa Pos,"NYALI KECIL? Dulu Serang Jokowi, Begitu Dipenjara Ustaz Yahya Waloni: Saya…",https://gorontalopost.jawapos.com/nasional/29/12/2021/nyali-kecil-dulu-serang-jokowi-begitu-dipenjara-ustaz-yahya-waloni-saya/
2021-12-29_ja_0547,2021-12-29,Jawa Pos,"Sering Hujan, Lubang Jalan Bertambah",https://radarbojonegoro.jawapos.com/berita-daerah/lamongan/29/12/2021/sering-hujan-lubang-jalan-bertambah
2021-12-29_ja_0548,2021-12-29,Jawa Pos,Pupuk Jiwa Wirausaha Santri lewat Kafe,https://riaupos.jawapos.com/pekanbaru/29/12/2021/264682/pupuk-jiwa-wirausaha-santri-lewat-kafe.html
2021-12-29_ja_0549,2021-12-29,Jawa Pos,"Disentil ICW, KPK Klaim Tetap Memburu Harun Masiku",https://radarsemarang.jawapos.com/berita/nasional/2021/12/29/disentil-icw-kpk-klaim-tetap-memburu-harun-masiku/
2021-12-29_ja_0550,2021-12-29,Jawa Pos,IndiHome Resmi Jalin Kerja Sama dengan MNC Group,https://radarkediri.jawapos.com/show-case/29/12/2021/indihome-resmi-jalin-kerja-sama-dengan-mnc-group
2021-12-29_ja_0551,2021-12-29,Jawa Pos,"Libur Tahun Baru, Volume Kendaraan via Tol Diprediksi Naik",https://radarmadiun.jawapos.com/berita-daerah/mejayan/29/12/2021/libur-tahun-baru-volume-kendaraan-via-tol-diprediksi-naik/
2021-12-29_ja_0552,2021-12-29,Jawa Pos,Menteri Nadiem Makarim Muslim Berdarah Arab-Franka Franklin Kristen Pribumi,https://radarpapua.jawapos.com/berita-utama/29/12/2021/menteri-nadiem-makarim-muslim-berdarah-arab-franka-franklin-kristen-pribumi/
2021-12-29_ja_0553,2021-12-29,Jawa Pos,Menteri Nadiem Makarim Muslim Berdarah Arab-Franka Franklin Kristen Pribumi,https://gorontalopost.jawapos.com/berita-utama-2/29/12/2021/menteri-nadiem-makarim-muslim-berdarah-arab-franka-franklin-kristen-pribumi/
2021-12-29_ja_0554,2021-12-29,Jawa Pos,Polsek Senapelan Gelar Vaksinasi Massal,https://riaupos.jawapos.com/pekanbaru/29/12/2021/264681/polsek-senapelan-gelar-vaksinasi-massal.html
2021-12-29_ja_0555,2021-12-29,Jawa Pos,"Cemburu Buta, Istri Dibonceng Cowok, Suami Mengeroyok",https://radarjember.jawapos.com/peristiwa/29/12/2021/cemburu-buta-istri-dibonceng-cowok-suami-mengeroyok/
2021-12-29_ja_0556,2021-12-29,Jawa Pos,"Akses Jalan Ditutup Pemilik Lahan, Tiga KK di Mataram Terisolasi",https://lombokpost.jawapos.com/metropolis/29/12/2021/akses-jalan-ditutup-pemilik-lahan-tiga-kk-di-mataram-terisolasi/
2021-12-29_ja_0557,2021-12-29,Jawa Pos,"Manajer Persenga Sumardiono, Pelanggan Setia Jawa Pos Radar Nganjuk",https://radarkediri.jawapos.com/features/29/12/2021/manajer-persenga-sumardiono-pelanggan-setia-jawa-pos-radar-nganjuk
2021-12-29_ja_0558,2021-12-29,Jawa Pos,’’Hadang’’ Pengendara di Pintu Masuk Kabupaten,https://radarmadiun.jawapos.com/berita-daerah/mejayan/29/12/2021/hadang-pengendara-di-pintu-masuk-kabupaten/
2021-12-29_ja_0559,2021-12-29,Jawa Pos,"Didukung Banyak Pihak, Digitalisasi Aksara Diharapkan Segera Rampung",https://www.jawapos.com/oto-dan-tekno/teknologi/29/12/2021/didukung-banyak-pihak-digitalisasi-aksara-diharapkan-segera-rampung/
2021-12-29_ja_0560,2021-12-29,Jawa Pos,Ibu Kiper Timnas Indonesia yang Jadi Pahlawan di Semifinal,https://radarkediri.jawapos.com/sportainment/29/12/2021/ibu-kiper-timnas-indonesia-yang-jadi-pahlawan-di-semifinal
2021-12-29_ja_0561,2021-12-29,Jawa Pos,Administrasi Kependudukan di Pekanbaru Masih 12 Kecamatan,https://riaupos.jawapos.com/pekanbaru/29/12/2021/264680/administrasi-kependudukan-di-pekanbaru-masih-12-kecamatan.html
2021-12-29_ja_0562,2021-12-29,Jawa Pos,"Jadi Pelakor, Instagram Anya Geraldine Diserang Netizen",https://baliexpress.jawapos.com/hiburan/29/12/2021/jadi-pelakor-instagram-anya-geraldine-diserang-netizen
2021-12-29_ja_0563,2021-12-29,Jawa Pos,"Perubahan SMAN 1 Bangil Jadi Taruna Madani Diprotes, Ini Alasannya",https://radarbromo.jawapos.com/bangil/29/12/2021/perubahan-sman-1-bangil-jadi-taruna-madani-diprotes-ini-alasannya/
2021-12-29_ja_0564,2021-12-29,Jawa Pos,Klub Baru Erling Haaland Mengerucut ke Raksasa La Liga,https://www.jawapos.com/sepak-bola/sepak-bola-dunia/29/12/2021/klub-baru-erling-haaland-mengerucut-ke-raksasa-la-liga/
2021-12-29_ja_0565,2021-12-29,Jawa Pos,"NYALI KECIL? Dulu Serang Jokowi, Begitu Dipenjara Ustaz Yahya Waloni: Saya Dukung Pemerintah",https://manadopost.jawapos.com/nasional/29/12/2021/nyali-kecil-dulu-serang-jokowi-begitu-dipenjara-ustaz-yahya-waloni-saya-dukung-pemerintah/
2021-12-29_ja_0566,2021-12-29,Jawa Pos,"Anggaran Dipangkas, Perluasan Setonobetek Tertunda",https://radarkediri.jawapos.com/politik/29/12/2021/anggaran-dipangkas-perluasan-setonobetek-tertunda
2021-12-29_ja_0567,2021-12-29,Jawa Pos,Terdakwa ke Rumah Sakit Sesuai Prosedur,https://riaupos.jawapos.com/pekanbaru/29/12/2021/264678/terdakwa-ke-rumah-sakit-sesuai-prosedur.html
2021-12-29_ja_0568,2021-12-29,Jawa Pos,Bantuan Luar Negeri Juga Berdatangan Untuk Korban Erupsi Semeru,https://radarjember.jawapos.com/berita-lumajang/29/12/2021/bantuan-luar-negeri-juga-berdatangan-untuk-korban-erupsi-semeru/
2021-12-29_ja_0569,2021-12-29,Jawa Pos,"UMK Lotim 2022 Naik Jadi Rp 2,2 Juta, Ini Harapan Ketua DPRD",https://lombokpost.jawapos.com/selong/29/12/2021/umk-lotim-2022-naik-jadi-rp-22-juta-ini-harapan-ketua-dprd/
2021-12-29_ja_0570,2021-12-29,Jawa Pos,"Lima Calon Mundur, Pilkades Randuputih tanpa Bacakades",https://radarbromo.jawapos.com/probolinggo/29/12/2021/lima-calon-mundur-pilkades-randuputih-tanpa-bacakades/
2021-12-29_ja_0571,2021-12-29,Jawa Pos,Prestasi Aitor ’’Txiki’’ Begiristain Akhirnya Dihargai,https://www.jawapos.com/sepak-bola/sepak-bola-dunia/29/12/2021/prestasi-aitor-txiki-begiristain-akhirnya-dihargai/
2021-12-29_ja_0572,2021-12-29,Jawa Pos,"Lagi, Pelaku Investasi Bodong Diringkus",https://riaupos.jawapos.com/pekanbaru/29/12/2021/264676/lagi-pelaku-investasi-bodong-diringkus.html
2021-12-29_ja_0573,2021-12-29,Jawa Pos,"VIRALKAN! Presiden Jokowi: Tidak Ada Toleransi Pelayanan Publik Lambat, Berbelit dan Tidak Ramah",https://manadopost.jawapos.com/berita-terbaru/29/12/2021/viralkan-presiden-jokowi-tidak-ada-toleransi-pelayanan-publik-lambat-berbelit-dan-tidak-ramah/
2021-12-29_ja_0574,2021-12-29,Jawa Pos,"Maksimalkan PTM, Dikbud Kabupaten Madiun Matangkan Persiapan Vaksinasi Anak",https://radarmadiun.jawapos.com/advertorial/29/12/2021/maksimalkan-ptm-dikbud-kabupaten-madiun-matangkan-persiapan-vaksinasi-anak/
2021-12-29_ja_0575,2021-12-29,Jawa Pos,Perubahan Jadwal Turnamen Pengaruhi Performa Ganda Campuran Indonesia,https://lombokpost.jawapos.com/sportivo/29/12/2021/perubahan-jadwal-turnamen-pengaruhi-performa-ganda-campuran-indonesia/
2021-12-29_ja_0576,2021-12-29,Jawa Pos,Ketua Komisi X Dukung Penerapan Kurikulum Prototipe Tahun Depan,https://www.jawapos.com/nasional/29/12/2021/ketua-komisi-x-dukung-penerapan-kurikulum-prototipe-tahun-depan/
2021-12-29_ja_0577,2021-12-29,Jawa Pos,Tiga Resolusi 2022,https://radarbanyuwangi.jawapos.com/kolom/man-nahnu/29/12/2021/tiga-resolusi-2022
2021-12-29_ja_0578,2021-12-29,Jawa Pos,Golkar Tegaskan Tetap Konsisten jadikan Airlangga Capres pada 2024,https://www.jawapos.com/nasional/politik/29/12/2021/golkar-tegaskan-tetap-konsisten-jadikan-airlangga-capres-pada-2024/
2021-12-29_ja_0579,2021-12-29,Jawa Pos,"Dapat Alat, Petani Garam Rembang Sulap Grosok Jadi Kualitas Impor",https://radarkudus.jawapos.com/rembang/29/12/2021/dapat-alat-petani-garam-rembang-sulap-grosok-jadi-kualitas-impor/
2021-12-29_ja_0580,2021-12-29,Jawa Pos,Libur Tahun Baru Terminal Minak Koncar Masih Sepi,https://radarjember.jawapos.com/berita-jember/29/12/2021/libur-tahun-baru-terminal-minak-koncar-masih-sepi/
2021-12-29_ja_0581,2021-12-29,Jawa Pos,"Kasus Melandai, Harus Tetap Waspada",https://radarjogja.jawapos.com/kulon-progo-gunung-kidul/2021/12/29/kasus-melandai-harus-tetap-waspada/
2021-12-29_ja_0582,2021-12-29,Jawa Pos,"Di Kabupaten Madiun, 17 Bayi Meninggal karena Bumil Kurang Gizi",https://radarmadiun.jawapos.com/berita-daerah/madiun/29/12/2021/di-kabupaten-madiun-17-bayi-meninggal-karena-bumil-kurang-gizi/
2021-12-29_ja_0583,2021-12-29,Jawa Pos,Simak! Tiga Shio Ini Punya Peruntungan Paling Baik pada 2022,https://www.jawapos.com/lifestyle/29/12/2021/simak-tiga-shio-ini-punya-peruntungan-paling-baik-pada-2022/
2021-12-29_ja_0584,2021-12-29,Jawa Pos,Razman Sesalkan dr. Richard Lee Diam-diam Bertemu dengan Kartika Putri,https://www.jawapos.com/entertainment/infotainment/29/12/2021/razman-sesalkan-dr-richard-lee-diam-diam-bertemu-dengan-kartika-putri/
2021-12-29_ja_0585,2021-12-29,Jawa Pos,Gubernur Dorong Program Industrialisasi Terus Menggeliat,https://lombokpost.jawapos.com/ekonomi-bisnis/29/12/2021/gubernur-dorong-program-industrialisasi-terus-menggeliat/
2021-12-29_ja_0586,2021-12-29,Jawa Pos,Dorong Akses Danais Dipukul Rata,https://radarjogja.jawapos.com/sleman-bantul/2021/12/29/dorong-akses-danais-dipukul-rata/
2021-12-29_ja_0587,2021-12-29,Jawa Pos,GMPI Minta Pembangunan IKN Pertimbangkan Dampak Lingkungan,https://www.jawapos.com/ibu-kota-baru/29/12/2021/gmpi-minta-pembangunan-ikn-pertimbangkan-dampak-lingkungan/
2021-12-29_ja_0588,2021-12-29,Jawa Pos,Transfer Ferran Torres Molor karena Birokrasi,https://www.jawapos.com/sepak-bola/sepak-bola-dunia/29/12/2021/transfer-ferran-torres-molor-karena-birokrasi/
2021-12-29_ja_0589,2021-12-29,Jawa Pos,Tersangka Pemerkosaan Bocah SD Bertambah,https://radarmojokerto.jawapos.com/hukum-kriminal/29/12/2021/tersangka-pemerkosaan-bocah-sd-bertambah
2021-12-29_ja_0590,2021-12-29,Jawa Pos,Pelatih Singapura Yoshida Mundur setelah Dipermalukan Indonesia,https://radarsurabaya.jawapos.com/sport/internasional/29/12/2021/pelatih-singapura-yoshida-mundur-setelah-dipermalukan-indonesia/
2021-12-29_ja_0591,2021-12-29,Jawa Pos,"Memaki 2 Remaja Putri Sudah Tak Perawan, Bocah 12 Tahun Dianiaya",https://www.jawapos.com/jabodetabek/29/12/2021/memaki-2-remaja-putri-sudah-tak-perawan-bocah-12-tahun-dianiaya/
2021-12-29_ja_0592,2021-12-29,Jawa Pos,Kemenkes Deteksi Transmisi Lokal Omicron,https://www.jawapos.com/nasional/29/12/2021/kemenkes-deteksi-transmisi-lokal-omicron/
2021-12-29_ja_0593,2021-12-29,Jawa Pos,"Curi Susu di Mall hingga Rp 95 Juta, Wanita Paruh Baya Ditangkap",https://radarbali.jawapos.com/hukum-kriminal/29/12/2021/curi-susu-di-mall-hingga-rp-95-juta-wanita-paruh-baya-ditangkap
2021-12-29_ja_0594,2021-12-29,Jawa Pos,Panglima TNI Pastikan Peradilan 3 Prajurit di Kasus Nagreg Transparan,https://www.jawapos.com/nasional/29/12/2021/panglima-tni-pastikan-peradilan-3-prajurit-di-kasus-nagreg-transparan/
2021-12-29_ja_0595,2021-12-29,Jawa Pos,Persela Incar Pemain Liga Dua,https://radarbojonegoro.jawapos.com/sportainment/29/12/2021/persela-incar-pemain-liga-dua
2021-12-29_ja_0596,2021-12-29,Jawa Pos,Semua Alun-Alun di Jatim Ditutup saat Malam Pergantian Tahun,https://radarsurabaya.jawapos.com/surabaya/29/12/2021/semua-alun-alun-di-jatim-ditutup-saat-malam-pergantian-tahun/
2021-12-29_ja_0597,2021-12-29,Jawa Pos,Semua Alun-Alun di Jatim Ditutup saat Pergantian Tahun,https://radarsurabaya.jawapos.com/surabaya/29/12/2021/semua-alun-alun-di-jatim-ditutup-saat-pergantian-tahun/
