unique_id,date,source,headline,url
2021-12-09_ja_0479,2021-12-09,Jawa Pos,Isra Kadis Nan ”Datuknya” Dunia Pendidikan: ”Siap Dukung Laman Guru….!”,https://padek.jawapos.com/sumbar/agam/09/12/2021/isra-kadis-nan-datuknya-dunia-pendidikan-siap-dukung-laman-guru/
2021-12-09_ja_0480,2021-12-09,Jawa Pos,"Ganjar Lantik Pelajar Agen Antikorupsi: Mak, Izinkan Anakmu Jadi Musuh Koruptor",https://radarsolo.jawapos.com/nasional/09/12/2021/ganjar-lantik-pelajar-agen-antikorupsi-mak-izinkan-anakmu-jadi-musuh-koruptor/
2021-12-09_ja_0481,2021-12-09,Jawa Pos,Anak Muda Bertaruh Mempertahankan Negaranya Sendiri,https://radarbanyuwangi.jawapos.com/kolom/09/12/2021/anak-muda-bertaruh-mempertahankan-negaranya-sendiri
2021-12-09_ja_0482,2021-12-09,Jawa Pos,"Anak Buah Prabowo Bela Pemerintah, Pembatalan PPKM Sudah Lewati Kajian Mendalam",https://gorontalopost.jawapos.com/nasional/09/12/2021/anak-buah-prabowo-bela-pemerintah-pembatalan-ppkm-sudah-lewati-kajian-mendalam/
2021-12-09_ja_0483,2021-12-09,Jawa Pos,"Pelatih Persebaya Puji Tinggi, Bintang dari Jepang Memilih Merendah",https://www.jawapos.com/sepak-bola/sepak-bola-indonesia/09/12/2021/pelatih-persebaya-puji-tinggi-bintang-dari-jepang-memilih-merendah/
2021-12-09_ja_0484,2021-12-09,Jawa Pos,"Anak Buah Prabowo Bela Pemerintah, Pembatalan PPKM Sudah Lewati Kajian Mendalam",https://radarpapua.jawapos.com/nasional/09/12/2021/anak-buah-prabowo-bela-pemerintah-pembatalan-ppkm-sudah-lewati-kajian-mendalam/
2021-12-09_ja_0485,2021-12-09,Jawa Pos,Mau Diganti Untung ? Masyarakat Bermukim di Area Sungai Tondano Wajib Hadir !,https://manadopost.jawapos.com/berita-utama/09/12/2021/mau-diganti-untung-masyarakat-bermukim-di-area-sungai-tondano-wajib-hadir/
2021-12-09_ja_0486,2021-12-09,Jawa Pos,Bareskrim Polri Sebut Dugaan Korupsi Anak Perusahaan Jakpro Rugikan Negara,https://gorontalopost.jawapos.com/nasional/09/12/2021/bareskrim-polri-sebut-dugaan-korupsi-anak-perusahaan-jakpro-rugikan-negara/
2021-12-09_ja_0487,2021-12-09,Jawa Pos,Bareskrim Polri Sebut Dugaan Korupsi Anak Perusahaan Jakpro Rugikan Negara,https://radarpapua.jawapos.com/nasional/09/12/2021/bareskrim-polri-sebut-dugaan-korupsi-anak-perusahaan-jakpro-rugikan-negara/
2021-12-09_ja_0488,2021-12-09,Jawa Pos,"Kasus PT ASABRI, Pakar Sebut Hukuman Mati Bisa Ganggu Pasar Modal",https://www.jawapos.com/nasional/hukum-kriminal/09/12/2021/kasus-pt-asabri-pakar-sebut-hukuman-mati-bisa-ganggu-pasar-modal/
2021-12-09_ja_0489,2021-12-09,Jawa Pos,"Anak di Ciomas Tersangkut Gagang Pintu, Danru Rescue Damkar : Ini Pertama Kali",https://www.radarbogor.id/2021/12/09/anak-di-ciomas-tersangkut-gagang-pintu-danru-rescue-damkar-ini-pertama-kali/
2021-12-09_ja_0490,2021-12-09,Jawa Pos,"Trauma dengan Erupsi Gunung Semeru, Warga Pilih Tinggalkan Rumah",https://www.jawapos.com/nasional/09/12/2021/trauma-dengan-erupsi-gunung-semeru-warga-pilih-tinggalkan-rumah/
2021-12-09_ja_0491,2021-12-09,Jawa Pos,Shin Tae-yong Pastikan Indonesia Tak Pakai Ban Kapten Warna Pelangi,https://www.jawapos.com/sepak-bola/sepak-bola-indonesia/09/12/2021/shin-tae-yong-pastikan-indonesia-tak-pakai-ban-kapten-warna-pelangi/
2021-12-09_ja_0492,2021-12-09,Jawa Pos,"Surabaya Terbanyak, Gresik Kedua, Sidoarjo Terbawah",https://www.jawapos.com/surabaya/09/12/2021/surabaya-terbanyak-gresik-kedua-sidoarjo-terbawah/
2021-12-09_ja_0493,2021-12-09,Jawa Pos,"Dua Wanita Edarkan Sabu di Pariaman, Satu Orang Residivis",https://padek.jawapos.com/sumbar/pariaman/09/12/2021/dua-wanita-edarkan-sabu-di-pariaman-satu-orang-residivis/
2021-12-09_ja_0494,2021-12-09,Jawa Pos,Anda Pengguna WhatsApp? Ini Lima Fitur Tersembunyi yang Wajib Anda Ketahui,https://gorontalopost.jawapos.com/lifestyle-teknologi/09/12/2021/anda-pengguna-whatsapp-ini-lima-fitur-tersembunyi-yang-wajib-anda-ketahui/
2021-12-09_ja_0495,2021-12-09,Jawa Pos,Anda Pengguna WhatsApp? Ini Lima Fitur Tersembunyi yang Wajib Anda Ketahui,https://radarpapua.jawapos.com/lifestyle-teknologi/09/12/2021/anda-pengguna-whatsapp-ini-lima-fitur-tersembunyi-yang-wajib-anda-ketahui/
2021-12-09_ja_0496,2021-12-09,Jawa Pos,"Tundukkan Persatu, Dua Langkah Lagi Persewangi Menuju Final",https://radarbanyuwangi.jawapos.com/entertainment/sports/09/12/2021/tundukkan-persatu-dua-langkah-lagi-persewangi-menuju-final
2021-12-09_ja_0497,2021-12-09,Jawa Pos,"Dua Hari, 16.633 Warga Bengkalis Divaksinasi Covid-19",https://riaupos.jawapos.com/bengkalis/09/12/2021/263488/dua-hari-16633-warga-bengkalis-divaksinasi-covid19.html
2021-12-09_ja_0498,2021-12-09,Jawa Pos,Ami Dipanggil Ikut Seleksi Timnas,https://lombokpost.jawapos.com/sportivo/09/12/2021/ami-dipanggil-ikut-seleksi-timnas/
2021-12-09_ja_0499,2021-12-09,Jawa Pos,"Teluk Bayur Butuh Pengembangan, Tampung Kapal Besar Terakselerasi ke Tol",https://padek.jawapos.com/sumbar/09/12/2021/teluk-bayur-butuh-pengembangan-tampung-kapal-besar-terakselerasi-ke-tol/
2021-12-09_ja_0500,2021-12-09,Jawa Pos,"Strategi Jitu Dilakukan Wuling, Genjot Penjualan Jelang Akhir Tahun",https://www.jawapos.com/oto-dan-tekno/otomotif/09/12/2021/strategi-jitu-dilakukan-wuling-genjot-penjualan-jelang-akhir-tahun/
2021-12-09_ja_0501,2021-12-09,Jawa Pos,Kemenkum HAM: Kami Tak Punya Kuasa,https://riaupos.jawapos.com/riau/09/12/2021/263493/kemenkum-ham-kami-tak-punya-kuasa.html
2021-12-09_ja_0502,2021-12-09,Jawa Pos,Ayah Bripda Randy Bantah Pernah Suruh Aborsi Novia Widyasari,https://www.jawapos.com/nasional/hukum-kriminal/09/12/2021/ayah-bripda-randy-bantah-pernah-suruh-aborsi-novia-widyasari/
2021-12-09_ja_0503,2021-12-09,Jawa Pos,Warga-Pasuruan Inspiratif Tanyakan Pemilihan Ikon Jam Kolonial,https://radarbromo.jawapos.com/pasuruan/09/12/2021/warga-pasuruan-inspiratif-tanyakan-pemilihan-ikon-jam-kolonial/
2021-12-09_ja_0504,2021-12-09,Jawa Pos,Target Juara Dicanangkan Timnas Indonesia di Piala AFF 2020,https://www.jawapos.com/sepak-bola/sepak-bola-indonesia/09/12/2021/target-juara-dicanangkan-timnas-indonesia-di-piala-aff-2020/
2021-12-09_ja_0505,2021-12-09,Jawa Pos,"Piala AFF 2020, Harapan Baru di Generasi 23,8 Tahun",https://www.jawapos.com/sepak-bola/sepak-bola-indonesia/09/12/2021/piala-aff-2020-harapan-baru-di-generasi-238-tahun/
2021-12-09_ja_0506,2021-12-09,Jawa Pos,Pemerintah dan Baznas Bersinergi Tangani Kemiskinan di Masa Pandemi,https://radarsidoarjo.jawapos.com/kota-delta/09/12/2021/pemerintah-dan-baznas-bersinergi-tangani-kemiskinan-di-masa-pandemi/
2021-12-09_ja_0507,2021-12-09,Jawa Pos,Video Youtube untuk Pembelajaran PJOK di SD,https://radarsemarang.jawapos.com/artikel/untukmu-guruku/2021/12/09/video-youtube-untuk-pembelajaran-pjok-di-sd/
2021-12-09_ja_0508,2021-12-09,Jawa Pos,"Lakukan Kejahatan Skimming, Duo Warga Turki Ditangkap di Bali",https://radarbali.jawapos.com/hukum-kriminal/09/12/2021/lakukan-kejahatan-skimming-duo-warga-turki-ditangkap-di-bali
2021-12-09_ja_0509,2021-12-09,Jawa Pos,Dirut Jasa Raharja Paparkan Konsep Digitalisasi di Rakornas Samsat,https://radarsemarang.jawapos.com/webtorial/2021/12/09/dirut-jasa-raharja-paparkan-konsep-digitalisasi-di-rakornas-samsat/
2021-12-09_ja_0510,2021-12-09,Jawa Pos,"Permudah Masyarakat Tulungagung, Layanan Adminduk Kini Makin Diperluas",https://radartulungagung.jawapos.com/berita-daerah/tulungagung/09/12/2021/permudah-masyarakat-tulungagung-layanan-adminduk-kini-makin-diperluas
2021-12-09_ja_0511,2021-12-09,Jawa Pos,"Muhamad Yuli Wibisono Asli Boyolangu, Tangguk Rezeki dari Sketsa Wajah",https://radartulungagung.jawapos.com/berita-daerah/tulungagung/09/12/2021/muhamad-yuli-wibisono-asli-boyolangu-tangguk-rezeki-dari-sketsa-wajah
2021-12-09_ja_0512,2021-12-09,Jawa Pos,"Belum Tuntas, Tanah Ambles",https://radarmojokerto.jawapos.com/berita-daerah/mojokerto/09/12/2021/belum-tuntas-tanah-ambles
2021-12-09_ja_0513,2021-12-09,Jawa Pos,"23 Buku Terjemahan Kaba Minangkabau Diluncurkan, Kumpulan Dari 23 Kaba",https://padek.jawapos.com/sumbar/09/12/2021/23-buku-terjemahan-kaba-minangkabau-diluncurkan-kumpulan-dari-23-kaba/
2021-12-09_ja_0514,2021-12-09,Jawa Pos,Lima Fakta Unik Dibalik Popularitas Jajanan Khas Korea,https://radarsidoarjo.jawapos.com/lifestyle/09/12/2021/lima-fakta-unik-dibalik-popularitas-jajanan-khas-korea/
2021-12-09_ja_0515,2021-12-09,Jawa Pos,Ridwan Kamil Minta Hukuman Berat Buat Pelaku Pemerkosa 12 Santriwati,https://www.jawapos.com/nasional/hukum-kriminal/09/12/2021/ridwan-kamil-minta-hukuman-berat-buat-pelaku-pemerkosa-12-santriwati/
2021-12-09_ja_0516,2021-12-09,Jawa Pos,Catur Arum Syuting Jingle Lagu ArtOs Kembang Langit,https://radarbanyuwangi.jawapos.com/events/09/12/2021/catur-arum-syuting-jingle-lagu-artos-kembang-langit
2021-12-09_ja_0517,2021-12-09,Jawa Pos,"KPK Sebut Telah Selamatkan Potensi Kerugian Negara Rp 46,5 T",https://www.jawapos.com/nasional/09/12/2021/kpk-sebut-telah-selamatkan-potensi-kerugian-negara-rp-465-t/
2021-12-09_ja_0518,2021-12-09,Jawa Pos,"Penyertaan Modal Perumda Rp 0, DPRD Mentawai Nilai Tak Ada Kejelasan",https://padek.jawapos.com/sumbar/mentawai/09/12/2021/penyertaan-modal-perumda-rp-0-dprd-mentawai-nilai-tak-ada-kejelasan/
2021-12-09_ja_0519,2021-12-09,Jawa Pos,Kecamatan Semarang Tengah Fokus Jaga Kebersihan dan Keindahan Pusat Kota,https://radarsemarang.jawapos.com/advertorial/sang-praja/2021/12/09/kecamatan-semarang-tengah-fokus-jaga-kebersihan-dan-keindahan-pusat-kota/
2021-12-09_ja_0520,2021-12-09,Jawa Pos,"Anak Buah Prabowo Bela Pemerintah, Pembatalan PPKM Sudah Lewati Kajian Mendalam",https://manadopost.jawapos.com/nasional/09/12/2021/anak-buah-prabowo-bela-pemerintah-pembatalan-ppkm-sudah-lewati-kajian-mendalam/
2021-12-09_ja_0521,2021-12-09,Jawa Pos,"Kota Semipedesaan, Kelurahan Purwosari Tonjolkan Agrowisata",https://radarsemarang.jawapos.com/advertorial/sang-praja/2021/12/09/kota-semipedesaan-kelurahan-purwosari-tonjolkan-agrowisata/
2021-12-09_ja_0522,2021-12-09,Jawa Pos,Radar Malang-FKWTMR Dropping 2 Ton Beras untuk Korban Semeru,https://radarmalang.jawapos.com/malang-raya/09/12/2021/radar-malang-fkwtmr-dropping-2-ton-beras-untuk-korban-semeru/
2021-12-09_ja_0523,2021-12-09,Jawa Pos,PS Selaparang Raih Kemenangan Perdana,https://lombokpost.jawapos.com/sportivo/09/12/2021/ps-selaparang-raih-kemenangan-perdana/
2021-12-09_ja_0524,2021-12-09,Jawa Pos,Kelurahan Bojong Salaman Kembangkan Kampung Tematik Aneka Usaha,https://radarsemarang.jawapos.com/advertorial/sang-praja/2021/12/09/kelurahan-bojong-salaman-kembangkan-kampung-tematik-aneka-usaha/
2021-12-09_ja_0525,2021-12-09,Jawa Pos,"Kembali Terjadi di Nagari Selarehaia, Satwa Liar Diduga Serang Lima Sapi",https://padek.jawapos.com/sumbar/agam/09/12/2021/kembali-terjadi-di-nagari-selarehaia-satwa-liar-diduga-serang-lima-sapi/
2021-12-09_ja_0526,2021-12-09,Jawa Pos,Tim SAR Bakal Susuri Kali Porong,https://radarmojokerto.jawapos.com/hukum-kriminal/09/12/2021/tim-sar-bakal-susuri-kali-porong
2021-12-09_ja_0527,2021-12-09,Jawa Pos,Bareskrim Polri Sebut Dugaan Korupsi Anak Perusahaan Jakpro Rugikan Negara 315 Miliar,https://manadopost.jawapos.com/nasional/09/12/2021/bareskrim-polri-sebut-dugaan-korupsi-anak-perusahaan-jakpro-rugikan-negara-315-miliar/
2021-12-09_ja_0528,2021-12-09,Jawa Pos,Pemerintah Kecamatan Semarang Utara Buka Keran Komunikasi sampai Tingkat RW,https://radarsemarang.jawapos.com/advertorial/sang-praja/2021/12/09/pemerintah-kecamatan-semarang-utara-buka-keran-komunikasi-sampai-tingkat-rw/
2021-12-09_ja_0529,2021-12-09,Jawa Pos,Viral Oknum TNI Usir Ibu Mertua dari Rumah Dinas,https://www.jawapos.com/nasional/hukum-kriminal/09/12/2021/viral-oknum-tni-usir-ibu-mertua-dari-rumah-dinas/
2021-12-09_ja_0530,2021-12-09,Jawa Pos,Kecamatan Banyumanik Jaga Tradisi Leluhur Tetap Eksis,https://radarsemarang.jawapos.com/advertorial/sang-praja/2021/12/09/kecamatan-banyumanik-jaga-tradisi-leluhur-tetap-eksis/
2021-12-09_ja_0531,2021-12-09,Jawa Pos,"Perkuat Literasi Untuk Berdaya Saing, Temu Ramah Padek Dengan KGI Agam",https://padek.jawapos.com/sumbar/agam/09/12/2021/perkuat-literasi-untuk-berdaya-saing-temu-ramah-padek-dengan-kgi-agam/
2021-12-09_ja_0532,2021-12-09,Jawa Pos,Pemkab Lotim Naik Peringkat dalam Keterbukaan Informasi Publik,https://lombokpost.jawapos.com/selong/09/12/2021/pemkab-lotim-naik-peringkat-dalam-keterbukaan-informasi-publik/
2021-12-09_ja_0533,2021-12-09,Jawa Pos,Anda Pengguna WhatsApp? Ini Lima Fitur Tersembunyi yang Wajib Anda Ketahui,https://manadopost.jawapos.com/lifestyle-teknologi/09/12/2021/anda-pengguna-whatsapp-ini-lima-fitur-tersembunyi-yang-wajib-anda-ketahui/
2021-12-09_ja_0534,2021-12-09,Jawa Pos,Berharap Raperda Ketenagakerjaan Kota Probolinggo Tak Tumpang Tindih,https://radarbromo.jawapos.com/probolinggo/09/12/2021/berharap-raperda-ketenagakerjaan-kota-probolinggo-tak-tumpang-tindih/
2021-12-09_ja_0535,2021-12-09,Jawa Pos,Wardah Sukses Membawa Kampanye Beauty Moves You di Dubai,https://radarsidoarjo.jawapos.com/lifestyle/09/12/2021/wardah-sukses-membawa-kampanye-beauty-moves-you-di-dubai/
2021-12-09_ja_0536,2021-12-09,Jawa Pos,"Airlangga: 2022, Pemerintah Seimbangkan Penangan Pandemi dan PEN",https://radarbali.jawapos.com/ekonomi/09/12/2021/airlangga-2022-pemerintah-seimbangkan-penangan-pandemi-dan-pen
2021-12-09_ja_0537,2021-12-09,Jawa Pos,"Airlangga: 2022, Pemerintah Seimbangkan Penanganan Pandemi dan PEN",https://radarbali.jawapos.com/ekonomi/09/12/2021/airlangga-2022-pemerintah-seimbangkan-penanganan-pandemi-dan-pen
2021-12-09_ja_0538,2021-12-09,Jawa Pos,Kronologi Oknum TNI Usir dan Maki Ibu Mertua yang Hanya Duduk di Kursi Roda,https://manadopost.jawapos.com/nasional/09/12/2021/kronologi-oknum-tni-usir-dan-maki-ibu-mertua-yang-hanya-duduk-di-kursi-roda/
2021-12-09_ja_0539,2021-12-09,Jawa Pos,BPBD Masih Terus Lakukan Evakuasi Korban,https://radarmalang.jawapos.com/malang-raya/09/12/2021/bpbd-masih-terus-lakukan-evakuasi-korban/
2021-12-09_ja_0540,2021-12-09,Jawa Pos,Suporter Terus Gaungkan Dejan Out,https://radarjogja.jawapos.com/jogja-sport/2021/12/09/suporter-terus-gaungkan-dejan-out/
2021-12-09_ja_0541,2021-12-09,Jawa Pos,"Rayakan HUT ke 44 Tahun, BPJAMSOSTEK Tingkatkan Pelayanan",https://www.jawapos.com/ekonomi/09/12/2021/rayakan-hut-ke-44-tahun-bpjamsostek-tingkatkan-pelayanan/
2021-12-09_ja_0542,2021-12-09,Jawa Pos,"Sehari Tak Keluar, Warga Matesih Ditemukan Tewas di Dalam Kamar",https://radarsolo.jawapos.com/daerah/karanganyar/09/12/2021/sehari-tak-keluar-warga-matesih-ditemukan-tewas-di-dalam-kamar/
2021-12-09_ja_0543,2021-12-09,Jawa Pos,"Korupsi Anak Perusahaan Jakpro, Diduga Rugikan Negara Rp 315 Miliar",https://www.jawapos.com/nasional/hukum-kriminal/09/12/2021/korupsi-anak-perusahaan-jakpro-diduga-rugikan-negara-rp-315-miliar/
2021-12-09_ja_0544,2021-12-09,Jawa Pos,"Perkosa 12 Santri, 7 Hamil, Guru Pesantren Biadab Meringkuk di Sel",https://lombokpost.jawapos.com/nasional/09/12/2021/perkosa-12-santri-7-hamil-guru-pesantren-biadab-meringkuk-di-sel/
2021-12-09_ja_0545,2021-12-09,Jawa Pos,Pembatalan PPKM Level 3 saat Nataru Sudah Lewati Kajian Mendalam,https://www.jawapos.com/nasional/09/12/2021/pembatalan-ppkm-level-3-saat-nataru-sudah-lewati-kajian-mendalam/
2021-12-09_ja_0546,2021-12-09,Jawa Pos,Kirim Obat dan Air Bersih ke Tiga Desa Banjir di Tanggulangin,https://www.jawapos.com/surabaya/09/12/2021/kirim-obat-dan-air-bersih-ke-tiga-desa-banjir-di-tanggulangin/
2021-12-09_ja_0547,2021-12-09,Jawa Pos,600 Lebih Usaha Transportasi Laut di KLU Belum Berizin,https://lombokpost.jawapos.com/tanjung/09/12/2021/600-lebih-usaha-transportasi-laut-di-klu-belum-berizin/
2021-12-09_ja_0548,2021-12-09,Jawa Pos,Anis Matta: Indonesia Perlu Bangun Solidaritas Mitigasi Bencana,https://riaupos.jawapos.com/nasional/09/12/2021/263486/anis-matta-indonesia-perlu-bangun-solidaritas-mitigasi-bencana.html
2021-12-09_ja_0549,2021-12-09,Jawa Pos,Kabupaten Malang Tampung Korban Erupsi Semeru,https://radarmalang.jawapos.com/malang-raya/09/12/2021/kabupaten-malang-tampung-korban-erupsi-semeru/
2021-12-09_ja_0550,2021-12-09,Jawa Pos,Puluhan Rumah Warga Muncar Diterjang Banjir Rob,https://radarbanyuwangi.jawapos.com/berita-daerah/genteng/09/12/2021/puluhan-rumah-warga-muncar-diterjang-banjir-rob
2021-12-09_ja_0551,2021-12-09,Jawa Pos,Anggota Polres Loteng Temukan Sepeda Motor di Semak Belukar Jurang Lantan,https://lombokpost.jawapos.com/praya/09/12/2021/anggota-polres-loteng-temukan-sepeda-motor-di-semak-belukar-jurang-lantan/
2021-12-09_ja_0552,2021-12-09,Jawa Pos,Alasan Polri Lantik Novel Baswedan Cs pada Hari Antikorupsi Sedunia,https://www.jawapos.com/nasional/09/12/2021/alasan-polri-lantik-novel-baswedan-cs-pada-hari-antikorupsi-sedunia/
2021-12-09_ja_0553,2021-12-09,Jawa Pos,Kejari Kraksaan Buka Pemberian Keterangan Tidak Dihukum Lebih Cepat,https://radarbromo.jawapos.com/kraksaan/09/12/2021/kejari-kraksaan-buka-pemberian-keterangan-tidak-dihukum-lebih-cepat/
2021-12-09_ja_0554,2021-12-09,Jawa Pos,"Jadi Kuli Pasir Agar Bisa Menanak Nasi, Ali Hingga Kini Tak Kembali",https://baliexpress.jawapos.com/nasional/09/12/2021/jadi-kuli-pasir-agar-bisa-menanak-nasi-ali-hingga-kini-tak-kembali
2021-12-09_ja_0555,2021-12-09,Jawa Pos,"Terkuak, Siskae Ternyata Sudah Bikin 2000 Video dan 3.700 Foto Porno, Posting Konten di 7 Situs",https://manadopost.jawapos.com/nasional/09/12/2021/terkuak-siskae-ternyata-sudah-bikin-2000-video-dan-3-700-foto-porno-posting-konten-di-7-situs/
2021-12-09_ja_0556,2021-12-09,Jawa Pos,"PBSI Tarik Mundur Tim Indonesia dari Kejuaraan Dunia, BWF Kecewa",https://www.jawapos.com/sports/09/12/2021/pbsi-tarik-mundur-tim-indonesia-dari-kejuaraan-dunia-bwf-kecewa/
2021-12-09_ja_0557,2021-12-09,Jawa Pos,"Kadisbud Denpasar Diduga Korupsi Sesajen, Empat Pejabat Rebutan Kursi",https://radarbali.jawapos.com/berita-daerah/metro-denpasar/09/12/2021/kadisbud-denpasar-diduga-korupsi-sesajen-empat-pejabat-rebutan-kursi
2021-12-09_ja_0558,2021-12-09,Jawa Pos,Petugas Alami Kesulitan Penggunaan Alat Berat,https://radarmalang.jawapos.com/malang-raya/09/12/2021/petugas-alami-kesulitan-penggunaan-alat-berat/
2021-12-09_ja_0559,2021-12-09,Jawa Pos,"Proyek di Pemprov Jateng Kok Bisa Bebas Suap, Bagaimana Caranya?",https://www.jawapos.com/nasional/09/12/2021/proyek-di-pemprov-jateng-kok-bisa-bebas-suap-bagaimana-caranya/
2021-12-09_ja_0560,2021-12-09,Jawa Pos,"Setelah 25 Tahun, Amazon Hentikan Layanan Situs Pemeringkat Web Alexa.com",https://padek.jawapos.com/iptek/09/12/2021/setelah-25-tahun-amazon-hentikan-layanan-situs-pemeringkat-web-alexa-com/
2021-12-09_ja_0561,2021-12-09,Jawa Pos,Said Aqil-Yahya Staquf Saling Klaim Dapat Dukungan Mayoritas,https://www.jawapos.com/nasional/politik/09/12/2021/said-aqil-yahya-staquf-saling-klaim-dapat-dukungan-mayoritas/
2021-12-09_ja_0562,2021-12-09,Jawa Pos,Alhamdulillah…  Akhirnya Blora Dapat Dana Bagi Hasil Migas Tiga Persen,https://radarkudus.jawapos.com/blora/09/12/2021/alhamdulillah-akhirnya-blora-dapat-dana-bagi-hasil-migas-tiga-persen/
2021-12-09_ja_0563,2021-12-09,Jawa Pos,"Saatnya Protokol HEPA, Japan Air Filter Solusi Murnikan Udara Ruangan Anda",https://manadopost.jawapos.com/ekonomi-bisnis/09/12/2021/saatnya-protokol-hepa-japan-air-filter-solusi-murnikan-udara-ruangan-anda/
2021-12-09_ja_0564,2021-12-09,Jawa Pos,"Diduga Geng Motor Beraksi di Tanjakan Empang, Satu Warung Hancur",https://www.radarbogor.id/2021/12/09/diduga-geng-motor-beraksi-di-tanjakan-empang-satu-warung-hancur/
2021-12-09_ja_0565,2021-12-09,Jawa Pos,Investor Masih Soroti Penyebaran Omicron Dan Percepatan Tapering AS,https://www.jawapos.com/ekonomi/09/12/2021/investor-masih-soroti-penyebaran-omicron-dan-percepatan-tapering-as/
2021-12-09_ja_0566,2021-12-09,Jawa Pos,Literasi dan Kerjasama Mapel PJOK selama PPJ,https://radarsemarang.jawapos.com/artikel/untukmu-guruku/2021/12/09/literasi-dan-kerjasama-mapel-pjok-selama-ppj/
2021-12-09_ja_0567,2021-12-09,Jawa Pos,Penemu Vaksin Covid-19: Varian Baru Bisa Kurangi Kemanjuran Vaksin,https://www.jawapos.com/internasional/09/12/2021/penemu-vaksin-covid-19-varian-baru-bisa-kurangi-kemanjuran-vaksin/
2021-12-09_ja_0568,2021-12-09,Jawa Pos,Warga Genteng Minati Terapi Digigit Ikan,https://radarbanyuwangi.jawapos.com/berita-daerah/genteng/09/12/2021/warga-genteng-minati-terapi-digigit-ikan
2021-12-09_ja_0569,2021-12-09,Jawa Pos,Tes Penerimaan 271 Guru PPPK Dibayangi Penularan Covid-19,https://radarmalang.jawapos.com/malang-raya/kota-batu/09/12/2021/tes-penerimaan-271-guru-pppk-dibayangi-penularan-covid-19/
2021-12-09_ja_0570,2021-12-09,Jawa Pos,Anggy Novita Dinobatkan Sebagai Miss Popular 2021,https://www.jawapos.com/entertainment/infotainment/09/12/2021/anggy-novita-dinobatkan-sebagai-miss-popular-2021/
2021-12-09_ja_0571,2021-12-09,Jawa Pos,"IPK Indonesia Anjlok, Jokowi Minta KPK Perbaiki Kinerjanya",https://www.jawapos.com/nasional/09/12/2021/ipk-indonesia-anjlok-jokowi-minta-kpk-perbaiki-kinerjanya/
2021-12-09_ja_0572,2021-12-09,Jawa Pos,"Siskaeee Raup Rp 2,1 Miliar dari Konten Pornografi",https://www.jawapos.com/nasional/hukum-kriminal/09/12/2021/siskaeee-raup-rp-21-miliar-dari-konten-pornografi/
2021-12-09_ja_0573,2021-12-09,Jawa Pos,Pelayanan Kesehatan Tetap Jalan,https://radarmojokerto.jawapos.com/berita-daerah/mojokerto/09/12/2021/pelayanan-kesehatan-tetap-jalan
2021-12-09_ja_0574,2021-12-09,Jawa Pos,Mampu Kandaskan Tim Unggulan,https://radarmojokerto.jawapos.com/sportainment/09/12/2021/mampu-kandaskan-tim-unggulan
2021-12-09_ja_0575,2021-12-09,Jawa Pos,"Pemerintah Batalkan PPKM Level 3, Sufmi Dasco Beri Apresiasi",https://www.jawapos.com/nasional/politik/09/12/2021/pemerintah-batalkan-ppkm-level-3-sufmi-dasco-beri-apresiasi/
2021-12-09_ja_0576,2021-12-09,Jawa Pos,"Airlangga: 2022, Pemerintah akan Jaga Keseimbangan Penanganan Pandemi dan PEN",https://gorontalopost.jawapos.com/ekonomi-bisnis/09/12/2021/airlangga-2022-pemerintah-akan-jaga-keseimbangan-penanganan-pandemi-dan-pen/
2021-12-09_ja_0577,2021-12-09,Jawa Pos,"Dua ASN di Pati Diminta Bupati Kembalikan Bansos, Apa Alasannya?",https://radarkudus.jawapos.com/pati/09/12/2021/dua-asn-di-pati-diminta-bupati-kembalikan-bansos-apa-alasannya/
2021-12-09_ja_0578,2021-12-09,Jawa Pos,KSPPA-PSI Desak Pemerkosa Santriwati di Bandung Dihukum Berat,https://www.jawapos.com/nasional/hukum-kriminal/09/12/2021/ksppa-psi-desak-pemerkosa-santriwati-di-bandung-dihukum-berat/
2021-12-09_ja_0579,2021-12-09,Jawa Pos,"Tak Tertib Aturan, Tiga Jukir di Kota Pasuruan Disanksi Teguran Keras",https://radarbromo.jawapos.com/pasuruan/09/12/2021/tak-tertib-aturan-tiga-jukir-di-kota-pasuruan-disanksi-teguran-keras/
2021-12-09_ja_0580,2021-12-09,Jawa Pos,"Resort yang Berbeda, Astera Villa Canggu Primadona Baru",https://radarbali.jawapos.com/ekonomi/09/12/2021/resort-yang-berbeda-astera-villa-canggu-primadona-baru
2021-12-09_ja_0581,2021-12-09,Jawa Pos,"Tidak Laku Lagi, Situs Pemeringkat Website Alexa Resmi Ditutup Amazon",https://www.jawapos.com/oto-dan-tekno/teknologi/09/12/2021/tidak-laku-lagi-situs-pemeringkat-website-alexa-resmi-ditutup-amazon/
2021-12-09_ja_0582,2021-12-09,Jawa Pos,"Pemberantasan Korupsi Belum Baik, Jokowi: Apgakum Jangan Berpuas Diri",https://www.jawapos.com/nasional/09/12/2021/pemberantasan-korupsi-belum-baik-jokowi-apgakum-jangan-berpuas-diri/
2021-12-09_ja_0583,2021-12-09,Jawa Pos,Kebutuhan 12 Santri Korban Pemerkosaan Guru Biadab Harus Diperhatikan,https://www.jawapos.com/nasional/hukum-kriminal/09/12/2021/kebutuhan-12-santri-korban-pemerkosaan-guru-biadab-harus-diperhatikan/
2021-12-09_ja_0584,2021-12-09,Jawa Pos,"Kecewa Kenaikan UMK, Serikat Pekerja Wadul Bupati Batang",https://radarsemarang.jawapos.com/berita/jateng/batang/2021/12/09/kecewa-kenaikan-umk-serikat-pekerja-wadul-bupati-batang/
2021-12-09_ja_0585,2021-12-09,Jawa Pos,Siskaeee Sudah Buat 2.000 Video dan 3.700 Foto Porno,https://lombokpost.jawapos.com/nasional/09/12/2021/siskaeee-sudah-buat-2-000-video-dan-3-700-foto-porno/
2021-12-09_ja_0586,2021-12-09,Jawa Pos,Ruang Disabilitas Ditempatkan di Pasar Sore Tuban,https://radarbojonegoro.jawapos.com/berita-daerah/tuban/09/12/2021/ruang-disabilitas-ditempatkan-di-pasar-sore-tuban
2021-12-09_ja_0587,2021-12-09,Jawa Pos,"Genjot Vaksinasi, Bagi Peralatan Rumah Tangga",https://radarsemarang.jawapos.com/berita/jateng/pekalongan/2021/12/09/genjot-vaksinasi-bagi-peralatan-rumah-tangga/
2021-12-09_ja_0588,2021-12-09,Jawa Pos,Tingkatkan Pemahaman Wawasan Kebangsaan,https://padek.jawapos.com/sumbar/padang/09/12/2021/tingkatkan-pemahaman-wawasan-kebangsaan/
2021-12-09_ja_0589,2021-12-09,Jawa Pos,Kebun PT Bumi Sari Tunjukkan 38 Bukti Tertulis,https://radarbanyuwangi.jawapos.com/berita-daerah/banyuwangi/09/12/2021/kebun-pt-bumi-sari-tunjukkan-38-bukti-tertulis
2021-12-09_ja_0590,2021-12-09,Jawa Pos,Pemerintah Pertahankan Keseimbangan dalam Penanganan Pandemi dan PEN,https://radarmalang.jawapos.com/malang-raya/09/12/2021/pemerintah-pertahankan-keseimbangan-dalam-penanganan-pandemi-dan-pen/
2021-12-09_ja_0591,2021-12-09,Jawa Pos,"Trauma, Warga Pilih Tinggalkan Rumah",https://riaupos.jawapos.com/nasional/09/12/2021/263483/trauma-warga-pilih-tinggalkan-rumah.html
2021-12-09_ja_0592,2021-12-09,Jawa Pos,"Mobil Masuk Parit, Pengemudi Tak di Lokasi",https://radarsemarang.jawapos.com/berita/jateng/kajen/2021/12/09/mobil-masuk-parit-pengemudi-tak-di-lokasi/
2021-12-09_ja_0593,2021-12-09,Jawa Pos,Pembatalan PPKM Level 3 Angin Segar Kebangkitan Ekonomi Kulonprogo,https://radarjogja.jawapos.com/kulonprogo/2021/12/09/pembatalan-ppkm-level-3-angin-segar-kebangkitan-ekonomi-kulonprogo/
2021-12-09_ja_0594,2021-12-09,Jawa Pos,"PPKM Level 3 Dibatalkan, Pemkot Pekalongan Tetap Lakukan Pengetatan",https://radarsemarang.jawapos.com/berita/jateng/pekalongan/2021/12/09/ppkm-level-3-dibatalkan-pemkot-pekalongan-tetap-lakukan-pengetatan/
2021-12-09_ja_0595,2021-12-09,Jawa Pos,"Operasi Pasar Murah Ditunda, Disdag Tunggu Penyaluran Migor Dari Kemendag",https://padek.jawapos.com/sumbar/padang/09/12/2021/operasi-pasar-murah-ditunda-disdag-tunggu-penyaluran-migor-dari-kemendag/
2021-12-09_ja_0596,2021-12-09,Jawa Pos,"Strategi Singapura Deteksi Varian Omicron, Salah Satunya Tes Antigen",https://www.jawapos.com/internasional/09/12/2021/strategi-singapura-deteksi-varian-omicron-salah-satunya-tes-antigen/
