unique_id,date,source,headline,url
2021-07-25_ja_0375,2021-07-25,Jawa Pos,"UNIDA Bogor Sidang Senat secara Daring, Luluskan 371 Mahasiswa",https://www.radarbogor.id/2021/07/24/unida-bogor-sidang-senat-secara-daring-luluskan-371-mahasiswa/
2021-07-25_ja_0376,2021-07-25,Jawa Pos,"Eks Sekda Jadi Tersangka Tapi Tak Ditahan, Kejati Bali Dipertanyakan",https://radarbali.jawapos.com/read/2021/07/25/277590/eks-sekda-jadi-tersangka-tapi-tak-ditahan-kejati-bali-dipertanyakan
2021-07-25_ja_0377,2021-07-25,Jawa Pos,Mahfud: Warga Takut Mati karena Covid dan Takut Mati karena Ekonomi,https://www.jawapos.com/nasional/25/07/2021/mahfud-warga-takut-mati-karena-covid-dan-takut-mati-karena-ekonomi/
2021-07-25_ja_0378,2021-07-25,Jawa Pos,"Kalah di Awal, Nomor 1 Indonesia Menang",https://www.radarbogor.id/2021/07/24/kalah-di-awal-nomor-1-indonesia-menang/
2021-07-25_ja_0379,2021-07-25,Jawa Pos,"Menang Telak, Marcus-Kevin Tunjukkan Kelasnya",https://www.radarbogor.id/2021/07/24/menang-telak-marcus-kevin-tunjukkan-kelasnya/
2021-07-25_ja_0380,2021-07-25,Jawa Pos,"Sebelum Meninggal, Ibu Mendiang Mengaku Sempat Dapat Firasat Buruk",https://radarbali.jawapos.com/read/2021/07/25/277673/sebelum-meninggal-ibu-mendiang-mengaku-sempat-dapat-firasat-buruk
2021-07-25_ja_0381,2021-07-25,Jawa Pos,"Ingin Acaranya Luar Biasa, Lesti-Billar Tunda Pernikahan karena PPKM",https://www.jawapos.com/entertainment/infotainment/25/07/2021/ingin-acaranya-luar-biasa-lesti-billar-tunda-pernikahan-karena-ppkm/
