unique_id,date,source,headline,url
2021-07-05_ja_0490,2021-07-05,Jawa Pos,Pemkab Kendal Intensifkan Patroli dan Vaksinasi,https://radarsemarang.jawapos.com/berita/jateng/kendal/2021/07/05/pemkab-kendal-intensifkan-patroli-dan-vaksinasi/
2021-07-05_ja_0491,2021-07-05,Jawa Pos,"Periksa 27 Orang, Lima Orang Dinyatakan Positif",https://radarbanyuwangi.jawapos.com/read/2021/07/05/273063/periksa-27-orang-lima-orang-dinyatakan-positif
2021-07-05_ja_0492,2021-07-05,Jawa Pos,Alumni Kanisius Vaksinasi Covid-19 untuk 5 Ribu Orang Per Hari,https://www.jawapos.com/jabodetabek/05/07/2021/alumni-kanisius-vaksinasi-covid-19-untuk-5-ribu-orang-per-hari/
2021-07-05_ja_0493,2021-07-05,Jawa Pos,Personel Gabungan Edukasi Masyarakat Taat Protokol Kesehatan,https://radarkudus.jawapos.com/read/2021/07/05/273383/personel-gabungan-edukasi-masyarakat-taat-protokol-kesehatan
2021-07-05_ja_0494,2021-07-05,Jawa Pos,Wako Padang Ingin PT Semen Padang Tingkatkan Kontribusi,https://padek.jawapos.com/kerjasama/semen-padang/05/07/2021/wako-padang-ingin-pt-semen-padang-tingkatkan-kontribusi/
2021-07-05_ja_0495,2021-07-05,Jawa Pos,Taman Wisata Alam Ijen Juga Ditutup,https://radarjember.jawapos.com/taman-wisata-alam-ijen-juga-ditutup/
2021-07-05_ja_0496,2021-07-05,Jawa Pos,Dewan Ingatkan Jalankan PPKM Tegas dengan Sanksi,https://radarsemarang.jawapos.com/advertorial/gema-legislasi/2021/07/05/dewan-ingatkan-jalankan-ppkm-tegas-dengan-sanksi/
2021-07-05_ja_0497,2021-07-05,Jawa Pos,"Dicari, Siswa Tak Punya Akta Kelahiran",https://radarmalang.jawapos.com/malang-raya/kanjuruhan/05/07/2021/dicari-siswa-tak-punya-akta-kelahiran/
2021-07-05_ja_0498,2021-07-05,Jawa Pos,"Di Rohul, Angin Kencang Disertai Hujan Rusak Puluhan Rumah",https://riaupos.jawapos.com/rokan-hulu/05/07/2021/253227/di-rohul-angin-kencang-disertai-hujan-rusak-puluhan-rumah.html
2021-07-05_ja_0499,2021-07-05,Jawa Pos,"Priyanka Chopra Ternyata Punya Tato Tersembunyi, Bikin Penasaran Fans",https://www.jawapos.com/entertainment/05/07/2021/priyanka-chopra-ternyata-punya-tato-tersembunyi-bikin-penasaran-fans/
2021-07-05_ja_0500,2021-07-05,Jawa Pos,Dinkes Sukoharjo: Ivermectin Masih Uji Klinis,https://radarsolo.jawapos.com/daerah/sukoharjo/05/07/2021/dinkes-sukoharjo-ivermectin-masih-uji-klinis/
2021-07-05_ja_0501,2021-07-05,Jawa Pos,Pengadaan Alat Donor Plasma Konvalesen Tunggu Refocusing Anggaran,https://radarbromo.jawapos.com/bangil/05/07/2021/pengadaan-alat-donor-plasma-konvalesen-tunggu-refocusing-anggaran/
2021-07-05_ja_0502,2021-07-05,Jawa Pos,PM Malaysia Muhyiddin Yassin Terkena Infeksi Sistem Pencernaan,https://radarsurabaya.jawapos.com/read/2021/07/05/273382/pm-malaysia-muhyiddin-yassin-terkena-infeksi-sistem-pencernaan
2021-07-05_ja_0503,2021-07-05,Jawa Pos,"Lewat Khotbah, PYR Ajak Jemaat KGPM Sukseskan Program Pemerintah, Warga Wajib Divaksin",https://manadopost.jawapos.com/minahasa-raya/minahasa-selatan/05/07/2021/lewat-khotbah-pyr-ajak-jemaat-kgpm-sukseskan-program-pemerintah-warga-wajib-divaksin/
2021-07-05_ja_0504,2021-07-05,Jawa Pos,"PPKM Darurat Dijalankan, Semua Kecamatan Gerakkan Sumber Daya",https://radarsolo.jawapos.com/daerah/wonogiri/05/07/2021/ppkm-darurat-dijalankan-semua-kecamatan-gerakkan-sumber-daya/
2021-07-05_ja_0505,2021-07-05,Jawa Pos,"Harga Obat hingga Vitamin Melejit, Anggota Komisi III: Ini sudah Parah",https://www.jawapos.com/nasional/05/07/2021/harga-obat-hingga-vitamin-melejit-anggota-komisi-iii-ini-sudah-parah/
2021-07-05_ja_0506,2021-07-05,Jawa Pos,"Ulah Video Emak-emak, Pengelola Bebek Sawah Dipanggil Satpol PP",https://padek.jawapos.com/sumbar/padang/05/07/2021/ulah-video-emak-emak-pengelola-bebek-sawah-dipanggil-satpol-pp/
2021-07-05_ja_0507,2021-07-05,Jawa Pos,"PPKM Darurat, Pembatasan Alun-Alun 24 Jam",https://radarjember.jawapos.com/ppkm-darurat-pembatasan-alun-alun-24-jam/
2021-07-05_ja_0508,2021-07-05,Jawa Pos,"Bupati Temukan Warga Luar Daerah, Imbau agar Berada di Rumah Saja",https://radarmojokerto.jawapos.com/read/2021/07/05/273282/bupati-temukan-warga-luar-daerah-imbau-agar-berada-di-rumah-saja
2021-07-05_ja_0509,2021-07-05,Jawa Pos,Gawat! Kemenkum HAM Bali Ancam Deportasi WNA yang Melanggar Prokes,https://radarbali.jawapos.com/read/2021/07/05/273378/gawat-kemenkum-ham-bali-ancam-deportasi-wna-yang-melanggar-prokes
2021-07-05_ja_0510,2021-07-05,Jawa Pos,Kejati NTB Temukan Anggaran Penyewaan Ekskavator di Pemkab Bima Diduplikat,https://lombokpost.jawapos.com/kriminal/05/07/2021/kejati-ntb-temukan-anggaran-penyewaan-ekskavator-di-pemkab-bima-diduplikat/
2021-07-05_ja_0511,2021-07-05,Jawa Pos,Pemotongan Hewan Kurban Diarahkan ke RPH-Diserahkan Door to Door,https://radarbromo.jawapos.com/kraksaan/05/07/2021/pemotongan-hewan-kurban-diarahkan-ke-rph-diserahkan-door-to-door/
2021-07-05_ja_0512,2021-07-05,Jawa Pos,"Salatiga Sepi, Warga Patuhi Imbauan di Rumah Saja",https://radarsemarang.jawapos.com/berita/jateng/salatiga/2021/07/05/salatiga-sepi-warga-patuhi-imbauan-di-rumah-saja/
2021-07-05_ja_0513,2021-07-05,Jawa Pos,"Pesawat AL Filipina Jatuh, 47 Orang Tewas",https://radarsurabaya.jawapos.com/read/2021/07/05/273379/pesawat-al-filipina-jatuh-47-orang-tewas
2021-07-05_ja_0514,2021-07-05,Jawa Pos,Kematian Wanita Pensiunan PNS di Tepi Jalan Masih Jadi Teka-teki,https://radarsolo.jawapos.com/daerah/klaten/05/07/2021/kematian-wanita-pensiunan-pns-di-tepi-jalan-masih-jadi-teka-teki/
2021-07-05_ja_0515,2021-07-05,Jawa Pos,Enam Ruas Jalan di Kabupaten Semarang Ditutup Lur,https://radarsemarang.jawapos.com/berita/jateng/ungaran/2021/07/05/enam-ruas-jalan-di-kabupaten-semarang-ditutup-lur/
2021-07-05_ja_0516,2021-07-05,Jawa Pos,Luhut Minta Oksigen Industri Seluruhnya Dikonversi untuk Medis,https://www.jawapos.com/nasional/05/07/2021/luhut-minta-oksigen-industri-seluruhnya-dikonversi-untuk-medis/
2021-07-05_ja_0517,2021-07-05,Jawa Pos,"Tegur Pemilik Warung, Bupati Naikkan Kursi ke Meja",https://radarsemarang.jawapos.com/berita/jateng/ungaran/2021/07/05/tegur-pemilik-warung-bupati-naikkan-kursi-ke-meja/
2021-07-05_ja_0518,2021-07-05,Jawa Pos,Desak PPKM Darurat Disertai Percepatan Pemberian Bantuan Sosial,https://radarbromo.jawapos.com/probolinggo/05/07/2021/desak-ppkm-darurat-disertai-percepatan-pemberian-bantuan-sosial/
2021-07-05_ja_0519,2021-07-05,Jawa Pos,Harapkan Pengerjaan Jalan Cepat Selesai,https://radarjember.jawapos.com/harapkan-pengerjaan-jalan-cepat-selesai/
2021-07-05_ja_0520,2021-07-05,Jawa Pos,Cantiknya Kate Middleton dengan Sepatu Heels Putih Rp 10 Jutaan,https://www.jawapos.com/lifestyle/05/07/2021/cantiknya-kate-middleton-dengan-sepatu-heels-putih-rp-10-jutaan/
2021-07-05_ja_0521,2021-07-05,Jawa Pos,"Cegah Klaster, Persatu Libur Latihan",https://radarbojonegoro.jawapos.com/read/2021/07/05/273373/cegah-klaster-persatu-libur-latihan
2021-07-05_ja_0522,2021-07-05,Jawa Pos,Agresivitas Testing dan Tracing Harus Diimbangi Faskes dan Nakes,https://radarkudus.jawapos.com/read/2021/07/05/273377/agresivitas-testing-dan-tracing-harus-diimbangi-faskes-dan-nakes
2021-07-05_ja_0523,2021-07-05,Jawa Pos,250 Koperasi di Kota Malang Mati Suri,https://radarmalang.jawapos.com/ekonomi-bisnis/05/07/2021/250-koperasi-di-kota-malang-mati-suri/
2021-07-05_ja_0524,2021-07-05,Jawa Pos,Sekda Boyolali: Belajar Tatap Muka Tunggu Arahan Pusat,https://radarsolo.jawapos.com/daerah/boyolali/05/07/2021/sekda-boyolali-belajar-tatap-muka-tunggu-arahan-pusat/
2021-07-05_ja_0525,2021-07-05,Jawa Pos,"Pengurus ADKI Sumbar Dilantik, Tumbuhkan Ekonomi Kreatif Desa-Nagari",https://padek.jawapos.com/pariwisata/05/07/2021/pengurus-adki-sumbar-dilantik-tumbuhkan-ekonomi-kreatif-desa-nagari/
2021-07-05_ja_0526,2021-07-05,Jawa Pos,Mourinho Minta Southgate Tak Tergoda Pasang Tiga Bek,https://radarsurabaya.jawapos.com/read/2021/07/05/273376/mourinho-minta-southgate-tak-tergoda-pasang-tiga-bek
2021-07-05_ja_0527,2021-07-05,Jawa Pos,12 Pelaku Usaha Kreatif Pamerkan Produk di Pekan Ekraf Kota Padang,https://padek.jawapos.com/sumbar/padang/05/07/2021/12-pelaku-usaha-kreatif-pamerkan-produk-di-pekan-ekraf-kota-padang/
2021-07-05_ja_0528,2021-07-05,Jawa Pos,"PPKM Darurat Diterapkan, Tol Dalkot Jakarta Malah Macet 7 Km",https://www.jawapos.com/jabodetabek/05/07/2021/ppkm-darurat-diterapkan-tol-dalkot-jakarta-malah-macet-7-km/
2021-07-05_ja_0529,2021-07-05,Jawa Pos,Kandouw Jagokan Kane Cs Juarai EURO,https://manadopost.jawapos.com/publika/05/07/2021/kandouw-jagokan-kane-cs-juarai-euro/
2021-07-05_ja_0530,2021-07-05,Jawa Pos,"Pasien Covid yang Meninggal Tinggi, Armada & Kamar Jenazah Kurang",https://radarsolo.jawapos.com/daerah/klaten/05/07/2021/pasien-covid-yang-meninggal-tinggi-armada-kamar-jenazah-kurang/
2021-07-05_ja_0531,2021-07-05,Jawa Pos,"Tegaskan Ibadah di Rumah saja, Ganjar: Masjid Tetap Adzan & Salawatan",https://radarsolo.jawapos.com/nasional/05/07/2021/tegaskan-ibadah-di-rumah-saja-ganjar-masjid-tetap-adzan-salawatan/
2021-07-05_ja_0532,2021-07-05,Jawa Pos,"Perdana Hari Kerja di PPKM Darurat, Jumlah Pengguna KRL Turun Drastis",https://www.jawapos.com/jabodetabek/05/07/2021/perdana-hari-kerja-di-ppkm-darurat-jumlah-pengguna-krl-turun-drastis/
2021-07-05_ja_0533,2021-07-05,Jawa Pos,"Sepelekan PPKM Darurat, Tempat Usaha Disegel 20 Hari",https://radarsemarang.jawapos.com/berita/semarang/2021/07/05/sepelekan-ppkm-darurat-tempat-usaha-disegel-20-hari/
2021-07-05_ja_0534,2021-07-05,Jawa Pos,"Gencar Vaksinasi Massal, BML Targetkan Sasar 3000 Warga",https://manadopost.jawapos.com/publika/05/07/2021/gencar-vaksinasi-massal-bml-targetkan-sasar-3000-warga/
2021-07-05_ja_0535,2021-07-05,Jawa Pos,PLN Siap Jalankan Keputusan Pemerintah Berikan Stimulus Listrik Periode Juli-September 2021,https://manadopost.jawapos.com/publika/05/07/2021/pln-siap-jalankan-keputusan-pemerintah-berikan-stimulus-listrik-periode-juli-september-2021/
2021-07-05_ja_0536,2021-07-05,Jawa Pos,"Susu Steril Langka, Bisa Ganti Telur Rebus",https://www.jawapos.com/surabaya/05/07/2021/susu-steril-langka-bisa-ganti-telur-rebus/
2021-07-05_ja_0537,2021-07-05,Jawa Pos,Ahmad Mustaqim Terpilih Aklamasi Nakhodai Hipsi Jepara,https://radarkudus.jawapos.com/read/2021/07/05/273372/ahmad-mustaqim-terpilih-aklamasi-nakhodai-hipsi-jepara
2021-07-05_ja_0538,2021-07-05,Jawa Pos,"Sidang Korupsi, Eks Kepala Pasar Probolinggo Dipindah ke Kejati",https://radarbromo.jawapos.com/hukrim/05/07/2021/sidang-korupsi-eks-kepala-pasar-probolinggo-dipindah-ke-kejati/
2021-07-05_ja_0539,2021-07-05,Jawa Pos,Memulai Usaha Kreatif Bagi Masyarakat Sekitar Danau Maninjau,https://padek.jawapos.com/sumbar/agam/05/07/2021/memulai-usaha-kreatif-bagi-masyarakat-sekitar-danau-maninjau/
2021-07-05_ja_0540,2021-07-05,Jawa Pos,Pemuka Agama Diminta Mendorong Masyarakat Patuhi PPKM Darurat,https://www.jawapos.com/nasional/05/07/2021/pemuka-agama-diminta-mendorong-masyarakat-patuhi-ppkm-darurat/
2021-07-05_ja_0541,2021-07-05,Jawa Pos,"Minsel Ketambahan 10 Kasus Positif Covid-19, Empat Besar Se-Sulut",https://manadopost.jawapos.com/minahasa-raya/minahasa-selatan/05/07/2021/minsel-ketambahan-10-kasus-positif-covid-19-empat-besar-se-sulut/
2021-07-05_ja_0542,2021-07-05,Jawa Pos,"Pasien Covid Tambah, RSUP dr. Soeradji Tirtonegoro Tambah Tempat Tidur",https://radarsolo.jawapos.com/daerah/klaten/05/07/2021/pasien-covid-tambah-rsup-dr-soeradji-tirtonegoro-tambah-tempat-tidur/
2021-07-05_ja_0543,2021-07-05,Jawa Pos,Usada Kalimosada (10) : Digigit Ular Tak Tahu Jenisnya,https://baliexpress.jawapos.com/read/2021/07/05/273371/usada-kalimosada-10-digigit-ular-tak-tahu-jenisnya
2021-07-05_ja_0544,2021-07-05,Jawa Pos,MoU untuk Pemagangan dan Pelatihan IT Bagi Guru dan Siswa,https://radarbanyuwangi.jawapos.com/read/2021/07/05/273062/mou-untuk-pemagangan-dan-pelatihan-it-bagi-guru-dan-siswa
2021-07-05_ja_0545,2021-07-05,Jawa Pos,Polisi Tindak Karaoke dan Spa yang Buka saat Penerapan PPKM Darurat,https://www.jawapos.com/jabodetabek/05/07/2021/polisi-tindak-karaoke-dan-spa-yang-buka-saat-penerapan-ppkm-darurat/
2021-07-05_ja_0546,2021-07-05,Jawa Pos,Usada Kalimosada (11) : Jampi Kronis,https://baliexpress.jawapos.com/read/2021/07/05/273370/usada-kalimosada-11-jampi-kronis
2021-07-05_ja_0547,2021-07-05,Jawa Pos,Abrasi Pantai Memprihatinkan,https://riaupos.jawapos.com/bengkalis/05/07/2021/253230/abrasi-pantai-memprihatinkan.html
2021-07-05_ja_0548,2021-07-05,Jawa Pos,"Jika Nganggur Setahun, Alumni Unram Diberi Pelatihan Kemampuan",https://lombokpost.jawapos.com/pendidikan/05/07/2021/jika-nganggur-setahun-alumni-unram-diberi-pelatihan-kemampuan/
2021-07-05_ja_0549,2021-07-05,Jawa Pos,"Polresta Gelar Penyekatan Warga Luar Kota, Tiga Pengendara Positif",https://radarsolo.jawapos.com/daerah/solo/05/07/2021/polresta-gelar-penyekatan-warga-luar-kota-tiga-pengendara-positif/
2021-07-05_ja_0550,2021-07-05,Jawa Pos,MIXAGRIP Gelar Penyemprotan Disinfektan dan Edukasi Warga,https://radarkudus.jawapos.com/read/2021/07/05/273369/mixagrip-gelar-penyemprotan-disinfektan-dan-edukasi-warga
2021-07-05_ja_0551,2021-07-05,Jawa Pos,"Pasar Rakyat Poopo Perlu Dipaving, Ini Keluhan Kesah Masyarakat Poopo Raya",https://manadopost.jawapos.com/minahasa-raya/minahasa-selatan/05/07/2021/pasar-rakyat-poopo-perlu-dipaving-ini-keluhan-kesah-masyarakat-poopo-raya/
2021-07-05_ja_0552,2021-07-05,Jawa Pos,"Bantu Pemerintah, Surya Paloh: Kami Targetkan Vaksinasi 1 Juta Orang",https://www.jawapos.com/nasional/politik/05/07/2021/bantu-pemerintah-surya-paloh-kami-targetkan-vaksinasi-1-juta-orang/
2021-07-05_ja_0553,2021-07-05,Jawa Pos,"Genjot Vaksinasi, Tracing, dan Testing Selama PPKM Darurat",https://radarsemarang.jawapos.com/berita/semarang/2021/07/05/genjot-vaksinasi-tracing-dan-testing-selama-ppkm-darurat/
2021-07-05_ja_0554,2021-07-05,Jawa Pos,UNS Gelar Vaksin Masal untuk Mahasiswa,https://radarsolo.jawapos.com/pendidikan/05/07/2021/uns-gelar-vaksin-masal-untuk-mahasiswa/
2021-07-05_ja_0555,2021-07-05,Jawa Pos,Sarasamuccaya (45) : Jangan Mendengar yang Tak Patut Didengar,https://baliexpress.jawapos.com/read/2021/07/05/273368/sarasamuccaya-45-jangan-mendengar-yang-tak-patut-didengar
2021-07-05_ja_0556,2021-07-05,Jawa Pos,Sarasamuccaya (44) : Hilangkan Nafsu Murka Akan Dihormati,https://baliexpress.jawapos.com/read/2021/07/05/273367/sarasamuccaya-44-hilangkan-nafsu-murka-akan-dihormati
2021-07-05_ja_0557,2021-07-05,Jawa Pos,"Penumpang Kereta Jarak Jauh Bisa Vaksin di Stasiun, Berikut Caranya",https://www.jawapos.com/nasional/05/07/2021/penumpang-kereta-jarak-jauh-bisa-vaksin-di-stasiun-berikut-caranya/
2021-07-05_ja_0558,2021-07-05,Jawa Pos,Disdikpora Kudus Rangkul Mahasiswa lewat Kegiatan Kemahasiswaan,https://radarkudus.jawapos.com/read/2021/07/05/273366/disdikpora-kudus-rangkul-mahasiswa-lewat-kegiatan-kemahasiswaan
2021-07-05_ja_0559,2021-07-05,Jawa Pos,"Jadi Pro-Kontra Warga, Investasi TPS di Desa Bhuana Giri Capai Rp50 M",https://radarbali.jawapos.com/read/2021/07/05/273355/jadi-pro-kontra-warga-investasi-tps-di-desa-bhuana-giri-capai-rp50-m
2021-07-05_ja_0560,2021-07-05,Jawa Pos,170 Siswa SMPN 1 Singaraja Jalani Vaksinasi Perdana di Buleleng,https://baliexpress.jawapos.com/read/2021/07/05/273364/170-siswa-smpn-1-singaraja-jalani-vaksinasi-perdana-di-buleleng
2021-07-05_ja_0561,2021-07-05,Jawa Pos,Keterisian Ruang ICU Covid-19 Kembali Meningkat,https://riaupos.jawapos.com/riau/05/07/2021/253217/keterisian-ruang-icu-covid19-kembali-meningkat.html
2021-07-05_ja_0562,2021-07-05,Jawa Pos,Pedagang Kopi di Terminal Mandalika Mataram Nyambi Edarkan Sabu,https://lombokpost.jawapos.com/kriminal/05/07/2021/pedagang-kopi-di-terminal-mandalika-mataram-nyambi-edarkan-sabu/
2021-07-05_ja_0563,2021-07-05,Jawa Pos,"Selama PPKM Darurat, Daop 9 Lakukan Pengetatan di Stasiun",https://radarbromo.jawapos.com/ekonomi-bisnis/05/07/2021/selama-ppkm-darurat-daop-9-lakukan-pengetatan-di-stasiun/
2021-07-05_ja_0564,2021-07-05,Jawa Pos,Terjebak Belasan Jam di Jalan Lintas Riau-Sumbar,https://riaupos.jawapos.com/sumatera/05/07/2021/253216/terjebak-belasan-jam-di-jalan-lintas-riausumbar.html
2021-07-05_ja_0565,2021-07-05,Jawa Pos,"Bupati Inhu Resmi Dilantik, Tuntas Sudah Proses 9 Pilkada di Riau",https://riaupos.jawapos.com/indragiri-hulu/05/07/2021/253218/bupati-inhu-resmi-dilantik-tuntas-sudah-proses-9-pilkada-di-riau.html
2021-07-05_ja_0566,2021-07-05,Jawa Pos,Teknologi Honda Makin Ramah Lingkungan,https://lombokpost.jawapos.com/astra-honda/05/07/2021/teknologi-honda-makin-ramah-lingkungan/
2021-07-05_ja_0567,2021-07-05,Jawa Pos,110.356 Dosis Vaksin Sudah Disuntikan ke Masyarakat,https://riaupos.jawapos.com/dumai/05/07/2021/253214/110356-dosis vaksin-sudah-disuntikan-ke-masyarakat .html
2021-07-05_ja_0568,2021-07-05,Jawa Pos,Satpol PP Gencarkan Patroli Penegakan Prokes Covid-19,https://riaupos.jawapos.com/dumai/05/07/2021/253213/satpol-pp-gencarkan-patroli-penegakan-prokes-covid19 .html
2021-07-05_ja_0569,2021-07-05,Jawa Pos,Kasus Covid-19 Masih Tinggi di Dumai,https://riaupos.jawapos.com/dumai/05/07/2021/253212/kasus-covid19-masih-tinggi-di-dumai.html
2021-07-05_ja_0570,2021-07-05,Jawa Pos,Video Pembelajaran Gairahkan Motivasi Belajar IPA,https://radarsemarang.jawapos.com/rubrik/untukmu-guruku/2021/07/05/video-pembelajaran-gairahkan-motivasi-belajar-ipa/
2021-07-05_ja_0571,2021-07-05,Jawa Pos,"PPKM Darurat Jangan Kemana-mana, di Rumah Saja",https://radargresik.jawapos.com/kota-gresik/05/07/2021/ppkm-darurat-jangan-kemana-mana-di-rumah-saja/
2021-07-05_ja_0572,2021-07-05,Jawa Pos,"Hati-hati Melanggar PPKM Darurat, Ada Sanksi Pidananya, Ayo Simak",https://manadopost.jawapos.com/nasional/05/07/2021/hati-hati-melanggar-ppkm-darurat-ada-sanksi-pidananya-ayo-simak/
2021-07-05_ja_0573,2021-07-05,Jawa Pos,Selaraskan Pembelajaran dengan Kondisi Pandemi,https://radartulungagung.jawapos.com/read/2021/07/05/273361/selaraskan-pembelajaran-dengan-kondisi-pandemi
2021-07-05_ja_0574,2021-07-05,Jawa Pos,Dua Pemuda Gasak Burung untuk Pesta Miras,https://radargresik.jawapos.com/pojok-perkoro/05/07/2021/dua-pemuda-gasak-burung-untuk-pesta-miras/
2021-07-05_ja_0575,2021-07-05,Jawa Pos,Wako Diingatkan Hati-Hati Pilih Pejabat,https://riaupos.jawapos.com/pekanbaru/05/07/2021/253210/wako-diingatkan-hatihati-pilih-pejabat.html
2021-07-05_ja_0576,2021-07-05,Jawa Pos,Pelaku Usaha Isi Ulang Oksigen Medis Kewalahan,https://radargresik.jawapos.com/ekonomi-bisnis/05/07/2021/pelaku-usaha-isi-ulang-oksigen-medis-kewalahan/
2021-07-05_ja_0577,2021-07-05,Jawa Pos,PKS Jatim Siap Sukseskan Vaksinasi dan PPKM Darurat,https://radargresik.jawapos.com/politika/05/07/2021/pks-jatim-siap-sukseskan-vaksinasi-dan-ppkm-darurat/
2021-07-05_ja_0578,2021-07-05,Jawa Pos,"Nekat Melanggar PPKM Darurat di Surabaya, Disanksi Kunjungi Kuburan",https://www.jawapos.com/surabaya/05/07/2021/nekat-melanggar-ppkm-darurat-di-surabaya-disanksi-kunjungi-kuburan/
2021-07-05_ja_0579,2021-07-05,Jawa Pos,"Airlangga Hartarto Berduka, Sebut Harmoko Panutan Kader Golkar",https://gorontalopost.jawapos.com/news/05/07/2021/airlangga-hartarto-berduka-sebut-harmoko-panutan-kader-golkar/
2021-07-05_ja_0580,2021-07-05,Jawa Pos,"Sering Ditutup, Pendaki ke Arjuno-Welirang Cuma 75 Orang",https://radarbromo.jawapos.com/news/05/07/2021/sering-ditutup-pendaki-ke-arjuno-welirang-cuma-75-orang/
2021-07-05_ja_0581,2021-07-05,Jawa Pos,Wagub: Masyarakat Tuban Bisa Jadi Contoh,https://radarbojonegoro.jawapos.com/read/2021/07/05/273360/wagub-masyarakat-tuban-bisa-jadi-contoh
2021-07-05_ja_0582,2021-07-05,Jawa Pos,"Gotong Royong TNI dan Warga, Pembangunan Cepat Selesai",https://radarkudus.jawapos.com/read/2021/07/05/273359/gotong-royong-tni-dan-warga-pembangunan-cepat-selesai
2021-07-05_ja_0583,2021-07-05,Jawa Pos,Genjot Omzet dari Media Sosial,https://riaupos.jawapos.com/pekanbaru/05/07/2021/253209/genjot-omzet-dari-media-sosial.html
2021-07-05_ja_0584,2021-07-05,Jawa Pos,"Korona Menggila , PTM Tertunda",https://radargresik.jawapos.com/lifestyle/05/07/2021/korona-menggila-ptm-tertunda/
2021-07-05_ja_0585,2021-07-05,Jawa Pos,Pansel Persiapkan Seleksi Administrasi Calon ASN,https://riaupos.jawapos.com/pekanbaru/05/07/2021/253208/pansel-persiapkan-seleksi-administrasi-calon-asn.html
2021-07-05_ja_0586,2021-07-05,Jawa Pos,"Ikram Al Ghiffari, Siswa SMP 1 Tarusan Diterima di PPLP Sumbar",https://padek.jawapos.com/sumbar/pesisir-selatan/05/07/2021/ikram-al-ghiffari-siswa-smp-1-tarusan-diterima-di-pplp-sumbar/
2021-07-05_ja_0587,2021-07-05,Jawa Pos,Belajar dari Dapur Umum,https://radarkudus.jawapos.com/read/2021/07/05/273358/belajar-dari-dapur-umum
2021-07-05_ja_0588,2021-07-05,Jawa Pos,"Lucinta Luna Bikin Heboh Lagi, Mengaku Pernah Tidur dengan 28 Aktor",https://manadopost.jawapos.com/show-celebrities/05/07/2021/lucinta-luna-bikin-heboh-lagi-mengaku-pernah-tidur-dengan-28-aktor/
2021-07-05_ja_0589,2021-07-05,Jawa Pos,"PPKM Darurat, Ibadah Dibatasi 25 Persen dari Kapasitas",https://radarmojokerto.jawapos.com/read/2021/07/05/273278/ppkm-darurat-ibadah-dibatasi-25-persen-dari-kapasitas
2021-07-05_ja_0590,2021-07-05,Jawa Pos,Anak-anak Banyak yang Abai Prokes,https://radarbanyuwangi.jawapos.com/read/2021/07/05/273061/anak-anak-banyak-yang-abai-prokes
2021-07-05_ja_0591,2021-07-05,Jawa Pos,"Atur HET Obat Pasien Covid-19, Tokopedia Tindak 'Penjual Nakal'",https://www.jawapos.com/ekonomi/05/07/2021/atur-het-obat-pasien-covid-19-tokopedia-tindak-penjual-nakal/
2021-07-05_ja_0592,2021-07-05,Jawa Pos,Jablai Bikin Bubrah,https://radarkudus.jawapos.com/read/2021/07/05/273357/jablai-bikin-bubrah
2021-07-05_ja_0593,2021-07-05,Jawa Pos,"Kelebihan Kapasitas, Tak Harus Memindahkan Lapas",https://radarjember.jawapos.com/kelebihan-kapasitas-tak-harus-memindahkan-lapas/
2021-07-05_ja_0594,2021-07-05,Jawa Pos,Djohan Ajak Warga Hijaukan Sumber Mata Air,https://lombokpost.jawapos.com/tanjung/05/07/2021/djohan-ajak-warga-hijaukan-sumber-mata-air/
2021-07-05_ja_0595,2021-07-05,Jawa Pos,"Strategi Bertahan, Saatnya PKL Jualan Online",https://lombokpost.jawapos.com/ekonomi-bisnis/05/07/2021/strategi-bertahan-saatnya-pkl-jualan-online/
2021-07-05_ja_0596,2021-07-05,Jawa Pos,"Miris, Kekerasan Pada Anak Banyak Terjadi di Sekolah",https://lombokpost.jawapos.com/nasional/05/07/2021/miris-kekerasan-pada-anak-banyak-terjadi-di-sekolah/
2021-07-05_ja_0597,2021-07-05,Jawa Pos,Wujudkan Generasi Muslim yang Berakhlak Mulia dan Berprestasi,https://radarbojonegoro.jawapos.com/read/2021/07/05/273356/wujudkan-generasi-muslim-yang-berakhlak-mulia-dan-berprestasi
2021-07-05_ja_0598,2021-07-05,Jawa Pos,"Cerita Mongol Soal Gereja Setan di Manado: Target Rekrut Anak Muda, Sisa Anggota Tunggu Momen untuk Muncul Kembali",https://manadopost.jawapos.com/berita-utama/05/07/2021/cerita-mongol-soal-gereja-setan-di-manado-target-rekrut-anak-muda-sisa-anggota-tunggu-momen-untuk-muncul-kembali/
2021-07-05_ja_0599,2021-07-05,Jawa Pos,Pastikan Ada Sanksi bagi Pelanggar PPKM Darurat,https://radarbromo.jawapos.com/pandaan/05/07/2021/pastikan-ada-sanksi-bagi-pelanggar-ppkm-darurat/
2021-07-05_ja_0600,2021-07-05,Jawa Pos,Begini Alasan Warga yang Nekat Keluar Rumah saat PPKM Darurat,https://www.jawapos.com/jabodetabek/05/07/2021/begini-alasan-warga-yang-nekat-keluar-rumah-saat-ppkm-darurat/
2021-07-05_ja_0601,2021-07-05,Jawa Pos,Posko Darurat Isi Ulang Tabung Oksigen Di Monas,https://www.jawapos.com/photo/posko-darurat-isi-ulang-tabung-oksigen-di-monas/
2021-07-05_ja_0602,2021-07-05,Jawa Pos,Oksigen Medis di RSUP dr. Sardjito Memasuki Level Kritis,https://www.jawapos.com/photo/oksigen-medis-di-rsup-dr-sardjito-memasuki-level-kritis/
2021-07-05_ja_0603,2021-07-05,Jawa Pos,"Tingkatkan Kreativitas, Terus Gali Pemikiran Bung Karno",https://radartulungagung.jawapos.com/read/2021/07/05/273354/tingkatkan-kreativitas-terus-gali-pemikiran-bung-karno
2021-07-05_ja_0604,2021-07-05,Jawa Pos,"Lapangan, Tempat Olah Raga, hingga Taman di Tabanan Ditutup",https://radarbali.jawapos.com/read/2021/07/05/273353/lapangan-tempat-olah-raga-hingga-taman-di-tabanan-ditutup
2021-07-05_ja_0605,2021-07-05,Jawa Pos,Beben Jazz Meninggal Dunia Karena Terpapar Covid-19,https://www.jawapos.com/entertainment/infotainment/05/07/2021/beben-jazz-meninggal-dunia-karena-terpapar-covid-19/
2021-07-05_ja_0606,2021-07-05,Jawa Pos,Jujur sebelum Disuntik Vaksin,https://radarjember.jawapos.com/jujur-sebelum-disuntik-vaksin/
2021-07-05_ja_0607,2021-07-05,Jawa Pos,Pindah karena Tak Representatif,https://radarjember.jawapos.com/pindah-karena-tak-representatif/
2021-07-05_ja_0608,2021-07-05,Jawa Pos,Penyekatan Di Perbatasan Jakarta PPKM Darurat,https://www.jawapos.com/photo/penyekatan-di-perbatasan-jakarta-ppkm-darurat/
2021-07-05_ja_0609,2021-07-05,Jawa Pos,Ini Sanksi Pidana Bagi Pelanggar PPKM Darurat,https://www.jawapos.com/nasional/05/07/2021/ini-sanksi-pidana-bagi-pelanggar-ppkm-darurat/
2021-07-05_ja_0610,2021-07-05,Jawa Pos,Meninggalnya Deni Nova Saputra setelah Menjalani Vaksinasi,https://radarjember.jawapos.com/meninggalnya-deni-nova-saputra-setelah-menjalani-vaksinasi/
2021-07-05_ja_0611,2021-07-05,Jawa Pos,Latih Jiwa Kepemimpinan dan Kemandirian Santri,https://radarmojokerto.jawapos.com/read/2021/07/05/273277/latih-jiwa-kepemimpinan-dan-kemandirian-santri
2021-07-05_ja_0612,2021-07-05,Jawa Pos,"Sesak, Napi Tidur bagai Pindang",https://radarjember.jawapos.com/sesak-napi-tidur-bagai-pindang/
2021-07-05_ja_0613,2021-07-05,Jawa Pos,Prodi Rekayasa Energi Terbarukan FTI UBH  Resmi Dibuka,https://padek.jawapos.com/iptek/05/07/2021/prodi-rekayasa-energi-terbarukan-fti-ubh-resmi-dibuka/
2021-07-05_ja_0614,2021-07-05,Jawa Pos,Penertiban Pelanggar PPKM Darurat,https://www.jawapos.com/photo/penertiban-pelanggar-ppkm-darurat/
2021-07-05_ja_0615,2021-07-05,Jawa Pos,Luhut Tegaskan Penimbun Oksigen Masa PPKM Darurat Pasti Akan Dihukum,https://www.jawapos.com/nasional/05/07/2021/luhut-tegaskan-penimbun-oksigen-masa-ppkm-darurat-pasti-akan-dihukum/
2021-07-05_ja_0616,2021-07-05,Jawa Pos,Atap Bocor,https://radarsolo.jawapos.com/features/05/07/2021/atap-bocor/
2021-07-05_ja_0617,2021-07-05,Jawa Pos,"Raih Shiddakarya, RSKM Padang Eye Center Bidik Paramakarya",https://padek.jawapos.com/sumbar/padang/05/07/2021/raih-shiddakarya-rskm-padang-eye-center-bidik-paramakarya/
