unique_id,date,source,headline,url
2021-07-05_ja_0239,2021-07-05,Jawa Pos,Kantor Wali Kota Jaksel Disulap Jadi Tempat Isolasi Pasien Covid-19,https://www.jawapos.com/photo/kantor-wali-kota-jaksel-disulap-jadi-tempat-isolasi-pasien-covid-19/
2021-07-05_ja_0240,2021-07-05,Jawa Pos,Jadi Pak Tani Bikin Ajik Krisna Bisa Pekerjakan 2.000 Karyawannya Lagi,https://baliexpress.jawapos.com/read/2021/07/05/273466/jadi-pak-tani-bikin-ajik-krisna-bisa-pekerjakan-2000-karyawannya-lagi
2021-07-05_ja_0241,2021-07-05,Jawa Pos,"Insentif Nakes 2020 Masih Nunggak, Ini Penjelasan Menkes",https://www.jawapos.com/nasional/05/07/2021/insentif-nakes-2020-masih-nunggak-ini-penjelasan-menkes/
2021-07-05_ja_0242,2021-07-05,Jawa Pos,Tol Dalam Kota Macet Parah Imbas Pemberlakuan PPKM Darurat,https://www.jawapos.com/photo/tol-dalam-kota-macet-parah-imbas-pemberlakuan-ppkm-darurat/
2021-07-05_ja_0243,2021-07-05,Jawa Pos,"Peduli Sesama, D-Net Berbagi Sembako di Ponpes Miftahul Jannah",https://radarsolo.jawapos.com/daerah/boyolali/05/07/2021/peduli-sesama-d-net-berbagi-sembako-di-ponpes-miftahul-jannah/
2021-07-05_ja_0244,2021-07-05,Jawa Pos,"PPKM Darurat, Panti Pijat Hingga THM di Cibinong Disikat Satpol PP",https://www.radarbogor.id/2021/07/05/ppkm-darurat-panti-pijat-hingga-thm-di-cibinong-disikat-satpol-pp/
2021-07-05_ja_0245,2021-07-05,Jawa Pos,"Dari Gerai Pulsa, Agen BRILink Ini Raup Cuan hingga Punya Minimarket",https://radarsolo.jawapos.com/ekonomi/05/07/2021/dari-gerai-pulsa-agen-brilink-ini-raup-cuan-hingga-punya-minimarket/
2021-07-05_ja_0246,2021-07-05,Jawa Pos,Lady Bikers Bali Jajal Performa Honda Rebel Hingga Ke Kalimantan,https://radarbali.jawapos.com/read/2021/07/05/273461/lady-bikers-bali-jajal-performa-honda-rebel-hingga-ke-kalimantan
2021-07-05_ja_0247,2021-07-05,Jawa Pos,"Koordinasi dengan Luhut, Anies Dirikan Posko Oksigen di Monas",https://www.jawapos.com/nasional/05/07/2021/koordinasi-dengan-luhut-anies-dirikan-posko-oksigen-di-monas/
2021-07-05_ja_0248,2021-07-05,Jawa Pos,"Tes Swab Masal di Dispora, Satu Pegawai Positif",https://radarjember.jawapos.com/tes-swab-masal-di-dispora-satu-pegawai-positif/
2021-07-05_ja_0249,2021-07-05,Jawa Pos,Sepakat Tutup Tempat Ibadah di Probolinggo Selama PPKM Darurat,https://radarbromo.jawapos.com/probolinggo/05/07/2021/sepakat-tutup-tempat-ibadah-di-probolinggo-selama-ppkm-darurat/
2021-07-05_ja_0250,2021-07-05,Jawa Pos,"Wisata Paralayang Kota Batu Tutup, Banyak Pengunjung Yang Kecele’",https://radarmalang.jawapos.com/wisata-malang/05/07/2021/wisata-paralayang-kota-batu-tutup-banyak-pengunjung-yang-kecele/
2021-07-05_ja_0251,2021-07-05,Jawa Pos,Sektor Kesehatan Terhambat Akibat Warga yang Abaikan PPKM Darurat,https://www.jawapos.com/nasional/05/07/2021/sektor-kesehatan-terhambat-akibat-warga-yang-abaikan-ppkm-darurat/
2021-07-05_ja_0252,2021-07-05,Jawa Pos,Saat Belajar Alquran Jadi Menyenangkan bagi Anak Berkebutuhan Khusus,https://radarbromo.jawapos.com/features/05/07/2021/saat-belajar-alquran-jadi-menyenangkan-bagi-anak-berkebutuhan-khusus/
2021-07-05_ja_0253,2021-07-05,Jawa Pos,Saatnya Inggris Patahkan Mitos Final Euro,https://manadopost.jawapos.com/olahraga/05/07/2021/saatnya-inggris-patahkan-mitos-final-euro/
2021-07-05_ja_0254,2021-07-05,Jawa Pos,Suka Duka Petugas Jaga Micro Lockdown di Kelurahan Kemasan,https://radarkediri.jawapos.com/read/2021/07/05/273465/suka-duka-petugas-jaga-micro-lockdown-di-kelurahan-kemasan
2021-07-05_ja_0255,2021-07-05,Jawa Pos,Kasus Positif di Perumahan Griya Katulampa Tembus 100 Orang,https://www.radarbogor.id/2021/07/05/kasus-positif-di-perumahan-griya-katulampa-tembus-100-orang/
2021-07-05_ja_0256,2021-07-05,Jawa Pos,"Pandemi, Narasi Komersialisasi Pendidikan",https://radarbanyuwangi.jawapos.com/read/2021/07/05/273070/pandemi-narasi-komersialisasi-pendidikan
2021-07-05_ja_0257,2021-07-05,Jawa Pos,"Pasien Covid-19 Terus Bertambah, Sejumlah RS di Kota Bogor Mulai Kesulitan Oksigen",https://www.radarbogor.id/2021/07/05/pasien-covid-19-terus-bertambah-sejumlah-rs-di-kota-bogor-mulai-kesulitan-oksigen/
2021-07-05_ja_0258,2021-07-05,Jawa Pos,"Bermula Gerai Pulsa, Agen BRILink Ini Raup Cuan dan Punya Minimarket",https://padek.jawapos.com/bisnis/05/07/2021/bermula-gerai-pulsa-agen-brilink-ini-raup-cuan-dan-punya-minimarket/
2021-07-05_ja_0259,2021-07-05,Jawa Pos,"Ingin Tahan Lama di Ranjang, Pria Wajib Lakukan Saja 3 Hal Ini",https://manadopost.jawapos.com/lifestyle-teknologi/05/07/2021/ingin-tahan-lama-di-ranjang-pria-wajib-lakukan-saja-3-hal-ini/
2021-07-05_ja_0260,2021-07-05,Jawa Pos,"Ditinggal ke Kebun, Perhiasan Emas Senilai Rp 80 Juta Raib",https://baliexpress.jawapos.com/read/2021/07/05/273464/ditinggal-ke-kebun-perhiasan-emas-senilai-rp-80-juta-raib
2021-07-05_ja_0261,2021-07-05,Jawa Pos,Wanita Asal Kramat Nganjuk Ini Tewas Kehabisan Darah,https://radarkediri.jawapos.com/read/2021/07/05/273463/wanita-asal-kramat-nganjuk-ini-tewas-kehabisan-darah
2021-07-05_ja_0262,2021-07-05,Jawa Pos,Endang Tewas Kehabisan Darah,https://radarkediri.jawapos.com/read/2021/07/05/273463/endang-tewas-kehabisan-darah
2021-07-05_ja_0263,2021-07-05,Jawa Pos,"Puluhan ODGJ di Cigombong Jalani Swab Antigen, Ini Hasilnya!",https://www.radarbogor.id/2021/07/05/puluhan-odgj-di-cigombong-jalani-swab-antigen-ini-hasilnya/
2021-07-05_ja_0264,2021-07-05,Jawa Pos,"Uang Saku Atlet PON Sulut Cair, Wagub: Jangan Malas-malas Berlatih",https://manadopost.jawapos.com/olahraga/05/07/2021/uang-saku-atlet-pon-sulut-cair-wagub-jangan-malas-malas-berlatih/
2021-07-05_ja_0265,2021-07-05,Jawa Pos,"PPKM Darurat, Berikut Daftar Bansos yang Penyalurannya Dipercepat",https://www.jawapos.com/nasional/05/07/2021/ppkm-darurat-berikut-daftar-bansos-yang-penyalurannya-dipercepat/
2021-07-05_ja_0266,2021-07-05,Jawa Pos,Airlangga: Almarhum Harmoko Panutan Kader Partai Golkar,https://radarbromo.jawapos.com/news/05/07/2021/airlangga-almarhum-harmoko-panutan-kader-partai-golkar/
2021-07-05_ja_0267,2021-07-05,Jawa Pos,"Berat Badan Tinggal 40 Kilogram, Kerja Beberapa Bulan Jadi Satpam",https://radarkediri.jawapos.com/read/2021/07/05/273462/berat-badan-tinggal-40-kilogram-kerja-beberapa-bulan-jadi-satpam
2021-07-05_ja_0268,2021-07-05,Jawa Pos,Baksos Tutup Fivetastic Years GAIA Cosmo Hotel,https://radarjogja.jawapos.com/ekonomi/2021/07/05/baksos-tutup-fivetastic-years-gaia-cosmo-hotel/
2021-07-05_ja_0269,2021-07-05,Jawa Pos,Airlangga Perintahkan Kepala Daerah dari Golkar Bersatu Tangani Covid,https://www.jawapos.com/nasional/politik/05/07/2021/airlangga-perintahkan-kepala-daerah-dari-golkar-bersatu-tangani-covid/
2021-07-05_ja_0270,2021-07-05,Jawa Pos,"Makin Banyak Pilihan, STIKES WCH Malang Buka Dua Prodi Baru",https://radarmalang.jawapos.com/pendidikan/05/07/2021/makin-banyak-pilihan-stikes-wch-malang-buka-dua-prodi-baru/
2021-07-05_ja_0271,2021-07-05,Jawa Pos,Puluhan SMPN Kekurangan Murid,https://radarkediri.jawapos.com/read/2021/07/05/273460/puluhan-smpn-kekurangan-murid
2021-07-05_ja_0272,2021-07-05,Jawa Pos,"Sidak PPKM, Pedagang Nasi Jinggo: Tolonglah Beli Dulu, Baru Saya Tutup",https://radarbali.jawapos.com/read/2021/07/05/273459/sidak-ppkm-pedagang-nasi-jinggo-tolonglah-beli-dulu-baru-saya-tutup
2021-07-05_ja_0273,2021-07-05,Jawa Pos,"Telanjur Datang ke Stasiun, Kereta Api Ternyata Tidak Beroperasi",https://www.jawapos.com/surabaya/05/07/2021/telanjur-datang-ke-stasiun-kereta-api-ternyata-tidak-beroperasi/
2021-07-05_ja_0274,2021-07-05,Jawa Pos,ICOLEG 2021 Bahas Perspektif Hukum dan Moral Digitalisasi,https://radarsemarang.jawapos.com/advertorial/service/2021/07/05/icoleg-2021-bahas-perspektif-hukum-dan-moral-digitalisasi/
2021-07-05_ja_0275,2021-07-05,Jawa Pos,"Akses Menuju Malioboro Ditutup, Batasi Aktivitas Non Esssensial",https://radarjogja.jawapos.com/jogja-raya/2021/07/05/akses-menuju-malioboro-ditutup-batasi-aktivitas-non-esssensial/
2021-07-05_ja_0276,2021-07-05,Jawa Pos,"Luhut Bilang, Tengah Bulan ini Kasus Korona Turun, Tak Perlu Panik",https://www.jawapos.com/nasional/05/07/2021/luhut-bilang-tengah-bulan-ini-kasus-korona-turun-tak-perlu-panik/
2021-07-05_ja_0277,2021-07-05,Jawa Pos,"Jelang Semifinal, Pelatih Spanyol Pelajari Kemenangan Italia Atas Belgia",https://manadopost.jawapos.com/olahraga/05/07/2021/jelang-semifinal-pelatih-spanyol-pelajari-kemenangan-italia-atas-belgia/
2021-07-05_ja_0278,2021-07-05,Jawa Pos,Ratusan Pelajar di Bolmut Jalani Vaksinasi,https://manadopost.jawapos.com/bolmong-raya/bolmut/05/07/2021/ratusan-pelajar-di-bolmut-jalani-vaksinasi/
2021-07-05_ja_0279,2021-07-05,Jawa Pos,"Kartu JKN-KIS Hilang, Reni: Tenang, Ada Mobile JKN",https://lombokpost.jawapos.com/kesehatan/05/07/2021/kartu-jkn-kis-hilang-reni-tenang-ada-mobile-jkn/
2021-07-05_ja_0280,2021-07-05,Jawa Pos,BPOM Sudah Keluarkan Izin Dua Obat Perawatan Covid-19,https://www.jawapos.com/nasional/05/07/2021/bpom-sudah-keluarkan-izin-dua-obat-perawatan-covid-19/
2021-07-05_ja_0281,2021-07-05,Jawa Pos,"Kasus Covid-19 Melonjak, Permintaan Rempah-Rempah Kembali Meningkat",https://radarjogja.jawapos.com/jogja-raya/2021/07/05/kasus-covid-19-melonjak-permintaan-rempah-rempah-kembali-meningkat/
2021-07-05_ja_0282,2021-07-05,Jawa Pos,"Cari Peluang, Simak Cara Bangun Bisnis Startup saat Masih Mahasiswa",https://www.jawapos.com/nasional/pendidikan/05/07/2021/cari-peluang-simak-cara-bangun-bisnis-startup-saat-masih-mahasiswa/
2021-07-05_ja_0283,2021-07-05,Jawa Pos,Ini Alasan Luhut Lapor ke Jokowi Situasi Covid-19 masih Terkendali,https://www.jawapos.com/nasional/05/07/2021/ini-alasan-luhut-lapor-ke-jokowi-situasi-covid-19-masih-terkendali/
2021-07-05_ja_0284,2021-07-05,Jawa Pos,Mantan Kades Mekong Diperiksa Jaksa,https://riaupos.jawapos.com/kepulauan-meranti/05/07/2021/253242/mantan-kades-mekong-diperiksa-jaksa.html
2021-07-05_ja_0285,2021-07-05,Jawa Pos,Jangan Sampai Ada Penolakan Pasien,https://radarbojonegoro.jawapos.com/read/2021/07/05/273395/jangan-sampai-ada-penolakan-pasien
2021-07-05_ja_0286,2021-07-05,Jawa Pos,Disnaker Pastikan Tak Ada PHK Selama PPKM Darurat,https://radarbojonegoro.jawapos.com/read/2021/07/05/273403/disnaker-pastikan-tak-ada-phk-selama-ppkm-darurat
2021-07-05_ja_0287,2021-07-05,Jawa Pos,"Cegah Klaster Covid, KH Marzuqi Mustamar Minta Ponpes Ketati Prokes",https://radarmalang.jawapos.com/malang-raya/05/07/2021/cegah-klaster-covid-kh-marzuqi-mustamar-minta-ponpes-ketati-prokes/
2021-07-05_ja_0288,2021-07-05,Jawa Pos,"Kasus Covid-19 Naik 455 Persen, Ini Strategi Bansos Gubernur Khofifah",https://www.jawapos.com/jpg-today/05/07/2021/kasus-covid-19-naik-455-persen-ini-strategi-bansos-gubernur-khofifah/
2021-07-05_ja_0289,2021-07-05,Jawa Pos,"Halangi Pekerjaan, Kayu dan Ban Bekas di Jalan Napal Dibersihkan",https://riaupos.jawapos.com/indragiri-hulu/05/07/2021/253241/halangi-pekerjaan-kayu-dan-ban-bekas-di-jalan-napal-dibersihkan.html
2021-07-05_ja_0290,2021-07-05,Jawa Pos,Kejagung Didesak Ajukan Kasasi Terkait Vonis Rendah Pinangki Malasari,https://www.jawapos.com/nasional/05/07/2021/kejagung-didesak-ajukan-kasasi-terkait-vonis-rendah-pinangki-malasari/
2021-07-05_ja_0291,2021-07-05,Jawa Pos,"Inspiratif! Dari Gerai Pulsa, Agen BRILink Ini Kini Punya Minimarket",https://radarkediri.jawapos.com/read/2021/07/05/273458/inspiratif-dari-gerai-pulsa-agen-brilink-ini-kini-punya-minimarket
2021-07-05_ja_0292,2021-07-05,Jawa Pos,"Terbang Bersama Lion dan Garuda, Bisa Dapat Vaksin Gratis",https://manadopost.jawapos.com/ekonomi-bisnis/05/07/2021/terbang-bersama-lion-dan-garuda-bisa-dapat-vaksin-gratis/
2021-07-05_ja_0293,2021-07-05,Jawa Pos,"Vaksinasi Puskesmas Timbulkan Kerumunan, Dewan Beri Catatan ke Dinkes",https://radarkudus.jawapos.com/read/2021/07/05/273457/vaksinasi-puskesmas-timbulkan-kerumunan-dewan-beri-catatan-ke-dinkes
2021-07-05_ja_0294,2021-07-05,Jawa Pos,"RS Penuh dan Tak Ada Oksigen, Masyarakat Jangan Marahi Nakes",https://www.jawapos.com/nasional/05/07/2021/rs-penuh-dan-tak-ada-oksigen-masyarakat-jangan-marahi-nakes/
2021-07-05_ja_0295,2021-07-05,Jawa Pos,"Bermula dari Gerai Pulsa, Agen BRILink Ini Raup Cuan hingga Punya Minimarket",https://radarsemarang.jawapos.com/webtorial/2021/07/05/bermula-dari-gerai-pulsa-agen-brilink-ini-raup-cuan-hingga-punya-minimarket/
2021-07-05_ja_0296,2021-07-05,Jawa Pos,"Sponsori Golf Goes to Likupang,  BRI Bangkitkan Pariwisata Sulut",https://manadopost.jawapos.com/ekonomi-bisnis/05/07/2021/sponsori-golf-goes-to-likupang-bri-bangkitkan-pariwisata-sulut/
2021-07-05_ja_0297,2021-07-05,Jawa Pos,Airlangga Orang Jawa Keturunan Birokrat dan Ahli Ekonomi,https://radarbromo.jawapos.com/politik/05/07/2021/airlangga-orang-jawa-keturunan-birokrat-dan-ahli-ekonomi/
2021-07-05_ja_0298,2021-07-05,Jawa Pos,Kalangan Pakar Apresiasi Penerapan GCG di Antam,https://www.jawapos.com/ekonomi/05/07/2021/kalangan-pakar-apresiasi-penerapan-gcg-di-antam/
2021-07-05_ja_0299,2021-07-05,Jawa Pos,"Dua Petugas Terkonfirmasi Covid-19, Puluhan ODGJ Jalani Rapid Test",https://www.radarbogor.id/2021/07/05/dua-petugas-terkonfirmasi-covid-19-puluhan-odgj-jalani-rapid-test/
2021-07-05_ja_0300,2021-07-05,Jawa Pos,Pemilik Konten Tiktok Arisan Tumbal Brondong Telah Diperiksa Polisi,https://www.jawapos.com/nasional/hukum-kriminal/05/07/2021/pemilik-konten-tiktok-arisan-tumbal-brondong-telah-diperiksa-polisi/
2021-07-05_ja_0301,2021-07-05,Jawa Pos,Apkrindo Jatim Berharap Pemerintah Pertimbangkan PPKM Darurat,https://www.jawapos.com/surabaya/05/07/2021/apkrindo-jatim-berharap-pemerintah-pertimbangkan-ppkm-darurat/
2021-07-05_ja_0302,2021-07-05,Jawa Pos,"Raih Opini WTP dari BPK, BPKH Jamin Dana Haji Dikelola dengan Baik",https://www.jawapos.com/ekonomi/05/07/2021/raih-opini-wtp-dari-bpk-bpkh-jamin-dana-haji-dikelola-dengan-baik/
2021-07-05_ja_0303,2021-07-05,Jawa Pos,"Setelah 47 Tahun Berselang, Akhirnya Mampu Kembali Tembus Final",https://www.jawapos.com/sports/05/07/2021/setelah-47-tahun-berselang-akhirnya-mampu-kembali-tembus-final/
2021-07-05_ja_0304,2021-07-05,Jawa Pos,Dicari: Sikap Taat Prokes dengan Kesungguhan Hati,https://radarbanyuwangi.jawapos.com/read/2021/07/05/273069/dicari-sikap-taat-prokes-dengan-kesungguhan-hati
2021-07-05_ja_0305,2021-07-05,Jawa Pos,"Srikandi Rider Maxi Asal Jogja, Gemar Modifikasi Sampai Touring",https://radarkudus.jawapos.com/read/2021/07/05/273456/srikandi-rider-maxi-asal-jogja-gemar-modifikasi-sampai-touring
2021-07-05_ja_0306,2021-07-05,Jawa Pos,"RS Kian Penuh, Luhut: Saturasi Masih di Atas 95, Isoman Saja",https://radarmalang.jawapos.com/nusantara/05/07/2021/rs-kian-penuh-luhut-saturasi-masih-di-atas-95-isoman-saja/
2021-07-05_ja_0307,2021-07-05,Jawa Pos,"Setiap Hari Siapkan 100 Vaksin, Polresta Bogor Kota Keliling Salurkan Sembako",https://www.radarbogor.id/2021/07/05/setiap-hari-siapkan-100-vaksin-polresta-bogor-kota-keliling-salurkan-sembako/
2021-07-05_ja_0308,2021-07-05,Jawa Pos,"Relawan Surabaya Memanggil capai 1.050 Orang, masih Terus Bertambah",https://www.jawapos.com/surabaya/05/07/2021/relawan-surabaya-memanggil-capai-1-050-orang-masih-terus-bertambah/
2021-07-05_ja_0309,2021-07-05,Jawa Pos,Airlangga: Almarhum Harmoko Panutan Kader Partai Golkar,https://radarsidoarjo.jawapos.com/politika/politik-dan-pemerintahan/05/07/2021/airlangga-almarhum-harmoko-panutan-kader-partai-golkar/
2021-07-05_ja_0310,2021-07-05,Jawa Pos,"Liga 1 Ditunda, Persik Kediri Tetap Berlatih",https://radarkediri.jawapos.com/read/2021/07/05/273455/liga-1-ditunda-persik-kediri-tetap-berlatih
2021-07-05_ja_0311,2021-07-05,Jawa Pos,Oksigen Menipis di RS Bukan Karena Langka tapi Distribusi Tak Merata,https://www.jawapos.com/nasional/05/07/2021/oksigen-menipis-di-rs-bukan-karena-langka-tapi-distribusi-tak-merata/
2021-07-05_ja_0312,2021-07-05,Jawa Pos,Belasan IGD di Surabaya Putuskan Tutup Sementara,https://www.jawapos.com/surabaya/05/07/2021/belasan-igd-di-surabaya-putuskan-tutup-sementara/
2021-07-05_ja_0313,2021-07-05,Jawa Pos,"PPKM Darurat, Bangku Pinggir Jalan Kota Malang Dipalang Lagi",https://radarmalang.jawapos.com/malang-raya/kota-malang/05/07/2021/ppkm-darurat-bangku-pinggir-jalan-kota-malang-dipalang-lagi/
2021-07-05_ja_0314,2021-07-05,Jawa Pos,Wagub NTB Minta Muslimat NWDI Berbuat yang Riil dan Aktual,https://lombokpost.jawapos.com/ntb/05/07/2021/wagub-ntb-minta-muslimat-nwdi-berbuat-yang-riil-dan-aktual/
2021-07-05_ja_0315,2021-07-05,Jawa Pos,"Panglima TNI dan Kapolri Ajak Civitas Akademik, Pemuda hingga Ormas Terlibat Aktif Percepat Vaksinasi",https://manadopost.jawapos.com/nasional/05/07/2021/panglima-tni-dan-kapolri-ajak-civitas-akademik-pemuda-hingga-ormas-terlibat-aktif-percepat-vaksinasi/
2021-07-05_ja_0316,2021-07-05,Jawa Pos,"Mengenang Kepergian Harmoko, Airlangga: Panutan Kader Partai Golkar",https://radarsolo.jawapos.com/nasional/05/07/2021/mengenang-kepergian-harmoko-airlangga-panutan-kader-partai-golkar/
2021-07-05_ja_0317,2021-07-05,Jawa Pos,Luhut Minta Produsen Oksigen Industri Konversi Produknya ke Farmasi,https://www.jawapos.com/nasional/05/07/2021/luhut-minta-produsen-oksigen-industri-konversi-produknya-ke-farmasi/
2021-07-05_ja_0318,2021-07-05,Jawa Pos,"Di Dumai, Salat Idul Adha Dibolehkan di Masjid dan Lapangan",https://riaupos.jawapos.com/dumai/05/07/2021/253239/di-dumai-salat-idul-adha-dibolehkan-di-masjid-dan-lapangan.html
2021-07-05_ja_0319,2021-07-05,Jawa Pos,Pemerintah Naikan Jumlah Tes Swab Jadi 400.000 Orang Per Hari,https://www.jawapos.com/nasional/05/07/2021/pemerintah-naikan-jumlah-tes-swab-jadi-400-000-orang-per-hari/
2021-07-05_ja_0320,2021-07-05,Jawa Pos,8 Gedung Asrama Haji Pondok Gede Siap Rawat Pasien Covid-19,https://www.jawapos.com/nasional/05/07/2021/8-gedung-asrama-haji-pondok-gede-siap-rawat-pasien-covid-19/
2021-07-05_ja_0321,2021-07-05,Jawa Pos,Lampu Penerangan Jalan Umum Surabaya Tetap Nyala Selama PPKM Darurat,https://www.jawapos.com/surabaya/05/07/2021/lampu-penerangan-jalan-umum-surabaya-tetap-nyala-selama-ppkm-darurat/
2021-07-05_ja_0322,2021-07-05,Jawa Pos,"Layani Makan di Tempat saat PPKM Darurat, Kursi Warung Diangkut Aparat",https://radarkudus.jawapos.com/read/2021/07/05/273453/layani-makan-di-tempat-saat-ppkm-darurat-kursi-warung-diangkut-aparat
2021-07-05_ja_0323,2021-07-05,Jawa Pos,"Ganjar Bentuk Satgas Oksigen, Pastikan Stok di Jateng Aman",https://www.jawapos.com/nasional/05/07/2021/ganjar-bentuk-satgas-oksigen-pastikan-stok-di-jateng-aman/
2021-07-05_ja_0324,2021-07-05,Jawa Pos,"Cukup Setor KTP, Warga Bisa Vaksinasi Gratis di Polres Klungkung",https://radarbali.jawapos.com/read/2021/07/05/273452/cukup-setor-ktp-warga-bisa-vaksinasi-gratis-di-polres-klungkung
2021-07-05_ja_0325,2021-07-05,Jawa Pos,Airlangga: Almarhum Harmoko Panutan Kader Partai Golkar,https://radarjember.jawapos.com/airlangga-almarhum-harmoko-panutan-kader-partai-golkar/
2021-07-05_ja_0326,2021-07-05,Jawa Pos,Luhut: Pasien Covid-19 Saturasi di atas 94 Dirawat di Rumah Saja,https://www.jawapos.com/nasional/05/07/2021/luhut-pasien-covid-19-saturasi-di-atas-94-dirawat-di-rumah-saja/
2021-07-05_ja_0327,2021-07-05,Jawa Pos,"Muncul Tangan di Atas Pemakaman Jane Shalimar, Olive Ungkap Faktanya",https://www.jawapos.com/entertainment/infotainment/05/07/2021/muncul-tangan-di-atas-pemakaman-jane-shalimar-olive-ungkap-faktanya/
2021-07-05_ja_0328,2021-07-05,Jawa Pos,Ibu yang Videonya Viral di Resto Tanpa Prokes Warga Jakarta,https://www.jawapos.com/nasional/hukum-kriminal/05/07/2021/ibu-yang-videonya-viral-di-resto-tanpa-prokes-warga-jakarta/
2021-07-05_ja_0329,2021-07-05,Jawa Pos,"PPKM, Maksimal Penumpang Bus 50 Persen",https://radarbojonegoro.jawapos.com/read/2021/07/05/273393/ppkm-maksimal-penumpang-bus-50-persen
2021-07-05_ja_0330,2021-07-05,Jawa Pos,Pusat Laba Dalam Manajemen,https://radarbojonegoro.jawapos.com/read/2021/07/05/273451/pusat-laba-dalam-manajemen
2021-07-05_ja_0331,2021-07-05,Jawa Pos,"Miftahur Rozaq, Kiai yang Lebih Dikenal sebagai Komisioner KPU (1)",https://radarmadura.jawapos.com/read/2021/07/05/273450/miftahur-rozaq-kiai-yang-lebih-dikenal-sebagai-komisioner-kpu-1
2021-07-05_ja_0332,2021-07-05,Jawa Pos,Latihan Rutin Persijap Tetap Jalan di Lokasi Steril,https://radarkudus.jawapos.com/read/2021/07/05/273449/latihan-rutin-persijap-tetap-jalan-di-lokasi-steril
2021-07-05_ja_0333,2021-07-05,Jawa Pos,Anies Minta Karyawan yang Dipaksa Masuk Kantor Saat PPKM Darurat Lapor,https://www.jawapos.com/nasional/hukum-kriminal/05/07/2021/anies-minta-karyawan-yang-dipaksa-masuk-kantor-saat-ppkm-darurat-lapor/
2021-07-05_ja_0334,2021-07-05,Jawa Pos,Kasus Positif Perumahan Griya Katulampa jadi 90 Orang,https://www.radarbogor.id/2021/07/05/kasus-positif-perumahan-griya-katulampa-jadi-90-orang/
2021-07-05_ja_0335,2021-07-05,Jawa Pos,"Jadi Wisata Ramah Anak, Ada Puluhan Kelinci Unik",https://radarjember.jawapos.com/jadi-wisata-ramah-anak-ada-puluhan-kelinci-unik/
2021-07-05_ja_0336,2021-07-05,Jawa Pos,Gerak Cepat Tangani Pandemi,https://radarjember.jawapos.com/gerak-cepat-tangani-pandemi/
2021-07-05_ja_0337,2021-07-05,Jawa Pos,Tape Rasa Madu,https://radarjember.jawapos.com/tape-rasa-madu/
2021-07-05_ja_0338,2021-07-05,Jawa Pos,"Hadapi Tantangan Berat, No 1 Indonesia Target Medali di Olimpiade",https://www.jawapos.com/sports/05/07/2021/hadapi-tantangan-berat-no-1-indonesia-target-medali-di-olimpiade/
2021-07-05_ja_0339,2021-07-05,Jawa Pos,"Ucapkan Selamat Atas Pelantikan Rezita-Junaidi, Agung: Saat Ini Era Pemimpin Muda",https://riaupos.jawapos.com/riau/05/07/2021/253238/ucapkan-selamat-atas-pelantikan-rezitajunaidi-agung-saat-ini-era-pemimpin-muda.html
2021-07-05_ja_0340,2021-07-05,Jawa Pos,Masyarakat Makin Antusias Divaksin,https://radarmadura.jawapos.com/read/2021/07/05/273448/masyarakat-makin-antusias-divaksin
2021-07-05_ja_0341,2021-07-05,Jawa Pos,Grobogan Setor Sembilan Ribu Data Calon Penerima BPUM,https://radarkudus.jawapos.com/read/2021/07/05/273447/grobogan-setor-sembilan-ribu-data-calon-penerima-bpum
2021-07-05_ja_0342,2021-07-05,Jawa Pos,Mau Miber atau Bersepeda Oke,https://radarjember.jawapos.com/mau-miber-atau-bersepeda-oke/
2021-07-05_ja_0343,2021-07-05,Jawa Pos,Mengutamakan Ritual Adat,https://radarjember.jawapos.com/mengutamakan-ritual-adat/
2021-07-05_ja_0344,2021-07-05,Jawa Pos,Sekat di Perbatasan dan Akses Masuk Kota,https://radarkudus.jawapos.com/read/2021/07/05/273446/sekat-di-perbatasan-dan-akses-masuk-kota
2021-07-05_ja_0345,2021-07-05,Jawa Pos,Kiai Muda Revolusioner,https://radarmadura.jawapos.com/read/2021/07/05/273445/kiai-muda-revolusioner
2021-07-05_ja_0346,2021-07-05,Jawa Pos,"PJU Mati Saat PPKM Darurat, Warga: Lubang Jalan Nggak Kelihatan",https://radarmalang.jawapos.com/malang-raya/kanjuruhan/05/07/2021/pju-mati-saat-ppkm-darurat-warga-lubang-jalan-nggak-kelihatan/
2021-07-05_ja_0347,2021-07-05,Jawa Pos,Dance Bikin Mood Baik Lagi,https://radarkudus.jawapos.com/read/2021/07/05/273444/dance-bikin-mood-baik-lagi
2021-07-05_ja_0348,2021-07-05,Jawa Pos,Menkeu: Pertumbuhan Ekonomi Semester II Tergantung Penyebaran Covid-19,https://www.jawapos.com/ekonomi/05/07/2021/menkeu-pertumbuhan-ekonomi-semester-ii-tergantung-penyebaran-covid-19/
2021-07-05_ja_0349,2021-07-05,Jawa Pos,"Jane Shalimar Meninggal, Manajer: Wajah Kakak Bersih Banget",https://www.jawapos.com/entertainment/infotainment/05/07/2021/jane-shalimar-meninggal-manajer-wajah-kakak-bersih-banget/
2021-07-05_ja_0350,2021-07-05,Jawa Pos,Pembangunan Jembatan Lusi Mundur Lagi,https://radarkudus.jawapos.com/read/2021/07/05/273443/pembangunan-jembatan-lusi-mundur-lagi
2021-07-05_ja_0351,2021-07-05,Jawa Pos,Urus SIM Gratis Vaksin,https://radarkudus.jawapos.com/read/2021/07/05/273442/urus-sim-gratis-vaksin
2021-07-05_ja_0352,2021-07-05,Jawa Pos,"Seminggu Sakit Tenggorokan, Ribut Tewas di Kos di Kelan",https://baliexpress.jawapos.com/read/2021/07/05/273440/seminggu-sakit-tenggorokan-ribut-tewas-di-kos-di-kelan
2021-07-05_ja_0353,2021-07-05,Jawa Pos,Keratin untuk Rambut Lebih Berkilau,https://radarjember.jawapos.com/keratin-untuk-rambut-lebih-berkilau/
2021-07-05_ja_0354,2021-07-05,Jawa Pos,Staf Camat Jadi Pj Kades Tegalharjo,https://radarbanyuwangi.jawapos.com/read/2021/07/05/273067/staf-camat-jadi-pj-kades-tegalharjo
2021-07-05_ja_0355,2021-07-05,Jawa Pos,Inisiator Program Akselerasi Mambaul Ulum Bata-Bata,https://radarmadura.jawapos.com/read/2021/07/05/273438/inisiator-program-akselerasi-mambaul-ulum-bata-bata
2021-07-05_ja_0356,2021-07-05,Jawa Pos,Menulis Bikin Awet Muda,https://radarmadura.jawapos.com/read/2021/07/05/273437/menulis-bikin-awet-muda
2021-07-05_ja_0357,2021-07-05,Jawa Pos,"Suhartatik, Dosen STKIP PGRI Sumenep",https://radarmadura.jawapos.com/read/2021/07/05/273437/suhartatik-dosen-stkip-pgri-sumenep
2021-07-05_ja_0358,2021-07-05,Jawa Pos,"Sepekan, 537 Pasien Sembuh",https://radarmadura.jawapos.com/read/2021/07/05/273433/sepekan-537-pasien-sembuh
2021-07-05_ja_0359,2021-07-05,Jawa Pos,Shopee Pantau Pelaku Usaha Penjual Obat-Obatan Terapi Covid-19,https://www.jawapos.com/nasional/05/07/2021/shopee-pantau-pelaku-usaha-penjual-obat-obatan-terapi-covid-19/
2021-07-05_ja_0360,2021-07-05,Jawa Pos,"Kebun Raya Bedugul juga Ditutup, Bagaimana yang Sudah Beli Tiket?",https://radarbali.jawapos.com/read/2021/07/05/273431/kebun-raya-bedugul-juga-ditutup-bagaimana-yang-sudah-beli-tiket
2021-07-05_ja_0361,2021-07-05,Jawa Pos,"PKM Darurat, 22 Kampung Tematik Kota Malang Lockdown",https://radarmalang.jawapos.com/wisata-malang/05/07/2021/pkm-darurat-22-kampung-tematik-kota-malang-lockdown/
2021-07-05_ja_0362,2021-07-05,Jawa Pos,Tidak ada penjualan ternak atau lelang di UPTD Budi Daya Ternak,https://radarbromo.jawapos.com/pandaan/05/07/2021/tidak-ada-penjualan-ternak-atau-lelang-di-uptd-budi-daya-ternak/
2021-07-05_ja_0363,2021-07-05,Jawa Pos,"PPKM Darurat, Kuliner SGM Layani Take Away",https://radarsolo.jawapos.com/ekonomi/05/07/2021/ppkm-darurat-kuliner-sgm-layani-take-away/
2021-07-05_ja_0364,2021-07-05,Jawa Pos,Alfath Fathier Bergabung Dengan Persis Solo,https://radarsolo.jawapos.com/sport/sport-nasional/05/07/2021/alfath-fathier-bergabung-dengan-persis-solo/
2021-07-05_ja_0365,2021-07-05,Jawa Pos,"Forum Koordinasi Kades, Langkah Maju Kemandirian Pemerintahan Desa!",https://lombokpost.jawapos.com/ntb/05/07/2021/forum-koordinasi-kades-langkah-maju-kemandirian-pemerintahan-desa/
