unique_id,date,source,headline,url
2021-01-25_ja_0363,2021-01-25,Jawa Pos,"Baru 3 Bulan Menjabat, Kapolda Bali Geser Puluhan Perwira di Tabanan",https://radarbali.jawapos.com/read/2021/01/25/237241/baru-3-bulan-menjabat-kapolda-bali-geser-puluhan-perwira-di-tabanan
2021-01-25_ja_0364,2021-01-25,Jawa Pos,"Simpan Sabu di Cincin, Dua Pemuda Ditangkap Polisi",https://radarsurabaya.jawapos.com/read/2021/01/25/237210/simpan-sabu-di-cincin-dua-pemuda-ditangkap-polisi
2021-01-25_ja_0365,2021-01-25,Jawa Pos,"Epik Dalam Segala Hal, Ini Alasan Mengapa Samsung Galaxy S21 Ultra 5G Cocok Buat Kamu yang Perfeksionis!",https://radarsemarang.jawapos.com/webtorial/2021/01/25/epik-dalam-segala-hal-ini-alasan-mengapa-samsung-galaxy-s21-ultra-5g-cocok-buat-kamu-yang-perfeksionis/
2021-01-25_ja_0366,2021-01-25,Jawa Pos,"Bisnis Bangkrut, Rumah Disita karena Jadi Jaminan Pinjaman Bank",https://radarsurabaya.jawapos.com/read/2021/01/25/237197/bisnis-bangkrut-rumah-disita-karena-jadi-jaminan-pinjaman-bank
2021-01-25_ja_0367,2021-01-25,Jawa Pos,"Diduga Bersama ‘Hugel’,  Oknum Wakil Ketua Deprov Dihadang Istri Sah di Tumatangtang",https://manadopost.jawapos.com/publika-politika/25/01/2021/diduga-bersama-hugel-oknum-wakil-ketua-deprov-dihadang-istri-sah-di-tumatangtang/
2021-01-25_ja_0368,2021-01-25,Jawa Pos,"Motor Tabrak Jembatan, Emak-Emak Tewas Tercebur Sungai Porong",https://radarsurabaya.jawapos.com/read/2021/01/25/237240/motor-tabrak-jembatan-emak-emak-tewas-tercebur-sungai-porong
2021-01-25_ja_0369,2021-01-25,Jawa Pos,Satgasmar Ambalat XXVI TNI AL Amankan Pengedar Narkoba di Perbatasan,https://radarsurabaya.jawapos.com/read/2021/01/25/237239/satgasmar-ambalat-xxvi-tni-al-amankan-pengedar-narkoba-di-perbatasan
2021-01-25_ja_0370,2021-01-25,Jawa Pos,"Pondok Pesantren, Tempat Belajar Pluralisme dan Multikulturalisme",https://lombokpost.jawapos.com/opini/25/01/2021/pondok-pesantren-tempat-belajar-pluralisme-dan-multikulturalisme/
2021-01-25_ja_0371,2021-01-25,Jawa Pos,"Mobil Listrik Porsche Taycan Dilengkapi Fitur Baru, Segini Harganya",https://www.jawapos.com/oto-dan-tekno/otomotif/25/01/2021/mobil-listrik-porsche-taycan-dilengkapi-fitur-baru-segini-harganya/
